,uid,article_author,article_date,article_text,article_url
0,6fcddfaf-1d97-4001-9077-395febee1c92,[],,"Russian invaders have once again struck the southern Ukrainian city of Mykolaiv, using cluster munitions.

Mykolaiv city head Oleksandr Sienkevych said this on Telegram, Ukrinform reports.

“Cluster munitions again. Stay away from your windows. I will provide all information later,” the mayor wrote on social networks.

As reported, Russians hit Mykolaiv’s residential quarters and social service facilities Monday morning, April 4. On April 3, a person was killed and 14 injured as a result of a missile strike on Mykolaiv.

On February 24, Russian President Vladimir Putin launched the invasion of Ukraine. Russian troops have been shelling and destroying key infrastructure and residential neighborhoods.",https://www.ukrinform.net/rubric-ato/3448481-russian-troops-drop-cluster-bombs-on-mykolaiv-again.html
1,6fcddfaf-1d97-4001-9077-395febee1c92,[],,"Ten people were killed and 46 injured after Russian forces attacked the southern Ukrainian city of Mykolaiv on April 4, using cluster munitions.

Mykolaiv Mayor Oleksandr Senkevych said this in a statement posted on Telegram, Ukrinform reports.

He said that in addition to residential buildings, Russian troops shelled a city hospital, a regional hospital, the center for disease prevention, an orphanage, 11 kindergartens, 12 schools, a vocational school, and two out-of-school educational institutions.

Early on Monday, April 4, Russians fired at residential quarters and social infrastructure of Mykolaiv. On April 3, one person was killed and 14 injured as a result of a missile strike against Mykolaiv.

On February 24, Russian President Putin announced the beginning of a full-scale invasion of Ukraine. Russian troops have been shelling residential neighborhoods of Ukrainian cities, towns and villages using artillery, multiple rocket launchers and ballistic missiles.",https://www.ukrinform.net/rubric-ato/3448765-ten-killed-by-cluster-munitions-in-mykolaiv.html
2,6fcddfaf-1d97-4001-9077-395febee1c92,[],2022-04-05,"Europe In shattered Chernihiv, Russian siege leaves a city asking, ‘Why?’ ‘We don’t know what we did to deserve this,’ says one resident Loading... Women with bicycles pass a damaged church in the village of Lukashivka, near Chernihiv, Ukraine, on April 4. The church was partially incinerated after a Ukrainian drone strike hit a pile of weapons next to it. (Heidi Levine for The Washington Post)

Share this story

CHERNIHIV, Ukraine — This city endured weeks of Russian siege, but just barely. Officials here, 90 miles north of Kyiv, buried hundreds of civilians in makeshift coffins and hastily dug trenches. Families held mass funerals, fearing they could be killed if they lingered in the cemetery. Water and electricity were almost entirely cut off, and no aid could come in.

More than half of the city’s prewar population of 300,000 fled. Those who stayed behind spent much of the last five weeks huddled underground as Russian forces pounded residential neighborhoods with missiles and mortar fire. The civilian death toll remains unclear, but Mayor Vladyslav Atroshenko said at times the city buried up to 100 people in a single day.

“They were not fighting the army here,” he said in an interview from his office in the city’s historic center, which was damaged when two missiles struck nearby on Feb. 27. “They were bombing civilians.”

Advertisement

Chernihiv, a regional capital, is the largest Ukrainian city besieged by Russian troops to come back under complete Ukrainian control, though residents are preparing for what they fear could be a Russian return in the coming days.

On Monday, the first day a route from Kyiv to Chernihiv reopened, Washington Post reporters interviewed local people who provided accounts of atrocities that echo those emerging in other cities Russians have occupied, from Kyiv’s suburbs to wide swaths of the country’s east and south that remain under Russian control.

Residents here described violence and brutality by soldiers that added to the growing litany of potential Russian war crimes committed during the war in Ukraine.

A mother and father of three children describe the suffering inflicted on them by Russian forces during the occupation of their village near Chernihiv. (Video: Jon Gerberg, Alice Li/The Washington Post)

Russian troops arrived outside Chernihiv soon after the war’s start, only having to travel 45 miles by road from the border with Belarus, where they had been stationed. But the Ukrainian military managed to keep them outside the city, even though it was fully encircled.

Villages ringing Chernihiv became the front line. Locals said Russian troops repeatedly and indiscriminately deployed cluster munitions, and inflicted extreme brutality. On Monday, remnants of those weapons littered fields outside the city, alongside dozens of burned-out Russian and Ukrainian tanks and military transport vehicles.

Residents of one village near Chernihiv said that on Sunday and Monday they buried 12 civilians and that humanitarian workers removed more than 100 bodies, mostly of soldiers, both Russian and Ukrainian. They said most of the Russians were pulled from a century-old church they had been using as a place to sleep. It had been partially incinerated after a Ukrainian drone strike hit a pile of weapons next to it.

And in the city, where it was finally safe to do so, another 56 bodies were moved out of a morgue on Monday and buried in a trench.

Unlike in towns outside Kyiv such as Irpin and Bucha, where there is a sense that Russian forces have abandoned their push on the capital, officials in Chernihiv fear that Russian troops are simply regrouping and may soon be back at the city’s edge.

Advertisement

The last Russians left the city’s vicinity only a few days ago, said Viacheslav Chaus, the head of Chernihiv’s military administration. He added that the military was trying to quickly establish and secure aid and evacuation corridors that it was calling “roads of life,” in anticipation of a Russian return.

“We don’t have that feeling of peace or calm here because the Russians can come back as quickly as they left,” Atroshenko, the city’s mayor, said. “I don’t even understand the future of the war — whether this is the end of war for us or if we just need to repair water and electricity before another attack.”

The mayor was working in his third-floor office when a missile landed just outside.

His windows shattered, sending glass flying through the room. He dove to the floor before escaping outside. Another missile struck soon after. The two attacks damaged a children’s dentist’s office across the street and a historic cinema next door. The strikes also left Atroshenko convinced Russian forces intended to assassinate him.

On Monday, he surveyed the scene of damage outside his office and described how he now keeps his phone on airplane mode, to make it harder to track. He changes locations regularly and sleeps close to three bodyguards tasked with keeping him alive.

When he was first elected mayor in 2015, he never imagined his duties would include finding refrigerator trucks for morgues to preserve the unidentified dead. He never pictured Russian troops occupying the city’s main cemetery on its outskirts.

The strike on the mayor’s office came as Russians intensified their shelling, spurring many residents to flee to surrounding villages where they had extended family, hoping they might escape the worst of the battle for the city.

But facing stiff resistance, Russian troops were only able to encircle Chernihiv. That meant once-bucolic villages on the city’s perimeter, like tiny Lukashivka, were not a safe haven. Instead, they endured weeks of fierce artillery battles punctuated by Russian cluster bombing.

Advertisement

Cluster munitions, which disperse “bomblets” across a large area, are banned under a United Nations convention. So many cluster munition carriers littered the village that in the days since the Russians withdrew, residents had stacked them in piles.

By March 9, Lukashivka — former population 288 — had come under control of a Russian battalion led by a man known as Titan, who residents said terrorized them with vicious beatings and mock executions.

Alexey Pavliuk, 26, described one incident in which Titan and two other soldiers stormed into his house, dragged him and a friend into the backyard, hung them by their arms with rope from a tree branch and stripped them naked before pressing guns to their chests.

“It was below freezing, but I didn’t even notice,” Pavliuk said. “I was saying goodbye to life.”

The soldiers left them hanging while they rifled through Pavliuk’s house and stole everything of value, Pavliuk said. Then, unexpectedly, they cut the ropes.

The harassment became a daily routine. Residents said they were lined up and had their phones and passports confiscated. Others said Russian soldiers stole even their carpets and pillows.

“They put our mattresses on top of their tank and drove away with them,” Iryna Horbonos said. “After that we slept on the cold floor of our basement cellar for three weeks.”

Much of the violence was gratuitous.

As Russian losses in the village mounted, the violence against civilians worsened. Titan found Horbonos’s father-in-law, Anatoly, 70, walking one evening. Anatoly recalled how Titan forced him to guzzle from his vodka bottle, then slammed his rifle butt into his stomach twice, rendering the old man unconscious.

“We’ve lost 30 men today, so now you will suffer for it,” he remembered hearing Titan say before he lost consciousness.

On a cattle farm on the edge of the village that Russian troops took over from Ukrainians who had been using it as a defensive position, Titan’s men executed dozens of cows and calves, shooting them in their throats and eyes at point-blank range and even beheading some, leaving the heads in a pile. Residents described the killings as violence for its own sake.

The carcasses of the cattle had been rotting for a week before Olla Korobka entered their holding pen on Monday with Iryna Horbonos and her son, Nikita, 25. They rescued the only survivor, one barely alive calf stuck under the rubble.

“This is Titan’s work, too,” Korobka said.

Inside the city, as the siege dragged on, volunteers risked their lives to deliver water. Using a portable generator, they let desperate residents charge their phones to call family to confirm they were still alive. Despite their efforts, many residents died not only from shelling but because they were unable to access essential medicines, hospital employees said.

Many of those wounded in Russian attacks inside the city remain inside Chernihiv City Hospital No. 2 — their families often staying there with them because their homes were destroyed.

Bohdan Rozhylo, 40, who leads the hospital’s trauma unit, said the past month has been “the hardest of my life.”

His patients include Volodymyr Shyk, who on March 16 joined a queue of some 100 civilians waiting in line for bread. After around an hour of waiting, Shyk said, intense shelling hit the wall of the supermarket, throwing him to the ground. Shrapnel tore through his knee and broke his shin.

“I saw blood everywhere,” he said. “Twelve people didn’t stand up. They were killed instantly.” Bystanders helped evacuate him and dozens of others who were wounded to the hospital.

But even there, they had no respite.

Advertisement

The next day, Russian shelling and mortar fire struck the hospital, shattering windows and doors, filling the corridors with smoke and wounding some patients and staff in what hospital director Vladyslav Kukhar said he believes was an intentional attack. Russian forces have repeatedly struck hospitals throughout the country.

“I am 63 years old and have never witnessed such a thing,” Shyk said of the two attacks. “I would classify it as an atrocity against civilians.”

Medical workers picked shards of glass out of the faces, arms and legs of civilians wounded in the bread line. On Monday, the windows of the hospital remained boarded up and artillery damage was visible on the walls and ceilings inside.

The U.S. Embassy in Ukraine issued a statement decrying the March 16 attack, accusing Russian forces of killing at least 10 civilians. Russian officials said footage of victims amounted to a “hoax launched by the Ukrainian Security Service.”

On Monday, Shyk lay in a hospital bed, surrounded by other civilian men wounded in the city. One had been struck with shrapnel while bringing fresh produce to his wife. Another said a cluster munition landed a few feet from him while he delivered water to civilians.

Gregory Liudnyi, 63, had just biked home from a food handout around 7:30 p.m. on March 4 when he heard explosions in the distance. Rockets struck a telephone pole outside his house, sending a hail of shrapnel flying toward him.

More than a month later, he remains in the hospital — his right leg amputated at the knee despite two surgeries to try to save it. The brutality of the war has left him with “a hard feeling in my soul,” he said. To find work with just one leg, he said, will be nearly impossible.

In the bed next to him lay Valentyn Osypenko. On March 15, he and his wife, Svitlana, heard the roar of a jet pass over their house on the outskirts of town. With the power out, no air raid sirens went off. Still, they fled outside with their son and two neighbors to try to reach a nearby shelter. But they became trapped outside just as three cluster munitions fell in their backyard.

They covered their son, Ruslan, 17, with their own bodies. He escaped without injury, but the parents were both badly wounded.

Ruslan had to apply a tourniquet to his father’s leg as they waited for a ride to the hospital. One of their friends lay dead beside them.

“I think it was intentional that they hit civilian targets,” Valentyn said, showing the wounds to his right leg that remained covered in bloody bandages weeks later. “Our house is destroyed, our car is burned down.”

Svitlana, whose foot was broken, hobbled into Valentyn’s room on crutches and sat beside Ruslan on the next bed.

“We don’t know what we did to deserve this,” she said.

At the morgue behind the hospital, 13 bodies remained unclaimed in a refrigerator truck Monday, wrapped in blankets and plastic sheets. The victims still wore the clothes they were killed in — boots, sweaters, a black winter coat. A passport lay on one’s chest.

Relatives have been unable to collect them, maybe because they fled, or are still too afraid to venture out into the city — or because they too were killed.

Just outside, row after row of empty plywood coffins sat waiting.

Jon Gerberg, Kostiantyn Khudov, Serhiy Morgunov, Serhii Korolchuk and Anastacia Galouchka contributed to this report.

GiftOutline Gift Article",https://www.washingtonpost.com/world/2022/04/05/chernihiv-scene-death-destruction/
3,6fcddfaf-1d97-4001-9077-395febee1c92,"['Megan Specia', 'Cora Engelbrecht', 'Eric Schmitt', 'Nathan Willis', 'Anushka Patil', 'Traci Carl', 'Daniel Berehulak', 'Richard Pérez-Peña', 'Tyler Hicks', 'Farnaz Fassihi']",2022-04-06,"Families waiting to board trains in the eastern Ukrainian city of Kramatorsk on Tuesday.

Spurred by reports of Russian atrocities outside Ukraine’s capital, and alarmed at signs that Russia’s invasion force is about to escalate assaults in eastern Ukraine, many civilians in that region are fleeing while they can, officials said Wednesday.

“The cities of the Luhansk region are in ruins,” warned one eastern governor. “Thousands of residents have not yet left. Get out of the way!”

The exodus accelerated as Western nations moved to provide more weapons to Ukraine’s military and further ostracize Russia economically with new sanctions, including restrictions on its leading banks and on the assets of President Vladimir V. Putin’s children.

The new sanctions are a response to outrage and revulsion over the atrocities, including executions and torture, that appear to have been carried out by Russian forces before they retreated from areas outside Kyiv in the past few weeks. Russia has denied responsibility, saying the atrocities were fabricated or were committed by the Ukrainians themselves.

The European Union also was weighing a ban on coal from Russia, the leading provider of fossil-fuel energy to Europe, and Russia appeared to move closer to default on its foreign debt because of U.S. currency restrictions.

“Together with our allies and our partners, we’re going to keep raising the economic costs and ratchet up the pain for Putin, and further increase Russia’s economic isolation,” said President Biden, who has described Mr. Putin as a war criminal and suggested he should not remain in power.

More than 11 million Ukrainians — roughly one in four — have fled their homes since the Feb. 24 invasion, according to the United Nations, including more than four million who have fled the country. It is the biggest refugee crisis in Europe since World War II.

The Russian military announced last week that it would focus its campaign on eastern Ukraine, where Russian-backed separatists have been fighting for eight years. The redeployment came as the Russians, hampered by botched planning and fierce Ukrainian military resistance, retreated from the Kyiv area and apparently abandoned — at least for now — any effort to capture the capital in their war to subjugate the former Soviet republic.

Western military analysts have said the Russians vastly underestimated the challenges in Ukraine and that their initial invasion force of more than 150,000 has been weakened by losses, exhaustion and low morale. But that does not mean Russia’s military cannot undertake a powerful new assault in eastern Ukraine.

The shift has accelerated civilian displacement in the east. Thousands of people have been leaving, according to Ukrainian officials, and photos and videos posted online. Ukrainian officials say Russian troops have been massing in the Donetsk, Luhansk and Kharkiv regions.

Image Severodonetsk, in the eastern Donbas region, on Wednesday. Evacuate “now,” Ukrainians in the region have been told. Credit... Fadel Senna/Agence France-Presse — Getty Images

In Kramatorsk, a city in the north of the Donetsk region, photos showed crowds of people huddled at a platform in a central train station.

At least two people were killed and five injured when Russian forces launched a strike on a humanitarian aid site in the town of Vugledar in the Donetsk region, according to Pavlo Kyrylenko, the Donetsk governor.

Russian forces now control 60 percent of the town of Rubizhne, in the Luhansk region, according to the governor there, Serhiy Haidai, who said the attackers had scaled up their offensive this week.

“Evacuations are taking place under the roar of enemy guns,” Mr. Haidai wrote in a Facebook post on Wednesday, saying that approximately 30,000 people had left the region since Russia invaded. He urged remaining residents to flee before Russia scaled up attacks.

Oleg Synegubov, the state administrator for the Kharkiv military region, said Wednesday in a post on Telegram that the army would evacuate two towns in the eastern part of the country because fighting was escalating there.

The towns, Lozova and Barvinkove, are southwest of Izium, a city Russian forces seized as part of an apparent drive toward Sloviansk, which military analysts say is strategically critical to Russia’s plan to gain full control of eastern Ukraine.

Earlier this week, Oleksiy Danilov, the head of Ukraine’s National Security and Defense Council, speaking on national television, said “large groupings of Russian troops” had been massing in the region.

Image A young girl with her dog arriving in Zaporizhzhia, some 100 miles northwest of Mariupol. Credit... Bulent Kilic/Agence France-Presse — Getty Images

“They are not going to stop,” he said. “They have a great desire to create big problems for our armed forces in this direction, and we also expect that fierce battles will be fought there for our territory in the near future.”

The Pentagon’s assessment of Russian deployments appeared to corroborate what Ukrainian officials were saying. Pentagon officials said Russia had withdrawn all of its troops arrayed against Kyiv and another city in the north, Chernihiv, and sent them back to Russia or to its ally Belarus to rearm, resupply and possibly redeploy in eastern Ukraine.

The Pentagon officials said those forces included as many as 40,000 troops that, in many cases, had departed under fierce attack from the Ukrainian military units that retook the territory.

“We believe they are all out,” one senior Pentagon official said, speaking on the condition of anonymity to discuss confidential operational issues.

Russia now has about 30 battalion tactical groups — as many as 30,000 troops — in the east, the senior Pentagon official said. Earlier this week, Jake Sullivan, Mr. Biden’s national security adviser, said Russia would most likely send “tens of thousands of soldiers to the front line in Ukraine’s east” in the coming weeks.

Largely in anticipation of this next major phase of the war, the Pentagon announced late Tuesday that it was sending $100 million worth of Javelin anti-tank missiles — roughly several hundred missiles — to Ukraine, where the weapon has been used with high success in destroying Russian tanks and other armored vehicles.

NATO foreign ministers, meeting this week, have been discussing how to further help Ukraine prosecute the war without entangling the alliance in direct combat with Russian forces.

Image A column of Ukrainian armored vehicles on Tuesday moving through the town of Bucha, from which Russian forces recently retreated. Credit... Ivor Prickett for The New York Times

The war, they said, is far from over, noting that however badly Russia’s forces have performed, and their retreat from areas around Kyiv notwithstanding, they are making slow and brutal progress in the east.

“Moscow is not giving up its ambitions in Ukraine,” said Jens Stoltenberg, NATO’s secretary general.

Ukrainian officials in a number of areas, including Mykolayiv in the south and the Luhansk and Donetsk regions in the east, have been sharing schedules of planned evacuations or links to online portals for people to sign up to join buses and trains that are transporting residents to safer places.

But in some besieged cities in the south, like Mariupol, it is already nearly impossible to leave, making evacuations sporadic and risky.

Attempts by the Red Cross to enter Mariupol to supervise civilian departures have repeatedly been scrubbed, leaving fearful residents to fend for themselves. On Wednesday, 500 people who had escaped Mariupol to join a Red Cross convoy in the nearby city of Berdyansk arrived in Zaporizhzhia, about 100 miles away.

The climate of fear gripping Mariupol has spread to the region of Kherson, near the Black Sea, where people have lived under occupation by Russian forces since they encircled and entered the city and its suburbs on March 2.

“Anyone who did not leave early is now stuck here,” said Evgeniya Selivantseva, a doctor from Velyka Lepetyka, a village on the Dnipro River, in the Kherson region.

Dr. Selivantseva, 38, described a deepening humanitarian crisis in the village: Gasoline stations have run out of fuel, and food and medical supplies are running low. Food is so scarce that local leaders have started a makeshift flour mill.

“We feel helpless and totally defenseless,” she said. “People are afraid to leave their homes.”

The proposed European Union ban on Russian coal, part of the bloc’s effort to further penalize Russia over atrocities in Ukraine, reflected a choice of an imported energy source that would be the easiest to replace.

Deliberations over the ban and other sanctions were set to continue into Thursday, and European Union officials and diplomats anticipated that the measures would be approved. The process reflected the challenges of reaching agreement among all 27 member nations on the penalties, which would also include banning Russian ships from E.U. ports.

If approved, the sanctions would be the harshest enforced by the bloc since the invasion.

Though the European Union depends on Russian coal, the bloc could find substitute imports more easily than for natural gas and oil.

But banning coal from Russia could send energy prices soaring for European consumers, given the existing shortages in the bloc, according to Rystad Energy, a consulting firm. Carlos Torres Diaz, a senior vice president at Rystad, called the potential sanctions “a double-edged sword.”

Megan Specia and Cora Engelbrecht reported from Krakow, Poland, and Eric Schmitt from Washington. Reporting was contributed by Katie Rogers from Washington; Matina Stevis-Gridneff and Steven Erlanger from Brussels; Melissa Eddy from Berlin; and Farnaz Fassihi and Michael Schwirtz from New York.",https://www.nytimes.com/live/2022/04/06/world/ukraine-russia-war-news
