,uid,article_author,article_date,article_text,article_url
4,6fcddfaf-1d97-4001-9077-395febee1c92,['Rick Gladstone'],2022-04-05,"Perhaps it was the way the lifeless bodies, bloodied by bullets, and some with hands bound, had been left strewn about or shoveled into makeshift mass graves. Or the reality of seeing them up close in widely circulated photographs and videos.

There have been other atrocities in the weeks since Russia invaded Ukraine, concentrating much of its firepower on the dwellings and gathering spots of ordinary Ukrainians, but the international outrage they provoked has been eclipsed by the reaction to revelations that retreating Russian soldiers left many slain civilians behind near the Ukrainian capital.

Some of the bodies found this past weekend outside Kyiv were face down, and some curled up. Civilians appear to have been killed on their bicycles, while walking down the street, or in the basements of homes. In Bucha, where many of the dead were discovered, three bodies were found in a garden.

Many of the victims had been shot in the head. A coroner in Bucha said his team had collected dozens. The Russians fired at anyone as their tanks rolled through the town in the war’s early days, some residents said.",https://www.nytimes.com/2022/04/05/world/europe/russia-ukraine-war-atrocities.html
5,6fcddfaf-1d97-4001-9077-395febee1c92,[],,"The World Health Organization said on Tuesday it will supply thousands of doses of life-saving antiretroviral drugs to Ukraine to cover the needs of HIV patients in the country for the next 12 months.

WHO, along with the United States President's Emergency Plan for AIDS Relief, Ukrainian authorities and other partners, has procured 209,000 packs of generic antiretroviral drug TLD.

Ukraine has an estimated 260,000 people living with HIV, the second-largest number in Europe after Russia, and prior to Moscow's invasion around half of them were on antiretroviral treatment.

Last month, the UN agency for HIV/AIDS warned that Ukraine was left with less than a month's supply of drugs for HIV patients.

""This war has the potential to undermine the hard-earned progress of recent years on a number of health issues, including HIV. We could not let that happen when Ukraine had begun to turn a corner on HIV,"" WHO Regional Director for Europe Hans Henri P. Kluge said.

While there is no cure for HIV, antiretroviral medicines can control the virus and prevent onward sexual transmission to other people. Any disruption in treatment can lead to complications including drug resistance.

The first batch of the HIV drugs has crossed the Polish border into Ukraine and is about to be transported to HIV service facilities across the country, WHO said.",https://www.haaretz.com/world-news/europe/LIVE-u-s-eu-plan-new-sanctions-over-war-crimes-as-russia-shifts-focus-to-east-ukraine-1.10720710
