,uid,article_author,article_date,article_text,article_url
1,5fe2b112-5d84-46cb-a6bc-f217a94595b5,"['Jeremy Herb', 'Donald Judd', 'Phil Mattingly']",2022-02-23 00:00:00,"(CNN) US President Joe Biden condemned Russia's ""unprovoked and unjustified attack by Russian military forces"" in a statement Wednesday evening following explosions in Ukraine.

The US and allies are planning on Thursday to trigger the ""full scale"" of the sanctions that have been discussed over the last several weeks in response to the attack, according to a senior Biden administration official.

""President Putin has chosen a premeditated war that will bring a catastrophic loss of life and human suffering,"" Biden said. ""Russia alone is responsible for the death and destruction this attack will bring, and the United States and its Allies and partners will respond in a united and decisive way. The world will hold Russia accountable.""

The White House statement came in response to explosions across Ukraine, including in the capital of Kyiv. Shortly before the explosions began, Russian President Vladmir Putin announced a ""special military operation"" and called for Ukraine's ""demilitarization"" in televised remarks.

An adviser for the interior minister of Ukraine, Anton Gerashchenko, said Russia's ""invasion has begun"" with ""missile strikes on Kyiv,"" in an official WhatsApp group with journalists.

The early assessment from the US is that this is the start of the full Russian invasion, according to a senior US official familiar with the latest US intelligence. The source said the belief is that the explosions heard near Kyiv and Odessa are likely missiles, while those around Kharkiv in eastern Ukraine are likely artillery, given the proximity to the border.

Biden held a secure call with members of his national security team from the White House Wednesday evening, White House press secretary Jen Psaki tweeted . Biden was joined by Secretary of State Antony Blinken, Defense Secretary Lloyd Austin, Chairman of the Joint Chiefs of Staff Gen. Mark Milley and national security adviser Jake Sullivan, she said.

Biden also spoke by phone with Ukrainian President Volodymyr Zelensky. In a statement on the call, Biden said he briefed Zelensky ""on the steps we are taking to rally international condemnation, including tonight at the United Nations Security Council.""

""He asked me to call on the leaders of the world to speak out clearly against President Putin's flagrant aggression, and to stand with the people of Ukraine,"" Biden said.

In an address Thursday morning in Ukraine, Zelensky said he was introducing martial law across the country and urged Ukrainians to remain calm.

""No panic. We are strong. We are ready for everything,"" he said. ""We will win over everybody because we are Ukraine.""

Biden said that he planned to speak to his G-7 counterparts and would give a speech to the American people on Thursday. He said he intended to announce ""further consequences"" that the US and its allies planned to impose on Russia over ""this needless act of aggression against Ukraine and global peace and security.""

""We will also coordinate with our NATO Allies to ensure a strong, united response that deters any aggression against the Alliance,"" Biden said.

While the administration official declined to lay out specifics, the US has planned to target Russia's two largest banks, as well as other financial firms, and has prepared to deploy export controls to cut off Russian access to critical Western technology for entire Russian economic sectors.

Additional members of Putin's inner circle and their families are also likely to be targeted.

Discussions were ongoing late Wednesday evening between US and European officials about the final shape of the package, the official said. It will also be a topic of discussion at the virtual G-7 meeting that has been scheduled, the official said.

US officials remain on high alert for any cyber activity against key domestic targets including banks and critical infrastructure, the official said.

Biden's national security team plans to brief the House and Senate in separate, unclassified phone calls Thursday on the situation in Ukraine. Lawmakers from both parties roundly condemned Russia's actions in statements Wednesday and called for the US to ramp up sanctions against Moscow.

UN meeting as explosions begin

The UN Security Council held an emergency meeting on Wednesday evening in New York -- offering a remarkable split screen as the diplomats delivered speeches at the same time Putin's speech aired on Russian television and the explosions began in Ukraine. Ukraine's Ambassador to the United Nations

Sergiy Kyslytsya directly questioned Russia's representative in his speech.

""About 48 minutes ago, your President declared war on Ukraine,"" Kyslytsya said. ""You declared the war. It is the responsibility of this body to stop the war.""

US Ambassador to the UN Linda Thomas-Greenfield spoke for a second time as the UN meeting was nearing an end, stating Putin had ""delivered a message of war"" while the Security Council was meeting. She said the US would introduce a resolution in the UN on Thursday.

""At the exact time as we are gathered in the Council seeking peace, Putin delivered a message of war in total disdain for the responsibility of this council,"" Thomas-Greenfield said.

As the final speaker of the meeting, Kyslytsya turned his attention again to Russia's UN ambassador, Vasily Nebenzya, who was acting as president of the Security Council.

JUST WATCHED See Ukrainian ambassador's reaction as Russian counterpart defends Moscow's attacks Replay More Videos ... MUST WATCH See Ukrainian ambassador's reaction as Russian counterpart defends Moscow's attacks 01:49

""I welcome the decision of some members of this council to meet as soon as possible to consider the necessary decision that would condemn the aggression that you launch on my people,"" Kyslytsya said. ""There is no purgatory for war criminals. They go straight to hell, Ambassador.""

Nebenzya shot back by claiming Moscow wasn't being aggressive against the Ukrainian people but against the ""junta"" in power in Kyiv, before hastily gaveling an end to the UN meeting.

CORRECTION: This story has been updated to correctly identify the Ukrainian ambassador to the UN.",https://www.cnn.com/2022/02/23/politics/biden-russia-ukraine/index.html
2,5fe2b112-5d84-46cb-a6bc-f217a94595b5,[],,"JavaScript is not available.

We’ve detected that JavaScript is disabled in this browser. Please enable JavaScript or switch to a supported browser to continue using twitter.com. You can see a list of supported browsers in our Help Center.

Help Center",https://twitter.com/whitehouse/status/1496918779346968590
3,5fe2b112-5d84-46cb-a6bc-f217a94595b5,"['Kathryn Watson', 'Kathryn Watson Is A Politics Reporter For Cbs News Digital Based In Washington', 'Melissa Quinn']",,"California teen who vanished three years ago found alive in Utah

Wildfires rage in West, destroying homes and forcing thousands to evacuate

Here's what Biden, Harris and their spouses paid in 2021 taxes

Accident or murder? Wife of Pittsburgh dentist dies from fatal gunshot

Easter stories from the 60 Minutes Archive

2 killed, 9 wounded in shooting at Pittsburgh party, police say

Police arrest suspect in South Carolina mall shooting that injured 14

The Neptune: The missiles that struck Russia's flagship, the Moskva

Ukraine remains defiant as key port city of Mariupol teeters on the brink

Kathryn Watson is a politics reporter for CBS News Digital based in Washington, D.C.

Zelenskyy urges Europe to end energy dependence on Russia

Zelenskyy urges Europe to end energy dependence on Russia

Jews, Christians and Muslims mark major holidays, shadowed by war

Jews, Christians and Muslims mark major holidays, shadowed by war

The Neptune: The missiles that struck Russia's flagship, the Moskva

The Neptune: The missiles that struck Russia's flagship, the Moskva

Ukraine remains defiant as key port city of Mariupol teeters on the brink

Ukraine remains defiant as key port city of Mariupol teeters on the brink

Biden on Russia's invasion of Ukraine

Biden on Russia's invasion of Ukraine

Be the first to know

Get browser notifications for breaking news, live events, and exclusive reporting.

Not Now

Turn On",https://www.cbsnews.com/live-updates/russia-ukraine-sanctions-biden-speech-putin-aggressor/
4,5fe2b112-5d84-46cb-a6bc-f217a94595b5,['Press Trust Of India'],,"US President will deliver remarks on the Russian military actions in on Thursday, the announced.

Biden's first public comment on the Russian attack is scheduled to be delivered from the East Room of the at 11 pm IST (12:30 pm EST), according to the .

The presidential comment could come after his virtual consultations with the leaders of G-7 countries, a grouping of seven major advanced nations including Canada, France, Germany, Italy, Japan, the United Kingdom, and the United States. Three of them US, UK and France -- are permanent members of the UN Security Council.

According to a White House official, Biden and G-7 leaders were discussing their joint response to President Putin's unprovoked and unjustified attack on .

Earlier, Biden convened a meeting of the National Security Council in the morning in the Situation Room to discuss the latest developments in Ukraine, said a White House official.

(Only the headline and picture of this report may have been reworked by the Business Standard staff; the rest of the content is auto-generated from a syndicated feed.)",https://www.business-standard.com/article/international/joe-biden-to-speak-on-russian-attack-on-ukraine-says-white-house-122022401624_1.html
5,5fe2b112-5d84-46cb-a6bc-f217a94595b5,[],2022-02-24 00:00:00,"Updated at 1:21 p.m.



Franco Ordoñez, Brian Naylor | NPR

President Biden issued a new round of economic sanctions Thursday meant to punish Russian President Vladimir Putin for attacking Ukraine.

""Putin is the aggressor,"" Biden said in remarks at the White House. ""Putin chose this war and now he and his country will bear the consequences.""

Biden said the U.S. will block four additional Russian banks, including the two largest — Sberbank and VTB — from having access to the U.S. financial system and limit Russia's ability to import Western technology. He said the actions will hamper Russia's ability to do business ""in dollars, pounds, euros and yen.""

""The U.S. stands up to bullies,"" Biden said. ""We stand up to freedom.""

Biden repeated that U.S. troops will not be deployed to Ukraine, but reiterated that he has sent ""thousands of additional forces to Germany and Poland"" to protect NATO's eastern flank. Biden said NATO will convene a summit on Friday and that ""we'll be there to bring together the leaders of 30 allied nations and close partners to affirm our solidarity.""

""This is a dangerous moment for all of Europe,"" Biden said.

""If we don't move against him [Putin] now with these significant sanctions, he will be in Poland,"" Biden predicted.

Biden said he understood the effects on Americans of Russia's invasion

Biden vowed that he ""will do everything in my power to alleviate the pain"" that Americans are feeling at the gas pump as oil prices spike. But, he said, ""this aggression cannot go unanswered.""

Biden said that the U.S. and its allies would not take the step of keeping Russia from using the SWIFT system for global banking transactions because Europe did not want to, but he said it would be held in reserve.

Putin, he said, ""has much larger ambitions than Ukraine,"" adding that he thinks the Russian president wants to reestablish the Soviet Union. ""If we don't move against him now with these significant sanctions,"" Biden said, ""he will be emboldened.""

The White House has been saying for weeks that its threat of sanctions was aimed at deterring an invasion. But on Thursday, Biden said the sanctions were not expected to prevent one. Instead, he said, it would take time to have the intended impact: weakening Russia's economy.

Biden also again warned Putin against conducting cyberattacks against U.S. companies and infrastructure, vowing ""we are prepared to respond.""

Biden said Putin ""will be a pariah on the international stage""

Biden said he spoke Wednesday night with Ukrainian President Volodymyr Zelenskyy and promised him the U.S. would provide humanitarian aid. Biden said Putin has ""unleashed a great pain"" on the Ukrainian people.

This morning, I met with my G7 counterparts to discuss President Putin’s unjustified attack on Ukraine and we agreed to move forward on devastating packages of sanctions and other economic measures to hold Russia to account. We stand with the brave people of Ukraine. pic.twitter.com/dzvYxj7J9w — President Biden (@POTUS) February 24, 2022

The Treasury Department said in a statement that on a daily basis, Russian financial institutions conduct about $46 billion worth of foreign exchange transactions globally, 80% of which are in U.S. dollars. ""The vast majority of those transactions will now be disrupted,"" according to the statement. ""The Russian financial institutions subject to today's action can no longer benefit from the remarkable reach, efficiency, and security of the U.S. financial system.""

Payments for energy will be allowed, the Treasury Department confirmed, as well as payments for agricultural and medical commodities.

Six Russian individuals were added to the sanctions list — two banking executives and four family members of other officials deemed close to Putin.

New sanctions take aim at cutting Russia off from critical technology

The Commerce Department on Thursday unveiled its new export controls for Russia, saying that semiconductors, computers, telecommunications, information security equipment, lasers and sensors would be subject to the new bans. In addition, 49 Russian military end users were added to a control list.

The department said similar measures would be taken by the EU, Japan, Australia, United Kingdom, Canada and New Zealand, and that more countries were expected to join.

Thursday's sanctions follow measures Biden announced Tuesday. The first wave of sanctions against Russia targeted two Russian financial institutions along with the government's ability to access Western financing. There were also sanctions against the Russian-owned company building the Nord Stream 2 natural gas pipeline.

Biden has warned that these were the first ""tranche"" of sanctions and that the administration would ratchet up the response based on Russia's next steps. Senior administration officials say the group of Russian elites and their family members who are being sanctioned have ""shared in the corrupt gains of the Kremlin, and they will now share in the pain.""

Meanwhile, the administration and bipartisan members of Congress have been discussing providing additional assistance to Ukraine and allies and partners.",https://www.capradio.org/articles/2022/02/24/biden-is-expected-to-announce-new-sanctions-after-russia-attacks-ukraine/
6,5fe2b112-5d84-46cb-a6bc-f217a94595b5,"['Benjamin Kail', 'Bkail Masslive.Com']",2022-02-24 17:28:00.002000+00:00,"President Joe Biden plans to address Russia President Vladimir Putin’s unprovoked attack on Ukraine in a White House speech at *1:30 p.m. on Thursday.

The update from Biden comes as a wave of ongoing air strikes and Russian troop deployments have led to dozens of deaths across Ukraine, which Putin claimed he has no plans to occupy after “recognizing” rebel-held eastern regions and falsely suggesting the former Soviet republic isn’t a sovereign nation.

On Thursday morning, Putin announced plans to demilitarize and “denazify” Ukraine — a claim that experts quickly denounced as preposterous, as Russian troops and tanks poured into a country with a democratically elected Jewish president, Volodymyr Zelenskyy.

“There is no purgatory for war criminals. They go straight to hell,” Sergiy Kyslytsya, the Ukrainian Ambassador to the United Nations, told the U.N. Security Council, in remarks directed at his Russian counterpart Wednesday night as airstrikes started to pound his country.

60 The Russian Invasion of Ukraine

Biden’s address can be watched here at MassLive through the above White House YouTube feed.

Ukraine won its independence in 1991.

Earlier this week, Putin asserted that Ukraine only exists because of Russia, which belies both countries’ long and complex histories and is at odds with the international community’s recognition of Ukraine.

Russia had ramped up its military presence around Ukraine’s borders for months, claiming to conduct military exercises and denying it planned any invasion.

U.S. intelligence officials, Biden, Secretary of State Antony Blinken and Pentagon leaders increasingly warned for weeks that the Kremlin planned to use disinformation and propaganda as a pretext for war.

On Thursday morning, Putin claimed that the newly “recognized” Russian-backed republics in Eastern Ukraine requested Russia’s help to face Ukrainian aggression, and that in response he’d decided to conduct a “special military operation.” U.S. officials and European leaders say there was no Ukrainian aggression and point to Russia’s unprovoked military buildup and continued false statements from the Kremlin.

Zelenskyy said he tried to call Putin days ago to re-engage in diplomacy, but Putin never responded. Zelenskyy pledged to fully defend Ukraine, which is not a member of the European Union or the North Atlantic Treaty Organization.

The Biden administration and European allies have already announced punishing economic sanctions for Russia, which also was hit with severe sanctions after it rolled into the Crimean peninsula in 2014 and took control of the region from Ukraine.

Putin warned Western leaders Thursday: “To anyone who would consider interfering from the outside — if you do, you will face consequences greater than any you have faced in history.”

Biden on Thursday morning met with the Group of 7 conference of industrialized nations to discuss the joint response to the unprovoked attack.

“The prayers of the entire world are with the people of Ukraine tonight as they suffer an unprovoked and unjustified attack by Russian military forces,” Biden said Wednesday night. “President Putin has chosen a premeditated war that will bring a catastrophic loss of life and human suffering. Russia alone is responsible for the death and destruction this attack will bring, and the United States and its Allies and partners will respond in a united and decisive way. The world will hold Russia accountable.”

In a statement provided by the White House after a phone call with Zelenskyy, Biden said again that he’d pledged severe sanctions against Russia and continued support for the Ukrainian people.

“[Zelenskyy] asked me to call on the leaders of the world to speak out clearly against President Putin’s flagrant aggression, and to stand with the people of Ukraine,” he said.

*Editor’s note: the original broadcast time was set for 12:30 p.m. ET.

Related Content:",https://www.masslive.com/news/2022/02/russia-attacks-ukraine-watch-live-as-president-joe-biden-addresses-vladimir-putins-unprovoked-attack.html
