,uid,article_author,article_date,article_text,article_url
0,cd1fb4de-4c84-47c4-9fbe-ede5a7b3e3b4,[],2022-03-25 00:00:00,Axie Infinity believes the ‘play-to-earn’ model is unsustainable. One horse racing blockchain game is doubling down on it.,https://fortune.com/2022/03/25/russia-g20-summit-putin-biden-indonesia-bali-china-ukraine/
1,cd1fb4de-4c84-47c4-9fbe-ede5a7b3e3b4,[],2022-03-24 21:59:10+00:00,"President Joe Biden has called for Ukraine to be welcomed at future G20 summits should US attempts to expel Russia be unsuccessful.

After meeting with European allies on Thursday in Brussels, Mr Biden told a press conference it was time to step up efforts to isolate Russia from the international community.

He said if G20 member countries blocked his request to remove Russia, then Ukraine should be invited to attend the meetings.

“The single most important thing is for us to stay unified and the world to continue to focus on what a brute this guy (Russian President Vladimir Putin) is and all the innocent people’s lives that will be lost and ruined and what’s going on,” Mr Biden told reporters.

He said he didn’t expect the sanctions to have an impact in the short term, but he expected in the months to come the sustained pressure would take a toll on Mr Putin’s ability to wage war.

Joe Biden speaks in Brussels. (Copyright 2022 The Associated Press. All rights reserved)

“If you’re Putin and you think that Europe is going to crack in a month or six weeks or two months, why not. They can take anything for another month. But the reason I asked for the meeting, we have to stay fully, totally united,” Mr Biden said.

The president’s comments came after he met with the leaders of the 30 Nato countries and G7 partners in back-to-back meetings.

The countries presented a united front against Russia, issuing further sanctions against 300 members of its Parliament and discussing how they would counter the threat of a potential chemical or biological weapon attack.

The US also announced it would take in 100,000 Ukrainian refugees and donate $1bn in aid to help Europe deal with the surge of nearly 3 million refugees.

The G20 or Group of Twenty is a forum of the world’s 19 largest economies and the European Union, and has met at least once a year since 2008 to address issues including the financial stability and climate change.",https://www.independent.co.uk/news/world/americas/joe-biden-ukraine-g20-russia-b2043587.html
2,cd1fb4de-4c84-47c4-9fbe-ede5a7b3e3b4,[],2022-03-24 00:00:00,"U.S. President Joe Biden attends a news conference in the framework of a European Union leaders summit amid Russia's invasion of Ukraine, in Brussels, Belgium March 24, 2022. REUTERS/Evelyn Hockstein

BRUSSELS, March 24 (Reuters) - U.S. President Joe Biden said he thinks Russia should be removed from the Group of Twenty (G20) major economies and the topic was raised during his meetings with world leaders in Brussels earlier on Thursday.

""My answer is yes, depends on the G20,"" Biden said, when asked if Russia should be removed from the group.

Biden also said if countries such as Indonesia and others do not agree with removing Russia, then in his view, Ukraine should be allowed to attend the meetings.

Register now for FREE unlimited access to Reuters.com Register

Reporting by Jarrett Renshaw in Brussels and Nandita Bose in Washington; Editing by Chris Reese

Our Standards: The Thomson Reuters Trust Principles.",https://www.reuters.com/world/biden-says-he-thinks-russia-should-be-removed-g20-2022-03-24/
3,cd1fb4de-4c84-47c4-9fbe-ede5a7b3e3b4,"['Shannon Pettypiece', 'Shannon Pettypiece Is The Senior White House Reporter For Nbcnews.Com.']",2022-03-24 18:09:31.828000+00:00,"BRUSSELS — President Joe Biden said the most effective tool to end the invasion of Ukraine will be keeping NATO and European allies united and punishing those countries that defy sanctions against Russia.

He also said, following a day of meeting with key allies here, that Russia should be expelled from the G-20 group of nations and that if the other G-20 nations didn’t support expelling Russia from the group, then he would make the case for Ukraine to be able to participate in the meetings.

""The single most important thing is for us to stay unified and the world to continue to focus on what a brute this guy [Russian President Vladimir Putin] is and all the innocent people’s lives that will be lost and ruined and what’s going on,"" Biden said during a news conference.

""If you’re Putin and you think that Europe is going to crack in a month or six weeks or two months, why not. They can take anything for another month. But the reason I asked for the meeting, we have to stay fully, totally united,"" Biden said.

The U.S. announced a package of new sanctions against Russia Thursday that would apply to more than 400 Russians and Russian entities, including the Duma and more than 300 of its members, along with more than 40 defense companies.

Biden said he didn’t anticipate any of the actions taken Thursday to have an effect on Putin’s behavior in the short term, pointing instead to the impact of sustained and coordinated pressure.

“Why I asked for this NATO meeting today is to be sure that after a month we will sustain what we’re doing, not just next month and the following month, but for the remainder of this entire year. That’s what will stop him,” Biden said.

One wild card in the U.S. efforts to economically pressure Russia is China's next move. Biden said he has made it clear to Chinese President Xi Jinping that there would be consequences if he were to help Russia, pointing to the companies that have left Russia since the invasion.

""I think that China understands that its economic future is much more closely tied to the West than it is to Russia,"" Biden said.

Biden attended an emergency gathering of NATO leaders Thursday, where a senior administration official described the mood as having been “sober, it’s been resolute and it’s been incredibly united.” The NATO summit was followed by a meeting with leaders of the Group of Seven leading industrial nations and an address to European Union leaders.

As the biggest conflict in Europe since World War II enters its second month, the discussions here stood to be among the most consequential of Biden’s presidency. While the U.S. rolled out new steps aimed at further harming the Russian economy and additional assistance for Ukrainian refugees, Biden made no new military commitments to Ukraine.

While Biden has committed $2 billion in military assistance to Ukraine, that country’s president, Volodymyr Zelenskyy, told NATO on Thursday that his nation still needs more military equipment, specifically tanks and fighter jets.

“You have at least 20,000 tanks. Ukraine asked for a percent, one percent of all your tanks to be given or sold to us,” Zelenskyy said in a speech to NATO. “But we do not have a clear answer yet. The worst thing during the war is not having clear answers to requests for help.”

One topic the leaders discussed Thursday was the possibility that Putin might use chemical or biological weapons, something Biden said earlier this week was a “real threat.” Biden declined to elaborate on what NATO would do should Putin use chemical weapons but said the response would be “in kind.”

The administration also announced plans to take additional steps to prevent Russia from attempting to prop up its economy, like making clear that any transactions involving gold related to the bank are prohibited and calling on corporations to no longer conduct their activities with Russia in a business-as-usual manner.

And the White House said it would allow as many as 100,000 Ukrainians to enter the U.S., with a focus on those who are most vulnerable. The administration is also prepared to offer more than $1 billion in additional funding toward humanitarian assistance and $11 billion over the next five years to address worldwide food security threats after the disruptions to the Russian and the Ukrainian agricultural industries.",https://www.nbcnews.com/politics/white-house/biden-says-allies-must-stay-united-russia-expel-g20-rcna21381
4,cd1fb4de-4c84-47c4-9fbe-ede5a7b3e3b4,"['Zachary Basu', 'Authors Zbasu']",2022-03-24 18:25:40.757000+00:00,"President Biden said Thursday that he would support Russia being expelled from the G20 over its invasion of Ukraine, a step that would further isolate Vladimir Putin on the international stage.

Driving the news: Biden said the decision would ultimately be up to the G20, but that he has proposed allowing Ukraine to attend as an observer nation if other members do not agree to remove Russia.

The big picture: Biden spoke after hours of meetings with the leaders of NATO and the G7, and ahead of the European Council summit where he's been invited as a guest.

Biden announced earlier in the day that the U.S. would provide $1 billion in humanitarian assistance to Ukraine, welcome up to 100,000 Ukrainian refugees, and impose sanctions on over 600 Russian lawmakers, elites and defense companies.

The G7 and EU also agreed on a new initiative to tighten sanctions enforcement, as well as cooperation on supporting third countries harmed by sanctions and disruptions to food and energy security.

Other highlights

Chemical weapons: Biden said NATO ""would respond"" if Russia used chemical, biological or nuclear weapons inside Ukraine, and that ""the nature of the response would depend on the nature of the use.""

Pressed further on whether NATO would respond militarily, Biden said ""we'd make that decision at the time.""

China: Biden said he made clear in his phone call with Chinese President Xi Jinping last week that he would be putting himself in ""significant jeopardy"" if Beijing supported Russia militarily or with sanctions evasion.

He added that he believes China ""understands its economic future is much more closely tied to the West than it is to Russia.""

Food shortages: Biden warned that there is a real risk of global food shortages given Russia and Ukraine's role as the ""bread basket of Europe,"" and that the G7 and EU discussed ways to lift restrictions and other measures to alleviate those concerns.

Trump's return: Biden said it's ""not an illogical question"" for Europeans and other U.S. allies to ask whether Donald Trump could win back the White House in 2024, but quipped that he would feel ""very fortunate"" to have Trump as an opponent.",https://www.axios.com/biden-russia-g20-summit-d8fe5ce7-5986-4fc3-bb17-c5f4c17c3a10.html
5,cd1fb4de-4c84-47c4-9fbe-ede5a7b3e3b4,[],,"President says that he wants out of the G-20.

Biden made the comments during a press conference Thursday in Brussels following a series of urgent NATO meetings on the Russian invasion of Ukraine. The G-20, or Group of Twenty, is an intergovernmental forum of 19 countries and the European Union that works on major global issues. He said he raised the issue Thursday with other world leaders.

Biden said that he would prefer is removed from the group, but should Indonesia or other nations disagree, he would ask that Ukraine leaders be allowed in for conversations.

Biden and Western allies on Thursday pledged new sanctions and humanitarian aid in response to the continued assault in Ukraine by Russian President .

(Only the headline and picture of this report may have been reworked by the Business Standard staff; the rest of the content is auto-generated from a syndicated feed.)",https://www.business-standard.com/article/international/ukraine-war-us-president-joe-biden-says-he-wants-russia-out-of-the-g20-122032500012_1.html
6,cd1fb4de-4c84-47c4-9fbe-ede5a7b3e3b4,['Nicholas Gordon'],,"Russian President Vladimir Putin is likely keeping his invitation to join the G20 Summit in Bali later this year, despite calls from the U.S. and others to bar him from the November meeting due to his invasion of Ukraine.

At a Thursday press conference, U.S. President Joe Biden said that he supports ejecting Russia from the G20, an informal grouping of some of the world’s largest developed and developing economies, though noted that Russia's exclusion ""depends on the [other] G20"" members agreeing to excommunicate Putin—which is unlikely.

In 2014—after Putin annexed Crimea—members of what was then the G8 agreed to exclude Russia from their meetings, going back to being the G7. At the time, Russia Foreign Minister Sergey Lavrov downplayed the significance of Russia's eviction, saying the G8 ""does not give out any membership cards and, by its definition, cannot remove anyone.""

Australia, which hosted the G20 in 2014, threatened to push for Russia's removal from the larger economic summit that year, too. Ultimately Russia was allowed to join because the other G20 members had no consensus on excluding the country.

Now, once again, the G20 members are divided over the issue of whether Putin should be allowed to attend, or whether Ukraine should be invited too, as Biden has suggested. Putin's presence would be ""highly problematic"" for European members, one EU source told Reuters. Australian prime minister Scott Morrison called sitting with Putin in Bali ""a step too far"", and said he had talked directly with Indonesian president Joko Widodo on the subject.

On Tuesday, Poland said that it asked the U.S. to consider ejecting Russia from the G20—and allow Warsaw to claim Moscow’s seat. But it's unlikely the G20 will eject Russia from the organization, given that any decision on membership would likely need to be reached by all the members.

On Wednesday, Russia's ambassador to Indonesia, Lyudmila Vorobieva, said that Putin would attend the summit, and that Russia wanted the G20 to focus on ""economic problems."" China has backed Russia’s continued presence in the G20, calling it an “important member”.

Story continues

“No member has the right to remove another country as a member,” said Chinese foreign ministry spokesperson Wang Wenbin at a news briefing on Wednesday. China had earlier asked Indonesia to keep Ukraine off the G20's agenda.

The issue also puts pressure on Indonesia, the current president of the G20 and host of this year's summit, to be held in Bali this October. On Thursday, Indonesia said it would ""remain impartial"" and affirmed that it would invite Russia to the G20 summit.

The G20 is an informal organization of twenty advanced and developing countries that largely corresponds to the world’s largest economies, with a few concessions made to ensure geographical diversity.

The first summit of G20 heads of state was held in November 2008 in Washington D.C. as a way to coordinate a global policy response to the Global Financial Crisis. Since then, the yearly. summit has become a platform for discussing cooperation on global issues like macroeconomic stability and climate change.

At the last G20 Summit, held in Rome, leaders agreed to set a minimum corporate tax rate of 15%, and stop funding overseas coal projects. Putin did not attend the Rome summit in-person, joining via video.

This story was originally featured on Fortune.com",https://www.yahoo.com/video/president-biden-wants-kick-russia-075441266.html
