,uid,article_author,article_date,article_text,article_url
0,088c9b1c-6963-4a5f-9a6f-32d986e53ddf,[],,"Heavy fighting and Russian air strikes continue in the encircled Ukrainian city of Mariupol, British military intelligence said on Wednesday.

""The humanitarian situation in the city is worsening,"" the defence ministry said.

""Most of the 160,000 remaining residents have no light, communication, medicine, heat or water. Russian forces have prevented humanitarian access, likely to pressure defenders to surrender.""

Reuters could not immediately verify the report.

(Reporting by Akanksha Khushi in Bengaluru; Editing by Clarence Fernandez)",https://www.todayonline.com/world/britain-says-heavy-fighting-russian-air-strikes-continue-ukraines-mariupol-1865836
1,088c9b1c-6963-4a5f-9a6f-32d986e53ddf,[],2022-04-06 22:48:00+00:00,"More than 5,000 civilians have been killed in the besieged city of Mariupol since the Russian invasion of Ukraine started, a top official has claimed.

Mariupol mayor Vadym Boichenko said that among the thousands of civilians killed during weeks of Russian airstrikes and street fighting, 210 were children.

He claimed Russian forces bombed hospitals, including one in which 50 people burned to death, and added that more than 9 per cent of the city’s infrastructure has now been completely destroyed.

The city has been encircled by Russian forces for more than a month and has been cut off from food, water, fuel and medicine supplies.

Almost 160,000 people remained trapped in the city, which had a pre-war population of 430,000, according to British defence officials.

A humanitarian-relief convoy accompanied by the Red Cross has been trying without success to get into the city since Friday.

In other developments, Ukrainian president Volodymyr Zelensky warned that Moscow is now marshalling reinforcements and trying to push deeper into the country’s east.

A local resident stands near an apartment building damaged by Russian airstrikes in the southern port city of Mariupol, Ukraine (REUTERS)

“The fate of our land and of our people is being decided. We know what we are fighting for. And we will do everything to win,” Mr Zelensky said.

His comments came after a US defence official said that Russian forces had completed the pullout of all of its estimated 24,000 or more troops from the Kyiv and Chernihiv areas in the north of the country.

The official, speaking on condition of anonymity, said they were being sent into Belarus or Russia to resupply and reorganise.

In response to the scenes of atrocities that were revealed when Russian forces left the town of Bucha, northwest of the capital, Kyiv, last week, the US and Western allies have imposed yet further sanctions against the Kremlin.

✕ Biden vows to 'ratchet up the pain' on Putin to increase economic isolation

The UK government put an asset freeze on Russia’s largest bank Sberbank and an “outright ban” on outward investment to the country, worth £11 billion in 2020.

Meanwhile, US president Joe Biden signed an executive order directly targeting Mr Putin and foreign minister Sergei Lavrov’s families, and also blocked further new investment in Russia.

“There’s nothing less happening than major war crimes,” Mr Biden said in a speech to labour leaders, referring to the Ukrainian town of Bucha retaken from Russian forces where civilians were found shot at close range.

“Responsible nations have to come together to hold these perpetrators accountable,” he said. “And together with our allies and our partners, we’re going to keep raising economic costs and ratchet up the pain for Putin.”

Moscow has insisted its troops have committed no war crimes and said that the images out of Bucha were staged by the Ukrainians.

The Independent has a proud history of campaigning for the rights of the most vulnerable, and we first ran our Refugees Welcome campaign during the war in Syria in 2015. Now, as we renew our campaign and launch this petition in the wake of the unfolding Ukrainian crisis, we are calling on the government to go further and faster to ensure help is delivered. To find out more about our Refugees Welcome campaign, click here. To sign the petition click here. If you would like to donate then please click here for our GoFundMe page.

Additional reporting by agencies",https://www.independent.co.uk/news/world/europe/mariupol-deaths-russia-invasion-mayor-b2052513.html
2,088c9b1c-6963-4a5f-9a6f-32d986e53ddf,[],,"Since the 40th day of the invasion of Ukraine, Russian troops have been reorganizing and trying to improve the tactical situation in some areas of southern Ukraine, according to the General Staff of the Armed Forces of Ukraine.

“Additional units of the Russian Federation are being formed and transferred to take part in hostilities on the territory of Ukraine,” the statement said.

The General Staff of the Armed Forces of Ukraine stated:

- Advertisement -

In the direction of Volyn – unchanged.

In the direction of Polissya high probability of rocket and bomb attacks on military and civilian infrastructure. Russian troops are moving by rail and air from Belarus to Russia.

- Advertisement -

In the north direction – The withdrawal of units from the Central Military District in the territory of the Kursk region and their further relocation has been completed.

In the direction of Slobozhansky – Blockade of Kharkiv, artillery bombardment of the city, reorganization of troops, strengthening of air cover of objects in the area of ​​Belgorod city and areas of concentration of troops in the direction of Kharkiv.

- Advertisement -

“There is still a high probability of airstrikes and missiles on civilian targets in Kharkov, preparations are underway for an attack in the direction of Slavyansk,” the statement said.

In the directions of Donetsk and Tavriya – Russian forces are concentrated in Rubezhnoye, Popasnaya, Severodonetsk, Mariupol. In Mariupol today the troops of the Russian Federation made 8 air raids, street battles continue. “Ukrainian defenders are defending the city,” the General Staff added.

In the direction of South Bug our troops repel the invaders in the area of ​​Hersonissos. The enemy carried out air reconnaissance around Nikolaev using a UAV.

In the business zones of the Black Sea and the Azov – The activity of the group of ships of the Russian troops in the Black Sea decreased due to the storm (up to 4 points).

lasts from the morning of February 24th. Russian troops have carried out airstrikes on key military and civilian infrastructure, destroying homes, churches, schools, hospitals, gas stations, airports, military units and oil depots.

Russia has denied any wrongdoing on the part of Ukraine, calling it a “special operation” to “demilitarize and demilitarize.” In addition, despite numerous testimonies, the Russian authorities deny that they are attacking civilians in Ukraine.",https://24happenings.com/top-world/163827.html
3,088c9b1c-6963-4a5f-9a6f-32d986e53ddf,[],,"A local resident stands near an apartment building damaged during Ukraine-Russia conflict in the southern port city of Mariupol, Ukraine April 4, 2022. REUTERS/Alexander Ermochenko reuters_tickers

This content was published on April 6, 2022 - 05:51

(Reuters) - Heavy fighting and Russian air strikes continue in the encircled Ukrainian city of Mariupol, British military intelligence said on Wednesday.

""The humanitarian situation in the city is worsening,"" the defence ministry said.

""Most of the 160,000 remaining residents have no light, communication, medicine, heat or water. Russian forces have prevented humanitarian access, likely to pressure defenders to surrender.""

Reuters could not immediately verify the report.

(Reporting by Akanksha Khushi in Bengaluru; Editing by Clarence Fernandez)",https://www.swissinfo.ch/eng/britain-says-heavy-fighting--russian-air-strikes-continue-in-ukraine-s-mariupol/47495006
