,uid,article_author,article_date,article_text,article_url
5,088c9b1c-6963-4a5f-9a6f-32d986e53ddf,"['Maureen Chowdhury', 'Mike Hayes', 'Jason Kurtz', 'Aditi Sangal', 'Meg Wagner', 'Travis Caldwell', 'Helen Regan', ""Seán Federico O'Murchú"", 'Amy Woodyatt', 'Jack Bantock']",2022-04-06 04:00:39+00:00,"The US will announce new sanctions on Russia Wednesday in coordination with Group of Seven nations and the European Union, according to an administration official.

The official said the sweeping package ""will impose significant costs on Russia and send it further down the road of economic, financial, and technological isolation.""

The new sanctions package will:

Ban all new investment in Russia

Increase sanctions on financial institutions and state-owned enterprises in Russia

Sanction Russian government officials and their family members

The new sanctions package will mark the latest escalation in efforts by the US and its allies to impose costs on Russia for its invasion and, over time, cut off critical economic sectors the country utilizes to wage the ongoing war.

They also follow new revelations of further atrocities committed by Russian forces in northern Ukraine, with the images of the atrocities committed in Bucha serving as an accelerator to ongoing discussions between the US and its European allies to ramp up the economic costs, officials said.

""These measures will degrade key instruments of Russian state power, impose acute and immediate economic harm on Russia, and hold accountable the Russian kleptocracy that funds and supports Putin's war,"" the official said. ""These measures will be taken in lockstep with our allies and partners, demonstrating our resolve and unity in imposing unprecedented costs on Russia for its war against Ukraine.""

The official added, ""We had already concluded that Russia committed war crimes in Ukraine, and the information from Bucha appears to show further evidence of war crimes. And as the President said, we will work with the world to ensure there is full accountability for these crimes. One of those tools is sanctions — and we have been working intensively with our European allies on further sanctions.""

More context: The expected sanctions come after the US Treasury announced it will no longer allow Russia to pay down its debt using dollars stockpiled at American banks. While Washington had imposed sanctions on the Russian Central Bank freezing their foreign currency at US banks, the Treasury Department had previously allowed Russia to use those reserves to repay its debt.

It's a move that officials say will substantially raise the risk of default and undercut urgent efforts by the central bank to stanch the economic bleeding that immediately arrested the Russian economy in the wake of the Western response to the invasion.

Read more about the sanctions here and watch CNN's reporting below:",https://www.cnn.com/europe/live-news/ukraine-russia-putin-news-04-06-22/h_fdebbc600d021462196979e13af905bd
6,088c9b1c-6963-4a5f-9a6f-32d986e53ddf,"['Aditi Sangal', 'Melissa Macaya', 'Lauren Said-Moorhouse', 'Travis Caldwell', 'Helen Regan', 'Ben Church', 'Jason Kurtz', 'Meg Wagner']",2022-04-04 04:01:02+00:00,"(AFP)

In a video address, Ukrainian President Volodymyr Zelensky called for an end to Russian “war crimes.”

His address came after reports of dozens of bodies found in the streets and mass graves in the Ukrainian city of Bucha.

“The world has already seen many war crimes. At different times. On different continents. But it is time to do everything possible to make the war crimes of the Russian military the last manifestation of such evil on earth,” Zelensky said.

Zelensky called on Russian leaders to be held accountable for the actions of the nation's military.

“I want all the leaders of the Russian Federation to see how their orders are being fulfilled. Such orders. Such a fulfillment. And joint responsibility. For these murders, for these tortures, for these arms torn off by explosions that lie on the streets. For shots in the back of the head of tied people. This is how the Russian state will now be perceived. This is your image,” Zelensky said.

In his address, Zelensky announced a “mechanism of justice” would be established to investigate crimes committed by Russian soldiers in Ukrainian territory. The mechanism would be supported by the Ministry of Foreign Affairs, the Office of the Prosecutor General, the National Police, the Security Service, the Intelligence Service and other government branches, he said.

“This mechanism will help Ukraine and the world bring to concrete justice those who unleashed or in any way participated in this terrible war against the Ukrainian people and in crimes against our people,” he said.

Zelensky said he will provide more information on the state of Ukrainian territory that was occupied by Russian forces.

“All partners of Ukraine will be informed in detail about what happened in the temporarily occupied territory of our state. War crimes in Bucha and other cities during the Russian occupation will also be considered by the UN Security Council on Tuesday,” he said.

He also noted efforts are underway to restore electricity and water to Bucha, as well as reestablishing medical institutions and infrastructure.

Zelensky once again invoked the need for stronger sanctions against Russia.

“There will definitely be a new package of sanctions against Russia. But I'm sure that's not enough. More conclusions are needed. Not only about Russia, but also about the political behavior that actually allowed this evil to come to our land,” he said.",https://edition.cnn.com/europe/live-news/ukraine-russia-putin-news-04-04-22/h_14cefcb130fc0e172a7a501d15d2f582?fbclid=IwAR2Pfn9PMSuwTw_kFTt3-WxYdycUcF437xSUywjQjzYs_tUPjI9t4wk1rgU
