,uid,article_author,article_date,article_text,article_url
0,08a037c8-1cf3-42be-b300-c5cfbc755e46,[],2022-03-18 00:00:00,"President Joseph R. Biden, Jr. spoke today with President Xi Jinping of the People’s Republic of China (PRC). The conversation focused on Russia’s unprovoked invasion of Ukraine. President Biden outlined the views of the United States and our Allies and partners on this crisis. President Biden detailed our efforts to prevent and then respond to the invasion, including by imposing costs on Russia. He described the implications and consequences if China provides material support to Russia as it conducts brutal attacks against Ukrainian cities and civilians. The President underscored his support for a diplomatic resolution to the crisis. The two leaders also agreed on the importance of maintaining open lines of communication, to manage the competition between our two countries. The President reiterated that U.S. policy on Taiwan has not changed, and emphasized that the United States continues to oppose any unilateral changes to the status quo. The two leaders tasked their teams to follow up on today’s conversation in the critical period ahead.

###",https://www.whitehouse.gov/briefing-room/statements-releases/2022/03/18/readout-of-president-joseph-r-biden-jr-call-with-president-xi-jinping-of-the-peoples-republic-of-china-2/
1,08a037c8-1cf3-42be-b300-c5cfbc755e46,[],2022-03-18 00:00:00,"Biden reiterated U.S. policy on Taiwan, the White House said, and “emphasized that the United States continues to oppose any unilateral changes to the status quo.“ The two presidents agreed to stay in communication, per the White House readout.

On a call with reporters Friday afternoon, a senior Biden administration official said the president did not make specific requests of Xi in their call but made clear that China should not support Moscow in its invasion. Biden outlined for Xi the United States’ view of the conflict and Putin’s “actions and miscalculations,” the official said, and stressed that China would suffer “consequences” if it did offer assistance to Moscow. The official did not outline the specifics of the possible consequences or Xi’s reaction to the warning.

Xi did not indicate whether China would aid Russia or not, according to the official, who described the two-hour call as “direct,” “substantive” and “detailed.”

The Biden-Xi meeting comes as Russia continues to escalate its attacks on the sovereign nation, and is a potential watershed moment for the countries’ relationship. The United Nations has already confirmed nearly 2,000 civilian casualties, though the numbers are likely higher.

The Chinese Embassy readout of the call notably did not mention Russia by name, though it said the “Ukraine crisis is not something we want to see.” The White House has not yet released a statement on the almost two-hour-long secure video call, which ended around 11 a.m.

“The events again show that countries should not come to the point of meeting on the battlefield. Conflict and confrontation are not in anyone’s interest, and peace and security are what the international community should treasure the most. As permanent members of the UN Security Council and the world’s two leading economies, we must not only guide the China-US relations forward along the right track, but also shoulder our share of international responsibilities and work for world peace and tranquility,” the Chinese readout said.

Last week, China announced a “six point” plan for preventing a widespread humanitarian crisis in Ukraine and called the situation inside the country “deeply” concerning. Xi reiterated the six points during his call with Biden on Friday but didn’t suggest China had any meaningful role in encouraging Russia to end the conflict, according to the Chinese Ministry of Foreign Affairs readout of the call. Xi instead conveyed that this was the responsibility of the U.S. and its NATO allies.

Ahead of the Biden-Xi meeting, Deputy Secretary of State Wendy Sherman said Friday that the Chinese president faces a historic choice amid Russia’s invasion of Ukraine: Be a “true leader on the world stage” by siding with Ukraine, the U.S. and its allies or stand with Moscow as it launches its full-fledged attack on Ukraine. She said Biden would urge Xi to use his influence with Putin to “end this horrible war.”

“We hope that he chooses the right side of history here,” Sherman told MSNBC’s “Morning Joe” on Friday. “That he ends this carnage, these attacks on civilians.”

Beijing has tried to walk a delicate line as Russian troops bombard Ukrainian cities and destroy civilian infrastructure. China has thus far avoided direct condemnation of its neighbor, maintaining its trade relationship with Moscow while expressing “concern” about the civilian deaths.

“We are all very candid, very direct about .. what the responsibility is of Xi Jinping if he wants to be a true leader on the world stage. If he wants to sign up to the principles of the U.N. Charter, which he says he does,“ Sherman said. “So we will see, whether in fact Xi Jinping makes the right choice here. His future is with the United States, with Europe, with developing countries around the world. His future is not with Russia and Vladimir Putin.“

Tension with Beijing built over the weekend, when Washington revealed intelligence and told reporters that Russia had requested economic and military assistance from China for its war against Ukraine. A senior U.S. official said the Chinese government had “responded to that request,” though offered no details on what the response was. Both Beijing and Moscow denied that such a request was made.

Jonathan Lemire and Phelim Kine contributed to this report.",https://www.politico.com/news/2022/03/18/biden-administration-pressures-xi-jinping-00018478
2,08a037c8-1cf3-42be-b300-c5cfbc755e46,"['Abc News', 'March']",,"In a high-stakes video call, President Joe Biden and China's President Xi Jinping spoke Friday morning for an hour and 50 minutes for the first time since November amid concerns that China will help Russian President Vladimir Putin's ongoing invasion of Ukraine.

Nearly four hours after the call ended, and hours after China put out its own version of events, the White House released a readout of the meeting. While lacking concrete details, the 164-word U.S. account stressed that Biden made clear the ""implications and consequences"" if China aligns with Russia and provides it ""material support"" for its attacks.

""President Biden detailed our efforts to prevent and then respond to the invasion, including by imposing costs on Russia. He described the implications and consequences if China provides material support to Russia as it conducts brutal attacks against Ukrainian cities and civilians,"" the White House said.

A readout from China, released ahead of the White House's, described the call as ""constructive"" -- a word the Biden administration did not use.

A senior administration official described the video meeting as ""direct,"" ""substantive,"" and ""detailed,"" adding that Biden and Xi spend the ""preponderance of their time"" on Russia's invasion of Ukraine.

After that official said Biden ""really wasn't making specific requests of China"" on the call and that he was, instead, ""laying out his assessment of the situation, what he thinks makes sense, and the implications of certain actions,"" ABC News Senior White House Correspondent asked White House press secretary Jen Psaki, ""Why not, given the stakes here?""

""Because China has to make a decision for themselves about where they want to stand and how they want the history books to look at them and view their actions,"" Psaki replied. ""And that is a decision for President Xi and the Chinese to make.""

Psaki said Biden ""made clear what the implications and the consequences would be if China provides material support to Russia"" -- a line she repeated throughout the briefing, but she would not elaborate on whether the U.S. views military or economic aid as more of a concern or which direction they could be leaning towards if they provide help.

She also wouldn't say if Xi ever referred to Putin's war as an ""invasion,"" saying that the White House doesn't ""speak for other countries"" and the Chinese can ""speak for themselves.""

According to China's readout, Xi told Biden the ""situation in Ukraine has developed to such a point that China does not want to see it. China has always advocated peace and opposed war.""

But China has yet to directly condemn Russia for its actions in Ukraine.

China supports negotiations, Xi said, but deferred to the U.S. and NATO to ""conduct dialogue with Russia to solve the crux of the Ukraine crisis and resolve the security concerns of both Russia and Ukraine"" -- appearing to reaffirm China's view that the NATO expansion is the root cause of the war.

The readout said Xi's used two Chinese idioms to Biden: ""One hand cannot clap,"" meaning the two sides need to come together to make any progress in ending the war, and, he said, ""Only the one who tied the bell to the tiger can untie it,"" implying that the U.S. and NATO will need to ""untie the bell"" themselves, and China will support efforts.

China's president also criticized U.S. sanctions saying that it is the common people who suffer from them and that sanctions have the potential of triggering crises in the global economy, according to the readout

White House press secretary Jen Psaki had said Biden would be candid and that the call provided a chance for him to ""assess where President Xi stands."" The conversation would center on ""managing the competition between our two countries as well as Russia's war against Ukraine and other issues of mutual concern,"" according to the White House.

Biden was expected to warn Xi that if China directly helps Russia in its assault on Ukraine there will be consequences -- but it's still unclear if he laid out specific actions the U.S. will take if China were to supply Russia with military equipment or economic assistance to offset the impact of global sanctions.

In what appeared to be a warning shot to the West, Russia's Foreign Minister Sergei Lavrov said Friday that any foreign supplies to Ukraine containing military equipment will be considered ""legitimate targets"" for Russian strikes after Biden announced this week a slate of weapons the U.S. is supplying to Ukraine.

""We clearly said that any cargo moving into the Ukrainian territory which we would believe is carrying weapons would be fair game. This is clear because we are implementing the operation the goal of which is to remove any threat to the Russian Federation coming from the Ukrainian soil,"" Lavrov said in an English-language interview with the RT television channel.

Ukrainians woke up Friday to the first strike on the outskirts city of Lviv, considered a safe haven until now, and not far from the Polish border. It follows a stark warning from the Pentagon that Russia was broadening its target and escalating attacks this week.

While the Biden administration has hesitated from drawing red lines of what would change its position on not supporting a no-fly zone or troops on the ground in Ukraine, Lavrov's message raises concerns that Russia could fire at military bases in neighboring NATO ally Poland to Ukraine, triggering an Article 5 response.

Earlier this week, national security adviser Jake Sullivan had a seven-hour meeting with his Chinese counterpart in Rome, which was described as ""intense."" A senior Biden administration declined to tell reporters whether China had expressed an openness to providing Russia with military or economic support or if it had already provided support to Russia since it invaded Ukraine.

""We do have deep concerns about China's alignment with Russia at this time, and the national security adviser was direct about those concerns and the potential implications and consequences of certain actions,"" the official said.

That meeting had been ""long-planned"" and ""long-discussed"" as a way to maintain communication with China, but it happened to take place at ""a really timely and important moment in this crisis,"" the official added.

Biden and Xi's critical call comes on the heels of Biden labeling Putin a ""war criminal,"" a ""murderous dictator,"" and a ""pure thug"" in the last 48 hours. Secretary of State Antony Blinken said Thursday he ""personally"" agrees with Biden that Russia has committed war crimes in Ukraine.

ABC News' Karson Yiu, Ben Gittleson, Conor Finnegan, Justin Gomez and Anastasia Bagaeva contributed to this report.",https://abcnews.go.com/Politics/biden-xi-hold-high-stakes-call-china-stands/story?id=83525812
3,08a037c8-1cf3-42be-b300-c5cfbc755e46,"['David E. Sanger', 'Edward Wong']",2022-03-18 00:00:00,"U.S. and European officials see China’s role in the conflict as critical, and decisions by Mr. Xi could push the war in different directions — perhaps toward a cease-fire or more robust diplomatic talks, or toward renewed momentum by the Russian forces in their deadly offensive. Mr. Xi, who has built a bond with Mr. Putin over years, gave no indication he would help seek a diplomatic solution, according to an official Chinese readout of the call.

That summary emphasized the friction between China and the United States over Taiwan before addressing Ukraine. It said Mr. Xi pointed out that “the situation in Ukraine has developed to this point, which China does not want to see.” He reiterated standard talking points that China would provide humanitarian aid and that Russia and Ukraine should hold peace talks. Mr. Xi did not suggest any role China could play in ending the war, and instead said the United States and NATO should talk to Russia to resolve the crisis.

Mr. Xi also used a phrase he and other Chinese officials have previously employed when blaming troubles on the United States: “Let he who tied the bell on the tiger take it off.”

Tensions between the United States and China have grown since the invasion because of Beijing’s persistent alignment with Moscow, even as the Russian military kills thousands of Ukrainian civilians.

On Thursday, Secretary of State Antony J. Blinken delivered his strongest public warning yet to China, saying the United States “will not hesitate to impose costs” if China gives military aid or other support to Russia. He and other officials say China’s strategy is to keep up a pretense of neutrality while siding with Russia.

Jake Sullivan, Mr. Biden’s national security adviser, gave similar warnings to Yang Jiechi, a top Chinese foreign affairs official, when the two met in Rome on Monday. U.S. officials told reporters a day before those talks that Russia had asked China for military and economic aid after it began its war, and a Pentagon official said there were indications China was leaning toward obliging Russia on military support.

China could be held responsible for violating international law if it gives military aid to Russia, according to two prominent law professors, Oona A. Hathaway of Yale and Ryan Goodman of New York University.",https://www.nytimes.com/2022/03/18/world/europe/biden-xi-russia-china.html
4,08a037c8-1cf3-42be-b300-c5cfbc755e46,[],,"PTI

Washington/Beijing, March 19

US President Joe Biden warned his Chinese counterpart Xi Jinping that there would be ""implications and consequences"" for Beijing if it chose to provide direct ""material support"" to Russia amid its invasion of Ukraine and increasing attacks on civilians, the White House has said.

The 110-minute secure video call on Friday was the first conversation between the two leaders since the Russian invasion of Ukraine. The talks between Biden and Xi largely focused on Russia's invasion of Ukraine and the implications for the US-China relationship and international order, a senior White House official told reporters.

""He (President Biden) described the implications and consequences if China provides material support to Russia as it conducts brutal attacks against Ukrainian cities and civilians,"" the White House said in a readout of the lengthy conversation between the two presidents.

Later, a senior Biden administration official refused to publicly detail what those consequences might be for Beijing, a close ally of Moscow.

""I'm not going to, sort of, publicly lay out our options from here,"" the senior official said.

Ever since Russia launched a 'special military operation' in Ukraine on February 24, China has been treading a fine line, declining to condemn it as an invasion.

The call between the two presidents was about making sure there is a ""direct, candid and detailed and very substantive conversation at the leader level,"" the senior administration official said.

""President Biden detailed our efforts to prevent and then respond to the invasion, including by imposing costs on Russia,"" the White House readout of the meeting said.

Biden underscored his support for a diplomatic resolution to the crisis. The two leaders also agreed on the importance of maintaining open lines of communication, to manage the competition between our two countries, it said.

Biden and Xi also tasked their teams to follow up on their conversation in the critical period ahead, the White House said.

At the same time, President Xi underscored that there have been and will continue to be differences between China and the US. What matters is to keep such differences under control. A steadily growing relationship is in the interest of both sides, the Chinese Foreign Ministry said in a statement in Beijing.

On the situation in Ukraine, President Biden expounded on the US position, and expressed readiness for communication with China to prevent the situation from exacerbating, it said.

""China does not want to see the situation in Ukraine to come to this. China stands for peace and opposes war. This is embedded in China's history and culture,"" the statement quoted Xi as telling Biden.

""China makes a conclusion independently based on the merits of each matter. China advocates upholding international law and universally recognised norms governing international relations,"" Xi said.

#China #joe biden #ukraine crisis #xi jinping",https://www.tribuneindia.com/news/world/biden-tells-xi-implications-consequences-if-china-provides-material-support-to-russia-white-house-378901
5,08a037c8-1cf3-42be-b300-c5cfbc755e46,"['Staff Writer', 'Eli Stokols Is A White House Reporter Based In The Los Angeles Times', 'Washington', 'D.C.']",2022-03-18 00:00:00,"President Biden and China’s President Xi Jinping spoke for nearly two hours by phone Friday as the White House sought to convince Beijing not to send military aid to support Russia’s war in Ukraine.

According to a White House readout of the call, Biden “described the implications and consequences if China provides material support to Russia as it conducts brutal attacks against Ukrainian cities and civilians” and “underscored his support for a diplomatic resolution to the crisis.”

It wasn’t immediately clear how Xi will respond to Biden’s warnings or if he’s decided whether to help Russia, a senior administration official said during a briefing for reporters.

“The president really wasn’t making specific requests of China. He was laying out his assessment of the situation, what he thinks makes sense, and the implications of certain actions,” said the official, who spoke on condition of anonymity. “We will see ... what decisions China makes in the days and weeks ahead,” the official said.

The call, the first contact between the leaders in four months, followed a lengthy and tense meeting between the countries’ national security officials earlier this week in Rome. The potentially difficult call on Friday could mark a pivotal moment in Russia’s war against Ukraine and Washington’s long-term relations with Beijing.

Advertisement

Beijing’s official summary of the call described the conversation as “candid and in-depth” and did not condemn Russia’s invasion. It called for direct dialogue to “ease the security concerns of both Russia and Ukraine” and stated that China “stands for peace and opposes war.”

“All sides need to jointly support Russia and Ukraine in having dialogue and negotiation that will produce results and lead to peace,” the Chinese government stated.

That statement of at least outward neutrality is notable coming just a month after Xi and Russian President Vladimir Putin declared their countries enjoyed a “friendship without limits.”

The call began at 9:03 a.m. Washington time and ended 1 hour and 50 minutes later, the White House said.

As the West has rallied around Ukraine’s cause, imposing severe economic sanctions against Russia, Putin has become increasingly isolated and desperate. Russian forces, somewhat surprisingly, have been hammered by fierce Ukrainian resistance and failed to make deep incursions into the country after more than three weeks of fighting.

Given the way the war has gone, China offers Russia one of its last economic and military lifelines.

And while there is no question that Xi and Putin have been aligned on many issues, Beijing must balance its allegiance to a weakened autocrat against its relationships with major trading partners and the long-term risks of escalating a major conflict with the U.S. and Europe.

Biden on Wednesday authorized an additional $800 million in defense aid for Ukraine, a package that includes anti-tank and surface-to-air missiles, heavy munitions and drones. That came just hours after Ukrainian President Volodymyr Zelensky gave an impassioned address to a joint session of Congress in which he asked Biden and the U.S. to do more to help defend his country.

Although Russia and Ukraine have engaged in peace talks, there has been little evidence that Putin is serious about negotiating an end to the conflict, even after losing an estimated 7,000 to 9,000 fighters and amid difficulties with maintaining supply lines and finding reinforcements. With Russia’s ground assault struggling to make progress, Putin has

increasingly turned the fight into one of attrition, indiscriminately bombing Ukrainian cities with little regard for civilians.

Xi also brought up Taiwan, the senior administration official said. Biden expressed U.S. support for the long-standing “One China” policy, under which Taiwan is viewed as part of mainland China, and for the maintaining of the current status quo.

Tensions across the Taiwan Strait have risen in recent months, as the self-ruling island of 24 million people has been bracing for a potential invasion by Chinese forces given the increase in provocative military exercises and the apparent likelihood of the Chinese Communist Party attempting to fulfill its long-held goal of “reunifying” Taiwan with the mainland.",https://www.latimes.com/politics/story/2022-03-18/biden-speaks-with-chinas-xi-about-not-aiding-russias-war-in-ukraine
