,uid,article_author,article_date,article_text,article_url
6,08a037c8-1cf3-42be-b300-c5cfbc755e46,"['Morgan Chalfant', 'Brett Samuels']",2022-03-18 19:00:04+00:00,"President Biden warned Chinese President Xi Jinping that Beijing would face consequences if it provides “material support” to Russia amid its invasion of Ukraine, the White House said Friday.

“President Biden detailed our efforts to prevent and then respond to the invasion, including by imposing costs on Russia,” said a White House readout of the call published hours after it concluded. “He described the implications and consequences if China provides material support to Russia as it conducts brutal attacks against Ukrainian cities and civilians.”

The White House has not detailed what those consequences would be. Biden administration officials also repeatedly declined to characterize Xi’s comments on the call.

The two leaders spoke for nearly two hours on Friday morning on a secure video call, which a senior administration official described as “direct,” “substantive” and “detailed” and largely focused on Russia’s war in Ukraine.

“We’re concerned that they’re considering directly assisting Russia with military equipment to use in Ukraine,” Secretary of State Antony Blinken told reporters on Thursday, the day the White House announced plans for the phone call.

The senior administration official told reporters that Biden did not make “specific requests” of Xi when questioned if Biden asked China to intervene to stop the Russian assault.

“The president really wasn’t making specific requests of China,” the official said. “He was laying out his assessment of the situation, what he thinks makes sense and the implications of certain actions.”

Asked why that was the case later Friday, White House press secretary Jen Psaki told reporters: “Because China has to make a decision for themselves about where they want to stand.”

Psaki said that, following the call, the administration was still concerned about the possibility of China aiding Russia militarily.

“That is something we will be watching and the world will be watching,” she said.

A Chinese readout of the call said that Xi told Biden “that China does not want to see the situation in Ukraine to come to this.” Xi also affirmed support for peace negotiations between Russia and Ukraine, according to the readout, which also indicated he did not condemn Russia’s actions in Ukraine.

“All sides need to jointly support Russia and Ukraine in having dialogue and negotiation that will produce results and lead to peace,” the readout posted by China’s Ministry of Foreign Affairs said. “The US and NATO should also have dialogue with Russia to address the crux of the Ukraine crisis and ease the security concerns of both Russia and Ukraine.”

Both readouts indicated the two leaders tasked their teams to follow up on the conversation in the days ahead.

China, which has deepened relations with Russia in recent years, has tried to portray itself as a neutral party in the Ukraine conflict. U.S. officials have urged China to condemn Russia’s behavior while raising concerns about China’s ties to Russia.

Reports surfaced earlier this week that Russia was seeking military assistance from China as it continues its invasion.

During a lengthy meeting with China’s top diplomat earlier this week in Rome, Biden’s national security adviser Jake Sullivan said that Beijing would face consequences if it helped Russia with the invasion financially or militarily.

White House officials have also raised concerns about China amplifying Russian claims that the U.S. is developing biological weapons in Ukraine, which the U.S. has called disinformation meant to lay the foundation for a possible Russian chemical attack.

The senior administration official told reporters Friday that Biden directly expressed concerns to Xi about China echoing Russian disinformation about bioweapons labs in Ukraine during the call.

Russia has escalated its attacks on Ukraine since it first launched its invasion three weeks ago, despite officials and experts saying the Russian advance has not moved as quickly or as effectively as the Kremlin had hoped.

Russia has launched missiles targeting hospitals and civilian areas, prompting Biden and Blinken to call Russian President Vladimir Putin a “war criminal.”

The U.S. has provided Ukraine with billions of dollars in humanitarian and security assistance. Biden this week announced a total of $1 trillion in aid that will be used to supply anti-aircraft defense systems, anti-tank weapons and other arms to Ukraine.

Separate from talks on Ukraine, Biden reiterated that the U.S. has not changed its policy on Taiwan and “emphasized that the United States continues to oppose any unilateral changes to the status quo,” according to the White House readout.

The senior administration official said Xi was the one who raised the issue of Taiwan.

Taiwan has been a source of some tension between the U.S. and China, and Russia’s aggression in Ukraine has prompted concerns among some international watchdogs that China may try to invade or lay claim to the island.

Biden has previously told Xi the U.S. is committed to the “One China” policy, under which the U.S. does not recognize Taiwan as a separate state from China, but had also mistakenly said the U.S. had an obligation to send troops to Taiwan if it were attacked by China.

Under the Taiwan Relations Act of 1979, the U.S. is committed to providing Taiwan with arms for its defense. The law does not commit the U.S. to sending troops to Taiwan to defend it.

This story was updated at 5:00 p.m.",https://thehill.com/homenews/administration/598791-biden-warns-beijing-no-material-support-to-russia
7,08a037c8-1cf3-42be-b300-c5cfbc755e46,[],2022-03-19 00:00:00,"In his call with Chinese President Xi Jinping, US President Joe Biden on Friday described to him the implications and consequences if China provides material support to Russia as it conducts brutal attacks against Ukrainian cities and civilians, the White House said.



The about two-hour-long conversation between the two leaders over a secure video call focused on Russia's invasion of Ukraine, it said.

President Biden detailed our efforts to prevent and then respond to the invasion, including by imposing costs on Russia. He described the implications and consequences if China provides material support to Russia as it conducts brutal attacks against Ukrainian cities and civilians, the White House said in a readout of the call.

White House Press Secretary Jen Psaki said the vast majority of the nearly two hours was spent with the president outlining the views of the United States, its allies and partners on this crisis, including a detailed overview of efforts to prevent and then respond to the invasion, how we got here, steps we've taken, where we've gone and why.

A senior administration official told reporters that the conversation was direct.

It was substantive and it was detailed. The two leaders spent the preponderance of their time discussing Russia's unprovoked and unjustified invasion of Ukraine, as well as the implications of the crisis for U.S.-China relations and the international order, the official said.

Biden shared with Xi a detailed review of how things have developed to this point, his assessment of the situation today, and President Biden underscored his support for a diplomatic resolution to the crisis, the official said, adding that Biden described the US' assessment of Putin's actions and his miscalculations.

He also described the unity of the United States and its allies and partners, the unprecedented coordination with our European, NATO, and Indo-Pacific partners, and the overwhelming global unity and condemnation of Russia's invasion of Ukraine, as well as the support for Ukraine, said the official.

Biden made clear the implication and consequences of China providing material support—if China were to provide material support—to Russia as it prosecutes its brutal war in Ukraine, not just for China's relationship with the United States but for the wider world, the official said.

During the call, Biden stressed concerns that Russia is spreading disinformation about biological weapons in Ukraine as a pretext for a false-flag operation and underscored concerns about echoing such disinformation.

President Xi raised Taiwan. President Biden reiterated that the United States remains committed to our one-China policy and is guided by the Taiwan Relations Act, the Three Joint Communiqus, and the Six Assurances. And he underscored the importance of maintaining peace and stability across the Taiwan Strait, the official said.",https://www.theweek.in/news/india/2022/03/19/biden-tells-xi-implications-consequences-if-china-provides-material-support-russia-white-house.html
8,08a037c8-1cf3-42be-b300-c5cfbc755e46,[],2022-03-18 00:00:00,"Call between two leaders comes amid US concerns that China could aid Russia in its invasion of Ukraine.

US President Joe Biden has informed Chinese President Xi Jinping of the “implications and consequences” should Beijing provide material support to Moscow in the war in Ukraine, the White House said, after the two leaders spoke in a video call.

Friday’s talks, which the US said lasted just under two hours and ended at 10:53am in Washington (1453 GMT), was months in the making and follows the first virtual meeting between Biden and Xi in November.

Biden “described the implications and consequences if China provides material support to Russia as it conducts brutal attacks against Ukrainian cities and civilians”, the White House said in a statement on the discussion. It did not elaborate on what those consequences would be.

The call came amid increasing US concerns that China may come to Russia’s aid – either by giving military equipment or bypassing Western sanctions – in its increasingly brutal offensive in Ukraine, which continues to test already shaky relations between Washington and Beijing.

Earlier on Friday, Chinese state broadcaster CCTV reported Xi as telling Biden that “state-to-state relations cannot go to the stage of military hostilities”. Xi also said: “Peace and security are the most valued treasures of the international community.”

Prior to the exchange on Friday, US Secretary of State Antony Blinken said the US president would make clear to Xi that China will bear responsibility if it supported Russia’s “aggression” and that Washington “will not hesitate to impose costs”.

He said the US administration was concerned China was considering directly assisting Russia with military equipment for use in Ukraine – something Beijing has denied despite reports that Moscow has formally lodged the request.

Beijing, for its part, maintains close economic ties to both Kyiv and Moscow and has stressed Ukraine’s sovereignty while avoiding direct condemnation of Russia.

However, Chinese officials also have insisted that Russia has legitimate security concerns that need to be addressed and echoed Russian claims the US has been secretly working on biological weapons in Ukraine, a claim that has been rejected by the US and the United Nations.

In a longer readout on Friday’s call published by the Chinese foreign ministry, Xi said “all sides” need to support “dialogue” between Russia and Ukraine. He also appeared to put some responsibility for Russia’s invasion of its neighbour on the West, saying “the US and NATO should also have dialogue with Russia to address the crux of the Ukraine crisis and ease security concerns of both Russia and Ukraine”, the ministry noted.

Reporting from Washington, Al Jazeera’s Kimberly Halkett said “the West, and the United States specifically, has had this sense that China has really been trying to play both sides with regard to this conflict”.

“The West is hoping that they can really encourage China to use its economic might over Russia, its influence to try and even bring about a ceasefire in this conflict,” she said.

Meanwhile, speaking to MSNBC on Friday shortly before the call, US Deputy Secretary of State Wendy Sherman called on Xi to tell Russian President Vladimir Putin “to end this war of choice, this war of carnage” in Ukraine.

She also told CNN: “China needs to stand on the right side of history. It needs to ensure that it does not backfill, financially or in any other way, sanctions that have been imposed on Russia.”

But while China remains tightly bound to the US and other Western economies, it remains unclear what leverage Biden has to employ in his appeal to Xi, Ross Feingolf, an Asia political risk analyst, told Al Jazeera.

“Especially keeping in mind that [Washington] does want China to buy more from the United States as well and fulfill the terms of the phase one trade agreement,” he said. “This is a tough call literally and figuratively for Biden.”

The Biden-Xi call came after US National Security Adviser Jake Sullivan and Yang Jiechi, China’s top diplomat, held what the White House called a “substantial” seven-hour meeting in Rome this week.

Brookings Institution fellow Ryan Hass, a former adviser on China to US President Barack Obama, said Beijing has to sort through its clashing priorities. “China’s and Russia’s interests are not in alignment. Putin is an arsonist of the international system and President Xi sees himself as an architect for remaking and improving the international system,” Hass told the AFP news agency.

“President Xi is trying to balance competing priorities. He really places a lot of value in China’s partnership with Russia but at the same time he does not want to undermine China’s relations in the West.”

The war in Ukraine began on February 24 when Russia launched an all-out invasion of its neighbour. The Russian bombardment has killed hundreds of civilians, reduced city areas to rubble and sparked a humanitarian crisis as millions have been forced to flee the country.",https://www.aljazeera.com/news/2022/3/18/xi-tells-biden-ukraine-conflict-is-in-no-ones-interest
9,08a037c8-1cf3-42be-b300-c5cfbc755e46,"['Sky Uk Limited', 'Martha Kelner', 'Us Correspondent']",,"Joe Biden has told China's president of the ""implications and consequences"" Beijing faces if it gives Russia material support for its war in Ukraine, as Xi Jinping said the conflict needs to end as soon as possible.

The pair spoke for almost two hours in a video call as the US sought to deter China from providing military or economic assistance for President Vladimir Putin's invasion, where there have been ""brutal attacks on civilians"".

A White House statement said the American president had laid out efforts to prevent and then respond to the invasion, including by ""imposing costs"" on Russia, believed to mean sanctions.

""He described the implications and consequences if China provides material support to Russia as it conducts brutal attacks against Ukrainian cities and civilians,"" it said. ""The president underscored his support for a diplomatic resolution to the crisis.""

Those ""implications and consequences"" were not detailed in the statement.

Image: Presidents Putin and Xi met in the weeks before the invasion of Ukraine

Live updates: 1,300 still trapped under theatre rubble

The White House also said the two leaders agreed on the importance of maintaining open lines of communication, to ""manage the competition"" between the two countries.

According to Chinese state media, Mr Xi told his American counterpart: ""The top priorities now are to continue dialogue and negotiations, avoid civilian casualties, prevent a humanitarian crisis, cease fighting and end the war as soon as possible.""

Russian leader Mr Putin has not called his military offensive, now in its fourth week, a ""war"", instead referring to it as a ""special military operation"".

Earlier on Friday, he hailed the country's ""special operation"" in Ukraine at a rally marking the anniversary of the 2014 annexation of Crimea.

Mr Xi told Mr Biden that all parties should support Russia-Ukraine dialogue and negotiations.

And he said the US and NATO should have discussions with Russia to solve the ""crux"" of the crisis and resolve the security concerns of Russia and Ukraine.

Biden unlikely to have received assurances that China won't help Putin Martha Kelner US correspondent @marthakelner The White House would not be drawn on whether President Xi gave President Biden any assurances that China would not be helping Russia out with military assistance. But it seems unlikely, given that the focus of the comments from the Biden administration following the call have been reiterating the threat of sanctions should China answer Russia's call. On that key issue, it seems, there is no change since US intelligence suggested China could be willing to help out its ally. There was no specific detail on the sanctions that have been threatened, but it is worth bearing in mind that China's economic relationship with the US and Europe is worth trillions of dollars and far outweighs its economic relationship with Russia. This is just the latest in a flurry of diplomatic telephone calls between world leaders and their deputies. But it is the first between Presidents Biden and Xi since November, and comes at a time when US-China relations are at a crunch point. A senior administration official described the call between the two leaders as ""direct, substantive and detailed"" but there was no condemnation from China of Vladimir Putin himself or the wider Russian attack on Ukraine.

China earlier accused the US of provoking Russia and fuelling the conflict by sending arms to Ukraine.

""China has called for every effort to avoid civilian casualties all the time,"" foreign ministry spokesperson, Zhao Lijian, told reporters.

""Which do the civilians in Ukraine need more: food and sleeping bags or machine guns and artillery? It's easy to answer.""

In other developments:

• Putin celebrates 'special military operation' in front of packed World Cup stadium

• Inside devastated city of Mariupol - left unrecognisable by war

• Kyiv's mayor Vitali Klitschko warns of a 'war on civilians' after 60 killed in the capital

• Battleships are lurking off the coast of port city Odesa and families are preparing for attack

• Boris Johnson told Sky News Putin is modelling himself on brutal Soviet dictator Joseph Stalin

• Kremlin-backed news outlet Russia Today has had its UK TV licence revoked

Follow the Daily podcast on Apple Podcasts, Google Podcasts, Spotify, Spreaker

Ahead of the video call, White House press secretary Jen Psaki said Mr Biden would question Mr Xi about Beijing's ""rhetorical support"" of Mr Putin and an ""absence of denunciation"" of Russia's invasion, which began on 24 February.

With Russia trying to regain the initiative in a stalled campaign, three missiles landed at an airport near the western city of Lviv, which has until now been far from Ukraine's battlefields further east.

Read more:

What are the chances of a peace deal with Russia to end the conflict?

US officials concerned by 'Russia's request for military assistance from China'

Russia's defence ministry said it was ""tightening its encirclement"" around the besieged southern port of Mariupol, where officials said more than 1,300 people may still be trapped in a bomb shelter under a destroyed theatre.

Ukraine said it had rescued at least 130 people from the basement after the building was flattened, reportedly by a Russian airstrike, on Wednesday. Moscow denies attacking the theatre, insisting it does not target civilians.

In the days after Mr Putin sent tens of thousands of his forces into neighbouring Ukraine, the Chinese government tried to distance itself from the offensive but avoided criticising Moscow.

At other times, Beijing has repeated unverified Russian claims that Ukraine ran biological weapons laboratories with US support.

Earlier this week, the US said its intelligence found China had signalled to Russia it would be willing to given military support and financial backing to help stave off the impact of the West's severe sanctions.

Russia and China have both denied the claims.",https://news.sky.com/story/ukraine-war-biden-tells-chinas-xi-of-consequences-if-beijing-gives-russia-material-support-for-invasion-12569525
