,uid,article_author,article_date,article_text,article_url
0,cc9f6e79-254c-4451-9b73-90bff351db4f,['Of'],2022-03-18 16:24:00+00:00,"Home page politics

Of: Florian Naumann, Cindy Boden

split

Germany wants to react to the Ukraine war – and Baerbock seemed to respond to Zelenskyj on Friday. Klingbeil comments on NATO intervention. News ticker.

Escalated Ukraine conflict * – SPD leader Klingbeil says: “There will be no Third World War” (see update from March 18, 4:24 p.m.).

* – SPD leader Klingbeil says: “There will be no Third World War” (see update from March 18, 4:24 p.m.). Meanwhile, Chancellor Olaf Scholz* spent an hour on the phone with Kremlin chief Vladimir Putin (see first report).

Ukraine reacted angrily to the Chancellor’s statements (see update from March 18, 12:30 p.m.).

This News ticker on German reactions to the Ukraine war is continuously updated. More on the background of the Ukraine crisis* here.

Update from March 18, 5:15 p.m: Federal Labor Minister Hubertus Heil (SPD) wants to quickly integrate Ukrainian refugees who are looking for a job into the German labor market. “I have the impression that many people know that they will stay longer in Germany due to the dramatic situation in Ukraine and that many also want to work,” said Heil on Friday world. In Germany there is a labor shortage in many areas, said Heil. You have to bring that together.

He stated the following as prerequisites:

fast recognition of Ukrainian qualifications

language acquisition

Ensuring childcare

“But workers are not coming here first,” emphasized Heil. “People come out of need who do not leave their homeland voluntarily. But it makes sense that we can get access to the labor market together – and that’s what we’re fighting for.”

Germany: SPD leader Klingbeil rules out NATO intervention in the Ukraine war

Update from March 18, 4:24 p.m.: SPD leader Lars Klingbeil has ruled out NATO getting involved militarily in the war in Ukraine. “There will be no military interference by NATO, there will be no Third World War,” he said at a symposium held by the Friedrich Ebert Foundation in honor of SPD politician Egon Bahr, who would have turned 100 on Friday. Regarding possible further sanctions against Russia, he said that there were “many possibilities that have not been exhausted”.

Chancellor Olaf Scholz and Lars Klingbeil, SPD party chairman (archive image) © Florian Gaertner/photothek.de/Imago

German reactions to the Ukraine war: Faeser wants more refugee votes in the EU

Update from March 18, 2:56 p.m.: After German media regulators had already issued a ban on the Russian state program RT DE, a Berlin court * now ruled in the case.

Update from March 18, 1:45 p.m.: Federal Minister of the Interior Nancy Faeser would like more coordination within the European Union* when it comes to accepting war refugees from Ukraine. In a conversation with EU Interior Commissioner Ylva Johansson on Friday, the SPD politician emphasized “that there must be closer coordination at European level”. It is particularly important to relieve Ukraine’s neighboring countries such as Moldova. Faeser rejected criticism that even after more than three weeks of war, the distribution of refugees in Germany was sometimes still haphazard. Your ministry has been in close contact with the federal states since the first day of the flight movement.

Ukraine news with a German perspective: Selenskyj adviser angry about Scholz

Update from March 18, 12:30 p.m.: Ukraine reacts angrily to statements by Chancellor Olaf Scholz. The reason: Scholz had relieved the people of Russia of responsibility for the war. He warned on Thursday not to equate Russia with President Vladimir Putin. “It was not the Russian people who made the fatal decision to invade Ukraine. This war is Putin’s war,” he said.

Scholz just wanted to justify his indecisiveness, Ukrainian presidential adviser Mykhailo Podoliak wrote on Telegram on Friday. This distinction is spreading across Europe, but it is wrong, Podoljak wrote. According to surveys, a majority of the Russian population supports the war and the killing of Ukrainians. The advisor is responsible for the foreign policy statements of the Ukrainian Presidential Office and also provides information on the ongoing negotiations between Kyiv and Moscow.

Olaf Scholz on Friday in the Bundestag – the Chancellor also phoned Vladimir Putin about the Ukraine war. © Tobias Schwarz/AFP

Ukraine war and Germany: Scholz makes three demands on Putin – Baerbock mothballs neutrality

Foreign Minister Annalena Baerbock once again reacted to the “new reality” in the Ukraine war on Friday. © Annegret Hilse/AFP

First report: Berlin – Germany is trying to draw political conclusions from the Ukraine conflict – even on the day after the unsuccessful Bundestag reaction to Volodymyr Zelenskyj’s Berlin speech. Foreign Minister Annalena Baerbock (Greens) declared the days of German “neutrality” to be over on Friday. Meanwhile, Chancellor Olaf Scholz (SPD) spoke to Vladimir Putin on the phone and apparently heard complaints about Ukrainian war crimes.

War in Ukraine: Baerbock reacts – also to Selensky’s speech?

Baerbock appeared to be referring directly to Zelenskyy in her speech launching a new “National Security Strategy.” “For us, and indeed for me, a special responsibility arises from Germany’s guilt for war and genocide,” said the Foreign Minister. This means the obligation “to stand by those whose lives, freedom and rights are threatened”. Zelenskyj had complained before the Bundestag on Thursday that Germany’s statements of “never again” are currently, 80 years after the Second World War, hardly to be taken seriously.

In view of the Ukraine war*, the following applies: “No country, not even Germany, can be neutral on questions of war and peace, on questions of law and injustice.” Putin’s war of aggression, which violates international law, is changing the security policy reality. “In the light of Russia’s massive breach of our peace order, we need to more clearly translate the principles that guide us into practical policies.”

Baerbock emphasized that a clear stance, a stronger ability to act and sharpened foreign and security policy instruments are crucial. Germany’s new security strategy should be developed together with the other ministries, across factions in the Bundestag and with national and international partners. Security policy is more than military plus diplomacy. The German security strategy should be linked to corresponding efforts at EU* and NATO level.

News about Germany in the Ukraine war: Putin complains to Scholz on the phone

Meanwhile, Chancellor Scholz was already very practically involved in wartime diplomacy. According to the Kremlin, he spoke to Vladimir Putin again by phone on Friday morning. The Russian President apparently complained about war crimes in eastern Ukraine: There were numerous fatalities when residential areas in the cities of Donetsk and Makiivka were shelled.

“These war crimes were ignored in the West,” the Kremlin said in a statement on Friday. The German government announced that the nearly hour-long conversation was dedicated to the war and the efforts to end it.

Scholz “urged that there be a ceasefire, an improvement in the humanitarian situation and progress in the search for a diplomatic solution to the conflict as soon as possible”. During the phone call initiated by Scholz, Putin said that everything was being done on the Russian side to avoid civilian casualties, the Kremlin said. For example, people should be taken out of the contested zones via humanitarian corridors. (fn/dpa/AFP) *Merkur.de is an offer from IPPEN.MEDIA.",https://pledgetimes.com/ukraine-war-scholz-makes-three-demands-to-putin-on-the-phone/
1,cc9f6e79-254c-4451-9b73-90bff351db4f,"['Aditi Sangal', 'Meg Wagner', 'George Ramsay', 'Jeevan Ravindran', 'Laura Smith-Spark', 'Peter Wilkinson', 'Adrienne Vogt', 'Melissa Macaya']",2022-03-18 04:00:36+00:00,"Conflict and confrontation is not in anyone’s interest, Chinese President Xi Jinping said to US President Joe Biden on a video call Friday morning, according to Chinese state media.

“State-to-state relations cannot go to the stage of military confrontation. Conflict and confrontation are not in the interests of anyone. Peace and security are the most cherished treasures of the international community,” CCTV quoted Xi as saying on the call.

Some context: The call between the two world leaders started at 9:03 a.m on Friday. It is their first known discussion in months, the White House said Thursday.

It comes days after a US diplomatic cable suggested China has expressed some openness to providing Russia with requested military and financial assistance as part of its war on Ukraine. It is not yet clear whether China intends to provide Russia with that assistance, US officials familiar with the intelligence told CNN earlier this week.

""This is part of our ongoing efforts to maintain open lines of communication between the United States and the PRC,"" Psaki had said, using the abbreviation for the People's Republic of China.",https://edition.cnn.com/europe/live-news/ukraine-russia-putin-news-03-18-22/h_7e03229b94333a79a179022f75bf0539
2,cc9f6e79-254c-4451-9b73-90bff351db4f,"['Aditi Sangal', 'Meg Wagner', 'George Ramsay', 'Jeevan Ravindran', 'Laura Smith-Spark', 'Peter Wilkinson', 'Adrienne Vogt', 'Melissa Macaya']",2022-03-18 04:00:36+00:00,"From CNN's Inke Kappeler in Berlin and Chris Liakos in London

German Chancellor Olaf Scholz speaks during a press conference at the Chancellery in Berlin, Germany, on March 15. (Photo by Hannibal Hanschke/AFP/Getty Images)

Russian President Vladimir Putin accused Kyiv Friday of delaying the negotiation process during a call with German Chancellor Olaf Scholz.

According to the Kremlin readout, Putin outlined his assessments of the ongoing video talks between Russian and Ukrainian representatives.

“It was noted that the Kyiv regime is trying in every possible way to delay the negotiation process, putting forward more and more unrealistic proposals. Nevertheless, the Russian side is ready to continue the search for solutions in line with its well-known principled approaches,” the readout said.

The Russian President claimed that the Russian Armed Forces were doing everything possible to save the lives of civilians, including by organizing safe corridors for the evacuation of the population from cities in the combat zone.

The Kremlin said that the call was initiated by the German side.

During their hour-long call, Scholz repeated his call for a “ceasefire as quickly as possible,"" as well as an ""improved humanitarian situation and progress in the search of a diplomatic solution,"" according to a tweet posted by Scholz's spokesman Steffen Hebestreit on Friday.

This is the third time Scholz and Putin have spoken since Russia’s invasion of Ukraine. The last conversation took place alongside French President Emmanuel Macron on March 12.

Kremlin spokesman Dmitry Peskov told journalists on a call the two leaders had a ""difficult but business-like"" discussion. ""The conversation, of course, can hardly be called friendly. This was a tough conversation,"" he said.

""But nevertheless, there is a need for such contacts, exchange of information, discussion of sensitive topics related to the special operation.""",https://www.cnn.com/europe/live-news/ukraine-russia-putin-news-03-18-22/h_f4b02f709f1fefd7e67ce03e63861151
3,cc9f6e79-254c-4451-9b73-90bff351db4f,[],,"Become an FT subscriber to read:

Leverage our market expertise

Expert insights, analysis and smart data help you cut through the noise to spot trends, risks and opportunities.

Join over 300,000 Finance professionals who already subscribe to the FT.",https://www.ft.com/content/232f07d1-5c90-4819-a637-397e14760339
4,cc9f6e79-254c-4451-9b73-90bff351db4f,[],2022-03-18 18:35:29+08:00,"MOSCOW (AFP, REUTERS) - Russian President Vladimir Putin on Friday (March 18) accused Ukrainian authorities of stalling talks, but added that Moscow was ready to search for solutions as he spoke with German Chancellor Olaf Scholz.

""It was noted that the Kyiv regime is trying in every possible way to stall negotiations, putting forward more and more unrealistic proposals,"" the Kremlin said after the phone call.

""Nevertheless, the Russian side is ready to continue to search for solutions in line with its well-known principled approaches.""

Mr Putin's spokesman Dmitry Peskov called the phone talks between Mr Putin and Mr Scholz ""tough"" but added that such contacts were still needed.

Mr Peskov said it was still early to talk about an agreement that Russian and Ukrainian negotiators could sign.

""I can only state that the Russian delegation is showing a willingness to work much faster than it is doing now,"" he told reporters.

""Unfortunately, the Ukrainian delegation is not ready to accelerate the pace of talks.""

Moscow has previously said it was close to agreeing a formula that would keep Ukraine neutral, one of its key demands.

Ukraine has said it is willing to negotiate but will not surrender or accept Russian ultimatums. It is sticking to its position that it retains sovereignty over areas seized by Russia and Russian-backed forces since 2014.

In talks with Mr Scholz, Mr Putin also stressed that Russian troops were ""doing their best"" to save civilians including through safe corridors, the Kremlin said, adding that some 43,000 people had been evacuated from the south-eastern city of Mariupol on Thursday.

German Chancellor Scholz called for a ceasefire in Ukraine during the phone call on Friday, a German government spokesman said.

In their nearly hour-long conversation, Mr Scholz also stressed that the humanitarian situation needed to be improved and progress needed to be made in finding a diplomatic solution as soon as possible, said the spokesman.

Mr Putin will also speak by phone with French President Emmanuel Macron Friday evening, Mr Peskov said.",https://www.straitstimes.com/world/in-call-with-scholz-putin-says-kyiv-is-stalling-peace-talks-with-moscow
