,uid,article_author,article_date,article_text,article_url
0,e05307d9-dc38-46a8-b248-31ac74f4a90b,[],,"JavaScript is not available.

We’ve detected that JavaScript is disabled in this browser. Please enable JavaScript or switch to a supported browser to continue using twitter.com. You can see a list of supported browsers in our Help Center.

Help Center",https://twitter.com/ralee85/status/1497496972101664768?lang=en
1,e05307d9-dc38-46a8-b248-31ac74f4a90b,[],,"JavaScript is not available.

We’ve detected that JavaScript is disabled in this browser. Please enable JavaScript or switch to a supported browser to continue using twitter.com. You can see a list of supported browsers in our Help Center.

Help Center",https://twitter.com/liveuamap/status/1497498142140473344?lang=en
2,e05307d9-dc38-46a8-b248-31ac74f4a90b,[],,,https://www.reddit.com/r/CombatFootage/comments/t1spip/possible_iskander_ballistic_missile_launch_from/
3,e05307d9-dc38-46a8-b248-31ac74f4a90b,[],,,https://crsreports.congress.gov/product/pdf/IN/IN11872/2
4,e05307d9-dc38-46a8-b248-31ac74f4a90b,"[""Rfe Rl'S Russian Service""]",,"Russia's Defense Ministry warned on April 15 that it will intensify attacks on the Ukrainian capital, Kyiv, after accusing Ukraine of targeting Russian border towns.

The statement came a day after Russia suffered a symbolic defeat with the loss of its Black Sea fleet flagship, and Ukrainian President Volodymyr Zelenskiy hailed his people for their resolve since Russia invaded in February and for making “the most important decision of their life -- to fight.”

Zelenskiy told Ukrainians late on April 14 that they should be proud of having survived 50 days under Russian attack when the invaders “gave us a maximum of five.”

Live Briefing: Russia's Invasion Of Ukraine RFE/RL's Live Briefing gives you all of the major developments on Russia's invasion, how Kyiv is fighting back, the plight of civilians, and Western reaction. For all of RFE/RL's coverage of the war, click here.

Zelenskiy noted “those who showed that Russian warships can sail away, even if it’s to the bottom” of the sea in a reference to Russia's guided-missile cruiser Moskva, the flagship of Russia's Black Sea fleet, which sank in the Black Sea after being damaged in disputed circumstances.

“The number and the scale of missile attacks on objects in Kyiv will be ramped up in response to the Kyiv nationalist regime committing any terrorist attacks or diversions on Russian territory,” Russian Defense Ministry spokesman Major General Igor Konashenkov said.

Kyiv claimed to have hit the Moskva with Neptune anti-ship missiles early on April 14, while Russia said a fire broke out on the ship, causing an explosion.

The U.S. military agreed with the Ukrainian version.

""We assess that they hit it with two Neptunes,"" a senior Pentagon official said in a briefing with reporters on April 15, calling it a ""big blow"" for Moscow.

The strikes were believed to have caused casualties, but it was difficult to assess how many, the official said, speaking on condition of anonymity.

The official added that the United States had observed survivors being recovered by other Russian vessels in the area. Russia said the Moskva's crew was evacuated to nearby ships.

Natalia Humenyuk, a spokeswoman for Ukraine's southern military forces, said the Ukrainian side expects Russia to take revenge.

The strike on the Moskva ""hit not only the ship itself, it hit the enemy's imperial ambitions. We are all aware that we will not be forgiven for this,"" she said during a briefing. ""We are aware that attacks against us will intensify and that the enemy will take revenge,"" she added, citing ongoing strikes on cities in the south of Ukraine, Odesa, and Mykolaiv.

On April 15, Russian troops fired on almost all settlements in the Luhansk region, killing and injuring civilians, Ukrainian authorities said.

""Occupying Russian troops fired mortars, artillery, and rocket-propelled grenade launchers at the cities of Syevyerodonetsk, Rubizhne, Kreminna, Lysychansk, Popasna, Hirske, Zolote, Orikhove, and Novotoshkivka 26 times,"" Ukraine's national police agency said.

Powerful explosions were heard in Kyiv on April 15, according to local media, and fighting raged in the east.

The Russian Defense Ministry said that Russian troops hit a ""military"" factory outside Kyiv late on April 14 using Kalibr sea-based long-range missiles.

The Ukrainian presidency says explosions were heard in the Vasylkiv area outside the capital.

The Russian ministry also said its S-400 missile system shot down a Ukrainian Mi-8 helicopter, which carried out ""an attack on civilians in the locality of Klimovo in the Bryansk region on April 14.”

On April 14, the National Security and Defense Council of Ukraine (RNBO) rejected Russia’s accusations about the attacks on Russian towns, calling them ""an attempt to ignite anti-Ukraine hysteria in Russia.""

Explosions were also heard on April 15 in the southern city of Kherson, the eastern city of Kharkiv, and in Ukraine's western city of Ivano-Frankivsk, media reported.

The German government said it plans to release more than 1 billion euros in military aid for Ukraine.

Berlin has decided to increase its international aid in the defense sector to 2 billion euros, with the largest part planned for Ukraine, Finance Minister Christian Lindner said on Twitter.

The move comes amid criticism from Ukraine and some EU partners such as Poland and the Baltic states that Germany has not done enough to send armaments to Kyiv.

Ukrainian authorities continue to expect an imminent, stepped-up offensive by Russian forces in the eastern part of the country.

Some areas in the east have already felt the brunt of Russian attacks. An official in the Kharkiv region said at least 503 civilians have been killed since the invasion began. Regional Governor Oleh Synehubov said in a post on Telegram that the dead included 24 children.

The city near the Russian border has been on the eastern front line since the start of the war and has suffered massive destruction.

Efforts to evacuate people from the southern port city of Mariupol continued on April 15. Ukrainian Deputy Prime Minister Iyrna Vereshchuk said 363 people from Mariupol were among 2,864 people who were evacuated from conflict zones.

Ukraine says tens of thousands of people are believed to have been killed in Mariupol, a strategic city that has seen some of the worst fighting of the war.

Seven people were killed and more than two dozen injured in a Russian attack on buses ferrying civilians in the village of Borova in the Izyum district, the Ukrainian Prosecutor-General's Office said in a statement on social media.

In Russia, the Federal Security Service (FSB) has asked the government to increase funding for troop funeral services and tombstones.

The FSB asked for a 17 percent increase for funeral services, according to documents recently posted to a government website.

With reporting by AP, Reuters, AFP, and dpa",https://www.rferl.org/a/rferl-novaya-gazeta-detained-belgorod/31725229.html
5,e05307d9-dc38-46a8-b248-31ac74f4a90b,[],,"“We have led our generation to the threshold of space—the road to the stars is now open.” — Walter Dornberger

The quote at the top of this page was written by Dr. Dornberger in his book V-2, referring to the first successful flight of a V-2 missile from the German facility which he commanded at Peenemunde. Implicit in these words is the recognition that the ballistic rocket had unlocked the key to successful exploration of space. Recent events – the Russian Sputniks and the American Explorer – have driven this fact home. Fortunately, in its space endeavors, this nation is in a position to call upon the resources of the mightiest single military project the country has ever known, exceeding in magnitude even the Manhattan Project, which produced the first atomic bomb.

This is the Air Forces’ ballistic missile program, a logical springboard into space. Ballistic missiles can be considered the first true space weapons, since they are outside the atmosphere for some ninety percent of an intercontinental flight. As an introduction to our discussion of the USAF ballistic missile program we could find no better source than its boss, Maj. Gen. Bernard A. Schriever, who runs the show from his position as Commander of the Ballistic Missile Division of the Air Research and Development Command.

The following excerpt is from an address by General Schriever; made long before the various satellites – Russian and American – had sullied the virgin reaches of outer space. The occasion was an Astronautics Symposium, jointly sponsored by the USAF Office of Scientific Research and Convair at San Diego, Calif., in February of last year. We think it remains the best explanation of the important implications of the USAF ballistic missile program in the US conquest of space and serves as a fitting introduction to our examination of the program in its historical, developmental, and operational context.— The Editors.

How have the ICBM and IRBM programs contributed to the conquest of space? They have contributed in a very concrete sense from the standpoint of hardware that has been developed or is being developed for this program. A tremendous industrial capability is being built up and production know-how is being established in many new areas. These airframe, propulsion, and guidance subsystems development and the data, which will become available as ballistic missile test flights are made, will make possible a whole gamut of follow-on projects.

Take, for example, the propulsive unit. The same propulsive unit that boosts a heavy nose-cone warhead to 25,000 ft/sec, could boost a somewhat lighter body to the escape velocity of 35,000 ft/sec or to an orbital path around the Earth. Using the same number of stages, the ratio of thrust to weight would be greater by using a lighter payload, and higher accelerations and velocities could be reached before burnout. Or with our present state of knowledge, it would be relatively easy to add another stage. We have already done that successfully on our reentry test vehicle, the X-17. The same guidance system that enables the warhead of a ballistic missile to reach its target within a permissible accuracy would also be sufficiently accurate to hit a target much smaller than the moon. Or, if we are talking about circular orbits around the Earth, errors in guidance could be easily observed over a period of time and corrected, and the satellite kept on an accurate orbit. And, of course, these same propulsive and guidance components could also be used for surface-to-surface transport vehicles of various sorts to experimentally carry mail or strategic military materiel to critical sites. The same applies to structural advances of the ICBM that have brought us to new heights in the ratio of total weight to structural weight. I would be willing to venture a guess that ninety percent of the unmanned follow-on projects that one cold visualize for the future can be undertaken with propulsive guidance, and structural techniques, presently under development in the Air Force ballistic missile program.

It is reasonable to expect that it will not be too difficult to extend these present developments to surface-to-surface transport of personnel by rocket propulsion, or space travel of personnel at some time in the future. However, before man can be committed to space vehicles, a tremendous amount of human factors research will be necessary…. Granted this research, there are other problems as well. A specific example of the kind of advanced development probably necessary for manned spaceflight to distant planets is sustained thrust through space. This will permit us to reach higher velocities and cut down the flight time, which would otherwise be impractically long for a human passenger even to the closest planets. Such long sustained thrust, at a small enough magnitude level to be tolerable to a man, requires a type of propulsion technique that is not well suited to takeoff thrust and general ICBM requirements. The successful achievement of the required propulsion system is clearly indicated by today’s science, but it has to be developed a program beyond the current ICBM program.

Space technology, probably for some decades, will not revolve primarily around apparatus for controlled movement of vehicles from one point to another in empty space. Perhaps not only initially but for all time, space technology will include as its most characteristic problem the need for going from the surface of one terrestrial body to another with successful passage through the atmosphere of each. The first big problems, then, are how to bring a substantial mass up to empty space with velocity sufficient to continue interbody space travel, with adequate precision in the velocity vector control, and how to bring it back through an atmosphere without disintegration. In each of these respects, if one for the moment bypasses human cargo ambitions, the ICBM is attaining the necessary capability and, even for manned flight, the ICBM flight-test program will provide experimental data of direct interest.

Granted then that the ICBM program is a major pioneering and foundation step for space technology, what appears to be a logical future program? The answer is not easy. It is very difficult to make a firm prognosis on military need during a twenty-year period for something as new and revolutionary as ballistic missiles, Earth satellites, and space vehicles. We are somewhat in the same position today as were military planners at the close of the First World War when they were trying to anticipate the employment of aircraft in future wars. Consequently, my prognoses will go from those which are reasonably firm to those, which might be considered visionary. Fortunately, there is a considerable overlap between the advances in the state of the art which are required for the firm needs and those now considered visionary.

First, we should consider those changes in the operational and technical characteristics of our long-range ballistic missiles to make them superior, reliable weapons. Almost any military planner would agree that if we can increase the range, increase the payload, reduce the gross weight, increase the accuracy, reduce the cost, or simplify the operational procedures, we will have made a worthwhile contribution. Now, in order to achieve any or all of thee objectives, it will be necessary to advance the sate of the propulsion art, the structures art, or the guidance art, or perhaps all three. When these advances are made, they will be applicable also to the more visionary projects. The basic science underlying these engineering arts has been well surveyed in the past two years. It tells us that considerable advance is possible on all fronts.

A word is necessary on the relationship between military need and scientific feasibility in space technology. In the long haul our safety as a nation may depend upon our achieving “space superiority.” Several decades from now the important battles may not be sea battles or air battles, but space battles, and we should be spending a certain fraction of our national resources to ensure that we do not lag in obtaining space supremacy. Besides the direct military importance of space, our prestige as would leaders might well dictate that we undertake lunar expeditions and even interplanetary flight when the appropriate technological advances have been made and the time is ripe. Thus, it is indeed fortunate that the technology advances required in support of military objectives can, in large part, directly support these more speculative space ventures….

Where does all this lead? My thought is that the evolution of space vehicles will be a gradual step-by-step process, with the first step beyond ballistic missiles being the unmanned, artificial Earth satellite and then perhaps unmanned exploratory flights to the moon or Mars. These first flights would no doubt be research vehicles to gather scientific data and to accumulate information on pace environmental conditions for future design use. The information gathered form these flights will supplement the information gathered from ballistic missile test flights. Many of the things that we can learn from satellites will lead not only to a better understanding of conditions to be encountered in space, but will lead to a better understanding of our own planet. Weather reconnaissance can be accomplished in a more effective manner. This will lead to a better understanding of the movements of polar air masses and the courses of jet streams and will permit improved long-range weather forecasts and improved aircraft and missile operations. A better understanding of the Earth’s magnetic field will lead to better radio communications, more reliable navigation instruments, and perhaps new ideas for propulsive devices. Refined data on the Earth’s gravitational effects will lead to improved guidance. Much remains to be known about cosmic rays. Unmanned satellites will be the means for obtaining this information.

I have described some of the benefits to be derived from our early ventures into space, and the contributions the ICBM program is making in this direction.

Payload capability of a future satellite could be in the order of hundreds or even a thousand pounds. Such payload would permit more instrumentation and many varied types of space experiments.

Vehicles with additional complications could be made to have the ability to return intact from space. However, without fundamental extension the environment during spaceflight would not be suitable for a human passenger. Therefore, manned spaceflight cannot be attempted with such apparatus, but many of the associated physiological questions can be answered by experiments with animals. We may, in fact, be able to fill nearly all the gaps in our knowledge which are now holding back the design of manned spacecraft.

Given vehicles with these capabilities, still another avenue for a scientific achievement is immediately opened – for with additional rocket thrust a lunar research vehicle is highly possible. In view of the small additional cost of such an experiment, it seems certain that in the not too distant future it will be tried.

The ICBM program, through the technology it is fostering, the facilities that have been established, the industrial teams being developed, and the vehicles themselves, is providing the key to the further development of spaceflight. Many fascinating new horizons are sure to open within the next decade as a direct result.

There is ample precedent in history for the utilization of military capability to explore unknown regions. Over the centuries the great exploration of this planet have been conducted by military men, usually with no precise idea of what the ultimate value of their discoveries might be – either in a military or an economic sense. But the exploring was done, and the value usually followed.

Columbus discovered America as an admiral in the service of Spain. Magellan and Sir Francis Drake were military men. The Lewis and Clark expedition, which opened the West, was a military enterprise. Likewise Admiral Byrd’s exploits at both Poles.

So it is quite fitting that the Air Force should be interested in furthering the knowledge of its new medium, just as did the Army and Navy in their in the past. It has been estimated that during the next five to seven years, American exploration in space must be based on ICBM technology. Hence this section will be devoted to the ICBM program, with charts beginning on Page 76, a chronology of ICBM milestones on page 80, and a text beginning on page 84.—The Editors",https://www.airforcemag.com/article/0358missiles/
6,e05307d9-dc38-46a8-b248-31ac74f4a90b,[],,"Summary

Bilateral agreement between the U.S. and U.S.S.R. requiring each nation to notify the other party, ""no less than twenty-four hours in advance, of the planned date, launch area, and area of impact for any launch of a strategic ballistic missile."" The treaty entered into force on May 31, 1988.

Narrative

The Agreement on Notifications of ICBM and SLBM Launches, signed during the 1988 Moscow Summit, reflects the continuing interest of the United States and the Soviet Union in reducing the risk of nuclear war as a result of misinterpretation, miscalculation, or accident.

A number of earlier U.S.-Soviet agreements address advance notification of some, but not all, strategic ballistic missile launches.

The 1971 ""Accidents Measures"" Agreement requires each Party to notify the other in advance of any planned missile launches if such launches will extend beyond its national territory in the direction of the other Party.

The 1972 ""Incidents at Sea"" Agreement provides for advance notice, through Notices to Airmen and Mariners of actions on the high seas which represent a hazard to navigation or aircraft in flight. Planned ballistic missile launches which will take place in international waters represent such a hazard, and, under the ""Incidents at Sea"" Agreement, notification must be provided. The Notices to Airmen and Mariners, however, consist of warnings which announce ""closure areas"" due to a hazard to navigation or aircraft in flight; they need not identify the nature of the hazard.

Article XVI of the SALT II Treaty, which was never ratified, would have obligated each Party to notify the other well in advance before conducting multiple ICBM launches, or single ICBM launches planned to extend beyond its national territory. There was no obligation, however, to notify single launches not intended to extend beyond national territory. There were also no provisions in the SALT II Treaty for the notification of SLBM launches.

None of these earlier agreements, therefore, provided total coverage of all strategic ballistic missile (ICBM and SLBM) launches. In 1982, President Reagan proposed a number of new confidence-building measures for discussion at the U.S.-Soviet Strategic Arms Reductions Talks (START). Among these was a proposal for prior notification of all launches of ICBMs and SLBMs. During the course of the START negotiations, both sides drafted similar launch notification procedures which were incorporated into the joint draft of the START agreement text.

In May 1988, the United States proposed to the Soviets that, as a confidence-building measure, the sides conclude a separate agreement calling for advance notification of ICBM and SLBM launches. The Soviets agreed, and on May 31, 1988, in Moscow, U.S. Secretary of State Shultz and Soviet Foreign Minister Shevardnadze signed the Agreement on Notifications of ICBM and SLBM Launches. The Agreement provides for notification, no less than 24 hours in advance, of the planned date, launch area, and area of impact for any launch of an ICBM or SLBM. The Agreement also provides that these notifications be provided through the Nuclear Risk Reduction Centers. The Agreement entered into force on the date it was signed.

The U.S.-Soviet Joint Statement issued following the Moscow Summit included the following statement:

The agreement between the United States and the USSR on notifications of launches of Inter-continental Ballistic Missiles and Submarine-Launched Ballistic Missiles, signed during the Moscow summit, is a practical new step, reflecting the desire of the sides to reduce the risk of outbreak of nuclear war, in particular as a result of misinterpretation, miscalculation, or accident.

Afterwards, the START I Treaty was signed in 1991. This Treaty contains an obligation to notify any flight test of an ICBM or SLBM, including those used to launch objects into the upper atmosphere or space. In addition to the requirements under the Ballistic Missile Launch Notification Agreement (i.e., that the notifying Party provide planned launch date, launch area, and reentry impact area), the START I Treaty requires that the notifying Party must also specify the telemetry broadcast frequencies to be used, modulation types and information as to whether the flight test is to employ encapsulation or encryption.",https://www.atomicarchive.com/resources/treaties/launch-notification.html
7,e05307d9-dc38-46a8-b248-31ac74f4a90b,"['India Mctaggart', 'Claudia Rowan', 'George Styllis', 'Josh White', 'Roland Oliphant', 'Senior Foreign Correspondent']",2022-02-27 00:00:00,"A three-mile column of Russian troops and tanks have been seen ""moving towards Kyiv"" in satellite imagery taken on Sunday.

The images released by Maxar Technologies, a space technology company, showed a large deployment of Russian ground troops moving in the direction of the Ukrainian capital from approximately 40 miles (64 km) away.

The deployment consisted of hundreds of military vehicles and extended more than 3.25 miles (5 km), Maxar said.

The convoy was situated northeast of the Ukrainian city of Ivankiv and contained fuel, logistics and armored vehicles including tanks, infantry fighting vehicles and self-propelled artillery.

Maxar has been tracking the buildup of Russian forces for weeks.

This development comes as the European Union took the unprecedented step of supplying weapons to Ukraine, which is the first time the bloc has financed the purchase and delivery of weapons for a country that is under attack.

Ursula von der Leyen, the president of the European Commission, called the step a ""watershed moment"" and also announced that the bloc will also close its airspace to Russian airlines.

Follow the latest updates in our Monday blog.",https://www.telegraph.co.uk/world-news/2022/02/27/russia-ukraine-news-war-putin-zelensky-nato-latest-updates/
