,uid,article_author,article_date,article_text,article_url
0,fee6c067-417e-4a12-bb44-8dff9658aedf,[],,,https://tass.com/society/1415271
1,fee6c067-417e-4a12-bb44-8dff9658aedf,[],,"Roskomnadzor demands Wikipedia delete Russian-language article about Ukraine situation

MOSCOW. March 2 (Interfax) - Russia's telecommunications watchdog Roskomnadzor has demanded that an article on the events in Ukraine in which the Prosecutor General's Office found fake information be deleted from Wikipedia, the agency told Interfax.

""On the basis of the requirement issued by the Russian Prosecutor General's Office on March 1, Roskomnadzor sent a notification to the management of the aforementioned Internet resource about the need to delete false information dealing with the special military operation in Ukraine. It involves the website's use of false content aimed to misinform Russian users,"" the agency said in response to Interfax's request.

""The failure to delete unlawful information as demanded by Roskomnadzor is an administrative offense punishable by a fine of up to 4 million rubles for legal entities,"" it said.",https://interfax.com/newsroom/top-stories/75109/
2,fee6c067-417e-4a12-bb44-8dff9658aedf,[],,"JavaScript is not available.

We’ve detected that JavaScript is disabled in this browser. Please enable JavaScript or switch to a supported browser to continue using twitter.com. You can see a list of supported browsers in our Help Center.

Help Center",https://twitter.com/liveuamap/status/1499029748399460357
3,fee6c067-417e-4a12-bb44-8dff9658aedf,[],2022-03-02 15:53:10+00:00,"Moscow has threatened to block access to Wikipedia’s Russian-language site over an article about Vladimir Putin’s invasion of Ukraine.

Amid widespread reports that Russia’s war is not going to plan, Moscow further tightened its grip on the information available to its populace on Tuesday and attacked Google and Meta as “foreign instigators of war”, after they also clamped down on Kremlin-backed media outlets.

Having ordered independent media outlets last week to remove references to Russia’s “assault, invasion, or declaration of war” or face being blocked and fined, the Russian media watchdog – Roskomnadzor – has now issued a similar threat to Wikipedia.

Citing a request from the office of Russia’s prosecutor general, the communications regulator issued a notice threatening that Russian telecommunications companies could block access to Wikipedia over an article it said violated the law, titled: “Russian invasion of Ukraine (2022).”

In its complaint, the regulator pointed to references on the Wikipedia page relating to numerous casualties among the Russian military – and among civilians and children in Ukraine – as well as Russian citizens’ panicked attempts to withdraw their money from banks in response to western sanctions.

Ukraine on Wednesday said that more than 2,000 of its civilians have been killed during the first week of the Russian invasion, and claims to have killed nearly 6,000 Russian troops.

It took Moscow until Sunday – the fourth day of Mr Putin’s invasion – to acknowledge that “there are dead and wounded” Russian troops. No estimates of the death toll have yet been given by the Kremlin, but it has claimed its losses have been far lower than those of Ukrainian troops.

During Russia’s annexation of Crimea in 2014, The New York Times notes that Mr Putin arrested journalists who attempted to report on soldiers’ funerals in a bid to bury casualty figures.

Wikimedia Russia confirmed to The Independent on Wednesday that it had received the threat from Moscow’s communications regulator, which was published on the former’s website.

But its executive director, Stanislav Kozlovskiy, said that so far it was “not very clear” which parts of the article Moscow officials had taken issue with.

The article on Russia’s invasion is “written simultaneously by a huge number of people”, Mr Kozlovskiy said in an email, adding: “Every minute, day and night, numerous corrections and additions are made to it. Thousands of people with very different views on what is happening very carefully ensure that all the information in the article is as reliable as possible, and is also presented as neutrally as possible.

World news in pictures Show all 50 1 /50 World news in pictures World news in pictures 13 April 2022 Two women hug outside a heavily damaged apartment block following an artillery attack during the Russian assault on Kharkiv Reuters World news in pictures 12 April 2022 Members of the New York Police Department and emergency vehicles crowd the streets after at least 16 people were injured during a rush-hour shooting at a subway station in Brooklyn AFP via Getty Images World news in pictures 11 April 2022 A university student shouts slogans during a protest against high prices of supplies, postponement of presidential elections and an extension of the president's term in front of the people's representative council (DPR) in Banda Aceh AFP/Getty World news in pictures 10 April 2022 Girls dressed as Kumari arrive to attend rituals to celebrate the Hindu festival of Navratri at the Adyapeath temple on the outskirts of Kolkata, India Reuters World news in pictures 9 April 2022 Volodymyr Zelensky and Boris Johnson walk during their meeting in downtown Kyiv AP World news in pictures 8 April 2022 An aerial photograph shows protesters holding a massive Ukrainian flag in Tirana’s main square, as they prepare to march toward the Russian Embassy AFP/Getty World news in pictures 7 April 2022 A remote controlled airplane enthusiast launches an electric glider from a cliff in Hong Kong – alternative outdoor activities are increasingly popular in Hong Kong as coronavirus restrictions have closed beaches, gyms and swimming pools. EPA World news in pictures 6 April 2022 A firefighter works at the site of burning fuel storage facilities damaged by an airstrike, as Russia's attack on Ukraine continues, in Dnipropetrovsk region Press service of the State Emergency Service of Ukraine via Reuters World news in pictures 5 April 2022 A boy jumps into the Yamuna river to cool himself off amid rising temperatures in New Delhi AFP via Getty Images World news in pictures 4 April 2022 Volodymyr Zelensky (2nd L) walks in the town of Bucha, just northwest of Kyiv, after reports that hundreds of civilians were killed AFP/Getty World news in pictures 3 April 2022 Displaced Syrian children with boxes of food distributed by a local charity organisation, before the ‘Iftar’ meal during the Muslim holy month of Ramadan, at a camp on the outskirts of the rebel-held town of Dana, east of the Turkish-Syrian border in the northwestern Idlib province AFP/Getty World news in pictures 2 April 2022 Plumes of smoke billow from the site of a fire that broke out at the Waaheen market in Hargeisa, Somaliland AFP/Getty World news in pictures 1 April 2022 Palestinians demonstrating against the expropriation of land by Israel, clash with Israeli security forces in the village of Kfar Qaddum near the Jewish settlement of Kedumim in the occupied West Bank AFP via Getty World news in pictures 31 March 2022 Members of Al Fursan aerobatics demonstration team of the United Arab Emirates (UAE) perform over the EXPO site before the official closing ceremony of EXPO 2020 Dubai, United Arab Emirates EPA World news in pictures 30 March 2022 Ukrainian rescue workers walk past destroyed Russian military vehicles next to the railway station where the Russian forces were stationed, in Trostyanets town, in Sumy region, Ukraine EPA World news in pictures 29 March 2022 A critically endangered Sumatran rhino was born in a sanctuary bringing hope to the conservation of the rapidly declining species at the Way Kambas National Park, in Lampung province in Indonesia AFP/Getty World news in pictures 28 March 2022 US actor Will Smith (R) slaps US actor Chris Rock onstage during the 94th Oscars at the Dolby Theatre in Hollywood, California AFP/Getty World news in pictures 27 March 2022 Volunteers cover with sandbags the Monument to Princess Olga, Apostle Andrew, Cyril, and Methodius to protect them from Russian shelling, in the Ukrainian capital of Kyiv, Ukraine EPA World news in pictures 26 March 2022 U.S. President Joe Biden, flanked by Polish Prime MInister Mateusz Morawiecki, holds a child as he visits Ukrainian refugees at the PGE National Stadium, in Warsaw, Poland Reuters World news in pictures 25 March 2022 A man holds a mobile phone while smoke rises after Russian attacks hit a fuel storage facility in the city of Kalynivka AFP/Getty World news in pictures 24 March 2022 Britain's Prince William and Catherine, Duchess of Cambridge ride in a vintage Land Rover used by Britain's Queen Elizabeth during her visit to Jamaica Reuters World news in pictures 23 March 2022 The moon sets behind the Great Giewont peak in the Tatra Mountains, in Zakopane, southern Poland EPA World news in pictures 22 March 2022 A man holds his breath while he swims inside hot spring on the occasion of World Water Day outside Kuala Lumpur, Malaysia EPA World news in pictures 21 March 2022 Students hold white balloons during a demonstration against violence, after recent incidents between Thai rangers and suspected separatists, in Ra-ngae district in the southern Thai province of Narathiwat AFP/Getty World news in pictures 20 March 2022 Festival participants known as ‘Gilles,’ wearing traditional costumes and hats made of ostrich feathers, are dressed up for carnival celebrations in the streets of Strepy Bracquegnies, Belgium EPA World news in pictures 19 March 2022 Visitors dressed in period costumes walk near the Gate of Supreme Harmony in the Forbidden City in Beijing AP World news in pictures 18 March 2022 Twins are prepared for a newborn photo shoot by local photographer Fanny Nurdiana in Banda Aceh AFP/Getty World news in pictures 17 March 2022 President Joe Biden meets virtually with Irish Prime Minister Micheál Martin in the Oval Office of the White House, in Washington AP World news in pictures 16 March 2022 The moon sets behind a statue of William Penn atop of City Hall in Philadelphia AP World news in pictures 15 March 2022 Indian widows participate in the Holi festival in Vrindavan, Uttar Pradesh, India EPA World news in pictures 14 March 2022 A farmer works at a poppy field in the Zhari district of Kandahar AFP/Getty World news in pictures 13 March 2022 Ukrainian President Volodymyr Zelensky shakes hands with an injured man during a visit at a military hospital following fightings in the Kyiv region Getty World news in pictures 12 March 2022 'Choke on it !!!' says the slogan of a carnival float showing a depiction of Russian President Putin as he swallows an object in the form and national colors of Ukraine EPA World news in pictures 11 March 2022 A young man kisses goodbye his girlfriend at Kyiv Main Railway Station as she tries to flee from Kyiv, Ukraine EPA World news in pictures 10 March 2022 The pack rides during the 5th stage of the 80th Paris - Nice cycling race AFP/Getty World news in pictures 9 March 2022 Houses inundated with floodwaters from an overflowing Hawkesbury River are pictured in the Windsor suburb of Sydney AFP via Getty Images World news in pictures 8 March 2022 People shelter from fireworks before the traditional ""torito"" (little bull) made of paper, wood and fireworks during celebrations of San Juan de Dios in Tultepec on the outskirts of Mexico City AFP via Getty Images World news in pictures 7 March 2022 People cross the destroyed bridge as they flee from the frontline town of Irpin, Kyiv region, Ukraine EPA World news in pictures 6 March 2022 A local resident reacts as a house is on fire after heavy shelling on the only escape route used by locals to leave the town of Irpin, while Russian troops advance towards the capital, 24km from Kyiv, Ukraine Reuters World news in pictures 5 March 2022 Austria’s Roman Rabl competing in the men’s downhil sitting para alpine skiing during the Beijing 2022 Winter Paralympic Games in Yanqing OIS/IOC/AFP/Getty World news in pictures 4 March 2022 People remove personal belongings from a burning house after being shelled in the city of Irpin, outside Kyiv AFP/Getty World news in pictures 3 March 2022 An aerial view shows a residential building destroyed by shelling, as Russia’s invasion of Ukraine continues, in the settlement of Borodyanka in the Kyiv region Reuters World news in pictures 2 March 2022 A man with his newborn child takes shelter in the basement of a perinatal centre as air raid siren sounds are heard amid Russia’s invasion of Ukraine, in Kyiv Reuters World news in pictures 1 March 2022 Members of an Ukrainian civil defense unit pass new assault rifles to the opposite side of a blown up bridge on Kyiv’s northern front AFP/Getty World news in pictures 28 February 2022 Members of the Ukrainian community of Rome collect basic necessities to be distributed to the Ukrainian population, at the church of Santa Sofia in Rome, Italy EPA World news in pictures 27 February 2022 Protesters crowd around the victory column and close to the Brandenburg Gate in Berlin to demonstrate for peace in Ukraine AFP/Getty World news in pictures 26 February 2022 The Swiss Air Force fly in front of the Weisshorn mountain in the Swiss Alps prior to the start of the FIS Alpine Ski World Cup in Crans-Montana, Switzerland AFP via Getty Images World news in pictures 25 February 2022 A Ukrainian firefighter walks between at fragments of a downed aircraft seen in in Kyiv AP World news in pictures 24 February 2022 Firefighters work on a building after bombings on the eastern Ukraine town of Chuguiv. Russian armed forces are trying to invade Ukraine from several directions, using rocket systems and helicopters to attack Ukrainian position in the south, the border guard service said AFP/Getty World news in pictures 23 February 2022 A woman wearing a face mask walks next to decorations at a shopping mall in Bangkok, Thailand EPA

“Every edit is checked. All dubious, unverified, contradictory statements from the article are promptly removed. Similarly, emotional assessments, incorrect or ambiguous phrases etc are removed from the article,” he told The Independent.

Mr Kozlovskiy added: “Now the entire Wikipedia community is carefully studying this article and double-checking all sources even more carefully. So far, the claims are not very clear. It is possible that the prosecutors looked at some older version of the article.”

While the Kremlin has threatened Wikipedia over a number of articles in the past, it is only possible for it to block access to the entire website, as opposed to individual pages.

The regulator did so in 2015, over a page giving information about charas, a hashish type of cannabis – but the decision was later reversed.

Mr Kozlovskiy said: “The basic principle of Wikipedia is that information is deleted only if it is doubtful, unreliable, erroneous, not supported by the source or the source is not authoritative etc. Not by order. The article is now carefully reviewed by the Wikipedia community.”

Follow live updates on Russia’s war on Ukraine.

Adding that Wikipedia aims “to give people reliable and neutral information about the world”, he added: “This principle is observed in all articles.”

The wider Wikimedia Foundation pointed The Independent to a statement published on Tuesday, saying it “is actively working with affected communities to identify potential threats to information on Wikimedia projects, and supporting volunteer editors and administrators who serve as a first line of defence against manipulation of facts and knowledge”.

It follows a similar warning last week from Roskomnadzor – also citing the prosecutor general’s office – that news sites including broadcaster Dozhd, newspaper Novaya Gazeta, and radio station Echo of Moscow would be blocked and fined unless they removed “unreliable socially significant untrue information” about Russia’s attack on Ukraine.

And on Tuesday, days after having partially restricted Facebook access, the Russian media regulator reimposed a slowdown of Twitter’s loading speed – a measure lifted last May – and accused the company of failing to take down what it said were fake posts about Russia’s “special operation”.

It came as Google banned the YouTube channels of Russia Today and Sputnik in Europe, with Facebook’s owner Meta also announcing that it would restrict access to the pages of the media companies across the EU.

Meanwhile, the French satellite which broadcasts Russia Today in both the UK and EU is to be switched off, meaning it will no longer be available on Sky, culture secretary Nadine Dorries said in a triumphant tweet on Tuesday night – despite foreign secretary Liz Truss having warned that moves against the broadcaster could lead to repercussions against the BBC in Russia.

The Independent has approached Roskomnadzor for comment.",https://www.independent.co.uk/news/world/europe/russia-wikipedia-block-ukraine-invasion-b2026291.html
4,fee6c067-417e-4a12-bb44-8dff9658aedf,[],2022-03-04 10:31:03,"Russia’s media watchdog is threatening to block access to the online encyclopedia Wikipedia because of its entry on the Russian invasion of Ukraine. This is the latest in a series of crackdowns on free media coverage since the war broke out. EURACTIV Germany reports.

Since the start of the war in Ukraine, the Russian leadership has tried to keep the flow of information about the war in check.

Russian media, for example, have been obliged to follow the Kremlin’s official line in their reporting, as they could otherwise face heavy fines or be shut down. The authorities have already closed down the several who refused to comply with the Kremlin’s “control of the narrative”.

Wikipedia is now in the sights of Russian media authority, Roskomnadzor, because Wikipedia’s Russian-language article on the war deviates from the Kremlin’s official account.

Wikipedia’s entry meticulously traces the course of the conflict and contains over 500 sources, some of which differ from Russia’s stance. Furthermore, the Wikipedia entry speaks of an “invasion” by Russia, while the Kremlin’s official line refers to a “military operation” for “peaceful purposes”.

The number of casualties cited in the entry also deviates from Moscow’s official account of the conflict because figures from the Ukrainian defence ministry, far higher than the Kremlin’s official figures, are also listed.

Featuring at the top of the Russian Wikipedia page with around three million hits, the entry of the Ukraine war appears quite irritating for Moscow.

According to the office of the Prosecutor General, this amounts to a violation that could ultimately lead to the blocking of Wikipedia.

Wikipedia’s response

Wikipedia has already defended itself against the threat of an impending shutdown and made the letter from the supervisory authority public.

The online encyclopaedia also announced it would take legal action against the threatened shutdown, although its chances of success in Russian courts, which are close to the state, are slim.

For this reason, Wikipedia has already published tips on how to circumvent the block.

Russia, meanwhile, is increasingly tightening its grip on freedom of expression.

According to the Moscow Times, the State Duma is preparing a draft law that aims to criminalise the dissemination of “false” information about the Ukrainian war, punishable by up to 15 years in prison.

According to the draft, the “purpose, role and tasks” of the Russian army may not be falsified, nor may figures on Russian military losses be published that do not come from the Kremlin itself.

Russia wages war against independent media As the war in Ukraine continues, Russia has stepped up efforts to restrict the availability of information, targeting independent reporting on both sides of the border.

[Edited by Alice Taylor]",https://www.euractiv.com/section/digital/news/russia-threatens-to-block-access-to-wikipedia/
5,fee6c067-417e-4a12-bb44-8dff9658aedf,[],,"Press J to jump to the feed. Press question mark to learn the rest of the keyboard shortcuts

Search within r/ukraine r/ukraine r/ukraine",https://www.reddit.com/r/ukraine/comments/t51mgq/russia_demanding_wikipedia_remove_war_information/
6,fee6c067-417e-4a12-bb44-8dff9658aedf,[],2022-03-04 00:00:00,"Summary Russia to impose jail terms, fines for fake news

Those who lied will be punished - Duma chairman

Russia limits access to BBC and other news sites

BBC: access to accurate information is human right

Russia says it is fighing an information war

MOSCOW, March 4 (Reuters) - Russia's parliament on Friday passed a law imposing a jail term of up to 15 years for spreading intentionally ""fake"" news about the military, stepping up the information war over the conflict in Ukraine.

Russian officials have repeatedly said that false information has been spread by Russia's enemies such as the United States and its Western European allies in an attempt to sow discord among the Russian people.

Lawmakers passed amendments to the criminal code making the spread of ""fake"" information an offence punishable with fines or jail terms. They also imposed fines for public calls for sanctions against Russia.

Register now for FREE unlimited access to Reuters.com Register

""If the fakes lead to serious consequences then imprisonment of up to 15 years threatens,"" the lower house of parliament, known as the Duma in Russian, said in a statement.

The Duma outlined a scale of punishments for anyone deemed to have discredited the armed forces, with stiffer penalties for those who intentionally spread fake information or called for unsanctioned public action.

The amendments, which could not be viewed by Reuters on the Duma website, appear to give the Russian state much stronger powers to crack down.

""Literally by tomorrow, this law will force punishment - and very tough punishment - on those who lied and made statements which discredited our armed forces,"" Duma chairman Vyacheslav Volodin said.

President Vladimir Putin said the ""special military operation"" was essential to ensure Russian security after the United States enlarged the NATO military alliance to Russia's borders and supported pro-Western leaders in Kyiv.

Russian lawmakers attend a session of the State Duma, the lower house of parliament, in Moscow, Russia March 4, 2022. Russian State Duma/Handout via REUTERS ATTENTION EDITORS - THIS IMAGE HAS BEEN SUPPLIED BY A THIRD PARTY. NO RESALES. NO ARCHIVES. MANDATORY CREDIT.

Russian officials do not use the word ""invasion"" and say Western media have failed to report on what they cast as the ""genocide"" of Russian-speaking people in Ukraine.

The amendments have to be approved by the upper house of parliament before going to Putin to be signed into law.

'TOUGH PUNISHMENT'

Russian opposition leaders have warned that the Kremlin could crack down on dissent after Putin ordered the operation.

Russia's communications watchdog also cut access to several foreign news organisations' websites, including the BBC and Deutsche Welle, for spreading what it alleged was false information about its war in Ukraine.

""Access has been restricted to a host of information resources owned by foreigners,"" the watchdog, known as Roskomnadzor, said in a statement. read more

Russia has repeatedly complained that Western media organisations offer a partial - and often anti-Russian - view of the world while failing to hold their own leaders to account for foreign wars such as Iraq and corruption.

Britain's BBC said access to accurate information was a fundamental human right and it would continue its efforts to make its news available in Russia.

Register now for FREE unlimited access to Reuters.com Register

Reporting by Moscow bureau, Writing by Guy Faulconbridge, Editing by Simon Cameron-Moore and Angus MacSwan

Our Standards: The Thomson Reuters Trust Principles.",https://www.reuters.com/world/europe/russia-introduce-jail-terms-spreading-fake-information-about-army-2022-03-04/
