,uid,article_author,article_date,article_text,article_url
1,d1428112-37bd-4dd8-84f5-faa9728a0991,[],,"Putin spricht ja von einer ""Entnazifizierung der Ukraine"". Jetzt haben die Geheimdienste über bereits bestehende Listen mit Personen hingewiesen. Die Russen wollen angeblich diese Personen sofort festnehmen und ausschalten. Leider muss ich das im Zusammenhang mit Putins Worten sehr ernst nehmen.



Original (Englisch) übersetzt von

Russische Truppen, die aus Weißrussland in die Ukraine einmarschieren, haben einen TOS-1A Thermobaric MLRSs (Raketenflammenwerfer) dabei. Beachten Sie die kreisförmige IFF-Markierung. #Ukraine

#BREAKING

TOS-1 ... das sind diese grausamen Mistwaffen, auf welche ich schon an andere Stelle hinwies de.wikipedia.org/wiki/Aerosolbombe#Thermobare_Waffen



schnelle Übersetzung:

Die ukrainische Front in Cherson brach vollständig zusammen. Russische Truppen haben den Dnepr erreicht und stoßen auf keinen Widerstand. Ich habe sie 130 km innerhalb der Ukraine geolokalisiert. Die ukrainische Armee bezeichnet die Situation als „schwierig“. Understatement des Jahres. Das ist unglaublich.

Ich werde hier immer wieder weitere Infos hineinsetzen / Seite dann bitte neu laden / alle Zeitangaben in MEZ ...11:00 Mariupol und Schastia (direkt nördlich Luhansk) sind unter Kontrolle der ukr. Armee / bei Schastia konnte ich mir auch nicht anders denken, da muss man erst einmal über den Fluss Siwerskyj Donez / aber die Russen werden vermutlich aus Nordosten noch vorstoßen11:08 gerade auf Twitter gesehen:Petri Mäkelä @pmakela1 30 min Russian troops entering Ukraine from Belarus have a TOS-1A Thermobaric MLRSs (Rocket flamethrowers) with them.Note the circle IFF marking.#Ukraine #BREAKING11:16 RT.de verdummt die Menschen gerade mit Halbwahrheiten und Fake / das war zu erwarten11:19 es sind keine Infos aus Charkiv zu bekommen / fest steht, dass russ. Truppen in den Außenbezirken sind / Achtung: im Netz sind Bilder zu sehen: russ. Fahne wird am Rathaus angebracht / die Bilder sind aus 2014 / also Fake11:24 Charkiv: 4 russische Panzer wurden bei der Stadt Charkiv zerstört11:33 gerade auf Twitter reingekommen: Julian Röpcke@JulianRoepcke · 3 Min.#Breaking #NewsMapThe Ukrainian front in Kherson totally collapsed.Russian troops reached the Dnepr and do not face any resistance.I geolocated them 130 km inside Ukraine.The Ukrainian army says the situation is ""difficult"". Understatement of the year.This is unbelievable.",https://www.deutsch-ukrainisches-forum.de/forum/index.php/Thread/17741-die-Besetzung-der-Ukraine-durch-Russland-im-Jahr-2022/?pageNo=3
2,d1428112-37bd-4dd8-84f5-faa9728a0991,[],,"Presidentja e Kosovës, Vjosa Osmani ka reaguar sot në orët e hershme të mëngjesit pasi Kievi zyrtar ka njoftuar se Rusia ka nisur pushtimin në shkallë të plotë të Ukrainës.

Presidentja e vendit në një postim në Twitter shkruan se Kosova qëndron me Ukrainën dhe popullin e saj, ndërkohë që theksoi se do të bashkëpunojnë me aleatët për të ndaluar çdo destabilizim në rajonin tonë.

“Kosova qëndron me Ukrainën dhe popullin e saj, ndërkohë që ata po përballen me pasojat e luftës si rrjedhojë e akteve të agresionit të Rusisë.

Ne do të bashkëpunojmë me aleatët tanë për të ndaluar çdo destabilizim në rajonin tonë. Hegjemonia e Rusisë nuk do të ketë sukses. Liria dhe demokracia do të mbizotërojnë”, shkruan Osmani.

Ndryshe, ministri i Jashtëm i Ukrainës, Dmytro Kuleb, ka shkruar në Twitter se Putini ka nisur “pushtimin në shkallë të plotë të Ukrainës”.

“Qytetet paqësore të Ukrainës janë nën sulme. Kjo është një luftë agresioni. Ukraina do të mbrojë veten dhe do të fitojë. Bota mund dhe duhet ta ndalojë Putinin. Koha për të vepruar është tani”, ka shkruar ai në Twitter.

🇽🇰 stands with 🇺🇦 & its people, while they’re facing the consequences of unprovoked war as a result of Russia’s acts of aggression.

We’ll cooperate with our allies to stop any destabilization in our region. Russia’s hegemony will not succeed. Freedom and democracy will prevail.

— Vjosa Osmani (@VjosaOsmaniPRKS) February 24, 2022",https://albanianpost.com/live/57-te-vdekur-te-pakten-bilanci-tragjik-vazhdon-ne-ukraine/
