,uid,article_author,article_date,article_text,article_url
8,a3b7c1fa-e4b1-4871-8195-7caa7f2c249a,"['Brett Samuels', 'Morgan Chalfant']",2022-02-24 03:32:53+00:00,"President Biden on Wednesday expressed solidarity with Ukraine as Russia launched what Biden described as an “unprovoked and unjustified attack,” with shelling reported in multiple Ukrainian cities.

“The prayers of the entire world are with the people of Ukraine tonight as they suffer an unprovoked and unjustified attack by Russian military forces,” Biden said in a statement released by the White House.

“President Putin has chosen a premeditated war that will bring a catastrophic loss of life and human suffering. Russia alone is responsible for the death and destruction this attack will bring, and the United States and its Allies and partners will respond in a united and decisive way. The world will hold Russia accountable,” Biden added.

Russian President Vladimir Putin announced Wednesday night that he was launching a military operation in eastern Ukraine in what many interpreted as a declaration of war on Ukraine. Reporters and witnesses on the ground reported a short time later the sounds of shelling in multiple cities.

Biden said he was monitoring the developments, and he was briefed by his national security team at the White House. He is set to meet with Group of Seven allies on Thursday morning and said in the statement he will deliver remarks on additional measures targeting Russia.

“We will also coordinate with our NATO Allies to ensure a strong, united response that deters any aggression against the Alliance,” Biden said. “Tonight, Jill and I are praying for the brave and proud people of Ukraine.”

Putin delivered remarks just before 6 a.m. Moscow time Thursday while representatives of the United Nations Security Council met to condemn Russian aggression and urge the Kremlin to choose diplomacy.

In his address, Putin announced a “special military operation” in Ukraine that would aim for the “demilitarization and denazification of Ukraine,” according to multiple reports.

Reporters on the ground in Ukraine reported hearing explosions that resembled artillery fire in the capital of Kyiv and in other cities such as Kharkiv and Kramatorsk.

Biden administration officials have warned for over a week that a Russian assault on Ukraine could come at any moment, but the threat of a large-scale military operation became more imminent in recent days as Moscow moved troops into two regions in eastern Ukraine after Putin recognized them as independent territory.

“We believe that they are now at a state of readiness where they could attack at any time,” Pentagon press secretary John Kirby told reporters earlier Wednesday.

The Biden administration, in coordination with European allies, unveiled an initial tranche of sanctions on Moscow on Tuesday over its decision to send troops into the Donbas, with Biden describing the moves as the beginning of a Russian invasion of Ukraine.

The sanctions targeted Russian sovereign debt, two Russian banks and five Russian elites with links to the Kremlin. The White House has indicated that further penalties could target larger banks, including Russia’s VTB Bank, as well as other Russian oligarchs. The Biden administration has also threatened to impose export controls that would prevent Moscow from acquiring key U.S. technologies.

Some criticized the sanctions as insufficient and urged Biden to impose more stringent measures as Russia appeared intent on attacking Ukraine.

Biden has previously pledged he would not send U.S. forces to fight in Ukraine against Russia, something White House press secretary Jen Psaki firmly reiterated earlier Wednesday.

The administration has provided military aid to Ukraine, and earlier this week, the U.S. relocated troops to reinforce the Baltic States and reinforce the eastern flank of NATO in a bid to deter Russia from attacking alliance members.

Updated 10:55 p.m.",https://thehill.com/homenews/administration/595603-biden-condemns-unprovoked-and-unjustified-russian-military-operation/
9,a3b7c1fa-e4b1-4871-8195-7caa7f2c249a,[],2022-02-24 17:26:14.868000,"Help keep LAist independent, paywall-free, and ready to meet the needs of our city by making a donation today.

You have the power to make local journalism strong!

Start your day with LAist Sign up for the Morning Brief, delivered weekdays. Subscribe

President Joe Biden spoke to the nation Thursday about Russia's attack and invasion of Ukraine.

The Russian military, along with separatists supported by Russia, launched attacks on Ukraine's northern, eastern, and southern borders early Thursday morning local time.

Ukrainian President Volodymyr Zelenskyy has declared martial law and called on the public to remain calm.

In a statement released late Wednesday, Biden said Russia would be held accountable for its ""unprovoked and unjustified attack."" He added:

""President Putin has chosen a premeditated war that will bring a catastrophic loss of life and human suffering. Russia alone is responsible for the death and destruction this attack will bring, and the United States and its Allies and partners will respond in a united and decisive way.""

You can watch the president's address below:",https://laist.com/news/watch-live-president-biden-addresses-nation-on-ukraine-crisis
