,uid,article_author,article_date,article_text,article_url
0,0a35520c-2633-4b00-93e5-bf520f0e5886,"['Mihir Mishra', 'Parul Pandya Dhar', 'Nilanjan Mukhopadhyay', 'Indrajit Hazra']",,"As Russia announces military action into Ukraine , the country today shut its airspace for all civilian flights.“ …Restricted due to potential hazard for civil aviation,” read a Notice to Airmen (NOTAM) issued by Ukrainian authorities.Civilians flights are banned when a country wants to keep its airspace free from any aircraft so that it could detect any attempts of an air attack by a unfriendly country.Back in 2019, Pakistan had also shut its airspace completely for civilian flights after a surgical strike by India on terror hideouts in that country. Pakistan had responded and that led to an Indian pilot being captured in Pakistan - he was later released.Despite the NOTAM, Tata-Group owned Air India is operating a special flight to bring back Indian nationals, mainly students, from the country.“The flight is on its way,” said an executive, who did not want to be identified.This will be the second evacuation flight by Air India - the first one brought back about 254 Indians from the country.According to an earlier plan by Air India, the airline was to operate third evacuation flight on Saturday but that may not happen now.Official sources also said that other airlines too were to operate flights to bring back Indian nationals.“Other airlines were also to operate flights to evacuate Indian nationals…,” said another source.Now, any more evacuation flights will depend on the conditions in that country.","https://m.economictimes.com/industry/transportation/airlines-/-aviation/ukraine-closes-airspace-for-civilian-flights-ai-evacuation-flight-on-its-way/articleshow/89790294.cms#:~:text=%E2%80%9C%20%E2%80%A6,attack%20by%20a%20unfriendly%20country."
1,0a35520c-2633-4b00-93e5-bf520f0e5886,[],2022-03-01 00:00:00,"John Cox

Special to USA TODAY

Following the invasion of Ukraine, the European Union closed its airspace to all Russian airline, Russian-owned and Russian-operated aircraft. Soon after, Russia closed its airspace to all European aircraft. More countries like Canada have since followed the EU, consequently, the number of aircraft and flights affected increased.

So what does all of this mean to air travelers?

The most immediate effect is on travelers to and from Russia. Many flights are canceled, and some have been forced to turn around. One Aeroflot flight was nearing Canada airspace when the ban was announced and had to return to Russia.

Another Aeroflot flight en route from Miami to Moscow was mistakenly allowed to transit Canada. The controlling authority, NAV Canada, admitted the mistake and said that corrective action had been taken to prevent a reoccurrence.

As a result of losing access to Canadian airspace, Aeroflot has been canceling flights to their four destinations in the U.S. (New York, Washington, Los Angeles and Miami), as well as Cancun, Mexico, and Punta Cana in the Dominican Republic.

And last week, Delta Air Lines suspended its code-sharing agreement with Aeroflot, which is Russia's national airline.

During the State of the Union speech, President Joe Biden announced the U.S. is closing off airspace to all Russian flights, joining a growing number of countries around the world that have made similar moves in recent days.

TRY OUR TRAVEL NEWSLETTER: Get the latest headlines in your inbox daily

Longer routes, fewer diversion airports

More consequences of the closing of airspace are the necessity to reroute some flights, adding flight time and increasing fuel costs.

Flights, for example, from London to Asia now fly much further south to avoid Russian airspace. Polar flights from the U.S. to Asia can no longer use Russia as alternate airports. Should an emergency such as engine failure occur, no Russian airport can be a diversion airport.

Under Long Range Operational Performance Standards, aircraft are rated by how long it would take to reach the nearest diversion airport. For newer, more efficient long-haul aircraft like the Airbus A-350, the limit is 370 minutes. For smaller twin-engine planes, the limit is lower.

Some polar flights must have Russian airports as an available diversion airport. Losing those airports mean that the flights must go much further south and may require a technical stop for fuel, which dramatically increases flight time and cost.

'IT WILL BE A LOT HARDER ON PEOPLE': How sanctions will impact ordinary Russians

The airspace over Ukraine is, of course, closed, requiring all air traffic to route around it.

The rules for closing airspace were tightened after the Russian military shot down Malaysian Airlines Boeing 777 over eastern Ukraine in 2014. Hence, no civilian aircraft are flying over Ukraine until the conflict subsides.

In the meantime, any plans for travel that might overfly Russia or any of Eastern Europe should include regular information from your airline to see the departure time, flight time and other possible changes, such as a technical stop.

HOW TO PRESSURE PUTIN: Do Russia's yacht-owning oligarchs hold the key?

Fewer planes flying in Russia due to parts shortages, leased aircraft recall

Secondary issues include a ban on aircraft parts to Russian operators. Aircraft will be soon be grounded due to lack of needed parts. This will cause cancellations of domestic flights. Many Russian operators fly European, and U.S.-built aircraft. Once the flow of the parts stops, the reliability of the airlines will be adversely affected.

Meanwhile, a number of leased Russian planes will be recalled or seized in the next few weeks because the latest EU sanctions cut off the supply of planes, parts and technology to that country and its ability to insure planes starting March 28. This will impact Russian air travel as well.

For the aircraft that aren't recalled, it remains to be seen how airlines can make their payments after several major Russian banks were removed from SWIFT, a communications network linking financial institutions worldwide.

Already, European-based aircraft leasing companies are scrambling to recover billions from Russian airlines before the EU's embargo on planes and supplies kick in on March 28. They've also recalled some planes and could seize more.

All of us hope the conflict in Ukraine will end quickly and peacefully. Until then, travelers need to factor the fighting there into their planning. But know that the airlines are doing all they can to maintain our very high level of safety during this challenging time.

SUPPORTING UKRAINE: Strangers worldwide are opening hearts, homes to refugees from Ukraine",https://www.usatoday.com/story/travel/airline-news/2022/03/01/how-russia-ukraine-conflict-impacts-air-travel/6978208001/
2,0a35520c-2633-4b00-93e5-bf520f0e5886,"['Ian Petchenik', 'Ian Petchenik S Love Of Aviation Began At An Early Age Growing Up Next To Chicago S O Hare Airport. As S Director Of Communications', 'Co-Host Of The Avtalk Podcast Ian Now Gets To Share That Passion For Aviation With Millions Of Users', 'Listeners Around The World.']",2020-04-10 03:53:09+00:00,"With the decline in air traffic around the world, the visibility of certain flights has attracted attention and we’ve received quite a few questions. We’ve provided answers to common questions below. If you have a question we didn’t answer, please let us know in the comments or you can reach us on Twitter or Facebook.

Survey patterns

One of the most visible quirks of flying at the moment are survey-pattern flights. These flights take place all the time for a variety of reasons. Some flights are capturing imagery for mapping services—‘satellite’ maps used in commercial mapping services are often partially compiled from aerially imagery. Other flights are completing various other surveys using technology like LiDAR. Some of these are working on ecological projects, engineering works, or even checking for leaks in utility pipes.

Ground vehicles

We’re a flight tracker, but we also track airport ground vehicles that are equipped with transponders. Transponder-equipped ground vehicles enhance safety on the airfield by ensuring the vehicles can be seen by air traffic control and other vehicles and aircraft. Ground vehicles visible on Flightradar24 are generally those that are most active in the movement areas of an airport, like airport rescue and fire fighting, ‘follow me’ cars, and push back tugs. At some airports, specialized vehicles like wildlife control and lawnmowers are visible.

Incorrect or missing route display

‘Is that plane really going to…’ is a question we often receive when the route listed doesn’t match the current location or track of the aircraft. The route of the flight is not received directly from the aircraft. Through the use of various schedule databases and what some might call machine learning, but we’ll just call computer magic, we match the call sign the aircraft is broadcasting to a flight number and route for that flight. Sometimes the computer matches the flight incorrectly and sometimes it isn’t matched at all.

A route can be matched incorrectly for a few reasons, but generally it is because the flight is using the same call sign for a flight that previously flew the listed route and we have no received a schedule update for the current flight. For example, Turkish Cargo flight 6492 has flown between Istanbul and Riyadh multiple times recently and been matched correctly, but the airline also uses the flight number for other flights including Istanbul-Entebbe. Because we’re not receiving a schedule update from one of our schedule providers, the flight is incorrectly matched in this case. Schedule matching issues are more likely for cargo or special flights as they may not file a commercial schedule update or the routing is changed at the last minute after we have matched a flight to a route.

I heard a plane, but I don’t see it on Flightradar24

A flight may not be visible on Flightradar24 for different reasons, but most likely it is either outside our coverage in that area or not equipped with a compatible transponder or a combination of the two. Our service operates via line-of-sight radio signals and if receivers in the area are unable to see the aircraft, it cannot be displayed. For some aircraft operating with an older transponder, it is necessary for multiple receivers to see the aircraft in order to display it. That technology is called Multilateration (MLAT), which we’ve written about extensively before.

Restricted aircraft

Operators of private or sensitive aircraft may request their tracking details be restricted or not displayed. Generally, aircraft requesting that they not be displayed on Flightradar24 are military aircraft. Some military aircraft, such as various transport aircraft, are visible.",https://www.flightradar24.com/blog/whats-this-plane-doing-answering-recent-frequently-asked-questions/
3,0a35520c-2633-4b00-93e5-bf520f0e5886,[],2022-03-11 09:25:04+00:00,"Russia’s invasion of Ukraine has profoundly affected the air travel process.

- Advertisement -

Up to this point, all European Union Member States, as well as Albania, Switzerland, Canada, Norway, and the United Kingdom, have banned airlines of Russia from entering their airspace. Authorities in Moscow have taken similar measures, banning all flights from these countries from entering their airspace, SchengenVisaInfo.com reports.

Amid raised safety concerns, the military attack on Ukraine by Russia has raised serious questions about whether it is safe to fly to and within Europe.

Besides, the war in Ukraine has also affected many European airlines, with airBaltic, Austrian Airlines, British Airways, Jet2, KLM, Lufthansa, Ryanair, Scandinavian Airlines, Swiss International Airlines, and Wizz Air being the most affected ones, as reported by Euronews.

airBaltic

Amid raised safety concerns, the Latvian airline has suspended all flights to Russia until the end of May. Russian authorities have also taken reciprocity measures.

“Due to the airspace limitations, a small number of airBaltic routes are adjusted, without a significant increase in the flight time,” a spokesperson from the airline said.

Austrian Airlines

Following the example of other airlines, Austrian Airlines has also suspended flights to Ukraine until March 26. At the same time, flights to Kyiv and Odessa have been cancelled since February 21.

Regarding flights to neighbouring countries, the airline said that “We continue to monitor the situation closely and are in close contact with national and international authorities. The safety of our passengers and crew members is our top priority at all times.”

British Airways

British Airways has also cancelled its flights to Russia’s capital, warning that such a decision would lead to rerouting some services to Asia, causing longer journey time.

Russian authorities have also been banned from landing at Russian airports.

Jet2

The airline has suspended all flights to Poland, at the same time cancelling flights to Krakow from late March until the end of May. Such a decision was announced through a statement published by the airline on March 9.

KLM

The Dutch airline has also cancelled all flights to Russia.

In this regard, the airline said the decision was prompted by sanctions imposed by EU states.

“This means KLM can no longer guarantee that flights to Russia or passing over Russian territory can return safely,” the statement reads.

Lufthansa

The German airline Lufthansa has also suspended flights to Russia.

“Lufthansa Group continues to monitor the situation closely and is in close exchange with national and international authorities,” a spokesperson pointed out in this regard.

Ryanair

The airline has also suspended flights to Ukraine and Russia for an unlimited period due to the current situation in Ukraine.",https://www.schengenvisainfo.com/news/these-are-the-most-affected-airlines-by-russias-invasion-of-ukraine/
4,0a35520c-2633-4b00-93e5-bf520f0e5886,[],2022-02-24 11:57:48+00:00,"Authorities in Ukraine have announced that they have closed their airspace to civilian flights amid safety concerns, including fights from the European Union countries.

- Advertisement -

In addition, Europe’s aviation regulator has warned airlines not to operate flights in bordering areas of Russia and Belarus due to military activities, SchengenVisaInfo.com reports.

The President of Russia Vladimir Putin authorised a military operation in Ukraine, while the latter was attacked through multiple borders, according to the report of the Ukrainian State Border Service early Thursday.

“At about 5:00 a.m., the state border of Ukraine in the area with the Russian Federation and the Republic of Belarus was attacked by Russian troops supported by Belarus,” the service pointed out in this regard.

The same said that attacks are being carried out in Luhansk, Kharkiv, Chernihiv, Sumy, and Zhytomyr areas, targeting border patrols, units and checkpoints.

The Ukraine State Air Traffic Services Enterprise said that the airspace was closed to flights from 0045 GMT on Thursday while stressing that air traffic services have also been suspended.

According to the European Union Aviation Safety Agency (EASA), airspace in Russia and Belarus could also pose safety risks.

“In particular, there is a risk of both intentional targeting and misidentification of civil aircraft. The presence and possible use of a wide range of ground and airborne warfare systems pose a high risk for civil flights operating at all altitudes and flight levels,” the agency emphasised.

EASA stressed that Russia’s defence ministry had addressed Ukraine with an urgent message warning of high risk to flight safety as a result of the use of weapons and military equipment from 0045 GMT while calling on Ukraine’s air traffic control to stop flights.

The current situation has led Ukraine’s neighbouring countries to be prepared for an influx of migrants.

“We have to be prepared for a wave of up to a million people,” the Deputy Interior Minister, Maciej Wąsik, pointed out in this regard, as reported by the Guardian.

The Czech Republic, Slovakia, and Hungary could also receive a large number of migrants from Ukraine.

According to a recent report by Al Jazeera, about five million people could leave Ukraine in the worst-case scenario.

Authorities in Ukraine announced that ten European airlines cancelled or suspended flights to this country.

In addition, several European countries such as Ireland, Norway, Netherlands, Switzerland and France advised their citizens not to travel to Ukraine due to the current situation that the latter is facing.",https://www.schengenvisainfo.com/news/ukraine-closes-airspace-to-civilian-flights-including-those-from-eu/
5,0a35520c-2633-4b00-93e5-bf520f0e5886,[],,"JavaScript is not available.

We’ve detected that JavaScript is disabled in this browser. Please enable JavaScript or switch to a supported browser to continue using twitter.com. You can see a list of supported browsers in our Help Center.

Help Center",https://twitter.com/flightradar24/status/1496667700151599107?lang=en
6,0a35520c-2633-4b00-93e5-bf520f0e5886,[],,"Sort By: Default Report Effective Date Expiration Date Created Date Keyword Sort: Locations: UKFV Data Current as of: Sun, 17 Apr 2022 17:10:00 GMT UKFV SIMFEROPOL TMA [Back to Top]

A0595/22 (Issued for UKFV UKOV) - DUE TO MILITARY INVASION OF RUSSIAN FEDERATION AIRSPACE OVER HIGH SEAS IN FIR SIMFEROPOL AND FIR ODESA IS DANGEROUS AND NOT AVAILABLE FOR FLIGHT PLANNING OF CIVIL AVIATION. ATS IS NOT PROVIDED. 13 APR 15:17 2022 UNTIL 25 MAY 02:30 2022 ESTIMATED. CREATED: 13 APR 15:18 2022 A0594/22 (Issued for UKBV UKDV UKFV UKLV UKOV) - AIRSPACE OF UKRAINE IS CLOSED FOR CIVIL AVIATION FLIGHTS DUE TO MILITARY INVASION OF RUSSIAN FEDERATION. 13 APR 15:14 2022 UNTIL 25 MAY 02:30 2022 ESTIMATED. CREATED: 13 APR 15:14 2022 A0593/22 (Issued for UKBV UKDV UKFV UKLV UKOV) - AIRAC EFFECTIVE DATE 19 MAY 2022 - NIL. 19 MAY 00:00 2022 UNTIL 01 JUN 23:59 2022. CREATED: 07 APR 05:46 2022 A0585/22 (Issued for UKBV UKDV UKFV UKLV UKOV) - AIRAC EFFECTIVE DATE 21 APR 2022 - NIL. 21 APR 00:00 2022 UNTIL 04 MAY 23:59 2022. CREATED: 10 MAR 08:11 2022 A0451/22 - ALL RUSSIAN FEDERATION AERONAUTICAL PUBLICATIONS REGARDING SIMFEROPOL' FIR UKFV, AD UKFF, AD UKFB IS UNILATERAL DECISION AND CONTRADICTING TO THE INTERNATIONAL LAW AND ICAO STANDARDS (ANNEX 11, ANNEX 15) AS WELL AS BILATERAL AND MULTILATERAL AGREEMENTS WHICH ESTABLISHING FIR BOUNDARIES BETWEEN THE BLACK SEA STATES, APPROVED BY THE DECISION OF THE ICAO COUNCIL ON FEBRUARY 17, 1997 (EUR/NAT 96/38 - ATS). IN ACCORDANCE WITH THE ICAO EUROPEAN AIR NAVIGATION PLAN (DOC 7754) ACTUAL LOCATION INDICATORS ARE: UKFB-SEVASTOPOL'/BEL'BEK UKFF-SIMFEROPOL' UKFV-SIMFEROPOL' FIR. 17 FEB 06:10 2022 UNTIL 18 MAY 23:59 2022 ESTIMATED. CREATED: 17 FEB 06:10 2022 A0084/22 (Issued for UKBV UKDV UKFV UKLV UKOV) - UKRAINIAN AIRCRAFT OPERATORS AND CIVIL AIRCRAFT REGISTERED IN UKRAINE ARE PROHIBITED TO PERFORM FLIGHTS TO AFGHANISTAN AND TO UTILIZE THE AIRSPACE OF AFGHANISTAN DURING PERFORMING THE TRANSIT FLIGHTS BELOW FL260. UKRAINIAN AIRCRAFT OPERATORS ARE NOT ADVISED TO UTILIZE THE AIRSPACE OF AFGHANISTAN DURING PERFORMING THE TRANSIT FLIGHTS ABOVE FL260. IN CASE OF PERFORMING OF SUCH FLIGHTS, IT IS NECESSARY TO PROVIDE THE RELEVANT DOCUMENTS TO THE STATE AVIATION ADMINISTRATION OF UKRAINE. 11 JAN 15:20 2022 UNTIL 10 APR 23:59 2022 ESTIMATED. CREATED: 11 JAN 15:20 2022 A0083/22 (Issued for UKBV UKDV UKFV UKLV UKOV) - UKRAINIAN AIRCRAFT OPERATORS AND CIVIL AIRCRAFT REGISTERED IN UKRAINE ARE PROHIBITED TO UTILIZE THE AIRSPACE OF SYRIA, THE TERRITORY OF THE PALESTINIAN NATIONAL AUTHORITY, THE CITY OF SANAA AS AN ADMINISTRATIVE UNIT, AL JAWF GOVERNORATE OF YEMEN, SAADA GOVERNORATE OF YEMEN, MARIB GOVERNORATE OF YEMEN, AND LYBIA. UKRAINIAN AIRCRAFT OPERATORS AND CIVIL AIRCRAFT REGISTERED IN UKRAINE ARE PROHIBITED TO UTILIZE THE AIRSPACE BELOW FL260 OF THE NORTH AND CENTRAL PARTS OF THE TERRITORY OF THE SINAI PENINSULA OF EGYPT. UKRAINIAN AIRCRAFT OPERATORS ARE NOT ADVISED TO UTILIZE THE AIRSPACE ABOVE FL260 OF THE NORTH AND CENTRAL PARTS OF THE TERRITORY OF THE SINAI PENINSULA OF EGYPT. IN CASE OF PERFORMANING OF SUCH FLIGHTS, IT IS NECESSARY TO PROVIDE THE RELEVANT DOCUMENTS TO THE STATE AVIATION ADMINISTRATION OF UKRAINE. 11 JAN 15:15 2022 UNTIL 10 APR 23:59 2022 ESTIMATED. CREATED: 11 JAN 15:17 2022 A0082/22 (Issued for UKBV UKDV UKFV UKLV UKOV) - ACCORDING TO THE SAFETY DIRECTIVE OF THE STATE AVIATION ADMINISTRATION OF UKRAINE NUMBER 2020-02 DATED 18.03.2020 UKRAINIAN AIR OPERATORS ARE PROHIBITED TO PERFORM FLIGHTS WITHIN AIRSPACE OF ISLAMIC REPUBLIC OF IRAN. 11 JAN 15:15 2022 UNTIL 10 APR 23:59 2022 ESTIMATED. CREATED: 11 JAN 15:15 2022 A0081/22 (Issued for UKBV UKDV UKFV UKLV UKOV) - ACCORDING TO THE DECISION OF THE GOVERNMENT OF UKRAINE UKRAINIAN OPERATORS AND AIRCRAFT REGISTERED IN UKRAINE ARE PROHIBITED TO PERFORM ANY TYPES OF FLIGHTS WITHIN AIRSPACE OF THE REPUBLIC OF BELARUS. AIRCRAFT REGISTERED IN THE REPUBLIC OF BELARUS AND AIRCRAFT OPERATORS OF THE REPUBLIC OF BELARUS ARE PROHIBITED TO PERFORM ANY TYPES OF FLIGHTS WITHIN AIRSPACE OF UKRAINE. 11 JAN 15:10 2022 UNTIL 10 APR 23:59 2022 ESTIMATED. CREATED: 11 JAN 15:12 2022 A0080/22 (Issued for UKBV UKDV UKFV UKLV UKOV) - STATE AVIATION ADMINISTRATION OF UKRAINE ISSUED SAFETY DIRECTIVE SD-2021-02 ON RETURN TO SERVICE OF BOEING 737-8 AND 737-9 (MAX) AEROPLANES, WHICH COULD BE FOUND ON STATE AVIATION ADMINISTRATION OF UKRAINE WEBSITE. 11 JAN 15:10 2022 UNTIL 10 APR 23:59 2022 ESTIMATED. CREATED: 11 JAN 15:11 2022 A0079/22 (Issued for UKBV UKDV UKFV UKLV UKOV) - ACCORDING TO THE DECISION OF THE GOVERNMENT OF UKRAINE TRANSIT FLIGHTS OVER UKRAINIAN AIRSPACE OF ALL AIRCRAFT OPERATORS REGISTERED IN THE RUSSIAN FEDERATION ARE PROHIBITED. 11 JAN 15:00 2022 UNTIL 10 APR 23:59 2022 ESTIMATED. CREATED: 11 JAN 15:09 2022 A0078/22 (Issued for UKBV UKDV UKFV UKLV UKOV) - COVID-19: INFORMATION TO ENSURE SAFE AND EXPEDITIOUS DELIVERY OF COVID-19 VACCINES, AIRCRAFT OPERATORS OF FLIGHTS CARRYING SUCH VACCINES SHOULD ASK APPROVAL FROM THE STATE AVIATION ADMINISTRATION OF UKRAINE FOR EXEMPTION FROM ATFM MEASURES FOR EACH FLIGHT DEEMED CRITICAL. UPON APPROVAL, STS/ATFMX AND RMK/VACCINE SHALL BE INSERTED IN ITEM 18 OF THE FLIGHT PLAN. AIRCRAFT OPERATORS CARRYING COVID-19 VACCINES REGULARLY MAY REQUEST APPROVAL IN ADVANCE FOR ALL FLIGHTS INVOLVED. 11 JAN 15:00 2022 UNTIL 10 APR 23:59 2022 ESTIMATED. CREATED: 11 JAN 15:01 2022 Number of NOTAMs: 12 End of Report



",https://www.notams.faa.gov/dinsQueryWeb/queryRetrievalMapAction.do?retrieveLocId=Ukfv&actionType=notamRetrievalByICAOs&submit=NOTAMs&fbclid=IwAR30mSr2uldCjHPskx-uLD4gvzLxNJOVbLhfa6adzqRBLH9drhnI9VoQtPA
7,0a35520c-2633-4b00-93e5-bf520f0e5886,[],2022-02-24 00:00:00,Axie Infinity believes the ‘play-to-earn’ model is unsustainable. One horse racing blockchain game is doubling down on it.,https://fortune.com/2022/02/24/russia-ukraine-invasion-airspace-putin-planes-flights-map/
8,0a35520c-2633-4b00-93e5-bf520f0e5886,"['Mihir Mishra', 'Parul Pandya Dhar', 'Nilanjan Mukhopadhyay', 'Indrajit Hazra']",,"As Russia announces military action into Ukraine , the country today shut its airspace for all civilian flights.“ …Restricted due to potential hazard for civil aviation,” read a Notice to Airmen (NOTAM) issued by Ukrainian authorities.Civilians flights are banned when a country wants to keep its airspace free from any aircraft so that it could detect any attempts of an air attack by a unfriendly country.Back in 2019, Pakistan had also shut its airspace completely for civilian flights after a surgical strike by India on terror hideouts in that country. Pakistan had responded and that led to an Indian pilot being captured in Pakistan - he was later released.Despite the NOTAM, Tata-Group owned Air India is operating a special flight to bring back Indian nationals, mainly students, from the country.“The flight is on its way,” said an executive, who did not want to be identified.This will be the second evacuation flight by Air India - the first one brought back about 254 Indians from the country.According to an earlier plan by Air India, the airline was to operate third evacuation flight on Saturday but that may not happen now.Official sources also said that other airlines too were to operate flights to bring back Indian nationals.“Other airlines were also to operate flights to evacuate Indian nationals…,” said another source.Now, any more evacuation flights will depend on the conditions in that country.",https://economictimes.indiatimes.com/industry/transportation/airlines-/-aviation/ukraine-closes-airspace-for-civilian-flights-ai-evacuation-flight-on-its-way/articleshow/89790294.cms
