,uid,article_author,article_date,article_text,article_url
0,c583c634-d78a-4d51-bd56-a8226ea63cbe,[],2022-02-24 17:13:08+00:00,"Russia denounced Israel’s sovereignty over the Golan Heights at a meeting of the U.N. Security Council on Wednesday, hours before it launched its invasion of Ukraine.

“We are concerned over Tel Aviv’s announced plans for expanding settlement activity in the occupied Golan Heights, which directly contradicts the provisions of the 1949 Geneva Convention,” said Russia’s United Nations envoy Dmitry Polyanskiy in a statement. “Russia doesn’t recognize Israel’s sovereignty over Golan Heights that are part of Syria.”

These were Russia’s first comments about Israel in the hours since the Israeli Ministry of Foreign Affairs released a statement voicing support for Ukraine’s sovereignty and territorial integrity on Wednesday, without mentioning Russia by name, in what was seen as an effort not to anger Moscow, which has allowed Israel to operate with a large degree of freedom in its attacks on Iranian targets in Syria.

Addressing the U.N. Security Council’s monthly briefing on the Middle East on Wednesday, Polyanskiy said, “Russia’s unchanging position, according to which we do not recognize Israeli sovereignty over the Golan Heights that are an inalienable part of Syria.”

#Polyanskiy: We're concerned over Tel Aviv’s announced plans for expanding settlement activity in the occupied #GolanHeights, which contradicts the provisions of the 1949 Geneva Convention. Russia doesn't recognize Israel's sovereignty over Golan Heights that are part of #Syria. pic.twitter.com/slHQSefJp5 Subscribe to The JNS Daily Syndicate

by email and never miss

our top stories — Russian Mission UN (@RussiaUN) February 23, 2022

The Security Council meeting came despite the fact that most of the international community’s attention was focused on the opposite end of the building, as the body’s General Assembly took up the Ukraine/Russia crisis.

Meanwhile, at the Security Council meeting, the Palestinian Authority ambassador to the U.N. Riyad Mansour used the occasion to slam Israel, notably wearing a mask printed with the words “End Apartheid.”

Mansour made sure to utter “apartheid” at every opportunity, attempting to capitalize on any anti-Israel momentum generated by a recent Amnesty International report which labeled Israel’s treatment of Arabs, both within the disputed territories and Israel proper. It is a claim, as Israeli Ambassador to the U.N. Gilad Erdan noted on Wednesday, that no one has taken up outside of the P.A. and designated terrorist groups.

“You can see the campaign that started here today on the mask of my counterpart. But make no mistake, this is a joint campaign between these organizations and the Palestinians with the mission of delegitimizing Israel as a Jewish democratic state,” said Erdan, adding, “Can anyone honestly look me in the eye and tell me that Israel, a country that protects the social and political equality of all of its citizens, is guilty of systematic injustice? A country in which Arab doctors, Arab members of parliament and Arab ministers serve alongside their Jewish counterparts. “

Erdan went on the offensive against an open-ended Commission of Inquiry (COI) established by the U.N. Human Rights Council that was formed in the aftermath of last May’s Israel-Hamas conflict, in which the terror group that runs the Gaza Strip launched more than 4,000 rockets into Israel. The COI, however, will have the ability to investigate every Israeli government and military decision since the founding of the state, with a budget that is nearly double that of one-time investigations into human rights violations in Syria or Venezuela, Erdan noted. The COI is the first one ever launched by the UNHRC with no end date built into its mandate, and its appointed chair has regularly vilified Israel.

“Amnesty International, Human Rights Watch, and other so-called ‘human rights organizations’ have chosen to launch a Jihad war against the only vibrant democracy in the Middle East. Some of the very same organizations that could not find the time to write up reports on Syria, Myanmar, Iran or other horrific human-rights abusers, managed to find the time to write up hundreds of pages delegitimizing the existence of Israel. These recent reports have attempted to brand Israel with absurd claims and heinous accusations,” said Erdan.

Mansour countered, “This council might not be ready to use the word, but apartheid is and has been for a while now, our reality. … Israel may be outraged by the word apartheid. Everyone else should be outraged by the policy.”

The debate was originally scheduled to be closed. But the Palestinians requested that it be changed to an open format, and Russia, holding the presidency of the Security Council this month, acceded. Most Security Council ambassadors were at the General Assembly meeting on Ukraine and Russia, taking place at the exact same time, something not lost on Erdan.

“As we sit here debating legal disputes and false allegations, the clouds of unrest, violence, and war cast long shadows across the world. One might wonder what the urgency was to turn a closed monthly debate into an open one while such critical matters to global security are being discussed in the General Assembly as we speak. That being said, if we are here today to discuss the situation in the Middle East, then the real threat to the region must be the focus of this meeting,” said Erdan, turning the focus of the conversation to Iran’s growing nuclear program and other menacing activities by the Islamic Republic and its proxies throughout the region.

‘Good-faith engagement can build confidence and create a path to cooperation’

U.S. Deputy Ambassador to the U.N. Richard Mills was also critical of the diplomatic time and energy the monthly meetings on the Israeli-Palestinian file take up at the Security Council, saying, “The fundamental reality is that any solution must be agreed by the parties themselves. In this context, holding meetings for the sake of meetings is not going to help. But when the parties are ready to move forward, the United States will be here to support them.”

Mills began his remarks by praising the progress afforded by the Abraham Accords, noting Israeli Prime Minister Naftali Bennett’s recent visit to Bahrain and this month’s Emirati Federal National Council delegation to the Knesset.

“These visits demonstrate that good-faith engagement can build confidence and create a path to cooperation towards greater security, prosperity, and dignity. In addition to these visits, we support the efforts by the signatories of the Abraham Accords to further their relationships through working groups and other initiatives to develop trade, cultural, and people-to-people ties. These deepening relations offer new opportunities for the people of the region,” said Mills.

Ghana called on Israelis and the Palestinians to resume peace talks, saying it supports the efforts of the Munich Group (Jordan, Egypt, Germany and France) to restart negotiations. China said it’s working with Egypt to provide COVID-19 vaccines to the Palestinians.",https://www.jns.org/at-un-russia-denounces-israels-sovereignty-in-golan-heights-after-jerusalem-backs-ukraine/
1,c583c634-d78a-4d51-bd56-a8226ea63cbe,"['Arab News', 'Mohammed Abu Zaid']",2022-02-24 15:44:49+03:00,"Over 20 wounded in new Jerusalem violence

Jerusalem: More than 20 Israelis and Palestinians were wounded on Sunday in several incidents in and around Jerusalem’s flashpoint Al-Aqsa Mosque compound, two days after major violence at the site.

The latest clashes take the number of wounded since Friday to more than 170, at a tense time when the Jewish Passover festival coincides with Ramadan. They also follow deadly violence in Israel and the occupied West Bank in late March and early this month that has killed 36 people.

Early on Sunday morning, “hundreds” of Palestinian demonstrators inside the mosque compound started gathering piles of stones, shortly before the arrival of Jewish visitors, police said.

Jews are allowed to visit but not to pray at the site, also known as Temple Mount, the holiest place in Judaism and third-holiest in Islam.

The police said its forces had entered the compound in order to “remove” the demonstrators and “re-establish order.”

The Palestinian Red Crescent said 19 Palestinians were wounded, including at least five who were hospitalized. It said some had been wounded with rubber-coated steel bullets.

An AFP team near the entrance to the compound early Sunday morning saw barefoot Jewish worshippers leaving the site, protected by heavily armed police.

Outside the Old City, in Israeli-annexed East Jerusalem, Palestinian youths threw rocks at passing buses, resulting in seven people being treated for light wounds at Shaare Zedek hospital, the medical facility said.

Video released by the police showed two Israeli buses, their windscreens and side windows smashed in, driving down a road near the Old City as young men showered them with rocks. The police said they had arrested 18 Palestinians.

Senior Palestinian official Hussein Al Sheikh said Sunday that “Israel’s dangerous escalation in the Al-Aqsa compound ... is a blatant attack on our holy places,” and called on the international community to intervene.

The chief of the Hamas Islamist movement which controls the Palestinian enclave of Gaza meanwhile warned Israel that “Al-Aqsa is ours and ours alone.”

“Our people have the right to access it and pray in it, and we will not bow down to (Israeli) repression and terror,” Ismail Haniyeh said in a statement.

Later Sunday morning, mosques in Palestinian neighborhoods of annexed east Jerusalem broadcast calls for people to head toward the Al-Aqsa compound.

Weeks of mounting tensions saw two deadly attacks by Palestinians in or near the Israeli coastal city of Tel Aviv in late March and early April, alongside mass arrests by Israeli forces in the occupied West Bank.

A total of 14 people have been killed in attacks against Israel since March 22, including a shooting spree in Bnei Brak, an Orthodox Jewish city in greater Tel Aviv.

Twenty-two Palestinians have been killed over the same period, including assailants who targeted Israelis, according to an AFP tally.

On Friday morning, police clashed with Palestinians in the Al-Aqsa compound, including inside the Al-Aqsa mosque, drawing strong condemnation from Muslim countries. Those clashes wounded some 150 people.

The United Nations has called for calm, a year after clashes in and around the mosque compound escalated into an 11-day war between Israel and Palestinian militants in Gaza.

Pope Francis called Sunday for free access to the holy sites in Jerusalem and prayed for peace in the city.

“May Israelis, Palestinians and all who dwell in the Holy City, together with the pilgrims, experience the beauty of peace, dwell in fraternity and enjoy free access to the Holy Places in mutual respect for the rights of each,” he said in his Easter address.

Despite the tensions, a few streets away from the Al-Aqsa compound hundreds of Christians staged a noisy parade through the alleys of Jerusalem’s Old City to mark Easter at the Church of the Holy Sepulchre where they believe Jesus was crucified.

Marching bands led the processions with drumming and bagpipes, before worshippers gathered in the cavernous church for mass.",https://www.arabnews.com/node/2031141/middle-east
2,c583c634-d78a-4d51-bd56-a8226ea63cbe,[],,"Golan Heights , also called Golan Plateau , Arabic Al-Jawlān , Hebrew Ramat Ha-Golan or Ha-Golan , hilly area overlooking the upper Jordan River valley on the west. The area was part of extreme southwestern Syria until 1967, when it came under Israeli military occupation, and in December 1981 Israel unilaterally annexed the part of the Golan it held. The area’s name is from the biblical city of refuge Golan in Bashan (Deuteronomy 4:43; Joshua 20:8).

Geographically, the Golan is bounded by the Jordan River and the Sea of Galilee on the west, Mount Hermon (Arabic: Jabal Al-Shaykh; Hebrew: Har Ḥermon) on the north, the seasonal Wadi Al-Ruqqād (a north-south branch of the Yarmūk River) on the east, and the Yarmūk River on the south. As a political unit the boundaries differ; Israel is the suzerain of almost all of the Golan except for a narrow strip in the east that follows the Israeli-Syrian armistice line of June 10, 1967, which was later modified by the separation of forces agreement of May 31, 1974. The Golan extends about 44 miles (71 km) from north to south and about 27 miles (43 km) from east to west at its widest point. It is roughly boat-shaped and has an area of 444 square miles (1,150 square km). The better agricultural land lies in its southern portion; the stony foothills of Mount Hermon in the north, with patches of woodland and scrub, are a stock-raising area. The Israeli portion of the Golan rises to 7,297 feet (2,224 metres) at its extreme northeast point on the Mount Hermon slopes.

History

In 1894 the French-Jewish banker Baron Edmond de Rothschild bought a large tract of land for Jewish settlement in the Golan; he was followed by other groups in the United States, Canada, and Europe. Jewish colonization was attempted but was frustrated by the hostility of the Arab population and by the Ottoman land laws, which virtually forbade settlement by nonnatives. After World War I the Golan became part of the French mandate of Syria and in 1941 passed to independent Syria. After the Arab-Israeli War of 1948–49, Syria fortified the western crest of the Golan Heights, which commands the Ḥula Valley, the Sea of Galilee, and the upper Jordan River valley, all in Israel. In these sections many Israeli civilians were killed by Syrian artillery and sniper fire; agriculture and fishing were rendered difficult, and at times impossible.

On the last two days (June 9–10, 1967) of the Six-Day War, the Israeli armed forces, after defeating Egypt and Jordan, turned their attention to Syria. Under cover of the Israel Air Force, engineer troops built access roads up the steep Golan Heights, which were then frontally assaulted by armoured vehicles and infantry. The Syrian defenders and most of the Arab inhabitants fled, and Syria asked for an armistice; fighting ceased on June 10. The heights were placed under Israeli military administration, and Golan was integrated into the communications and financial framework of Israel. Five villages of mostly Druze Arabs remained and were offered Israeli citizenship, though most declined and retained Syrian citizenship. By the late 1970s nearly 30 Jewish settlements had been established on the heights, and in 1981 Israel unilaterally annexed the area.

A disengagement agreement between Israel and Syria, signed following the Yom Kippur War of October 1973, established a United Nations buffer zone in the Golan Heights, monitored by a UN Disengagement Observer Force (UNDOF). The UNDOF mandate was renewed every six months thereafter.

Negotiations between Syria and Israel, initiated during bilateral talks held in Madrid in 1991, continued intermittently until they broke down in 2000 over Syria’s insistence on Israel’s full withdrawal from the Golan Heights territory. Discussions between the two countries were renewed in 2008 through the mediation of Turkey, which was then a close ally of both countries, but those talks fell apart after the resignation of Israeli Prime Minister Ehud Olmert. Meanwhile, developments in both Israel and the region in the 2010s stirred the traditionally quietist Golan Druze to become more vocal about their status: Israel witnessed an uptick in citizenship applications from some in the community, while others began holding public rallies reaffirming loyalty to Syria. In March 2019 the United States became the only country to recognize Israel’s annexation of the region.",https://www.britannica.com/place/Golan-Heights
3,c583c634-d78a-4d51-bd56-a8226ea63cbe,[],2022-02-25 02:55:25-05:00,"JERUSALEM, Israel – Responding to Jerusalem’s support for Ukraine, Russia on Wednesday said it rejects Israel’s claim to the Golan Heights.

Russia blasted Israel at the United Nations during a Security Council debate on the Israeli-Palestinian conflict.

“We are concerned over Tel Aviv’s announced plans for expanding settlement activity in the occupied Golan Heights, which directly contradicts the provisions of the 1949 Geneva Convention. We stress Russia’s unchanging position, according to which we do not recognize Israeli sovereignty over the Golan Heights that are an inalienable part of Syria,” Russia’s deputy ambassador, Dmitry Polyanskiy, told the council.

#Polyanskiy: We're concerned over Tel Aviv’s announced plans for expanding settlement activity in the occupied #GolanHeights, which contradicts the provisions of the 1949 Geneva Convention. Russia doesn't recognize Israel's sovereignty over Golan Heights that are part of #Syria. pic.twitter.com/slHQSefJp5 — Russian Mission UN (@RussiaUN) February 23, 2022

Israel captured the Golan Heights from Syria during the Six-Day War in 1967. To date, the United States is the only other country to recognize Israel’s sovereignty over the strategic border region.

Russia is a close ally of Syrian dictator Bashar al-Assad and has gained significant power in that country. This influence has forced Israel to walk a geopolitical tightrope during the Ukraine crisis. Israel needs to maintain a good relationship with Russia, which allows it to carry out regular airstrikes on Iranian-backed militias in Syria. But Israel also has close ties to Ukraine and condemns Moscow’s invasion of its smaller neighbor.

“Israel is engaged in an ongoing air campaign to try to roll back Iranian efforts at consolidation and entrenchment in Syria, nothing can happen over the skies of Syria without tacit Russian permission, which means that the Israeli-Russian relationship is of paramount diplomatic importance to Israel right now,” Middle East expert Jonathan Spyer told CBN News.

Israel has carried out airstrikes on hundreds of targets inside government-controlled parts of Syria, but rarely acknowledges reports about such operations. Israel considers the Golan Heights to be a key territory it needs to defend against threats in Syria.

***Please sign up for CBN Newsletters and download the CBN News app to ensure you keep receiving the latest news from a distinctly Christian perspective.***",https://www1.cbn.com/cbnnews/2022/february/russia-rejects-israel-rsquo-s-claim-to-golan-heights
4,c583c634-d78a-4d51-bd56-a8226ea63cbe,[],,"In an address to the US nation, Biden assails Putin and accuses him of a “flagrant violation of international law.”

Recounting the intelligence his administration has been declassifying and sharing with US allies over the past few weeks, as Russia geared up for war, Biden says, “We’ve been transparent with the world… so that there can be no confusion or cover-up about what Putin was doing.”

He accuses the Russian leader of planning the invasion for a long time and of lying to create pretexts for his actions in Ukraine.

“Putin is the aggressor, Putin chose this war,” Biden says, predicting that the Russian leader “will be a pariah on the international stage.”

“He has much larger ambitions than Ukraine. He wants to reestablish the former Soviet Union. That’s what this is all about,” he charges.

The US president, whose address comes after a meeting earlier today with leaders of the G7 group of nations, warns that powerful sanctions will exact a “severe cost” from Russia’s economy, “both immediately and over time.”

“We’ve been building a coalition of partners representing well over half of the global economy,” he says. “We’re in full and total agreement. We will limit… Russia’s ability to participate in the global economy.”

Watch live as I deliver remarks on Russia’s unprovoked and unjustified attack on Ukraine. https://t.co/fsc84Sq6F6 — President Biden (@POTUS) February 24, 2022

He says the steps imposed in coordination with Europe will block top Russian banks from the US financial system and “cut off more than half of Russia’s high-tech imports.”

The penalties fall in line with the White House’s insistence that it will look to hit Russia’s financial system and Putin’s inner circle, while also imposing export controls that aim to starve Russia’s industries and military of US semiconductors and other high-tech products.

But Biden, for now, holds off on imposing some of the most severe sanctions, including cutting Russia out of the SWIFT payment system, which allows for the transfers of money from bank to bank around the globe, or Russia’s energy sector.

On the military front, he vows to defend “every inch” of NATO territory, but reaffirms that no American troops will be deployed to Washington’s ally.

“As I made crystal clear, the United States will defend every inch of NATO territory with a full force of American power,” Biden says.

The president adds, however: “Our forces will not be engaged in a conflict with Russia in Ukraine.”

— With Agencies.",https://www.timesofisrael.com/liveblog-february-24-2022/
5,c583c634-d78a-4d51-bd56-a8226ea63cbe,[],,"President Biden has announced new sanctions against Russia in response to its invasion of Ukraine.

Ukraine’s president says that there is heavy fighting near the nuclear power plant in Chernobyl and that Russian forces are “trying to seize” it.

A senior U.S. defense official tells NPR that the Russian assault is in the “initial phase” of a “large-scale invasion.” And that it appears Ukrainian forces are fighting back.

Follow live updates below.

",https://www.npr.org/live-updates/russia-invades-ukraine-putin
