,uid,article_author,article_date,article_text,article_url
6,c583c634-d78a-4d51-bd56-a8226ea63cbe,['Ben Samuels'],,"WASHINGTON – Israel’s first official response Wednesday to Russia’s actions in Ukraine caught the attention of many for its seemingly tepid condemnation of Russian President Vladimir Putin and failure to even mention Russia by name.

On Thursday, after Russia launched a full-scale attack on Ukraine, Israeli Foreign Minister Yair Lapid delivered a short statement denouncing the attack, mentioning Russia by name, and calling for a return to negotiations between Moscow and Kyiv. Even then, however, Lapid devoted only one sentence to the denunciation, and spent most of his statement emphasizing the fact that Israel has strong ties to both Russia and Ukraine, and is mostly concerned with protecting its own citizens and diplomats in those countries.

These statements were very different from the forceful words offered by other key U.S. allies against Russia. But experts and former senior officials who spoke with Haaretz don't expect the Biden administration to express anger or disappointment at Israel, since the country's cautious pragmatism is largely motivated by Russia’s hold over Syria, and its tacit approval of Israeli military operations against Iranian-backed activities within the country.

Officials and experts say the Biden administration understood that Israel had no choice but to traverse this tightrope, even if it would prefer a stronger reaction – something it may now look for given Russia’s military attacks across Ukraine on Thursday morning.

Not just Ukraine: 'Putin uses Iran to make America look weak.' LISTEN Subscribe 0:00 -- : -- 15 Skip 15 seconds backwards Play audio 15 Skip 15 seconds ahead 1 X Change playback rate from 1 to 1 Mute audio

They believe the fact that Israel supported the U.S. position at all, rather than staying on the sidelines, was a notable sign of Israel’s commitment to being aligned with the Biden administration.

“Israel has been doing the same dance for years in terms of sidestepping potential political landmines with how it engages with the U.S. on Russia,” says Dan Arbell, former deputy chief of mission at Israel’s embassy in Washington and scholar-in-residence at Washington’s American University.

Open gallery view Security personnel inspecting the remains of a shell in a street in Kyiv this morning. Credit: VALENTYN OGIRENKO/REUTERS

Officials highlight previous examples of Israeli passivity concerning Russia, particularly its notable abstention from a United Nations resolution condemning Russia’s annexation of Crimea in 2014.

Wednesday’s statement, according to Arbell, “brought it to a new artform. It’s just another manifestation of this policy of not upsetting Russia.”

Walking a fine line

Despite Israel’s apparent fence-sitting, experts stress the Biden administration is aware of Israel’s delicate position due to Russia’s genuine leverage in Syria. Last month, Russian and Syrian jets conducted a joint patrol over the Golan Heights, sending a strong signal to Israel that it could cease Israel’s freedom of movement within Syria’s borders if it chose to strategically align itself against Russia.

“Either Israel has the ability to operate there or it doesn’t. From an Israeli perspective, if the Russians limit their ability to operate there, Israel could face a much more profound strategic threat. So walking a fine line is required of the Israelis,” says Dennis Ross, who served as the Middle East peace envoy in the Clinton administration.

Open gallery view Black smoke rises from a military airport in Chuguyev near Kharkiv earlier today. Credit: ARIS MESSINIS - AFP

One week after the joint Russian-Syrian patrol, Biden and Bennett discussed “the potential of further Russian aggression against Ukraine,” according to a White House readout. However, it did not contain the language of a shared position akin to other U.S. statements following calls with allies.

“Would the administration like a more definitive posture? Of course. Does it understand the Israeli position? Yes, I think it does,” Ross adds.

Martin Indyk, a distinguished fellow at the Council on Foreign Relations and U.S. special Middle East envoy from July 2013 to June 2014, says the United States would like to have Israel on board precisely because it is an example of a liberal democracy threatened by living in a hostile neighborhood.

“They’d like to see Israel stand up, but they understand,” he says. “The interaction at the national security level between the United States and Israel, and between the Biden administration and the Bennett government, is very intense,” he adds, noting that there may be a sort of quid pro quo between their respective public postures.

Open gallery view A person walking past luggage carts at Kyiv Airport today after Russia launched a full-scale attack on Ukraine. Credit: UMIT BEKTAS/REUTERS

“Israel is cutting the Biden administration some slack on the Iran [nuclear] deal, even though they oppose it. There’s a feeling in the administration that given the circumstances – particularly in Syria – they should cut Israel some slack too.”

Despite Washington’s seeming acceptance, people familiar with both governments’ thinking understand the situation remains dynamic – particularly in the face of Thursday morning’s full-scale Russian attacks across Ukraine.

“Israel’s reaction to Ukraine, like the [administration’s], is a moving train,” says Carnegie Endowment for International Peace senior fellow Aaron David Miller. “They very much want to fence-sit because of maintaining their interests in Syria, so they’re slow-walking a tough response to Russia, waiting to see how far Putin goes.

“But make no mistake: If Putin moves massively into Ukraine, they won’t – nor will Biden abide without a cost – a middling or tepid response,” Miller adds, speaking before Thursday morning’s developments. “Israel is America’s closet Middle East ally. And Biden will expect Bennett to act like it.”

That warning came days after several senior Israeli officials openly indicated that Israel would be forced to side with the United States should it be forced to make a decision. However, Foreign Minister Yair Lapid attempted to qualify such inevitabilities by stating that “our border with Syria is, for all intents and purposes, a border with Russia.”

When asked about Israel’s Ukraine statement, a State Department spokesperson said that “the United States and many other nations are deeply concerned about the destabilizing role that Russia is playing, and its ongoing threat to the sovereignty and territorial integrity of Ukraine.”

The spokesperson added that the U.S. engages in “ongoing and regular dialogue with other countries at all levels of our government” concerning positions on Russia and Ukraine, and that “the vast majority of the global community is united in their view – a shared view that invading another country, attempting to take some of their land, terrorizing their people is certainly not aligned with global values.”",https://www.haaretz.com/israel-news/.premium-israel-offered-a-soft-response-to-putin-s-actions-does-biden-care-1.10631830
7,c583c634-d78a-4d51-bd56-a8226ea63cbe,[],,"News Digest — 2/25/22

Jews In Ukraine City Of Uman Aiding Ukrainian Armed Forces Against Russian Invasion

The Jewish community in the historic Ukrainian city of Uman – site of the tomb of Rabbi Nachman of Breslov, the revered founder of the Breslov Hasidim – is actively providing medical and logistical assistance to Ukraine’s armed forces in the face of the ongoing Russian military invasion.

“We love Ukraine and we will defend it,” Haim Hazin, a representative of the community, told the Ukrainian news outlet Telegraf on Wednesday (23rd), as Russian forces attacked targets around the country.

The community has already provided practical assistance to the Ukrainian armed forces. “At the beginning of hostilities, we handed over dozens of bags with Israeli first-aid kits to the army,” Hazin said while partner organizations in Israel also sent specialists who conducted tactical medical courses, and shared Israeli technologies on how to stop wounds from bleeding.”

On Wednesday (23rd), Hazin announced that the community was donating an ambulance that would be deployed with Ukrainian troops in the Donbass region. “It’s equipped with modern Israeli medical supplies and bags with Israeli medicines,” he said.

Hazin added that Jews in Uman, which is located in central Ukraine, “are determined to help in any way we can.”

He continued: “it hurts us, we fear for Ukraine. This is sacred land for us here in Uman, where Rabbi Nachman is buried.”

Uman was once home to a thriving Jewish community that was decimated during the Nazi Holocaust. Since the dissolution of the Soviet Union in 1991, several Orthodox families have moved to the city, mainly concentrated near the Rabbi’s tomb, which attracts thousands of worshipers from Israel, the US and other countries during Rosh Hashanah, the Jewish New Year.

In Israel, meanwhile, Jewish immigrants from Ukraine expressed support for the country of their birth on social media after an impassioned message from a Ukrainian citizen to the Israeli people went viral.

“Citizens of Israel! Please support us! We, unlike Russia, do not welcome Hamas delegations,” Sasha Marynich wrote in a message to readers of Vesty, a Russian-language newspaper in Israel.

A resident of the Podil neighborhood in the capital Kiev, Marynich said a section of the Jewish community lived nearby. “Never, never have we had any conflicts or misunderstandings,” he wrote. “Every morning we greet the Jewish children with a smile as they board their school buses.” Tuesday (22nd), however, “was a hard day, no one in town had a smile or a greeting.” He ended his message pledging to “defend ourselves, defend our Kiev, defend Podil, and the church, and the synagogue.”

Several Israeli readers reacted warmly to Marynich’s plea. “Israel is for an independent and free Ukraine! Israel and the entire civilized world is with you! wrote reader Alexander Linsky, while Berta Pinhasov declared, “Hold on, Israel is with you!”

Another reader, Irina Tsybulya, said she would visit the Western Wall in Jerusalem and place a note in its cracks praying for Ukraine’s welfare.

“God take care of Ukraine,” she wrote.

(thealgemeiner.com)

Nuclear Talks Put On Hold Amid Ukraine Incursion

Several days after superpowers said they were close to signing a new Iranian nuclear deal, negotiators announced Thursday (24th) the talks would be put on hold due to the Russian incursion in Ukraine.

A few hours before Russian troops invaded Ukraine early Thursday morning (24th), Iran’s top negotiator Ali Bakri Kani took off from Vienna to Tehran for consultations after various sides indicated the new deal was close although some disagreements remained.

Shortly before takeoff, Kani said, “being close to the finish is not a guarantee that it will be crossed. It requires caution, perseverance and creativity to take the last step. There are certain decisions that our Western interlocutors have to make.”

However, Russian President Vladimir Putin’s decision to invade Ukraine has pushed the nuclear negotiations off the global stage, forcing Iran to reassess the situation and perhaps even reconsider its position in the negotiations.

Iranian President Ebrahim Raisi told Putin in a telephone call on Thursday (24th) that “NATO expansion is a serious threat to the stability and security of independent countries in different regions.”

Raisi expressed hope that “what was happening” would benefit “the nations and the region,” he said according to a statement.

The Iranian Foreign Ministry said Iran was working to evacuate its citizens from Ukraine which closed its airspace early Thursday (24th).

(israelhayom.com; i24news.tv)

Russia Denounces Israel’s Sovereignty In The Golan Heights

Russia denounced Israel’s sovereignty over the Golan Heights at a meeting at the UN Security Council on Wednesday (23rd), hours before it launched its invasion of Ukraine.

“We are concerned over Tel Aviv’s announced plans for expanding settlement activity in the occupied Golan Heights, which directly contradicts the provisions of the 1949 Geneva Convention,” said Russian United Nations envoy Dmitry Polyansky in a statement.

“Russia doesn’t recognize Israel’s sovereignty over the Golan Heights that are part of Syria,” he said.

These were Russia’s first comments about Israel in the hours after the Israeli Ministry of Foreign Affairs released a statement voicing support for Ukraine’s sovereignty and territorial integrity on Wednesday (23rd). The statement did not mention Russia by name, apparently in an effort to not anger Moscow, which has allowed Israel to operate with a large degree of freedom in its attacks on Iranian targets in Syria.

Addressing the UN Security Council’s monthly briefing on the Middle East Wednesday (23rd), Polyansky said, “Russia’s unchanging position is that we do not recognize Israeli sovereignty over the Golan Heights as they are an inalienable part of Syria.”

The Security Council meeting was held despite the fact that most of the international community’s attention was focused on the opposite end of the building, as the body’s General Assembly took up the Ukraine/Russia crisis.

Meanwhile, at the Security Council meeting, the Palestinian Authority ambassador to the UN, Riyad Mansour, used the occasion to slam Israel, notably wearing a mask printed with the words “End Apartheid.”

(jns.org)

The Ukrainians Are Learning A Lesson That Israel Has Already Learned – Dr. Dan Schueftan

→ The founders of Israel made the strategic choice to build and maintain a defense force capable of dealing independently with even the most dangerous threats. The Ukrainians are learning today what the Czechs learned in 1938, and what the Jews vowed never to forget: Western democracies can not be relied upon in the face of a threat from an authoritarian regime willing to turn to military measures to enforce its will. A country that cannot defend itself will be left to its own devices at a time it needs support the most.

→ Israel’s War of Independence victory was achieved only thanks to the mobilization of full human potential and the massive arms smuggling that took place despite the US embargo. Amid the pan-Arab threat, shaped under Egyptian President Nasser’s leadership, Israel was left to its fate for almost 20 years.

→ In the 1950s, Israel faced a critical threat when the USSR supplied Egypt (and later other Arab countries) with massive quantities of frontline weapons, while Washington refused to supply Jerusalem with defensive weapons. France, which had helped Israel deal with these dangers, betrayed Jerusalem after the Six-Day War and supported its enemies.

→ When Arab countries declared war on Israel again in 1973, the rest of Europe turned its back on Jerusalem by refusing to allow American planes that carried supplies for the IDF to refuel in its territories. Europe continues to support efforts to delegitimize the Jewish state in international organizations, and generously funds groups that undermine it.

→ Israel became a success story not only because of its freedom and innovation, but also because it chose to base its national security on self-defense. Its survival, progress, and prosperity were made possible by its strong military and determination to defend itself on its own.

→ Israel receives assistance due to its determination to survive without it. It prevents war through deterrence, for it has learned that what triggers the aggression of authoritarian regimes is democracies’ hesitance to use their power even if the avenues of diplomacy and economic means have been exhausted.

The writer is head of the International Graduate Program in National Security at the University of Haifa.

(israelhayom.com)

Report: UK Poised To Outlaw BDS Movement

The British government on Tuesday (22nd) moved to ban the anti-Israel Boycott, Divestment and Sanctions movement, the Jewish Chronicle reported.

London’s Parliament passed an amendment stopping local authority pension funds from backing BDS sanctions against British companies doing business with Israel, despite protest from some Labor MPs.

Conservative MP Rob Jenrick introduced the amendment that gives the government new powers to direct local pension funds to not make decisions that conflict with London’s foreign and defense policy.

“BDS against Israel is all too often connected to anti-Semitism here in the UK and does nothing to promote peace and is increasingly out of step with the mood in the Middle East following the Abraham Accords, whereby a number of Gulf states are forging productive links with Israel,” Jenrick told the Chronicle after the vote.

Jenrick continued: “It is unacceptable for local councils to be making divisive foreign policy interventions contrary to the position of the UK government. I am delighted that my amendment has passed and will be the first step in legislation outlawing BDS in the UK. I hope it presages a wider bill in the forthcoming Queen’s Speech tackling BDS throughout the public sector.”

The amendment passed on the same day that the Hertfordshire County Council rejected a bid to divest from Israel-linked companies, saying that it was out of their purview.

The Board of Deputies of British Jews, Hertfordshire Jewish Forum and the Jewish Leadership Council issued a joint statement thanking the Hertfordshire County Council for dismissing the petition.

“We thank Hertfordshire County Council for continuing to focus on the priorities of local government and rejecting the self-indulgent grandstanding of BDS,” the statement said. “The authority has sent a clear signal that the county’s Jewish residents do not have to worry about divisive politics stirring up trouble locally.”

(israelhayom.com; thejc.com)",https://israelmyglory.org/news-digest-2-25-22/
