,uid,article_author,article_date,article_text,article_url
8,c583c634-d78a-4d51-bd56-a8226ea63cbe,"['Craig Singleton', 'Radm', 'Ret', 'Mark Montgomery', 'Trevor Logan']",,"Russia

Rockets struck Kyiv early Friday morning, according to several Ukrainian officials, as the United States warned that Russian forces were just 20 miles outside the capital and cautioned that the city could fall quickly. – Washington Post

Russian President Vladimir Putin, posing one of the biggest security threats to Europe since World War II, is staking his legacy on an irredentist invasion of Ukraine that poses significant risks to his own country and raises worrisome questions about his ambitions to bring Kyiv to heel. – Washington Post

The European Union will formally sign off on sanctions Friday that will cut 70% of Russia’s banking system off from international financial markets and place limits on the amount of money Russian elites can hold in the EU, European Commission President Ursula von der Leyen said. – Wall Street journal

Russia’s overnight assault on Ukraine triggered a surge of calls for Western allies to completely sever Russia off from the global financial system by disconnecting it from the so-called Swift global payment system. Fear of collateral damage is putting the idea on hold for now. – Wall Street Journal

Shocked Russians turned out by the thousands Thursday to decry their country’s invasion of Ukraine as emotional calls for protests grew on social media. Some 1,745 people in 54 Russian cities were detained, at least 957 of them in Moscow. – Associated Press

Russia has spent the past seven years building up formidable financial defences, yet in the long run, its economy is unlikely to withstand the onslaught of coordinated sanctions from the West. – Reuters

US President Joe Biden was meeting with G7 allies Thursday to hammer out a raft of new sanctions against Russia after it invaded Ukraine, and will later speak to the American people on a crisis that he warns will cause “catastrophic loss of life.” – Agence France-Presse

Russia intends to take the whole of Ukraine but the Russian army failed to deliver it main objectives on the first day of President Vladimir Putin’s invasion, British Defence Secretary Ben Wallace said on Friday. – Reuters

International Criminal Court (ICC) prosecutor Karim Khan on Friday expressed his concern over the Russian invasion of Ukraine and said his court may investigate possible war crimes in the country. – Reuters

Ukrainian President Volodymyr Zelenskiy said on Friday that continued Russian aggression against his country showed that sanctions imposed on Moscow by the West were not enough. – Reuters

The flurry of sanctions the U.S. announced this week against Russia are some of the hardest hitting that Moscow has ever faced, but the slow pain they inflict may not be enough to deter President Vladimir Putin from escalating his invasion of Ukraine, experts said. – NBC

Efforts by the US to inflict economic pain on Russia in retaliation for its invasion of Ukraine could be hamstrung if sanctions drive an increase in energy prices. – Financial Times

Ukraine’s president Volodymyr Zelensky has warned that “enemy saboteur groups” have entered Kyiv and Russia is planning to assassinate him as Vladimir Putin’s invading forces intensified their attack on Ukraine’s capital and other cities on Friday. – Financial Times

Russia has developed a multilayered plan to invade and seize Ukraine’s capital city of Kyiv as part of its ongoing invasion of Ukrainian territory, according to intelligence sources of the Ukrainian outlet Ukrainska Pravda and further shared by the news outlet Kyiv Independent. – Jerusalem Post

The Biden administration’s call for sanctions against Russia will jeopardize the country’s ability to buy semiconductors and other technology — and it could affect military technologies in the future. – Bloomberg

Top U.S. space officials this week said it’s likely Russia’s invasion of Ukraine will extend to space, predicting continued GPS jamming and spoofing and urging military and commercial space operators to be prepared for possible cyber attacks. – Defense News

Editorial: We can debate if Mr. Biden’s weakness on Afghanistan caused Mr. Putin to believe he could invade Ukraine, but you fight a new Cold War with the President you have. Mr. Biden now has to rally the world and the American public to understand the stakes in Ukraine and counter the rapidly increasing threats to America. – Wall Street Journal

Editorial: Mr. Biden ducked a question at his Thursday press conference about why the U.S. hasn’t sanctioned Mr. Putin personally but said it’s still possible. The press should keep asking. The only sanctions that will really get Mr. Putin’s attention are those that threaten his control of Russia and the loyalty of his cronies. – Wall Street Journal

Editorial: But Mr. Kerry’s comments aren’t a gaffe. They reveal the Biden Administration’s obsession with climate, and with punishing fossil-fuel production, which has made the U.S. and Europe vulnerable to Mr. Putin’s energy blackmail. The climate lobby has made Mr. Putin more powerful. Every time Mr. Kerry visits Moscow, the boys in the Kremlin must think it’s Christmas. – Wall Street Journal

Editorial: In his two televised addresses this week, Mr. Biden displayed the resolution and calm of a tested leader, and the Western alliance demonstrated a rare unity in the face of Russia’s attack. The West is strongest when it stands together for its shared values and against a common enemy. However difficult it may be, our pain will be nothing compared with the agonies of the Ukrainian people at the hands of an invading army. – New York Times

Editorial: As the leader of the free world, the U.S. must rally its allies in support of the noble ideals of democracy and a rules-based international order. The Ukrainian people must find in Joe Biden unflinching support, and Putin must be made to understand that he is all alone. He has made a most grievous error, and he must rescind his claims on Ukraine. – Washington Examiner

Robert C. O’Brien and Alexander B. Gray write: The U.S. remains the world’s indispensable power and retains global interests. The primacy of the China challenge and justifiable skepticism of U.S. overseas entanglements, born out of the Iraq and Afghanistan interventions, don’t mean we can ignore American interests in other areas of the world, particularly today in Ukraine. – Wall Street Journal

David Ignatius writes: The Ukraine assault, pitting a messianic Russian autocrat against the wishes of every other major nation, perhaps including China, will determine the shape of the new order to come. If Putin loses his battle to subjugate Ukraine, the new order will have a solid and promising foundation. If Putin wins, the new era will be very dangerous indeed. – Washington Post

Eugene Robinson writes: Rather than confuse and weaken NATO, Putin seems to have united its members. Rather than erase the notion of independent Ukrainian nationhood, he seems to have reinforced it. And while roughly 200,000 troops equipped with modern weaponry might be enough to defeat the Ukrainian military, they are not enough to permanently conquer a country of more than 43 million people who don’t want to be occupied. Putin hasn’t made a bold chess move; he has overturned the chessboard. He cannot be sure where the pieces will land. – Washington Post

Peggy Noonan writes: All the West is going to have to play a long, cool, careful game. Leaders and officials should do nothing to provoke. In Europe they should speak in one voice to the extent possible: define, describe, be precise, no histrionics. Don’t taunt. […]Sometimes it’s good to quiet your rousing voices and concentrate on not letting this become World War III. – Wall Street Journal

Kimberley A. Strassel writes: Mr. Biden’s first Thursday response to the Ukrainian invasion offered a mixed bag—tough talk on Russia, but also progressive talking points (such as pre-emptively demagoguing oil and gas producers for any price hikes). Yet he can’t have it both ways, and by Tuesday he’ll have had plenty of time for the choosing. Will it be an emboldened, reset Biden presidency? Or more progressive puerility, as per usual? – Wall Street Journal

Walter Russell Mead writes: Nothing less can be our goal. “My idea of American policy toward the Soviet Union is simple, and some would say simplistic,” Reagan told his foreign-policy adviser Richard Allen in 1977. “We win and they lose.” Mr. Putin has sought to return the world to an era of zero-sum international competition under the law of the jungle; he and the acolytes and imitators inspired by his example must be taught why that’s bad. – Wall Street Journal

Nika Melkozerova writes: First Mr. Putin annexed Crimea, then he fomented the war in the Donbas that has killed more than 14,000 people. Now the battle for Ukraine has come to a climax. But it’s about more than Ukraine. It’s a contest between democracy and autocracy, freedom and dictatorship, whose implications will scatter across the world. It’s not our fight alone. So please don’t leave us alone to fight it. – New York Times

Prashant Rao writes: In essence, Ukrainian insurgents would require just about all that the Iraqi and Afghan insurgents and extremists needed, except for suicide bombers, which I assume would not be employed. And the question will again be whether to provide that assistance overtly or just covertly, or at all, I suspect. – The Atlantic

Paula J. Dobriansky writes: The attack on Ukraine is a clear wake-up call to all those who have argued that America is not confronting dangerous great power competition with not only China but also Russia. Russia is destabilizing Europe, seeking to undercut U.S. power and influence globally and to fragment our close alliances and partnerships. And Moscow is threatening implicitly and explicitly to use its massive nuclear arsenal against any who resist. These events will shape the international system and American foreign and security policy for years to come. – Barrons

David Rothkopf writes: In the end, all these factors will contribute to Putin’s decline, will add to his vulnerability to domestic challenges, will isolate him, and will, in the end, destroy him. […]But if history is any guide, his over-reach and his miscalculations, his weaknesses as a strategist, and the flaws in his character will undo him. And, if there is justice in the world, if the people of the U.S. and Europe are paying attention, they will also serve to undo those Putin acolytes abroad who supported this monster and ignored the profound danger to us all that he embodies. – The Daily Beast

Paul J. Davies writes: Financial shock and awe may be the only tactic that can reverse Russia’s aggression – and it is Europe that will bear the costs. If it doesn’t, it is also Europe that will most likely bear the consequences. – Bloomberg

Tiana Lowe writes: Putin is a dictator and a murderer. He never deserved the deference and respect shown to him by the West and its leaders. But he gambled that we were pusillanimous wimps, and that bet just endlessly keeps paying off. – Washington Examiner

Stephen Blank writes: In other words, NATO should either accelerate the track membership for Ukraine or give it the membership it needs now. The argument that reforms there are incomplete is now irrelevant. NATO is first an organization for the collective, and Russia’s invasion threatens European security as a whole. […]These actions will deter Moscow, strengthen Ukraine and our allies, and invigorate international, not just European, security. If there are those who do not believe that defeating and deterring Putin is in our interest, then the burden of proof remains upon them. – Washington Examiner

Hal Brands writes: But if the Western democracies fail, then the fallout from Putin’s gambit may be a preview of greater global disruptions to come. – Bloomberg

Ben Dubow writes: Putin may be counting on a repeat of the euphoria that followed Crimea’s annexation as a further step in Russia’s spiritual rejuvenation. But he should take heed of the implications of the Russian Idea and what befell the Tsarist autocracy and Soviet Bolshevism–and the suffering inflicted on Russians in the process. – Center for European Policy Analysis

Eriks Selga and Jérémie Langlois write: Without new narratives and terminology, Putin will keep exploiting the misconception that Russia has unique claims on countries occupied by its predecessor, driving more wedges between democratic solidarity. – Center for European Policy Analysis

Daniel Hoffman writes: Putin cannot allow Ukraine to succeed as a democracy, which would serve as a beacon of hope and inspiration for his own domestic opponents who are denied basic civil liberties including freedom of expression and assembly. Putin’s long-term objective is the destruction of Ukraine as a state. – Fox News

Anna Mahjar-Barducci writes: Russian Foreign Ministry spokeswoman Maria Zakharova said that “this is not the beginning of a war,” but rather the prevention of the development of a crisis, which may lead to a global military confrontation. She also said that the recognition of the DPR and LPR help to put an end to the war in Donbass. […]He then added that Putin’s actions are not to be read in the “space of politics,” where the support of the street is needed, but rather in a history textbook. “Tangible popular support is saved for the future.” – Middle East Media Research Institute",https://www.fdd.org/overnight-brief/february-25-2022/
