,uid,article_author,article_date,article_text,article_url
0,289c3e82-53b5-49a1-812e-8efd5656d9a0,[],2022-02-23 00:00:00,"MADRID, Feb 23 (Reuters) - Spain recommended Spaniards to leave Ukraine temporarily as soon as possible given the worsening of the security situation, Foreign Minister Jose Manuel Albares said on Wednesday.

""We recommend to temporarily leave the country as soon as possible and advise against travelling to Ukraine under any circumstances,"" Albares told a parliamentary committee.

Russia's recognition of Donetsk and the neighbouring self-proclaimed Lugansk People's Republic on Monday was declared illegal by Western countries, which have imposed new sanctions against Moscow.

Albares said 334 Spaniards remain in Ukraine, down from 445 when the crisis began, a few weeks ago.

Register now for FREE unlimited access to Reuters.com Register

Reporting by Emma Pinedo, editing by Inti Landauro

Our Standards: The Thomson Reuters Trust Principles.",https://www.reuters.com/world/europe/spain-recommends-spaniards-leave-ukraine-temporarily-2022-02-23/
1,289c3e82-53b5-49a1-812e-8efd5656d9a0,[],,"I am appearing after the National Security Council presided over by the Head of State, King Felipe VI, and the first thing I would like to convey to the Spanish people is the resounding condemnation; the total and resounding condemnation by our country, Spain, of the unacceptable military actions of Putin's government in Ukraine.

The facts, as you know, are both very serious and very simple. A nuclear power has violated international law and begun an invasion of a neighbouring country, while threatening retaliation against any other nation that comes to the aid of the attacked country.

It is therefore, from every point of view, a flagrant violation of international law, national sovereignty and the territorial integrity of Ukraine. And it is something more. It is a frontal attack on the principles, on the values - above all, the value of peace - that have brought Europe years of stability and prosperity.

This is a crisis that undoubtedly causes unbalances far beyond the countries directly involved in the conflict. It is certain to have far-reaching consequences, which is why UN Secretary General Antonio Guterres' clear-cut appeal to President Putin to withdraw his troops from Ukraine and stop the conflict is understandable.

Spain shares interests with the European Union, but above all we share values. And these values are at the basis of our Constitution, of the Spanish Constitution, and are, moreover, values and principles widely shared by Spanish citizens. The values of peace, respect for international law, solidarity and humanitarian cooperation with the peoples affected.

And it is precisely these values that will inspire us in this crisis. Spain will defend international legality, Spain will strive to restore peace, Spain will show solidarity with the peoples affected by this conflict.

We are, without a doubt, committed to peace and to the way in which we must guarantee that peace, which, if we want it to be effective, we must try to stop this aggression as soon as possible.

That is why the European Union and the rest of the European Union's allies have adopted a first package of sanctions with a clear objective, which is to prevent further aggression by Putin's government, which has already, unfortunately, cost too many lives. The European Union and allies also want to demonstrate to the Putin government that violations of international law and violations of the sovereignty and territorial integrity of third countries cannot and must not go unpunished.

We are also committed to international legality, and the most effective way to work for international legality is to sanction its violation. The European Council will meet again tonight in an extraordinary session to define the European Union's response to this flagrant violation of international law. We have been in contact for many weeks with our partners, with our allies, to provide a coordinated and united European response to this crisis.

We show solidarity with the peoples affected by the aggression, and the most effective way of exercising that solidarity is to help Ukraine from the European Union: with financial aid, as we have been doing for some weeks now, to deal with the current difficulties, with economic and financial solvency, also with important investments to protect the well-being of the Ukrainian people and, of course, also with health material.

I have informed the leader of the opposition of all this and I will appear before Parliament next Wednesday to inform all the parliamentary groups of the decisions that will be taken at a European level.

I would also like to remember all the Spaniards who are currently in Ukraine. The Spanish Embassy in Kiev has been in contact with the Spanish community for some weeks now. There are 436 Spaniards registered at the Embassy, of whom a hundred have already returned to our country, leaving just over 320 compatriots. Our consular services are maintaining telephone contact with the residents of Ukraine to provide them with the information available at this difficult time about the possibilities and ways to leave Ukraine or to evacuate, as soon as the situation allows. And, likewise, the Spanish Embassy in Warsaw is on standby to provide logistical support, all the logistical support that is necessary.

What I can guarantee is that the Government of Spain, in collaboration with our European partners, will attend to and provide the necessary assistance to Spanish citizens who are still in Ukraine.

This conflict and the sanctions resulting from it will undoubtedly have an economic impact on our country and on the European Union, especially on the energy markets.

The Government of Spain, as you know, in coordination with the European Union, has been preparing for some time now to react to this risk of military aggression and crisis, which has unfortunately been confirmed.

We will therefore take whatever measures are necessary to mitigate the economic impact, including the energy impact, of this crisis on Spanish society, on its companies, on households, on industry, and undoubtedly also on the economic recovery that we are beginning to see on the verge of overcoming the pandemic.

The European Union has a new opportunity, as it did with COVID-19 and its devastating effects, to demonstrate unity, solidarity and integration by dedicating the necessary means and taking the appropriate decisions to deal with this serious crisis and its economic effects.

The position of the Government of Spain has been very clear from the outset. We have supported and pushed the diplomatic route to the extreme, the route of dialogue to reach a solution that would avoid this escalation of war. And at the same time we have done something important, which is to emphasise that together with the whole of Europe, we would never accept unjust, unjustified aggression, and that we would therefore sanction any violation of international law.

In the eyes of the Government of Spain, we need to maintain the unity of all those of us who believe in democracy, in the rule of law, in a world based on rules and therefore on certainty, in peace, in respect for borders, in national sovereignty and in the freedom of peoples, in this case Ukraine, to choose their future.

With our unity we are sending a clear, sharp, resounding message of our determination to stand up for what we believe in.

Spain wishes to maintain a relationship of friendship and respect with all the peoples of the world, and it is precisely from the friendship we profess to the Russian people, from the affection we profess to the thousands of Russian citizens who live in harmony on Spanish soil, that we send a clear message to Putin's government, and that is to demand an immediate end to the hostilities, to revoke recognition of the independence of the territories that form part of another sovereign nation, in this case Ukraine; we demand that it fulfil its commitments as signatory to the Minsk agreements.

Ultimately, we call on the Putin government to comply with international law and to return to discussions within the Normandy format and the Trilateral contact group.

Today, two paths are opening up before Spain and before the entire European Union, which is what I would also like to convey to the Spanish people to conclude this institutional declaration.

The path of peace and international legality is open, or the path of illegitimate force, which leads only to world disorder and insecurity, can also be opened. And for Spain, I am convinced that for the majority of Spaniards, as well as for the European Union as a whole, the choice is hard, but it is simple: we are a country, we are a democracy, we are a union, committed to the values of peace, international legality and solidarity.

Thank you.

---

UNOFFICIAL TRANSLATION

---",https://www.exteriores.gob.es/Embajadas/washington/en/Comunicacion/Noticias/Paginas/Articulos/20220224_NEWS01.aspx
2,289c3e82-53b5-49a1-812e-8efd5656d9a0,[],2022-02-24 00:00:00,"Russian media reported quoting President Putin had given approval to a ‘special military operation’ in the Donbas region of Ukraine.

Russian President Vladimir Putin’s “special military operation” in eastern Ukraine has been swiftly condemned by several nations.

The authorisation by Putin was made at the same time as the United Nations Security Council met late on Wednesday for its second emergency meeting this week to urge de-escalation and return to diplomatic talks.

Russian media reported quoting Putin he had given approval to the operation in the Donbas region of Ukraine, where Moscow earlier recognised rebel-held territories in Luhansk and Donetsk and said they had asked for its “help”.

Here is how the world is reacting:

Ukraine

Ukraine’s Foreign Minister Dmytro Kuleba said Putin had “launched a full-scale invasion of Ukraine” and that peaceful cities were “under strikes”.

“This is a war of aggression. Ukraine will defend itself and will win. The world can and must stop Putin. The time to act is now,” he tweeted.

Speaking at an emergency UN Security Council meeting, Ukrainian Ambassador Sergiy Kyslytsya said it was too late to talk about de-escalation. “I call on every one of you to do everything possible to stop the war,” he said.

United States

President Joe Biden has condemned Russia for an “unprovoked and unjustified attack” on Ukraine while promising that his country and its allies “will hold Russia accountable”.

“President Putin has chosen a premeditated war that will bring a catastrophic loss of life and human suffering. Russia alone is responsible for the death and destruction this attack will bring, and the United States and its allies and partners will respond in a united and decisive way. The world will hold Russia accountable,” he said.

Tomorrow, I will be meeting with the Leaders of the G7, and the United States and our Allies and partners will be imposing severe sanctions on Russia. We will continue to provide support and assistance to Ukraine and the Ukrainian people. — President Biden (@POTUS) February 24, 2022

G7

The Group of Seven industrialised nations strongly condemned Russia’s invasion of Ukraine and said they would bring forward severe and coordinated economic and financial sanctions against Moscow.

“This crisis is a serious threat to the rules-based international order, with ramifications well beyond Europe,” the G7 leaders said in a joint statement, adding Russian President Vladimir Putin had re-introduced war to the European continent.

“He has put himself on the wrong side of history,” said the leaders in the statement released by Germany.

The leaders also said they supported consistent and constructive engagement and coordination among major energy producers and consumers towards stable global energy supplies and were ready to act to address potential disruption.

United Nations

Secretary-General Antonio Guterres condemned Russia’s actions, telling Putin to “bring your troops back to Russia”.

“In the name of humanity, do not allow a war to start in Europe which could be worst war since the beginning of the century with consequences not only devastating for Ukraine, not only tragic for the Russian Federation but with an impact cannot even foresee.”

Speaking at the UN Security Council, Guterres implored Putin to “give peace a chance.”

World Health Organization

The UN health agency has voiced alarm over an expected health emergency in Ukraine.

“Amid the conflict rapidly unfolding in Ukraine, the WHO Regional Office for Europe reiterates its deepest concern for the safety, health and wellbeing of all civilians impacted by the crisis in the country and possibly beyond,” the office said in a statement.

United Kingdom

UK Prime Minister Boris Johnson said he was appalled by the horrific events in Ukraine and has spoken to Ukrainian President Volodymyr Zelenskyy to discuss the next steps.

“President Putin has chosen a path of bloodshed and destruction by launching this unprovoked attack on Ukraine,” Johnson tweeted.

In a televised address to the nation, he said Western powers would impose massive sanctions to hobble the Russian economy. “Today, in concert with our allies, we will agree a massive package of economic sanctions designed in time to hobble the Russian economy,” he said.

I am appalled by the horrific events in Ukraine and I have spoken to President Zelenskyy to discuss next steps. President Putin has chosen a path of bloodshed and destruction by launching this unprovoked attack on Ukraine. The UK and our allies will respond decisively. — Boris Johnson (@BorisJohnson) February 24, 2022

European Union

The bloc will hold Moscow accountable for the “unjustified” attack on Ukraine, the chief of the EU’s Executive Commission, Ursula von der Leyen, said.

“In these dark hours, our thoughts are with Ukraine and the innocent women, men and children as they face this unprovoked attack and fear for their lives,” she said on Twitter.

The EU is expected to discuss a further sanctions package on Russia at an emergency meeting later in the day.

Speaking at a news conference alongside the President of the European Council Charles Michel, von der Leyen said EU sanctions will “seriously degrade” Russia’s economy.

NATO

The Atlantic alliance’s secretary general said Russia had “chosen the path of aggression against a sovereign and independent country.”

The attack “puts at risk countless civilian lives,” Jens Stoltenberg said in a statement, describing it as a “grave breach of international law, and a serious threat to Euro-Atlantic security.”

After chairing an emergency meeting of NATO ambassadors, Stoltenberg said the Western military alliance will deploy capabilities and forces on its territory after Russian invaded Ukraine, saying it put over 100 warplanes on high alert.

NATO leaders will also hold a virtual summit on Friday.

International Olympic Committee

The International Olympic Committee (IOC) said Russia had breached the Olympic Truce that is currently in effect, which aims to harness the power of sport to promote peace and dialogue.

A UN resolution calling for cooperate with the IOC and the International Paralympic Committee “to use sport as a tool to promote peace, dialogue and reconciliation” was adopted on 2 December 2021 by consensus of all 193 UN Member States.

Belarus

President Alexander Lukashenko said the Belarusian armed forces were not taking part in Russia’s military operation against Ukraine, the Belta news agency reported.

“Our troops are taking no part in this operation,” Lukashenko was quoted as saying.

Turkey

Turkish President Recep Tayyip Erdogan has denounced Russia’s invasion of Ukraine as a “heavy blow” to regional peace.

“We reject Russia’s military operation,” Erdogan said in a televised speech, calling it as a “heavy blow to regional peace and stability.”

Czech Republic

Foreign Minister Jan Lipavsky said Russia’s attack on Ukraine is a “barbaric act of aggression” and that his country will respond together with its allies,

“The Kremlin’s decision to launch a completely unprovoked attack is unacceptable and in contradiction to international law,” he posted on Twitter.

I strongly condemn the Russian invasion of Ukraine. The Kremlin's decision to launch a completely unprovoked attack is unacceptable and in contradiction to international law. Together with Allies, we will respond to this barbaric act of aggression. — Jan Lipavský (@JanLipavsky) February 24, 2022

China

China rejected calling Russia’s moves on Ukraine an “invasion” and urged all sides to exercise restraint.

“You are using a typical Western media question method of using the word invasion,” Hua Chunying, spokesperson at China’s foreign ministry told reporters.

“China is closely monitoring the latest situation. We call on all sides to exercise restraint to prevent the situation from getting out of control.”

The Chinese embassy in Ukraine told its citizens in Ukraine to stay put at home as a precautionary measure, following the bombings of some Ukrainian cities.

Poland

Polish Prime Minister Mateusz Morawiecki demanded an immediate reaction to Russia’s aggression on Ukraine, seeking the “fiercest possible” sanctions.

“We must immediately respond to Russia’s criminal aggression on Ukraine,” Morawiecki tweeted.

“Europe and the free world have to stop Putin. Today’s European Council should approve fiercest possible sanctions. Our support for Ukraine must be real.”

The country’s health ministry said it is preparing a medical train to transport the wounded, adding that Polish hospitals were ready to receive thousands of patients.

We must immediately respond to Russia's criminal aggression on Ukraine.

Europe and the free world has to stop Putin. Today's European Council should approve fiercest possible sanctions.

Our support for Ukraine must be real. — Mateusz Morawiecki (@MorawieckiM) February 24, 2022

Hungary

Foreign Minister Peter Szijjarto said “war is the worst-case scenario”.

“The task now, just as always, is to guarantee the security of Hungarian people,” Sjijjarto posted on his official Facebook page.

“Our embassy in Kyiv is operating, and ready to help Hungarians who are in the Ukraine right now.”

Bulgaria

Bulgarian President Rumen Radev said his country was preparing to evacuate by land more than 4,000 ethnic Bulgarians from Ukraine and was ready to host other Ukrainian refugees.

Bulgarian Prime Minister Kiril Petkov said the Balkan country would prepare hotels and other tourism bases to host them.

Australia

Prime Minister Scott Morrison said sanctions against Russia would become law Friday but would not take effect until the end of March.

He said the time was needed to give “opportunities for businesses that have had very legitimate operations and business interests in Russia and in the affected territories of Ukraine to be able to make changes to their arrangements.”

“The reason we’re doing this is there must be a price for the unprovoked, unlawful, unwarranted, unjustified attacks and threats and intimidation that has been imposed by Russia on Ukraine. This cannot be a consequence-free action by Vladimir Putin and the Russian regime,” Morrison said.

Germany

German Chancellor Olaf Scholz condemned Russia’s attack on Ukraine as a “blatant breach of international law” that “cannot be justified by anything”.

He said western sanctions would ensure Russia paid a “bitter price” for its attack on Ukraine and that Putin had made “a serious mistake.”

France

President Emmanuel Macron has said France will stand by Ukraine’s side and warned that Russia’s invasion of its neighbour will have durable and “deep” consequences for the continent of Europe.

“We will respond without weakness to this act of war, with calm, determination and unity,” Macron said in an address to the French nation.

Spain

The Spanish Prime Minister Pedro Sanchez condemned the Russian military operation in Ukraine and said he is in contact with allies from NATO to coordinate a response.

Italy

Prime Minister Mario Draghi condemned Russia’s attack on Ukraine as “unjustified and unjustifiable.”

“Italy stands by the Ukrainian people and institutions in this dramatic moment,” he said in a statement. “We are working with our European and NATO allies to respond immediately, with unity and determination.”

Draghi has called on Russia to “withdraw unconditionally” from Ukraine and “put an immediate end to the bloodshed.”

Greece

Greece slammed Russia’s attack on Ukraine as “revisionist” as it scrambled to bolster consular support for its ethnic community of over 100,000 people in the country.

“We strongly condemn the Russian aggression against an independent country,” Greek President Katerina Sakellaropoulou said.

Deputy foreign minister Andreas Katsaniotis said that “while other countries withdrew their diplomats, we increased our personnel.”

Finland

Finland’s President Sauli Niinistö strongly condemned the Russian military measures, describing them as an assault not just on Ukraine, but “on the entire European security order.”

“We feel deep compassion towards Ukraine and are seeking ways to increase our support to Ukraine,” he said.

I strongly condemn the military measures Russia has started in Ukraine. Russia's acts target Ukraine, but at the same time they are an attack on the entire European security order. We feel deep compassion towards Ukraine and are seeking ways to increase our support to Ukraine. — Sauli Niinistö (@niinisto) February 24, 2022

Sweden

Sweden’s Prime Minister Magdalena Andersson said the defence ministry will look at ways of strengthening Ukraine’s capacity to resist Russia’s invasion.

“I have … today given the Defence Minister Peter Hultqvist the task of immediately preparing a decision so that we, from the Swedish side, can support Ukraine with further ways to… to strengthen their resilience,” Andersson told reporters during a news conference.

Canada

Prime Minister Justin Trudeau in a statement called Russia’s attacks “unprovoked” and “a clear further violation of Ukraine’s sovereignty and territorial integrity”.

Trudeau said he would meet with partners from the Group of Seven to shape a collective response, “including by imposing sanctions additional to those announced earlier this week.”

“These reckless and dangerous acts will not go unpunished.”

Iran

Iran urged its citizens residing in Ukraine to leave the country, Iran’s semi-official ISNA news agency reported.

Iran’s embassy in Ukraine is currently working on obtaining flight permits for the evacuation flights given that the Ukrainian airspace is currently closed, ISNA added.

Moldova

President Maia Sandu said Moldova would introduce a state of emergency and was ready to accept tens of thousands of people coming in from neighbouring Ukraine.

“We will help people who need our help and support,” she said.

Slovakia

Prime Minister Eduard Heger said Slovakia condemns “in strongest possible terms” Russia’s attack on neighbour Ukraine.

“Times when democratic world wants to live in peace, Russia wants war. We are ready and will act united,” he said.

Qatar

In a statement, Qatar’s Emir Sheikh Tamim bin Hamad Al Thani urged all parties to exercise restraint and to resolve all conflicts through “constructive dialogue and diplomatic means”.

“Sheikh Tamim also called the protection of civilians and the prioritisation of the humanitarian situation,” the statement said.

India

The Indian embassy in Ukraine said arrangements were being made to evacuate Indians since the Ukrainian airspace had been closed.

Lithuania

President Gitanas Nauseda said the Lithuanian parliament will decide whether to declare a state of emergency.

Japan

Prime Minister Fumio Kishida condemned Russia’s military actions and said Japan will respond in a speedy fashion together with the US and other allies.

“This Russian invasion stands to put at risk the basic principle of international order that forbids one-sided action of force in an attempt to change the status quo. We strongly condemn Russia, and we will respond speedily in cooperation with the US and other Western nations,” Kishida added.

South Korea

President Moon Jae-in said at a National Security Council meeting that Ukraine’s sovereignty, territory, and independence must be respected.

South Korea will join in unspecified multilateral economic sanctions on Russia in response to its military operations in Ukraine but is not considering adopting unilateral measures.",https://www.aljazeera.com/news/2022/2/24/world-reaction-putin-orders-military-operation-in-ukraine
