,uid,article_author,article_date,article_text,article_url
5,b6d78eef-458c-4d38-b175-9a1458a01c6a,['Simon Gardner'],,"(Adds Russia calling for UN meeting; Guterres calling for investigation; other details)

* Ukrainians accuse Russia of atrocities in Kyiv region

* Russia denies accusations, calls for UN meeting

* German minister: EU must discuss Russian gas import ban

* Ukrainian, European officials call for war crimes probe

* Fighting continues in other parts of Ukraine

By Simon Gardner

BUCHA, Ukraine, April 3 (Reuters) - Ukraine on Sunday accused Russian forces of carrying out a ""massacre"" in the town of Bucha, while Western nations reacted to images of dead bodies there with calls for new sanctions against Moscow.

Russia's defence ministry denied the Ukrainian allegations, saying footage and photographs showing bodies in Bucha were ""yet another provocation"" by the Ukrainian government.

The images from the town, 37 km (23 miles) northwest of Kyiv's city centre, emerged after Ukraine said on Saturday its forces had reclaimed control of the whole Kyiv region and liberated towns from Russian troops.

They prompted outrage in Ukraine and abroad, adding to pressure on Russian President Vladimir Putin by increasing the likelihood of further Western sanctions. Western nations have already sought to isolate Russia economically and punish it for the invasion, which began on Feb. 24.

""Bucha massacre was deliberate,"" Ukrainian Foreign Minister Dmytro Kuleba said on Twitter.

U.S. Secretary of State Antony Blinken described the images as ""a punch in the gut,"" while United Nations Secretary-General Antonio Guterres called for an independent investigation.

German Foreign Minister Annalena Baerbock said Russia must pay for ""war crimes."" British Prime Minister Boris Johnson said his government would step up sanctions, as well as military and humanitarian support for Ukraine.

""Putin and his supporters will feel the consequences,"" said German Chancellor Olaf Scholz, adding that Western allies would agree on further sanctions in the coming days.

Germany's defence minister Christine Lambrecht said the European Union must discuss banning the import of Russian gas - a departure from Berlin's prior resistance to the idea of an embargo on Russian energy imports.

Russia requested that the U.N. Security Council convene on Monday to discuss what Moscow called a ""provocation by Ukrainian radicals"" in Bucha.

The defence ministry in Moscow described photos and videos from the town as a ""staged performance.""

Russia has previously denied targeting civilians and has rejected allegations of war crimes in what it calls a ""special military operation"" aimed at demilitarising and ""denazifying"" Ukraine. Ukraine says it was invaded without provocation.

On Saturday, Reuters saw bodies in a mass grave and still lying on the streets, while on Sunday the mayor of Bucha, Anatoliy Fedoruk, showed reporters two corpses with white cloth tied around their arms, one of which appeared to have been shot in the mouth.

Oleksiy Arestovych, an aide to Ukrainian President Volodymyr Zelenskiy, said Ukrainian troops had found the bodies of women who had been raped and set alight as well as the bodies of local officials and children.

Bucha's mayor said 300 residents had been killed during a month-long occupation by the Russian army.

Reuters could not immediately verify the allegations by Arestovych and Fedoruk.

Ukraine's foreign minister called on the International Criminal Court to collect evidence of what he called Russian war crimes, while the foreign ministers of France and Britain said their countries would support any such probe.

However, legal experts say a prosecution of Putin or other Russian leaders would face high hurdles and could take years.

Human Rights Watch said it had documented ""several cases of Russian military forces committing laws-of-war violations"" in the Ukrainian regions of Chernihiv, Kharkiv and Kyiv.

Ukraine's Prosecutor General Iryna Venediktova said prosecutors investigating possible war crimes by Russia had found 410 bodies in towns near Kyiv, of which 140 had been examined.

FIGHTING IN SEVERAL AREAS

Russia has pulled back forces that had threatened Kyiv from the north, saying it intends to focus on eastern Ukraine.

Fighting was reported on Sunday in several parts of Ukraine.

The governor of the eastern Donetsk region said shelling had continued throughout the night and day. Russian shelling killed seven people in Kharkiv, Ukraine's second-largest city, according to the regional prosecutor's office.

Missiles struck near the southern port of Odesa, with Russia saying it had destroyed an oil refinery used by the Ukrainian military. The Odesa city council said ""critical infrastructure facilities"" were hit.

Dmytro Lunin, governor of the central Poltava region, said the Kremenchug oil refinery, 350 km (220 miles) northeast of Odesa, had been destroyed in a separate rocket attack on Saturday.

Two blasts were heard in the Russian city of Belgorod near the border with Ukraine on Sunday, two witnesses told Reuters, days after Russian authorities accused Ukrainian forces of striking a fuel depot there.

Ukraine evacuated 2,694 people from conflict zones in the southeastern port of Mariupol and the region of Luhansk on Sunday, Ukrainian Deputy Prime Minister Iryna Vereshchuk said. Ukrainian officials were in talks with Russia to allow several Red Cross buses to enter Mariupol, she added.

The Red Cross abandoned earlier attempts due to security concerns. Russia blamed the charity for the delays.

Mariupol is Russia's main target in Ukraine's southeastern region of Donbas, and tens of thousands of civilians there have been trapped for weeks with scant access to food and water.

There was little sign of a breakthrough in efforts to negotiate an end to the war, although Russia's chief negotiator, Vladimir Medinsky, said talks were due to resume on Monday via videoconference.

Medinsky said that while Ukraine was showing more realism by agreeing to be neutral, renouncing nuclear weapons, not joining a military bloc and refusing to host military bases, there had been no progress on other key Russia demands.

""I repeat again and again: Russia's position on Crimea and Donbas remains UNCHANGED,"" he said on Telegram.

Russia annexed Crimea from Ukraine in 2014 and has recognised declarations of independence by the self-proclaimed republics of Luhansk and Donetsk in the Donbas area of eastern Ukraine which rose up against Kyiv's rule.

(Additional reporting by Zohra Bensemra and Abdelaziz Boumzar in Bucha, Pavel Polityuk in Lviv, Issam Abdallah in Odesa, Natalia Zinets in Mukachevo and Reuters bureaus in Europe and Washington Writing by Estelle Shirbon and Andy Sullivan Editing by Frances Kerry and Paul Simao)",https://sports.yahoo.com/amphtml/top-wrap-1-ukraine-claims-043236526.html
6,b6d78eef-458c-4d38-b175-9a1458a01c6a,"['Associated Press', 'Petros Giannakouris - Staff', 'Vadim Ghirda - Staff', 'Rodrigo Abd - Staff', 'Efrem Lukatsky - Staff', 'Andreas Solaro - Pool', 'Afp Pool']",,"Some experts say it's time to think the unthinkable: How the U.S. should respond if Russia drops a nuclear bomb in Ukraine. Explore the scenarios here. Plus, view today's photos from the fighting.",https://journalnow.com/photos-scenes-this-weekend-from-the-russia-ukraine-war-includes-graphic-images/collection_981a4907-61aa-55c7-83b7-32d0d7e72501.html
7,b6d78eef-458c-4d38-b175-9a1458a01c6a,[],,"As Ukraine claimed its forces had retaken all areas around Kyiv, the mayor of a liberated town said 300 residents had been killed during a month-long occupation by the Russian army, and victims were seen in a mass grave and still lying on the streets.

Israel's 'embarrassing' Ukraine policy: LISTEN to General H.R. McMaster Subscribe 0:00 -- : -- 15 Skip 15 seconds backwards Play audio 15 Skip 15 seconds ahead 1 X Change playback rate from 1 to 1 Mute audio

Ukraine's troops have retaken more than 30 towns and villages around Kyiv, Ukrainian officials said on Saturday, claiming complete control of the capital region for the first time since Russia launched its invasion.

At Bucha, a town neighboring Irpin, just 37 km (23 miles) northwest of the capital, Reuters journalists saw bodies lying in the streets, and the hands and feet of multiple corpses poking out of a still open grave at a church ground.

Open gallery view A playground with bullet holes is seen in Bucha, northwest of Kyiv, on Saturday Credit: Ronaldo Schrmidt - AFP

Israel's ambassador to Ukraine, Michael Brodsky, said Sunday that he was ""Deeply shocked by the photos from Bucha. Killing of civilians is a war crime and cannot be justified.""

A report issued Sunday by Human Rights Watch documents several cases of summary execution by Russian forces in Bucha and other localities in the Irpin area.

On March 4 in Bucha, ""soldiers forced five men to kneel on the side of the road, pulled their T-shirts over their heads, and shot one of the men in the back of the head,"" the report states.

Hugh Williamson, Europe and Central Asia director at Human Rights Watch, said that ""the cases we documented amount to unspeakable, deliberate cruelty and violence against Ukrainian civilians. Rape, murder, and other violent acts against people in the Russian forces’ custody should be investigated as war crimes.""

'Kyiv is liberated'

After five weeks of fighting, Russia has pulled back forces that had threatened Kyiv from the north to regroup for battles in eastern Ukraine.

""The whole Kyiv region is liberated from the invader,"" Ukrainian Deputy Defense Minister Hanna Malyar wrote on Facebook. There was no Russian comment on the claim, which Reuters could not immediately verify.

President Volodymyr Zelenskyy warned in a video address: ""They are mining all this territory. Houses are mined, equipment is mined, even the bodies of dead people."" He did not cite evidence.

Locals said the dead in Bucha were civilians killed by departing Russian soldiers without provocation. President Zelenskyy warned residents that Russian forces were creating a “catastrophic” situation for civilians by leaving mines around homes, abandoned equipment and even corpses. Anti-tank mines were scattered across a bridge in Bucha.

In Irpin, crosses honoring the civilians killed during fighting mark a mass grave in the forest.

Ukraine's emergencies service said over 1,500 explosives had been found in one day during a search of the village of Dmytrivka, west of the capital. Russia's defense ministry did not reply to a request for comment on the mining allegations. Reuters could not independently verify them.

Moscow denies targeting civilians and rejects war crimes allegations. But in Bucha, Mayor Anatoliy Fedoruk said more than 300 residents had been killed. Many residents tearfully recalled brushes with death and cursed the departed Russians.

""The bastards!"" Vasily, a grizzled 66-year-old man said, weeping with rage as he looked at more than a dozen bodies lying in the road outside his house. ""I’m sorry. The tank behind me was shooting. Dogs!""

British Foreign Secretary Liz Truss said she was appalled by atrocities in Bucha and voiced support for the International Criminal Court's inquiry into potential war crimes.

Since the launch on Feb. 24 of what President Vladimir Putin called a ""special military operation"" to demilitarize Ukraine, Russia has failed to capture a single major city and has instead laid siege to urban areas, uprooting a quarter of the country's population.

Russia has depicted its drawdown of forces near Kyiv as a goodwill gesture in peace talks. Ukraine and its allies say Russia was forced to shift its focus to east Ukraine after suffering heavy losses.

A new round of talks has not yet been announced. But Ukrainian negotiator David Arakhamia said on Saturday that enough progress had been made to allow direct talks between Russian President Vladimir Putin and Zelenskyy.

""The Russian side confirmed our thesis that the draft documents have been sufficiently developed to allow direct consultations between the two countries' leaders,"" Arakhamia said. Russia has not commented on the possibility.

Among those killed near Kyiv was Maksim Levin, a Ukrainian photographer and videographer who was working for a news website and was a long-time contributor to Reuters.

His body was found in a village north of Kyiv on April 1, the news website LB.ua where he worked said on Saturday.

In the east, the Red Cross was hoping a convoy to evacuate civilians would reach the besieged port of Mariupol on Sunday, having abandoned earlier attempts due to security concerns. Russia blamed the ICRC for the delays.

Mariupol is Russia's main target in Ukraine's southeastern region of Donbas, and tens of thousands of civilians there are trapped with scant access to food and water.

Ukraine's armed forces reported diminished Russian air and missile strikes, though in the early hours of Sunday missiles struck the southern port city of Odesa, the city council said.

Russia's defense ministry said its missiles had disabled military airfields in Poltava, in central Ukraine, and Dnipro, further south. It later said its forces had hit 28 Ukrainian military facilities across the country, including two weapons depots.

The Ukrainian military also reported Russian air strikes on the cities of Severodonetsk and Rubizhne in Luhansk, one of two southeastern regions where pro-Russian separatists declared breakaway states days before the invasion. The Ukrainian military said it had repulsed six enemy attacks in Luhansk and Donetsk, the other breakaway region, on Saturday.",https://www.haaretz.com/world-news/europe/retreating-russian-forces-leave-behind-mass-graves-around-ukraine-s-capital-1.10715837
8,b6d78eef-458c-4d38-b175-9a1458a01c6a,[],,,https://www.cbc.ca/news/world/ukraine-russia-war-april2-2022-1.6406411
