,uid,article_author,article_date,article_text,article_url
0,d4574e7a-97d6-4faa-abb5-05af72b94d94,['Reuters Staff'],2022-03-03 10:28:54+00:00,"LVIV, Ukraine, March 3 (Reuters) - Ukraine’s southern port of Mariupol is surrounded by Russian troops, interior ministry adviser Anton Herashchenko said on Thursday.

“The occupiers want to turn it into besieged Leningrad,” he said, referring to Nazi Germany’s siege of the then-Soviet city where about 1.5 million people died during two years of blockade. (Reporting by Pavel Polityuk, Writing by Gabriela Baczynska Editing by Raissa Kasolowsky)",https://www.reuters.com/article/ukraine-crisis-mariupol-adviser-idAFS8N2IN03S
1,d4574e7a-97d6-4faa-abb5-05af72b94d94,['Reuters'],,"LVIV: Ukrainian interior ministry adviser Anton Herashchenko on Saturday said there would be further agreements with Russia on establishing humanitarian corridors to evacuate civilians from front-line communities.""There will definitely be more agreements like this for all other territories,"" he said, referring to an existing evacuation plan for the besieged Ukrainian port city of Mariupol",https://timesofindia.indiatimes.com/world/europe/ukraine-interior-ministry-adviser-says-there-will-be-more-civilian-evacuation-deals/articleshow/90012833.cms
2,d4574e7a-97d6-4faa-abb5-05af72b94d94,[],,"The situation in Mariupol is the most critical now and there is no results yet in talks on humanitarian corridors for the city, according to Vadym Denysenko, an adviser to the Ukrainian interior minister.

“The most critical situation now - the city of Mariupol, of course. Unfortunately, results in talks on humanitarian corridors have not been achieved yet. The situation there is quite critical. Especially considering that in recent days, the enemy is constantly shelling the city from Grad MLRS, firing upon the infrastructure. A special cynicism is that they are shelling hospitals too,” Denysenko said on Ukrainian TV channels, an Ukrinform correspond reported.

He also said that according to preliminary information, a battle has just begun in Nemishayevo, a town near Borodianka, Kyiv region. The information is being verified.

As reported, on February 24, Russian President Vladimir Putin declared war on Ukraine and launched a large-scale invasion. Russian troops have been shelling and destroying key infrastructure. Missiles hit residential buildings.

Martial law was imposed in Ukraine and general mobilization was announced.

Ukraine officially filed a lawsuit against the Russian Federation with the UN International Court of Justice in The Hague.

iy",https://www.ukrinform.net/rubric-ato/3420367-results-in-talks-on-humanitarian-corridors-for-mariupol-not-yet-achieved-adviser-to-interior-minister.html
3,d4574e7a-97d6-4faa-abb5-05af72b94d94,"['March', 'At A.M.']",2022-03-05 00:00:00,"Coronavirus Bulletin Stay informed daily on the latest news and advice on COVID-19 from the editors at U.S. News & World Report. Sign up to receive the latest updates from U.S. News & World Report and our trusted partners and sponsors. By clicking submit, you are agreeing to our Terms and Conditions & Privacy Policy.

Sign Up Sign in to manage your newsletters »

Sign up to receive the latest updates from U.S News & World Report and our trusted partners and sponsors. By clicking submit, you are agreeing to our Terms and Conditions & Privacy Policy.",https://www.usnews.com/news/world/articles/2022-03-05/ukraine-interior-ministry-adviser-says-there-will-be-more-civilian-evacuation-deals
4,d4574e7a-97d6-4faa-abb5-05af72b94d94,"['Tess Mcclure', 'Daniel Boffey', 'Peter Beaumont', 'Miranda Bryant', 'Jon Henley']",2022-03-05 00:00:00,"Authorities in the Ukrainian port city of Mariupol have said an evacuation of civilians has been postponed because Russian forces encircling the city were not respecting an agreed ceasefire.

In a statement, the city council asked residents to return to shelters in the city and await further information on evacuation.

In a televised broadcast, Ukrainian presidential adviser Oleksiy Arestovych said Russia was not observing an agreed ceasefire in some areas, preventing a joint plan to allow civilians to evacuate.

Meanwhile, Ukraine’s foreign minister, Dmytro Kuleba, accused the Nato alliance of bending to Russian pressure and said it was not the force that Ukrainians had previously imagined. Speaking on Ukrainian television, he said he was open to talks with his Russian counterpart, Sergei Lavrov, but only if they were “meaningful”.

The Russian defence ministry said its units had opened humanitarian corridors near Mariupol and Volnovakha, a smaller city 40 miles (65km) to the north, on Saturday morning. Evacuations from Mariupol had been due to begin at 11am local time (0900 GMT).

01:13 Footage shows devastated town of Volnovakha, Ukraine – video

Located on the Sea of Azov, the city of 450,000 people has become the scene of growing misery amid days of shelling that has knocked out power and most phone service and raised the prospect of food and water shortages for hundreds of thousands of people in freezing weather. The city represents a potential strategic advantage for Moscow’s invasion, connecting it to the Russian forces coming from annexed Crimea, as well as to the troops in the Donbas.

In Volnovakha, the attack is still so intense that dead bodies lie uncollected, those hiding in shelters are running out of food, and about 90% of the city has been damaged by bombing, local MP Dmytro Lubinets said.

Before the postponement, the Ukrainian government said the plan was to evacuate about 200,000 people from Mariupol and 15,000 from Volnovakha, and that the Red Cross would act as the ceasefire’s guarantor. An adviser to Ukraine’s interior ministry said there would be agreements on humanitarian corridors for other cities.

Turkey said the humanitarian ceasefires declared by Russia should be countrywide and lasting. The Turkish foreign minister, Mevlüt Çavuşoğlu, said evacuation and aid shipment corridors must be opened across the country and that it was working to evacuate its citizens in Ukraine by bus and train.

The Turkish president, Recep Tayyip Erdoğan, was due to speak to Vladimir Putin by phone on Sunday. A spokesperson said Turkey was ready to help resolve the crisis.

Putin said on Saturday that western sanctions on Russia were akin to a declaration of war and warned that any attempt to impose a no-fly zone in Ukraine would lead to catastrophic consequences for the world.

Putin reiterated that his aims were to defend Russian-speaking communities through the “demilitarisation and de-nazification” of the country so that Russia’s former Soviet neighbour becomes neutral and no longer threatens Russia.

Ukraine and western countries have dismissed this as a baseless pretext for the invasion he launched on 24 February and imposed a sweeping range of sanctions aimed at isolating Moscow.

“These sanctions that are being imposed are akin to a declaration of war, but thank God it has not come to that,” Putin said, speaking to a group of flight attendants at an Aeroflot training centre near Moscow.

Mariupol and Volnovakha are just two of many cities across Ukraine left reeling by a devastating campaign of shelling and artillery from Russian forces. The Russian defence ministry said on Saturday a broad offensive would continue elsewhere in Ukraine.

Ukraine said Russian forces were trying to encircle the capital, Kyiv, and Kharkiv, the country’s second biggest city, while attempting to set up a land bridge to Crimea.

Authorities in Sumy, about 190 miles east of Kyiv, reportedly urged residents to stay inside shelters, warning there could be fighting in the city’s streets.

Russian forces have taken control of a psychiatric hospital in the town of Borodyanka in Ukraine’s Kyiv region, with 670 people inside, the regional governor Oleksiy Kuleba told local media on Saturday.

“Today we do not understand how to evacuate these people, how to help them,” Kuleba said. “They are running out of water and medicines,” he said. “These are people with certain special needs, they need constant help … Many of them have been bedridden for years.”

The Ukrainian president, Volodymyr Zelenskiy, made a “desperate plea” for eastern Europe to provide Russian-made aircraft to Ukraine during a call with US senators on Saturday, said the chamber’s majority leader, Chuck Schumer. “These planes are very much needed. And I will do all I can to help the administration to facilitate their transfer,” Schumer said in a statement.

On Friday night Zelenskiy had lashed out at Nato for ruling out a no-fly zone, saying it gave a “green light for further bombing of Ukrainian cities and villages”.

“All the people who die from this day forward will also die because of you, because of your weakness, because of your lack of unity,” the Ukrainian president said in an emotional address, in which he praised the bravery of the Ukrainian resistance.

Nato said on Friday that a no-fly zone could provoke full-fledged war in Europe with nuclear-armed Russia, causing far greater loss of life.

As people flee the crisis, a humanitarian disaster is unfolding, with more than 1.3 million people seeking refuge in western Ukraine and neighbouring countries. The UN security council will hold an emergency meeting Monday on the humanitarian crisis triggered by the invasion, diplomats said on Friday.

In Russia, Putin’s crackdown on independent and critical voices has intensified, as the government moves to silence dissent and tighten its grip on the flow of information. The Russian president introduced new laws and regulations cracking down on the free press and social media sites, prompting an exodus of broadcasters and publishers from the country.",https://www.theguardian.com/world/2022/mar/05/zelenskiy-lashes-out-at-nato-over-no-fly-zone-as-russian-attacks-intensify
5,d4574e7a-97d6-4faa-abb5-05af72b94d94,[],2022-03-05 00:00:00,"Kyiv (AFP) – Invading Russian troops have blockaded the strategic Ukrainian port city Mariupol, its mayor announced Saturday, as Moscow and Kyiv aimed to hold new talks over the weekend.

Advertising Read more

While laying siege to Mariupol for days, Russian forces also cut its electricity, food, water, heating and transportation in the depths of winter, prompting comparisons to the Nazi blockade of Leningrad in World War II.

""For now, we are looking for solutions to humanitarian problems and all possible ways to get Mariupol out of the blockade,"" said mayor Vadim Boychenko. He called for a ceasefire and a humanitarian corridor for food and medicine.

Since President Vladimir Putin's army invaded on February 24, Russia has pummelled Ukrainian cities, killed hundreds of civilians and assaulted Europe's largest atomic power plant.

The invasion has drawn condemnation and severe sanctions from Western nations balancing punishment of the Kremlin with fears of a hazardous escalation.

Moscow has seized two key cities in its 10-day-long invasion, Berdiansk and Kherson on Ukraine's southern Black Sea coast.

But capturing Mariupol, a city of about 450,000 people on the Azov Sea, would represent a bigger prize for Russian forces as it would deal a severe blow to Ukraine's maritime access and connect troops coming from annexed Crimea and the Donbas.

Kremlin spokesperson Dmitry Peskov said late Friday that Moscow was waiting for a third round of talks with Ukraine in Belarus, and one of Kyiv's negotiators said it hoped to hold them this weekend.

Since President Vladimir Putin ordered the invasion, Russia has pummelled Ukrainian cities and killed hundreds of civilians Dimitar DILKOFF AFP

""The third leg could take place tomorrow or the day after, we are in constant contact,"" Ukrainian presidential advisor Mykhailo Podolyak said Friday.

As Russia bombed cities across the country, the Ukrainian military said on Facebook that Moscow's main focus was to encircle Kyiv.

In a hospital in the Ukrainian capital, wounded soldiers told AFP of their grim battle against the Russian advance, and vowed to return to the frontline.

""We were on reconnaissance and came across an enemy column that had made a breakthrough,"" said Motyka, 29, who was hit by shrapnel on his right side.

""We fought them and killed their soldiers on foot, but they showered us with mortar fire.""

Ukrainian President Volodymyr Zelensky was set to appeal to Washington for more assistance Saturday. He will address the US Senate as some lawmakers urged President Joe Biden to take tougher measures, including banning Russia's oil imports.

No no-fly zone

Zelensky had earlier criticised NATO for ruling out a no-fly zone, saying the Western military alliance had essentially given ""the green light for further bombing of Ukrainian cities and villages"".

In the northern city Chernihiv, 47 people died Thursday when Russian forces bombed residential areas, including schools and a high-rise apartment block, according to local officials.

In the northern city Chernihiv, 47 people died when Russian forces bombed residential areas, according to local officials Dimitar DILKOFF AFP

""We are faced together with what is President Putin's war of choice, unprovoked, unjustified, and a war that is having horrific, horrific consequences,"" US Secretary of State Antony Blinken said in Brussels.

""We're committed to doing everything we can to make it stop.""

Putin on Friday told his Belarusian counterpart Alexander Lukashenko that ""the tasks set for the (Ukraine) operations are going according to plan and will be fulfilled in their entirety"".

With fears growing of nuclear conflict, the US and Russian armed forces have set up a new direct phone line to reduce the risks of ""miscalculation,"" the Pentagon said Friday.

A fire broke out at Europe's largest nuclear plant after a Russian attack on the Ukrainian facility - ZAPORIZHZHIA NUCLEAR AUTHORITY/AFP

Russian forces attacked and seized the Zaporizhzhia nuclear plant on Friday, pushing Kyiv to accuse Moscow of ""nuclear terror"".

Ukrainian monitors say there has been no spike in radiation after a fire in a training facility.

Moscow denied it had shelled the plant.

Media exodus

Peskov called on Russians ""to unite around our president"" after thousands braved mass arrests at anti-war demonstrations this week.

In an apparent response to the unrest, Russian authorities have imposed a news blackout and several media outlets have halted operations.

Multiple media websites, including the BBC, were partially inaccessible in Russia.

Twitter was restricted and Facebook blocked.

The BBC and Bloomberg said they were suspending work in Russia after lawmakers in Moscow approved legislation to impose fines and jail terms of up to 15 years for anyone publishing ""fake news"" about the army.

Ukrainian nuclear power plant Zaporizhzhia Vincent LEFAI AFP

""This legislation appears to criminalise the process of independent journalism,"" BBC Director-General Tim Davie said in a statement.

CNN said it would halt broadcasting in Russia, while independent Russian newspaper Novaya Gazeta said it would remove Ukraine content in the wake of the new law.

'Whole world against you'

Putin has been unmoved as Russia has become an economic, sporting and cultural pariah.

But UN prosecutors at The Hague are investigating a possible war crime in the eastern city of Kharkiv, where authorities say residential areas were indiscriminately shelled.

Ukrainian Foreign Minister Dmytro Kuleba demanded a special tribunal, alleging there were ""numerous cases of, unfortunately, when Russian soldiers rape women in the Ukrainian cities"".

In Geneva, the UN Human Rights Council voted to create a top-level investigation into violations committed in the invasion.

The UN says more than 1.2 million refugees have flooded into neighbouring countries from Ukraine Daniel LEAL AFP

""The message to Putin has been clear: you're isolated on a global level and the whole world is against you,"" Ukrainian ambassador Yevheniia Filipenko said after the vote.

The UN Security Council will hold an emergency meeting Monday on the humanitarian crisis in Ukraine and discuss a possible draft resolution, diplomats told AFP Friday.

The UN says more than 1.2 million refugees have flooded into neighbouring countries.

The global body's food agency has warned the conflict will create a food crisis in Ukraine and worsen global food insecurity, with Moscow and Kyiv providing around 29 percent of the global wheat trade.

© 2022 AFP",https://www.france24.com/en/live-news/20220305-ukraine-port-city-mariupol-blockaded-by-russian-forces
6,d4574e7a-97d6-4faa-abb5-05af72b94d94,[],,"Ukrainian President Volodymyr Zelensky says he spoke by phone with his US counterpart Joe Biden to discuss financial support and sanctions against Russia as his country faces an intensifying onslaught.

“As part of the constant dialogue, I had another conversation with @POTUS,” Zelensky tweets. “The agenda included the issues of security, financial support for Ukraine and the continuation of sanctions against Russia.”

In a readout on the half-hour call, the White House says Biden emphasized steps his administration and allies have taken “to raise the costs on Russia for its aggression in Ukraine.”

As part of the constant dialogue, I had another conversation with @POTUS. The agenda included the issues of security, financial support for Ukraine and the continuation of sanctions against Russia. — Володимир Зеленський (@ZelenskyyUa) March 6, 2022

He also highlighted efforts by private companies, such as payment giants Visa and MasterCard, to freeze out Moscow by suspending operations in the wake of the February 24 invasion.

Hours earlier, the Ukrainian leader addressed US lawmakers by video call, pleading for further assistance to his besieged country and a blacklisting of Russian oil imports.",https://www.timesofisrael.com/liveblog-march-5-2022/
