,uid,article_author,article_date,article_text,article_url
0,8f188d65-51f9-485b-87b0-66cec5f56038,[],,"JavaScript is not available.

We’ve detected that JavaScript is disabled in this browser. Please enable JavaScript or switch to a supported browser to continue using twitter.com. You can see a list of supported browsers in our Help Center.

Help Center",https://twitter.com/richardengel/status/1496859233370918915
1,8f188d65-51f9-485b-87b0-66cec5f56038,[],,"Ukraine announced Thursday that Russian forces had captured the Chernobyl nuclear power plant on the first day of Moscow’s invasion of its ex-Soviet neighbor.

Mykhailo Podolyak, an adviser to President Vladimir Zelensky, said the condition of the plant’s facilities, a confinement shelter, and storage of nuclear waste was unknown.

Earlier, as fighting raged near the site of the world’s worst nuclear disaster, Zelensky wrote on Twitter, “Our soldiers are giving their lives so that the tragedy of 1986 does not happen again.”

A nuclear reactor in then-Soviet Ukraine exploded in April 1986, spewing radioactive waste across Europe in the world’s worst nuclear disaster. The exploded reactor has been covered by a protective shelter to prevent radiation leak and the entire plant has been decommissioned.

Podolyak said that after the “absolutely senseless attack of the Russians in this direction, it is impossible to say that the Chernobyl nuclear power plant is safe.”

Get The Times of Israel's Daily Edition by email and never miss our top stories Newsletter email address Get it By signing up, you agree to the terms

He charged that Russia may mount provocations there and described the situation as “one of the most serious threats to Europe today.”

Footage from the Chernobyl Nuclear Power Plant showing some of the Russian military personnel who seized control of the station moments ago. https://t.co/20fdVTnMOB pic.twitter.com/wIXX4WLIEk — Kevin Rothrock (@KevinRothrock) February 24, 2022

Advertisement

Russian and Ukrainian forces also battled for control of an airbase on the northern outskirts of Kyiv, as the capital’s mayor declared an overnight curfew.

Zelensky said Russian troops had captured the site. “Enemy paratroopers have been blocked in Gostomel — our troops have been given the order to destroy them,” he said in a video address.

The Gostomel airfield, which is alongside the Antonov airport, is immediately on the northern edge of Kyiv, and the fighting there was the closest that Russian forces had gotten to the capital on the first day of their invasion.

Meanwhile, Kyiv Mayor Vitaly Klitschko announced an overnight curfew in Ukraine’s capital as the country battled to repel the Russian invasion.

Klitschko said the curfew would last from 10:00 p.m. to 7:00 a.m. local time and that public transport would stop working during that period.

Metro stations would remain open throughout to serve as bomb shelters, he said.

Advertisement

Alexander Kovtonenko, a 30-year-old civilian living nearby, said that two fighter jets had fired missiles at Ukrainian ground units as the assault got underway at the airfield.

“Then there was shooting, it lasted three hours,” he told AFP. “Then three more jets flew in and they started shooting again.”

Smoke was rising from the scene and social media images appeared to show an assault by helicopter-borne troops. CNN showed footage of Russian troops at the airport and a reporter said he had spoken to them.

Breaking: @mchancecnn with Russian forces at the Antonov airport about 15 miles outside of Kyiv. ""These troops you can see over here, they are Russian airborne forces. They have taken this airport"" pic.twitter.com/SnvmwQ1GeA — Natasha Bertrand (@NatashaBertrand) February 24, 2022

Shortly before, low-flying helicopters were seen over the capital from the north.

Earlier, Ukrainian border guards had confirmed that Russian ground forces equipped with tanks had also crossed south over the Belarus-Ukraine border into the Kyiv administrative region, headed towards the capital.

Russian President Vladimir Putin launched a full-scale invasion of Ukraine at dawn, killing dozens and forcing hundreds to flee for their lives in the pro-Western neighbor.

Advertisement

Zelensky said Russia’s invasion had severed Moscow from the rest of the international community. “What do we hear today? It’s not just rocket explosions, combat and the roar of aircraft. This is the sound of a new iron curtain lowering and closing Russia off from the civilized world,” he said.

Russian airstrikes hit military facilities across the country and ground forces moved in from the north, south, and east, triggering condemnation from Western leaders and warnings of massive sanctions.

Weeks of intense diplomacy failed to deter Putin, who massed over 150,000 troops on Ukraine’s borders in what the West said was the biggest military build-up in Europe since the Second World War.

“I have decided to proceed with a special military operation,” Putin said in a television announcement in the early hours of Thursday.

Shortly afterward, the first bombardments were heard in Ukraine’s capital, Kyiv, and several other cities, according to AFP correspondents.

At least 68 people were killed, including both soldiers and civilians, according to an AFP tally from various Ukrainian official sources.

In the deadliest single strike reported by the authorities, 18 people were killed at a military base near Ukraine’s Black Sea port city of Odessa.

Advertisement

Ukraine’s border guards said Russian forces had reached the region around the capital, Kyiv.

Ukrainian Foreign Minister Dmytro Kuleba said a “full-scale invasion” was underway.

Zelensky declared martial law and said Russia was attacking his country’s “military infrastructure” but urged citizens not to panic and vowed victory.

He accused Russia of acting like “Nazi Germany,” saying it had attacked in a “cowardly and suicidal way.”

Ukrainian forces said they had killed “around 50 Russian occupiers” while repulsing an attack on a town on the frontline with Moscow-backed rebels, a toll that could not be immediately confirmed by AFP.

‘Sounds of bombing’

Kyiv’s main international airport was hit in the first bombing of the city since World War II and air raid sirens sounded over the capital at the break of dawn.

“I woke up because of the sounds of bombing. I packed a bag and tried to escape,” Maria Kashkoska told AFP, as she sheltered inside the Kyiv metro station.

In the eastern Ukrainian town of Chuguiv, a son wept over the body of his father among the wreckage of a missile strike in a residential district.

“I told him to leave,” the man sobbed repeatedly, next to the twisted ruins of a car.

Kuleba said the worst-case scenario was playing out.

“This is a war of aggression. Ukraine will defend itself and will win. The world can and must stop Putin. The time to act is now,” he said.

Within a few hours of Putin’s speech, Russia’s defense ministry said it had neutralized Ukrainian military airbases and its air defense systems.

Ukraine said Russian tanks and heavy equipment crossed the border in several northern regions in the east, as well as from the Kremlin-annexed peninsula of Crimea in the south.

Kremlin spokesman Dmitry Peskov said the operation would last as long as necessary, saying there were “goals that need to be achieved.”

“Ideally, Ukraine needs to be liberated and cleansed of Nazis,” he told reporters, repeating unfounded claims made by the Kremlin.

‘Unprovoked and unjustified’

The fighting roiled global financial markets, with stocks plunging and oil prices soaring past $100.

European wheat prices also hit a record high on expectations of lower supplies as Ukraine and Russia are two of the world’s biggest producers.

In his televised address, Putin justified the assault by claiming the government was overseeing a “genocide” in the east of the country.

The Kremlin earlier said the leaders of two separatist territories in eastern Ukraine had asked Moscow for military help against Kyiv after Putin recognized their independence on Monday.

A conflict between the self-proclaimed Donetsk and Lugansk republics and government forces has dragged on since 2014, killing more than 14,000 people.

US President Joe Biden spoke with Zelensky after the Russian assault began to vow US “support” and “assistance.”

He condemned the “unprovoked and unjustified attack by Russian military forces,” and vowed Russia would be held accountable.

Biden was due to join a virtual meeting of G7 leaders — Britain, Canada, France, Germany, Italy, Japan, and the US — on Thursday, likely to result in more sanctions against Russia.

In Brussels, EU foreign policy chief Josep Borrell said Russia faced “unprecedented isolation” and would be hit with the “harshest sanctions” the European Union has ever imposed.

NATO said it would also hold a virtual summit and activate “defense plans” for allied countries.

But NATO chief Jens Stoltenberg said: “We don’t have any plans to send NATO troops into Ukraine.”

The Russian invasion also rattled eastern NATO members once dominated by Moscow during the Cold War.

Poland called for urgent NATO consultations and said it was preparing for a large influx of refugees, while Lithuania imposed a national state of emergency.

Drop NATO ambitions

Ukraine has around 200,000 military personnel, and could boost that with up to 250,000 reservists.

Moscow’s total forces are much larger — around a million active-duty personnel — and have been modernized and re-armed in recent years.

But Ukraine has received advanced anti-tank weapons and some drones from NATO members. More have been promised as the allies try to deter a Russian attack or at least make it costly.

Russia has long demanded that Ukraine be forbidden from ever joining the NATO alliance and that US troops pull out from Eastern Europe.

Putin this week set out a number of stringent conditions if the West wanted to de-escalate the crisis, saying Ukraine should drop its NATO ambition and become neutral.

“Putin’s aim is to end the existence of Ukraine as it was yesterday,” said Tatyana Stanovaya, founder of the political consultancy R.Politik Center and a non-resident scholar at the Carnegie Moscow Center.

“It is possible that the east of Ukraine will come under Russian control,” she said, adding: “I cannot see anything that would stop Russia now.”

Times of Israel staff contributed to this report.",https://www.timesofisrael.com/ukraine-troops-battle-invading-russian-army-in-kyiv-outskirts/
2,8f188d65-51f9-485b-87b0-66cec5f56038,[],2022-02-16 00:00:00,"The High Court says it will hear a petition against Israel’s policy regarding Ukrainian refugees in a week, rejecting the state’s request to throw the case out.

On Sunday night, Interior Minister Ayelet Shaked announced that people who are fleeing Ukraine who have relatives in Israel will be exempt from a 25,000-person entry cap placed on those refugees who are not eligible for Israeli citizenship.

Shaked’s announcement came after news that attorney Tomer Warsha had filed — on behalf of Ukrainian Ambassador to Israel Yevgen Korniychuk — a petition to the High Court against the interior minister’s earlier policy, which counted those ineligible for citizenship against the cap, which also includes 20,000 Ukrainians already in Israel.

Warsha, an attorney specializing in immigration, said Sunday evening that Shaked’s new policy was a positive change, but not enough.

According to reports, the state told the court that the cap would not be met for a week, meaning the issue won’t become relevant until then.

Speaking to Kan, Justice Minister Gideon Sa’ar backs Shaked’s decision to allow in more Ukrainians. But he appears to chafe at the description of those fleeing to Israel’s borders as “refugees,” which he says carries “certain legal ramifications.”

“Israel is sheltering those who need it, it’s the humane, correct thing to do,” he says, “and that’s what Israel has done the last two weeks.”

According to statistics published by the Population and Border Authority on Sunday morning, 7,179 Ukrainian nationals have arrived in Israel since Russia invaded Ukraine on February 24, and 221 were refused entry. The statistics included those who are immigrating and who are eligible to do so under the Law of Return, which grants citizenship to anyone with one Jewish grandparent.",https://www.timesofisrael.com/liveblog-march-13-2022-2/
3,8f188d65-51f9-485b-87b0-66cec5f56038,[],,"Reuters

Kyiv, February 25

Russian missiles pounded Kyiv on Friday, families cowered in shelters and authorities told residents to prepare Molotov cocktails to defend Ukraine’s capital as fighting was reported in the outskirts of the city.

Moscow said it had captured the Hostomel airfield northwest of the capital - a vital staging post for an assault on Kyiv that has been fought over since Russian paratroopers landed there in the first hours of the war. This could not be confirmed and the Ukrainian authorities reported heavy fighting there.

“Shots and explosions are ringing out in some neighbourhoods. Saboteurs have already entered Kyiv,” said the city’s mayor, former world heavyweight boxing champion Vitali Klitchko. “The enemy wants to put the capital on its knees and destroy us.”

A day after Russian President Vladimir Putin launched a three-pronged invasion of Ukraine from the north, east and south, air raid sirens again wailed over the city of 3 million people. Some residents sheltered in underground metro stations.

People take shelter at a building basement while the sirens sound announcing new attacks in the city of Kyiv, Ukraine on Friday. AP/PTI photo

President Volodymyr Zelenskiy tweeted that there had been heavy fighting with people killed at the entrance to the eastern cities of Chernihiv and Melitopol, as well as at Hostomel.

Windows were blasted out of a 10-storey apartment block near Kyiv’s main airport. A two-metre crater showed where a shell had struck before dawn.

“How can we be living through this in our time? Putin should burn in hell along with his whole family,” said Oxana Gulenko, sweeping broken glass from her room.

Hundreds of people were crowded into a cramped bomb shelter beneath a building after a televised warning of air strikes.

“How can you wage a war against peaceful people?” said Viktoria, 35, as her children aged 5 and 7 slept in their winter coats.

Alla, 40 said: “The kids were scared, they were crying and asking ‘Mom, will we all die?’”

Witnesses said loud explosions could also be heard in Kharkiv, Ukraine’s second-biggest city, close to Russia’s border, and air raid sirens sounded over Lviv in the west.

Authorities reported heavy fighting in the eastern city of Sumy.

Natali Sevriukova reacts next to her house following a rocket attack on the city of Kyiv, Ukraine, on Friday. AP/PTI photo

Britain’s defence ministry said in an intelligence update that Russian armoured forces had opened up a new route of advance towards the capital after failing to capture Chernihiv, and most troops remained more than 50km (31 miles) from Kyiv city centre.

'Number one target'

European Union finance ministers were meeting to agree new sanctions, expected to include asset freezes directly targeting Putin and Foreign Minister Sergei Lavrov for the first time.

U.S. officials believe Russia’s initial aim is to “decapitate” Zelenskiy’s government. Zelenskiy said he knew he was “the number one target” but would stay in Kyiv.

An adviser to Zelenskiy said Ukraine was prepared for talks with Russia, including on staying neutral, one of Moscow’s pre-war demands. The Kremlin said it had offered talks in the Belarusian capital Minsk, but that Ukraine had proposed Warsaw instead and there was now a “pause” in contacts.

Putin says Ukraine is an illegitimate state carved out of Russia, a view Ukrainians see as aimed at erasing their more than thousand-year history.

Putin says he does not plan a military occupation, only to disarm Ukraine and remove its leaders. But it is not clear how a pro-Russian leader could be installed unless troops control much of the country.

After Moscow denied for months it was planning an invasion, news that Putin had ordered one shocked Russians accustomed to viewing their ruler of 22 years as a cautious strategist. Many Russians have friends and family in Ukraine.

Russian state media have relentlessly characterised Ukraine as a threat, but dozens of anti-war protests were held in Russian cities on Thursday and more than 1,600 people were arrested.

One pop star posted a video on Instagram opposing the war, and the head of a Moscow state-run theatre quit, saying she would not take her salary from a murderer.

'Russian warship, go ***k yourself'

Ukrainians were circulating an unverified recording on Friday of a Russian warship ordering a Ukrainian Black Sea outpost to surrender. The Ukrainians reply: “Russian warship, go fuck yourself.” Zelenskiy said the 13 guards were killed by a Russian strike and would receive posthumous honours.

Thousands of people crowded Kyiv’s railway station trying to force their way onto packed evacuation trains to Lviv. When a train arrived people rushed the doors, some screamed and guards fired blank shots to scare the crowd away.

Maria, 30, had been there since the morning with her child, husband and dog, trying and failing to board the trains.

“It’s dangerous to break through the crowd with a kid. The dog is scared. Honestly, we’re exhausted,” she said.

When a squad of soldiers marched through the station, people clapped hands and shouted the national military cry of “Glory to Ukraine!”. The soldiers shouted back the traditional response: “Glory to the heroes!”

U.N. agencies said as many as 5 million people could try to flee abroad. Kyiv has banned fighting-aged men from leaving the country, and at borders with Poland, Romania, Hungary and Slovakia, those crossing were mostly women and children.

Reuters journalists saw women crying as they bade goodbye to male loved ones and crossed into Romania.

A democratic nation of 44 million people, Ukraine voted for independence at the fall of the Soviet Union and hopes to join NATO and the EU, aspirations that infuriate Moscow.

Western countries have announced new sanctions on Russia, including blacklisting its banks and banning technology imports.

But they stopped short of forcing Russia out of the SWIFT system for international bank payments, drawing criticism from Kyiv which says the most serious steps should be taken now.

Germany and others use SWIFT to pay for Russian gas.

Russia is one of the world’s biggest energy producers, and both it and Ukraine are among the top exporters of grain. War and sanctions will disrupt economies around the world.

Oil and grain prices have soared. Share markets around the world, many of which plunged on Thursday at news of the outbreak of war, were mainly rebounding on Friday.

#russia ukraine conflict #ukraine crisis",https://www.tribuneindia.com/news/world/russia-presses-invasion-to-outskirts-of-ukrainian-capital-372984
4,8f188d65-51f9-485b-87b0-66cec5f56038,"['Aditi Sangal', 'Meg Wagner', 'Adrienne Vogt', 'Melissa Macaya', 'Rob Picheta', 'Lauren Said-Moorhouse', 'Ed Upright', 'Maureen Chowdhury', 'Fernando Alfonso Iii']",2022-02-24 10:08:57+00:00,"Black smoke rises from a military airport in Chuguyev near Kharkiv on February 24 (Aris Messinis/AFP/Getty Images)

Russian forces invaded Ukraine from three sides, while explosions rang through a number of cities, including the capital Kyiv, in a broad attack that began before dawn on Thursday.

Here's a timeline of how and when it unfolded.

Putin announces attack: Russian President Vladimir Putin made a speech early Thursday morning, saying he had decided ""to conduct a special military operation ... to protect people who have been subjected to abuse and genocide by the Kyiv regime for eight years,"" repeating a baseless claim about Ukraine's Russian-separatist-backed Donbas region.

He denied, however, that Russia was planning to occupy Ukrainian territories. ""We are not going to impose anything on anyone by force.""

But in a deeply menacing passage Putin added that anyone trying to interfere with or threaten Russia would lead to ""consequences that you have never experienced in your history.""

Ukrainian President Volodymyr Zelensky responded several hours later with a minute-long speech of his own, saying he had spoken to US President Joe Biden and that the United States was rallying international support for Ukraine.

""The West is with us,"" he said, and announced martial law across the country.

A pre-dawn assault: The invasion began hours before dawn with a series of missile attacks against locations near Kyiv, as well as the use of long-range artillery against the northeastern city of Kharkiv, near the Russian border.

It quickly spread across central and eastern Ukraine as Russian forces attacked the country from three sides. In the hours before daylight, people in the cities of Odessa, Dnipro, Mariupol and Kramatorsk reported huge blasts.

Immediate details of casualties were unclear. The Ukrainian Defense Ministry claimed its troops sustained no losses.

But there was clearly substantial damage in and around several cities. In Kharkiv, video emerged of an apartment block that had been damaged by a missile or long-range artillery. Another video showed a rocket embedded in a road. The State Emergency Service reported that six people were trapped in rubble in Nizhyn.

Ukraine's interior ministry said ballistic missiles had been used as part of the offensive, while jets were heard over the central city of Zaporizhzhye.

The Russians used a wide array of weaponry in their assault, including attack aircraft and helicopters, tanks, long range artillery and missiles.

Dawn breaks: After dawn, air sirens sounded across Kyiv and also in the western city of Lviv. A short time later a single, unidentifiable plane roared above the capital.

As the day began in Kyiv, streams of vehicles could be seen crossing the North Bridge, heading west, away from the focus of the Russian assault. Other people in the capital sought shelter in the subway.

Across the country long lines formed at gas stations and cash machines. A few people gathered in the streets of Kharkiv to pray.

Under overcast skies on Friday morning, Kiev appeared to be in a state of shock. The streets were quiet and schools closed. Here and across the country, Ukrainians are just beginning to come to terms with a cataclysmic night and the prospect of a deeply uncertain future.

CNN teams across Ukraine and Russia contributed to this report.",https://www.cnn.com/europe/live-news/ukraine-russia-news-02-24-22-intl/h_4acca36c8b3aa9cabe9335cc2d6b4b2c
5,8f188d65-51f9-485b-87b0-66cec5f56038,"['Aditi Sangal', 'Adrienne Vogt', 'Amy Woodyatt', 'Rob Picheta', 'Ed Upright', 'Jessie Yeung', 'Adam Renton', 'Melissa Macaya', 'Meg Wagner']",2022-02-25 05:03:29+00:00,"Russian forces advancing towards the Ukrainian capital city of Kyiv are “meeting more resistance than they expected,” a senior US defense official told reporters on Friday.

“I can’t give you an exact geographic location of where they are, but they are not moving on Kyiv as fast as they anticipated they would be able to,” the official said.

The official added, Russians “continue to try to move on Kyiv,” even though they are meeting Ukrainian resistance.

The Russian invasion of the country is continuing in the Kharkiv area of Ukraine and from the south towards the Ukrainian city of Kherson on the river, the official added. These are still the three main advances on the country that Russia began yesterday, the official said.

There have been “no additional airborne drops over the last 24 hours” in the Kharkiv area, the official said.

The biggest change that the US is seeing is from the advance in the south, the official added. Russian forces are still moving towards Kherson on the river, but they are also splitting off some forces to go to the northeast “in the direction of Mariupol and the Donbas region,” the official said.

“The south towards Kherson on the river — we do assess that they continue to move in that direction. But we also think that — based on what we’re seeing in addition to moving from Crimea on an axis towards the northwest towards Kherson — they are also splitting off some forces to go to the northeast, sort of in the direction of Mariupol' and the Donbas region,” the official said.

Here's a map to understand the locations better:",https://www.cnn.com/europe/live-news/ukraine-russia-news-02-25-22/h_622a8b21dd1cf52845090a96c9c6513b
