,uid,article_author,article_date,article_text,article_url
0,0bba915a-a7e7-4e69-8745-0fffc483dd9a,"['Munsif Vengattil Elizabeth Culliford', 'Munsif Vengattil', 'Elizabeth Culliford']",2022-03-10 00:00:00,"March 10 (Reuters) - Meta Platforms (FB.O) will allow Facebook and Instagram users in some countries to call for violence against Russians and Russian soldiers in the context of the Ukraine invasion, according to internal emails seen by Reuters on Thursday, in a temporary change to its hate speech policy.

The social media company is also temporarily allowing some posts that call for death to Russian President Vladimir Putin or Belarusian President Alexander Lukashenko, according to internal emails to its content moderators.

""As a result of the Russian invasion of Ukraine we have temporarily made allowances for forms of political expression that would normally violate our rules like violent speech such as 'death to the Russian invaders.' We still won't allow credible calls for violence against Russian civilians,"" a Meta spokesperson said in a statement.

Register now for FREE unlimited access to Reuters.com Register

The calls for the leaders' deaths will be allowed unless they contain other targets or have two indicators of credibility, such as the location or method, one email said, in a recent change to the company's rules on violence and incitement.

Citing the Reuters story, Russia's embassy in the United States demanded that Washington stop the ""extremist activities"" of Meta. read more

""Users of Facebook & Instagram did not give the owners of these platforms the right to determine the criteria of truth and pit nations against each other,"" the embassy said on Twitter in a message that was also shared by their India office.

The temporary policy changes on calls for violence to Russian soldiers apply to Armenia, Azerbaijan, Estonia, Georgia, Hungary, Latvia, Lithuania, Poland, Romania, Russia, Slovakia, and Ukraine, according to one email.

In the email recently sent to moderators, Meta highlighted a change in its hate speech policy pertaining both to Russian soldiers and to Russians in the context of the invasion.

""We are issuing a spirit-of-the-policy allowance to allow T1 violent speech that would otherwise be removed under the Hate Speech policy when: (a) targeting Russian soldiers, EXCEPT prisoners of war, or (b) targeting Russians where it's clear that the context is the Russian invasion of Ukraine (e.g., content mentions the invasion, self-defense, etc.),"" it said in the email.

""We are doing this because we have observed that in this specific context, 'Russian soldiers' is being used as a proxy for the Russian military. The Hate Speech policy continues to prohibit attacks on Russians,"" the email stated.

Last week, Russia said it was banning Facebook in the country in response to what it said were restrictions of access to Russian media on the platform. Moscow has cracked down on tech companies, including Twitter (TWTR.N), which said it is restricted in the country, during its invasion of Ukraine, which it calls a ""special operation.""

Many major social media platforms have announced new content restrictions around the conflict, including blocking Russian state media RT and Sputnik in the European Union, and have demonstrated carve-outs in some of their policies during the war.

Emails also showed that Meta would allow praise of the right-wing Azov battalion, which is normally prohibited, in a change first reported by The Intercept.

The Meta spokesperson previously said the company was ""for the time being, making a narrow exception for praise of the Azov Regiment strictly in the context of defending Ukraine, or in their role as part of the Ukraine National Guard.""

Register now for FREE unlimited access to Reuters.com Register

Reporting by Munsif Vengattil in New Delhi and Elizabeth Culliford in New York; editing by Jonathan Oatis, Stephen Coates, Shri Navaratnam and Kim Coghill

Our Standards: The Thomson Reuters Trust Principles.",https://www.reuters.com/world/europe/exclusive-facebook-instagram-temporarily-allow-calls-violence-against-russians-2022-03-10/
1,0bba915a-a7e7-4e69-8745-0fffc483dd9a,"['Munsif Vengattil', 'Elizabeth Culliford']",2022-03-10 21:06:57+00:00,"March 10 (Reuters) - Meta Platforms will allow Facebook and Instagram users in some countries to call for violence against Russians and Russian soldiers in the context of the Ukraine invasion, according to internal emails seen by Reuters on Thursday, in a temporary change to its hate speech policy.

The social media company is also temporarily allowing posts that call for death to Russian President Vladimir Putin or Belarusian President Alexander Lukashenko in countries including Russia, Ukraine and Poland, according to a series of internal emails to its content moderators.

Meta did not immediately respond to requests for comment. (Reporting by Munsif Vengattil in New Delhi and Elizabeth Culliford in New York; editing by Kenneth Li and Jonathan Oatis)",https://www.reuters.com/article/ukraine-crisis-meta-platforms-idCNL3N2VD40U
2,0bba915a-a7e7-4e69-8745-0fffc483dd9a,[],,"JavaScript is not available.

We’ve detected that JavaScript is disabled in this browser. Please enable JavaScript or switch to a supported browser to continue using twitter.com. You can see a list of supported browsers in our Help Center.

Help Center",https://twitter.com/reuters/status/1502064499947409416
3,0bba915a-a7e7-4e69-8745-0fffc483dd9a,[],2022-03-11 00:00:00,"Facebook and Instagram users in some countries will be allowed to call for violence against Russians and Russian soldiers in the context of the Ukraine invasion, after parent company Meta made a temporary change to its hate speech policy.

The company is also temporarily allowing some posts that call for death to the Russian president, Vladimir Putin, and his Belarusian counterpart, Alexander Lukashenko, in countries including Russia, Ukraine and Poland, according to internal emails to its content moderators.

“As a result of the Russian invasion of Ukraine we have temporarily made allowances for forms of political expression that would normally violate our rules, like violent speech such as ‘death to the Russian invaders’. We still won’t allow credible calls for violence against Russian civilians,” Meta said in a statement.

The calls for the leaders’ deaths will be allowed unless they contain other targets or have two indicators of credibility, such as the location or method, in a recent change to the company’s rules on violence and incitement.

The temporary policy changes on calls for violence against Russian soldiers apply to Armenia, Azerbaijan, Estonia, Georgia, Hungary, Latvia, Lithuania, Poland, Romania, Russia, Slovakia and Ukraine.

In the email recently sent to moderators, Meta highlighted a change in its hate speech policy pertaining both to Russian soldiers and to Russians in the context of the invasion.

“We are issuing a spirit-of-the-policy allowance to allow T1 violent speech that would otherwise be removed under the hate speech policy when: (a) targeting Russian soldiers, except prisoners of war, or (b) targeting Russians where it’s clear that the context is the Russian invasion of Ukraine (eg content mentions the invasion, self-defense, etc),” it said in the email.

“We are doing this because we have observed that in this specific context, ‘Russian soldiers’ is being used as a proxy for the Russian military. The hate speech policy continues to prohibit attacks on Russians.”

In response, Russia’s embassy to the US demanded Washington “stop the extremist activities of Meta and take measures to bring the perpetrators to justice”.

“Meta’s aggressive and criminal policy leading to incitement of hatred and hostility towards Russians is outrageous,” the embassy said. “The company’s actions are yet another evidence of the information war without rules declared on our country.”

Last week, Russia blocked access to Facebook and Twitter in response to what it said were restrictions of access to Russian media on the platform.

Many major media platforms have announced new content restrictions around the conflict, including blocking Russian state media RT and Sputnik in Europe, and have demonstrated carve-outs in some of their policies during the war.

Emails also showed that Meta would allow praise of the Ukrainian far-right Azov battalion, which is normally prohibited.

Meta spokesman Joe Osborne previously said the company was “for the time being, making a narrow exception for praise of the Azov regiment strictly in the context of defending Ukraine, or in their role as part of the Ukraine National Guard”.",https://www.theguardian.com/technology/2022/mar/11/facebook-and-instagram-let-users-call-for-death-to-russian-soldiers-over-ukraine
4,0bba915a-a7e7-4e69-8745-0fffc483dd9a,"['Nat Rubio-Licht', 'Lisa Martine Jenkins', 'Kate Kaye', 'Sarah Roach', 'Veronica Irwin', 'Lindsey Choo', 'Caitlin Mcgarry', 'Ben Brody', 'Owen Thomas', 'Hirsh Chitkara']",2022-03-10 23:00:54+00:00,"The state’s Clean Air Resources Board unveiled its plan to phase out gas-powered vehicles on Thursday, and it's expected to vote on the proposal in August, after a 45-day public comment period and a June 9 public hearing. The rule would require the state to up its zero-emission car sales in the coming years, culminating in the full ban. It comes in response to Gov. Gavin Newsom’s executive order to end the sale of gas-powered cars by 2035, which he issued last September.

Román Partida-López, legal counsel for transportation equity at the non-profit Greenlining Institute, said he expects the rule to pass in a form fairly close to where it is currently, given that CARB has already been in talks with both the advocacy community and the auto industry. “There’s probably some buy-in from both,” he told Protocol.

Car companies have historically had a bit of a tenuous relationship with California regulators, which have imposed more stringent air pollution standards than federal ones. (A number of states have adopted California's standards as well.) Since the Trump administration, though, they have mostly fallen in line. For instance, they gave up on a high-profile lawsuit over California’s ability to set its own emissions in February 2021. California is such a large market for vehicles that not only do its policies inform what kinds of cars are sold nationwide, they also tend to be echoed by federal policy.

The proposal wouldn't apply to sales of used vehicles, which is how most people in the U.S. buy their cars). It also wouldn't require cutting gas-power vehicle sales cold turkey on Jan. 1, 2035. Starting with the 2026 model year, 35% share of new cars, SUVs and small pickup trucks sold in California must be zero-emission. After that, the required share would ratchet up yearly. Of the total, 20% can be plug-in hybrids.

Partida-López said that while the rule is a step in the right direction — and could “set the standard of what electric vehicles could look like post-2026,” when the current, less ambitious clean cars rule sunsets — it does not go far enough in terms of delivering on the state’s environmental justice goals.

“Currently, the rule itself just addresses the status quo approach,” Partida-López said, in reference to the number of automakers that have already committed to selling only zero-emissions vehicles by 2035 or thereabouts. “It’s building on the commitments that automakers have already made, and not necessarily being transformative or pushing them to do better.”

The rule in its current form would likely result in one major boon for low-income communities: In expanding the number of EVs on the market, it will inevitably expand the used EV market as well, which has remained relatively thin even as the number of them on the market has swelled in recent years. But Partida-López would like to see more intentionality, saying the rule could include formal requirements that automakers work to increase accessibility and deployment of EVs in low-income communities, including access to charging networks and other avenues. There's extra urgency to do that given that those same communities often face disproportionate impacts from air pollution from gas-powered cars zipping down roads and over highways nearby.

These issues could also factor into people's livelihoods. Ride-hailing companies, for instance, have said they want to transition to EVs in the coming decades. But infrastructure as well as the cost of EVs have so far created barriers to actually getting drivers in zero-emission cars.

An alliance of automobile manufacturers expressed qualified support in the wake of the proposal, saying that they are committed to electrifying the transportation sector. They also expressed concerns, however, about whether the right pieces are in place to meet the rule’s timeline. The lack of charging infrastructure and competition for critical minerals could make the transition a little rocky. Partida-López acknowledged this is a potential challenge as well, but argued that aligning regulations with the automakers plans will incentivize the state to address these issues sooner than later.",https://www.protocol.com/bulletins/facebook-russia-violence
5,0bba915a-a7e7-4e69-8745-0fffc483dd9a,['Gabrielle Bienasz'],2022-03-11 00:00:00,"Reuters reported Thursday that Meta would allow posts from certain users that called for violence against Russian invaders -- when related to the conflict in Ukraine.

The changes apply to users in certain countries.

Reuters cited several internal emails sent to content moderators.

Get the latest tech news & scoops — delivered daily to your inbox. Loading Something is loading. Email address By clicking ‘Sign up’, you agree to receive marketing emails from Insider as well as other partner offers and accept our Terms of Service and Privacy Policy

Citing several internal emails, Reuters reported Thursday that Meta Platforms – parent company to Instagram and Facebook – will allow speech on the platforms from people in specific countries that advocates for violence against invading Russians and Russian soldiers, as long as it's in a context related to Russia's invasion of Ukraine.

""In light of the ongoing invasion of Ukraine, we made a temporary exception for those affected by war, to express violent sentiments toward invading armed forces such as ''death to the Russian invaders'. These are temporary measures designed to preserve voice and expression for people who are facing invasion. As always, we are prohibiting calls for violence against Russians outside of the narrow context of the current invasion,"" a Meta spokesperson told Insider.

The changes in terms are temporary, Reuters reported.

The platforms also will allow speech that expresses a desire for the death of Russian President Vladimir Putin, or Alexander Lukashenko, president of Belarus, from users in Russia, Ukraine, Poland, and other countries. Lukashenko has been in power since 1994, and is an ally of Putin.

Citing an email, Reuters reported that the threats or calls against the leaders would only be allowed if they do not discuss other potential victims and do not contain ""two indicators of credibility, such as the location or method.""

Facebook's ""Transparency Center"" has a section about violence and incitement, which says, ""While we understand that people commonly express disdain or disagreement by threatening or calling for violence in non-serious ways, we remove language that incites or facilitates serious violence.""

More specifically, it adds, ""Do not post.. Threats that could lead to death (and other forms of high-severity violence).""

The emails reviewed by Reuters said that expressing the desire for violence against Russian soldiers is permitted because it was operating as a symbol for the Russian military. The same principle would not count for prisoners of war.

Reuters cited a ""series"" of internal emails sent to content moderators. One email said that the rule change related to Russian soldiers would apply to users in Armenia, Azerbaijan, Estonia, Georgia, Hungary, Latvia, Lithuania, Poland, Romania, Russia, Slovakia, and Ukraine, the outlet reported.

The outlet also quoted one of the internal emails discussing the changes:

""We are issuing a spirit-of-the-policy allowance to allow T1 violent speech that would otherwise be removed under the Hate Speech policy when: (a) targeting Russian soldiers, EXCEPT prisoners of war, or (b) targeting Russians where it's clear that the context is the Russian invasion of Ukraine (e.g., content mentions the invasion, self-defense, etc.),"" the email read.

""We are doing this because we have observed that in this specific context, 'Russian soldiers' is being used as a proxy for the Russian military. The Hate Speech policy continues to prohibit attacks on Russians,"" the email to moderators also said.

Reuters said the emails noted another content permissions change: allowing speech that positively highlights the Azov battalion, a far-right Ukrainian paramilitary group previously banned in 2019, when related to praising them for being in the country's National Guard or defending them. A Meta spokesperson has confirmed this to Reuters, but it was first reported by The Intercept.

Social media companies have responded to issues around Russia's invasion of Ukraine, such as by adding cautionary labels to Tweets from state-run media and reducing their circulation on the platform. Meta also introduced rules to help fight misinformation about the conflict.

Russia has responded, too: It blocked Facebook last week.

""Social media is bad for dictators, that's why Putin took us down,"" Facebook's COO Sheryl Sandberg told CNBC's Hadley Gamble Tuesday at an event in Dubai for International Women's day sponsored by Cartier.",https://www.businessinsider.com/facebook-instagram-to-allow-calls-for-violence-against-invading-russians-2022-3
6,0bba915a-a7e7-4e69-8745-0fffc483dd9a,['Rebecca Klar'],2022-03-10 22:08:10+00:00,"Facebook and Instagram will temporarily allow users in some countries to call for violence against Russians and Russian soldiers within the context of the war in Ukraine, a company spokesperson confirmed Thursday, a substantial shift to their rules on hate speech and violence and incitement.

“As a result of the Russian invasion of Ukraine we have temporarily made allowances for forms of political expression that would normally violate our rules like violent speech such as ‘death to the Russian invaders.’ We still won’t allow credible calls for violence against Russian civilians,” Meta spokesperson Andy Stone said in a statement.

The update was first reported by Reuters.

Meta, the parent company of Facebook and Instagram, will also temporarily allow some posts that call for death to Russian President Vladimir Putin or Belarusian President Alexander Lukashenko in Russia, Ukraine and Poland, Reuters reported, citing internal emails detailing the change.

The calls for death will not be allowed if they contain other targets or if they have two indicators of credible threats, such as the location or method, according to Reuters.

The reported shift in policy comes as Meta and other platforms respond to the Russian invasion into Ukraine.

Last week, Russia said it would block Facebook in the country due to the platform’s restrictions on Russian state-controlled media, which Moscow called a form of “discrimination.”

Facebook and other tech giants have cracked down on Russian state media over the spread of disinformation about the invasion after calls from global leaders, including sanctions from the European Union.

Updated at 6:43 p.m.",https://thehill.com/policy/technology/597763-facebook-instagram-to-allow-calls-for-violence-against-russians-temporarily/
7,0bba915a-a7e7-4e69-8745-0fffc483dd9a,"['Richard Lawler', 'Mar']",2022-03-10 00:00:00,"Facebook and Instagram have instituted a temporary change in policy that allows users in some countries to post content that’s usually forbidden, including calls for harm or even the death of Russian soldiers or politicians. The change first surfaced in a report by Reuters, citing internal emails to moderators. In them, the outlet reports mods are told that calls for the death of Russian President Vladimir Putin or Belarusian President Alexander Lukashenko will be allowed, as long as they don’t contain threats toward others or “indicators of credibility” like saying where or how the act will take place.

In a statement sent to The Verge, Meta spokesperson Andy Stone said, “As a result of the Russian invasion of Ukraine we have temporarily made allowances for forms of political expression that would normally violate our rules like violent speech such as ‘death to the Russian invaders.’ We still won’t allow credible calls for violence against Russian civilians.”

The New York Times confirmed this policy applies to people using the service from Ukraine, Russia, Poland, Latvia, Lithuania, Estonia, Slovakia, Hungary, and Romania. The Times also notes that in 2021, Vice reported Facebook moderators received similar temporary instructions about “death to Khamanei” content and cited a spokesperson saying that Facebook had made that particular exception in certain earlier cases as well.

The Facebook community standards regarding hate speech and violence and incitement have continued to receive updates since the company started publishing them publicly in 2018. This change is just the latest example of how platforms have modified their treatment of content originating from the invading countries or relating to them since the fighting began.

An update to the Reuters report includes the content of the message sent to moderators, which reads as follows:

We are issuing a spirit-of-the-policy allowance to allow T1 violent speech that would otherwise be removed under the Hate Speech policy when: (a) targeting Russian soldiers, EXCEPT prisoners of war, or (b) targeting Russians where it’s clear that the context is the Russian invasion of Ukraine (e.g., content mentions the invasion, self-defense, etc.).

Typically, moderation guidelines would dictate that language dehumanizing or attacking a particular group based on its identity be removed. But the emails cited by Reuters claim the context of the current situation requires reading posts from the listed countries about generic Russian soldiers as a proxy for the Russian military as a whole, and absent credible statements attached, moderators are directed not to take action on them.

Still, it’s unclear whether the posts would be removed even without the direction. The policy already includes many carve-outs and exceptions. It states explicitly that additional information or context is needed before the enforcement of the policy in several cases, including:

Content attacking concepts, institutions, ideas, practices, or beliefs associated with protected characteristics, which are likely to contribute to imminent physical harm, intimidation or discrimination against the people associated with that protected characteristic. Facebook looks at a range of signs to determine whether there is a threat of harm in the content. These include but are not limited to: content that could incite imminent violence or intimidation; whether there is a period of heightened tension such as an election or ongoing conflict; and whether there is a recent history of violence against the targeted protected group. In some cases, we may also consider whether the speaker is a public figure or occupies a position of authority.

The Russian government’s reaction to the report is unknown, and there haven’t been any updates from its censorship agency Roskomnadzor, which banned Facebook earlier this month.",https://www.theverge.com/2022/3/10/22970705/russia-ukraine-moderation-facebook-instagram-hate-speech-violence-policy
