,uid,article_author,article_date,article_text,article_url
8,0bba915a-a7e7-4e69-8745-0fffc483dd9a,"['Munsif Vengattil', 'Elizabeth Culliford']",,"Meta Platforms will allow Facebook and Instagram users in some countries to call for violence against Russians and Russian soldiers in the context of the Ukraine invasion, according to internal emails seen by Reuters on Thursday, in a temporary change to its hate speech policy.

The social media company is also temporarily allowing some posts that call for death to Russian President Vladimir Putin or Belarusian President Alexander Lukashenko in countries including Russia, Ukraine and Poland, according to a series of internal emails to its content moderators.

These calls for the leaders’ deaths will be allowed unless they contain other targets or have two indicators of credibility, such as the location or method, one email said, in a recent change to the company’s rules on violence and incitement.

Story continues below advertisement

The emails said calls for violence against Russians are allowed when the post is clearly talking about the invasion of Ukraine. They said the calls for violence against Russian soldiers were allowed because this was being used as a proxy for the Russian military, and said it would not apply to prisoners of war.

In a tweet, Meta spokesperson Andy Stone said the company would temporarily allow forms of “political expression” that would normally violate their terms of service, including “violent speech.” He gave the example of “death to the Russian invaders” as a phrase that could be accepted now.

“We still won’t allow credible calls for violence against Russian civilians,” he said.

Our statement on what's happening: pic.twitter.com/UQqb3vQeep — Andy Stone (@andymstone) March 10, 2022

Story continues below advertisement

2:38 Russia-Ukraine conflict: UN nuclear watchdog says situation is “dire.” Russia-Ukraine conflict: UN nuclear watchdog says situation is “dire.” – Mar 10, 2022

The temporary policy changes on calls for violence to Russian soldiers apply to Armenia, Azerbaijan, Estonia, Georgia, Hungary, Latvia, Lithuania, Poland, Romania, Russia, Slovakia, and Ukraine, according to one email.

Last week, Russia said it was banning Facebook in the country in response to what it said were restrictions of access to Russian media on the platform. Moscow has cracked down on tech companies, including Twitter, which said it is restricted in the country, during its invasion of Ukraine, which it calls a “special operation.”

Many major social media platforms have announced new content restrictions around the conflict, including blocking Russian state media RT and Sputnik in Europe, and have demonstrated carve-outs in some of their policies during the war.

Emails also showed that Meta would allow praise of the right-wing Azov battalion, which is normally prohibited, in a change first reported by The Intercept.

Story continues below advertisement

Meta spokesman Joe Osborne previously said the company was “for the time being, making a narrow exception for praise of the Azov Regiment strictly in the context of defending Ukraine, or in their role as part of the Ukraine National Guard.”",https://globalnews.ca/news/8673756/meta-facebook-instagram-call-for-violence-russia-ukraine/
9,0bba915a-a7e7-4e69-8745-0fffc483dd9a,[],2022-03-11 00:00:00,"Tech giant says will not allow credible threats against civilians but Russia demands US stop company’s ‘extremist activities’.

Meta Platforms, the parent company of Facebook and Instagram, has temporarily eased its policy on violent speech following Russia’s invasion of Ukraine, saying it will allow statements such as “death to Russian invaders” but not credible threats against civilians.

The policy decision was met immediately with controversy, with Russia’s embassy in the United States demanding on Friday that Washington stop the “extremist activities” of the Facebook owner.

“Meta’s aggressive and criminal policy leading to incitement of hatred and hostility towards Russians is outrageous,” the embassy said in a statement. “The company’s actions are yet another evidence of the information war without rules declared on our country.”

The tech giant, however, defended its policy decision.

“As a result of the Russian invasion of Ukraine, we have temporarily made allowances for forms of political expression that would normally violate our rules like violent speech such as ‘death to the Russian invaders,'” it in a statement.

“We still won’t allow credible calls for violence against Russian civilians,” it added.

Meta’s statement followed a report by Reuters news agency that said the policy applies to Armenia, Azerbaijan, Estonia, Georgia, Hungary, Latvia, Lithuania, Poland, Romania, Russia, Slovakia and Ukraine, citing the firm’s emails to its content moderators.

The firm did not reply to a request seeking confirmation of the policy’s geographic boundaries.

Meta, which counts billions of users globally across its platforms, has previously struggled with what it would allow people to post in moments of upheaval.

In July 2021, the firm temporarily allowed posts calling for “death to Khamenei”, referring to Iran’s Supreme Leader Ali Hosseini Khamenei, during protests that rocked the country.

Tech platforms have had to navigate a slew of thorny issues related to the war in Ukraine, such as when US Senator Lindsey Graham called for the assassination of Russian President Vladimir Putin in a televised interview and on Twitter.

“The only way this ends is for somebody in Russia to take this guy out,” says Graham’s tweet from March 3, which Twitter has not taken down.

Is there a Brutus in Russia? Is there a more successful Colonel Stauffenberg in the Russian military? The only way this ends is for somebody in Russia to take this guy out. You would be doing your country – and the world – a great service. — Lindsey Graham (@LindseyGrahamSC) March 4, 2022

Meta’s decision drew sharply contrasting views.

“The policy regards calls for violence against Russian soldiers,” said Emerson Brooking, a disinformation expert at the Atlantic Council’s Digital Forensic Research Lab.

“A call for violence here, by the way, is also a call for resistance because Ukrainians resist a violent invasion,” he added.

But some expressed deep concerns, including Lehigh University professor Jeremy Littau, who wrote on Twitter: “‘We don’t allow hate speech except against certain people from a certain country’ is one hell of a can of worms.”

“We don’t allow hate speech except against certain people from a certain country” is one hell of a can of worms. — Jeremy Littau (@JeremyLittau) March 10, 2022

Facebook and other US tech giants have moved to penalise Russia for the invasion of Ukraine. Apple and Microsoft have announced they are halting the sale of their products in Russia, while other companies have made public their “pauses” of certain business activities or ties.

Last week, US internet service provider Cogent Communications said it had “terminated its contracts with customers billing out of Russia”.

Russia, meanwhile, has also taken steps to block access to the Facebook network, joining the very small club of countries barring the largest social network in the world, along with China and North Korea.

Russian authorities have also tightened their grip on critical media, though press freedoms in the country were already rapidly waning.

Moscow blocked Facebook and restricted Twitter the same day last week that it backed the imposition of jail terms on media publishing “false information” about the military.

The war is running parallel with a period of a significant crackdown on opposition voices, which has included the arrest of protest leaders and protest participants.",https://www.aljazeera.com/news/2022/3/11/facebook-allows-posts-urging-violence-against-russian-invaders
