,uid,article_author,article_date,article_text,article_url
5,2526de57-3597-4413-a769-0ae43387db32,[],2022-03-09 00:00:00,"Ceasefire negotiations begin today in Turkey, even as combat continues. Russian forces occupy 22% of Ukraine. Despite a vigorous propaganda battle, the numbers favor Russia as Ukraine maintains a strong resistance that promises a lengthy insurgency that does not favor the counter-insurgents (see O’Brien thread below).

In Battle Damage Assessment, the conflict continues with fewer precision weapons used and consequently more indiscriminate destruction. The Ukrainian major cities are holding, and there are few safe corridors for civilians. The Russians made their first launch of thermobaric weapons and implied by projection that chemical weapons could be deployed. Cluster munitions have already been used by the Russians.

There seems to be a definitive ‘no’ on Poland’s using the US to avoid having the Russians decide that more MiG 29s is a NATO escalation.

Poland's envoy to the U.S. says his country understands American objections to a Polish proposal to provide Ukraine with MiG fighter jets as potentially ""too escalatory."" He says it's time to emphasize NATO's unity and ""move on."" https://t.co/QtEdek3Tzj

ISTANBUL — When President Vladimir V. Putin launched his invasion two weeks ago, he said a primary goal was the “denazification” of Ukraine. He referred to the Ukrainian government as a “gang of drug addicts and neo-Nazis,” making it clear that his aim was to topple it.

But in recent days, the language has shifted, with the Kremlin signaling that Mr. Putin is no longer bent on regime change in Kyiv. It is a subtle shift, and it may be a head-fake; but it is prompting officials who have scrambled to mediate to believe that Mr. Putin may be seeking a negotiated way out of a war that has become a much bloodier slog than he expected.

On Thursday, Foreign Minister Sergey V. Lavrov of Russia is expected to meet his Ukrainian counterpart, Dmytro Kuleba, in Turkey, in the highest-level talks between the two countries since the war began on Feb. 24. President Recep Tayyip Erdogan of Turkey, whose top diplomat has held a total of 10 calls with Mr. Lavrov and Mr. Kuleba since the start of the war, said on Wednesday that the meeting could “crack the door open to a permanent cease-fire.” Leading up to the meeting, both sides have softened their public positions, though they remain far apart. Russia has narrowed its demands to focus on Ukrainian “neutrality” and the status of its Russian-occupied regions, and declared on Wednesday that Russia was not seeking to “overthrow” Ukraine’s government. President Volodymyr Zelensky of Ukraine on Tuesday suggested he was open to revising Ukraine’s constitutionally enshrined aspiration to join NATO, and even to a compromise over the status of Ukrainian territory now controlled by Russia.

“The changes are noticeable,” Ivan Timofeev, the director of programs at the government-funded Russian International Affairs Council, said of the evolution in Russia’s negotiating position. “This position has become more realistic.” The Kremlin’s position now, according to comments this week by its spokesman, Dmitri S. Peskov, is that Ukraine must recognize Russian sovereignty over Crimea and the independence of the Russian-backed, separatist “people’s republics” in the country’s east and enshrine a status of neutrality in its constitution. That is still far from what Mr. Zelensky has said he would be willing to accept — and it could also puncture Mr. Putin’s strongman image at home, opening him up to criticism that he waged an enormous war for limited gain. www.nytimes.com/...

x The Kremlin is signaling that Mr. Putin is no longer bent on regime change in Kyiv. It may be insincere, but has raised hope that he may be seeking an exit from a much bloodier slog than than he expected. @antontroian @PatrickKingsley @michaelcrowley https://t.co/MEmITnAgPT — rickgladstone (@rickgladstone) March 9, 2022

""The situation today is disconcertingly similar to that at the outset of World War II. Russian President Vladimir Putin now speaks of Ukraine as an artificial state and nation. In 1938 and 1939, Adolf Hitler spoke in just the same way about Germany’s neighbors. Putin prepared the way for his invasion with a litany of imaginary atrocities supposedly suffered by compatriots across the border. Hitler was the pioneer of atrocity talk as a pretext to aggression. He used such lies to absorb Austria, destroy Czechoslovakia, and invade Poland,"" Tim Snyder wrote.

""EU heads of state and government will meet Thursday in Versailles, France. There, they have a chance to do something historic: to honor Ukrainian President Volodymyr Zelensky’s request and offer Ukraine EU membership negotiations. This would renew the essential tradition of integration as the answer to war in a way that speaks to present circumstances. Such a promise would offer Ukrainians a brighter future, a sense of meaning to their sacrifice and suffering now. When the circumstances allow for peace negotiations, it will make it easier for them to stop fighting, because they will have already won something important,"" he wrote. ""Such a chance only comes once in a political lifetime. Here’s hoping that they take it.""

www.rawstory.com/...

x Wednesday thread on the war in Ukraine. Usually get to this earlier in the day, but had competing assignments today.



Major takeaways from a couple of Pentagon briefings: — Dan Lamothe (@DanLamothe) March 10, 2022

In a morning background briefing, a senior U.S. defense official said the Pentagon now assesses that Russia is using ""dumb bombs."" It marks another example of how they're indiscriminately attacking people in Ukraine.

Right on cue, the images of today's hospital bombing in Mariupol flashed. The senior defense official said they did not yet have an assessment.

The Russians have made some progress toward Kharkiv, the senior U.S. defense official said. ""They gained about 20 kilometers over the last 24 hours in terms of proximity.""

The situation around Kyiv was the same today. Russians are still stalled near the airport north of the city. Other Russians are attempting to advance from other directions. The city still holds.

Russians are making some progress near the southern city of Mykolaiv, too, the senior U.S. defense official said.

""We estimate that they're about 15 kilometers away, but to the north of Mykolaiv, and they have increased their shelling of the city,"" he added.

As of Wednesday, the Russians had launched 710 missiles at Ukraine since the start of the invasion two weeks ago. That number continues to climb by a few dozen per day.

Patriot missile batteries have been repositioned in Poland, the senior defense official said. That move was announced Tuesday night, so done deal there. The units are designed to shoot down incoming ballistic missiles.

@PentagonPresSec this afternoon. Good coverage of that from @karoun here:



washingtonpost.com/national-secur… There was also an on-the-record briefing withthis afternoon. Good coverage of that fromhere:

• • •

Rather, the Pentagon maintains that supplying Ukraine with ground-based air defense systems, such as surface-to-air missiles, has proved effective at weakening Russian forces, including its air capabilities. The United States is evaluating how to provide Ukraine with more of those types of weapons rather than the aircraft its leaders have asked for.

The United States already has shipped Ukraine a number of Stinger antiaircraft missiles and Javelin antitank missiles, alongside shotguns and other materials useful for fighting in urban areas, as The Washington Post first reported last week.

Russian forces continue to close in on key population centers. A senior U.S. defense official, speaking on the condition of anonymity under ground rules established by the Pentagon, said earlier Wednesday that Kharkiv, Ukraine’s second-largest city, and Mykolaiv, a possible staging ground to attack the large port city of Odessa, appeared particularly vulnerable. www.washingtonpost.com/... x NEW campaign update from @TheStudyofWar and @criticalthreats: #Russian operations to continue the encirclement of and assault on #Kyiv have likely begun, although on a smaller scale and in a more ad hoc manner than we expected. https://t.co/tt5uYJacyg pic.twitter.com/ZoQRaOwNHF — ISW (@TheStudyofWar) March 9, 2022 x New resource: Zhukov, Yuri (2022). ""VIINA: Violent Incident Information from News Articles on the 2022 Russian Invasion of Ukraine."" Ann Arbor: University of Michigan, Center for Political Studies. ( https://t.co/9qOuCkkjOu , accessed [March 8, 2022]). Map of territorial control pic.twitter.com/4xdWU5fX8m — Dr. Olga Onuch (@oonuch) March 8, 2022 x Russia and Ukraine reached a tentative deal to let civilians evacuate from the war zone this morning. Folks will flee via humanitarian corridors.



But how exactly do countries in conflict create safe humanitarian corridors in the middle of a war? @HallieOnNBC explains. pic.twitter.com/pHkqfcKHpL — Hallie Jackson NOW (@HallieOnNBC) March 9, 2022

x An important thread to understand the logistical challenge the Russian Army is facing. Ukraine is huge and Russian logistics are not first rate. https://t.co/nlTKUj8fSJ — Phillips P. OBrien (@PhillipsPOBrien) March 10, 2022



1/ We are going to start with Ukraine & explain. Most people have no clue as to how truely large Ukraine is. So, to cure that, I have gone to the thetruesize.com appin order to educate people.



2/ In this case by laying the US state of Texas over Ukraine. The Texas-Louisiana border to El Paso is roughly the distance Compare Countries With This Simple Tool



The distance of Kyiv from the Belarus border to be about that of the Oklahoma border to Dallas, Texas.

The tip of Crimea to the Ukraine-Belarus border is roughly from Brownsville Tx to the Red River border w/Oklahoma.

3/ between Ukraine's Russian & Polish borders.The distance of Kyiv from the Belarus border to be about that of the Oklahoma border to Dallas, Texas.The tip of Crimea to the Ukraine-Belarus border is roughly from Brownsville Tx to the Red River border w/Oklahoma. Driving from Texarkana on the N.E. tip of Texas to El Paso at the western tip is 814 miles & 12 hours 13 min. non-stop on US interstates with a 75 mph speed limit.



4/ x https://twitter.com/UAWeapons/status/1500599590420107264 There was no way the Russian trucks like this were going to make it from Belarus to Kyiv ...let alone cross Ukraine North-to-South or East -to-West. What was the Russian General Staff thinking?



See:

5/ Unroll available on Thread Reader x https://twitter.com/GirkinGirkin/status/1499037919092297728 Well, we know because the Ukrainians captured the plans from a Russian Naval Infantry Colonel.See:

Putin's generals thought it would take 3 days to overthrow the Ukraine government and 12 more days for the 190,000 troops to occupy the entire country of 43 million people, twice that of Texas.

That is one Russian conscript per 266 Ukrainians & 3.1 sq. km

6/

This plan assumed the Ukrainian military would put up a token resistance and the newly installed Puppet government would arrange the surrender of Ukraine's army of 250,000 men and 45,000 man territorial defense force without any weapons or soldiers going insurgent.

7/

Nor do those armed Ukrainian numbers include the six annual conscript classes that filled up that 250,000 man army in the eight years of fighting in the Donbas.

Assuming 1/2 of 250,000 x six, that is 730,000 combat veterans who would take great exception to Russia's puppet

8/

Assuming only a perfect plan for the Ukrainian Army, territorials plus Russians faced only 150,000 of those conscript classes. Russian & puppet forces would only outnumber them 3.2 to one in a popular insurgency.

That isn't enough to win.

9/



""However, when facing broadly popular insurgencies, counterinsurgents lost every time they possessed a force ratio advantage of 5-1 or less, failed half the time with odds between 6-1 and 10-1,

10/ smallwarsjournal.com/jrnl/art/manpo… See these #'s""However, when facing broadly popular insurgencies, counterinsurgents lost every time they possessed a force ratio advantage of 5-1 or less, failed half the time with odds between 6-1 and 10-1,

...but succeeded three-quarters of the time when outnumbering the insurgents by 10-1 or more.""



Short form:

Putin lost the moment he decided to invade Ukraine.

Russia has no political or military options to achieve successful war termination.

11/

The only agents in this war with the power to achieve war termination in Ukraine is the Ukrainian people.

Not the Ukrainian government

The people.

Ukraine is engaged in a national people's war against a Kleptocratic potentate.

12/

The Ukrainian people's terms are ""We want the Russians gone, all our lands back and even then we will still keep fighting Russia while Putin is in power.""

No Ukrainian government can force them to settle for anything less.

13/



Ukraine is big.

So big that we have a lot of space between conventional armed formations like the WW2 N. African campaign.

14/ Since Putin's 15-day plan has failed & Ukraine's military is fighting. Lets turn to another map that represents the reality on the Ground in Ukraine.Ukraine is big.So big that we have a lot of space between conventional armed formations like the WW2 N. African campaign. There are more armed Ukrainians than Russians in Ukraine.

While the Russians are fighting conventional Ukrainian Army unit for cities and choke points.

The Ukrainian territorials are fulfilling a role much like the colonial militia of the American revolution.

They are

15/

...filling the the space between armed units and destroying Russian Army truck convoys in the 21st century like the Colonial militia destroyed British army foraging parties around Philadelphia in the 18th century & impelled then to retreat or starve.

16/ x https://twitter.com/ELINTNews/status/1497600865397530625



Long road marches of 300 AFV's see as many as 100 fall out for mechanical defects.

When these are Russian, the fallen out AFV are destroyed, or worse, stolen.

17/ x https://twitter.com/AllanBell247/status/1498087119989977089 Now we are going to address the mechanized battle of attrition between Ukraine & Russia.Long road marches of 300 AFV's see as many as 100 fall out for mechanical defects.When these are Russian, the fallen out AFV are destroyed, or worse, stolen.



All Russian operational losses and the repairable half of combat AFV losses are either permanent losses or they become Ukrainian Army GAINS.

/18 x https://twitter.com/UkraineNewsUK/status/1498349080447270913 Over and over again.All Russian operational losses and the repairable half of combat AFV losses are either permanent losses or they become Ukrainian Army GAINS.

President Zelensky claimed on Mar 9, 2022 that more Russian equipment has been captured than Ukrainian equipment lost in the campaign to date, and thus all Ukrainian losses have been covered in operational units by Russian AFV trophies, especially MBTs.

/19

Contrafactual Short form:

Ukraine is winning the vehicular firepower war of attrition with Russia because it has trained & combat experienced reserves from its previous conscript classes to fill those tractor captured Russian AFV's.

Long conventional war favors Ukraine.

20/End

PS.



Yes, the thread turned out to be long, not short.

• • •",https://m.dailykos.com/stories/2022/3/9/2084949/-Ukraine-Invasion-Day-15-perhaps-a-ceasefire-before-the-Russians-run-out-of-Iskander-missiles
