,uid,article_author,article_date,article_text,article_url
0,e7b3de41-d4b3-4ce8-97d8-eba7637a9db2,['Alamy Limited'],2022-03-20 00:00:00,"You can only use this image in editorial media and for personal use. Editorial media includes use as a visual reference to support your article, story, critique or educational text. Personal use allows you to make a single personal print, card or gift for non-commercial use. Not for resale.

It shouldn’t be used for commercial use which includes advertising, marketing, promotion, packaging, advertorials, and consumer or merchandising products.",https://www.alamy.com/trafalgar-square-london-uk-20220320-ukrainian-people-protest-thousands-gather-to-demand-tougher-sanctions-on-russia-from-british-government-image466116647.html
1,e7b3de41-d4b3-4ce8-97d8-eba7637a9db2,"['Andy Crick', 'Laura Sharman', 'Image', 'Google', 'Triangle News', 'University Of St Andrew Library']",2022-03-21 09:43:41+00:00,"Angry residents have targeted the Russian embassy and displayed Ukraine flags at the site between the villages of Hawkhurst, Kent, and Flimwell, East Sussex

Russia has a secret embassy country hideaway in the UK which has been targeted by angry villagers.

Ukraine flags have been displayed in front of the Grade II listed Seacox Heath after Vladimir Putin invaded the country.

The lavish 19th century castle straddles the villages of Hawkhurst in Kent and Flimwell in East Sussex.

It is tucked away down a half-a-mile long driveway and cannot be seen from the road.

But Google Maps satellite images reveal the hidden four-storey pad set in sprawling grounds.

The countryside retreat, built in 1871, is used by Russian diplomats and is 1,750 miles from the capital Moscow.

Image: Google) Google)

Angry resident Rebecca De Saintonge decided to decorate it with blue and yellow Ukraine flags.

She said: “I decided it looked a bit bare.

“There's space for lots more if you're in the area.”

Seacox Heath was presented to the Soviet government by the English Lord Gushen after WW2.

It was a gift after his son was saved by Russian sailors.

Image: Triangle News) Triangle News)

Thousands of Brits have attended protests across the country against Russia's invasion of Ukraine.

Widespread outrage over Russian aggression has erupted in protests around the world following the unprovoked bombardment of Ukraine on February 24.

A Global Day of Action to support Ukrainians took place on March 6, called by the Stop the War Coalition and the No to NATO network.

Image: University of St Andrew Library) University of St Andrew Library)

Some 60 events took place across the UK where thousands protested at Trafalgar Square in London calling for a no-fly zone over Ukraine and for Putin to be sanctioned as a war criminal and terrorist.

Hundreds more gathered outside the Council House in Nottingham which has been flying the Ukrainian flag.

In Germany, over 100,000 protesters marched to the Brandenburg Gate in Berlin to demonstrate their anger in one of the country's largest demonstrations in recent history.

Image: Google) Google)

There were similar scenes in Madrid in Spain, Tokyo in Japan, and Seoul in South Korea, where there was a protest outside the Russian Embassy in the capitals against the devastating invasion of Ukraine.

Even Russians have bravely protested the war despite new legislation which carries up to 15 years in prison for spreading ""false information"" about the national military.",https://www.mirror.co.uk/news/uk-news/russian-embassys-secret-countryside-hideaway-26515976
2,e7b3de41-d4b3-4ce8-97d8-eba7637a9db2,[],,"Hundreds of protesters marched through Hackney in east London on Sunday (March 20) in support of a Black pupil strip-searched at school after being wrongly suspected of carrying drugs.



A report released this month found the search of the 15-year-old girl, known as Child Q, was unjustified and racism was ""likely"" to have been a factor.



Activists were chanting ""Power to Black girl Child Q!"" and carried banners saying ""Protect Black kids.""

""ChildQ"" - Hackney community gathers in solidarity for schoolgirl wrongly strip-searched by police



London, UK. 20 March 2022. Stand up to Racism in support of a Black pupil strip-searched at school after being wrongly suspected of carrying drugs. A report released this month found the search of the 15-year-old girl, known as Child Q, was unjustified and racism.",https://www.newsflare.com/video/484560/childq-hackney-community-gathers-in-solidarity-for-schoolgirl-wrongly-strip-searched-by-police
3,e7b3de41-d4b3-4ce8-97d8-eba7637a9db2,[],,"Ways you can help:





Stay informed





​​One of the simplest ways to help the most vulnerable in Ukraine is by staying informed and learning more about how citizens are being affected by the conflict. If you want to fact-check news and information you're seeing about Ukraine, #UkraineFacts is a great tool, along with the fact-checking website of news agency AFP here.





Donate





There are a ton of organisations on the ground and globally that are supporting people within Ukraine and refugees seeking safety elsewhere with medical and humanitarian aid.





CARE is responding to the crisis by providing Ukrainians in need with food, hygiene kits, psychosocial support services, access to water, and access to cash. Donate here.





​​UNICEF is repairing schools damaged by the bombings and providing an emergency response to children affected by the conflict. Donate here.





The UN World Food Programme (WFP) is deploying emergency operations in Ukraine and surrounding countries to provide food assistance to those fleeing the conflict. Donate here.





The World Health Organization Foundation is raising funds for WHO’s Health Emergency Appeal for Ukraine. You can donate here.





Protest





The world must stand up against President Putin and stand together with Ukrainians. Around the world – from the UK and France to Japan, Turkey and elsewhere – people have shown solidarity with Ukraine, holding anti-war protests against Russia’s invasion. You can find your nearest demonstration here.





If you're in London, The Mayor of London, Sadiq Khan is inviting all those who wish to show solidarity with Ukraine to join together on Saturday 26 March for a march and vigil. ‘London stands with Ukraine’ will begin with a solidarity march from Park Lane to Trafalgar Square, starting at 2pm.





Host a refugee





Several countries around the world, including the UK, have opened their borders to allow Ukrainian refugees to seek safety. The ‘homes for Ukraine’ programme allows individuals, charities, community groups and businesses across the UK to offer a room or home rent-free to Ukrainians escaping the war, regardless of whether they have ties to the country. To date, more than 100,000 British people across the UK have offered to host. If you can and you’re willing to, you can sign up here.



",https://togetherband.org/blogs/news/celebrities-helping-ukraine
4,e7b3de41-d4b3-4ce8-97d8-eba7637a9db2,['Nicola Davis'],2022-03-20 00:00:00,"Civilians fleeing conflict in Ukraine must be given immediate access to mental health support when they reach the UK, experts have said, adding there is an urgent need for more investment in such services.

Jonathan Bisson, professor in psychiatry at Cardiff University and director of Traumatic Stress Wales, said many people remaining in Ukraine would be experiencing uncertainty, anxiety and fear and some were likely develop mental health problems.

“Depending on where you are in Ukraine, at the moment you may be experiencing, absolutely catastrophic, direct, traumatic events occurring: loss of homes, having no electricity, no water, deaths of people around you, being injured yourself,” he said. “And if that’s not happening to you, or your town, or where you live at the moment, then clearly there must be a major fear that that will happen in the near future.”

While Bisson stressed such feelings were normal, and should not be pathologised, he said some people were likely go on to develop mental health problems. An important approach to reduce this risk, he added, was ensuring people felt supported during the crisis.

But Bisson said short-, medium- and long-term mental health services were also crucial for those who had fled Ukraine, noting many refugees would require emotional support straight away once they arrived in countries like the UK.

“Any response right from the word go, needs to be trauma informed,” he said. But Bisson said that in the first instance that meant ensuring people fleeing conflict had safety and stability. “Establishing people in communities, getting community support, establishing good social networks for people and with people – these are absolutely fundamental to people’s longer term prospects in terms of their mental health and wellbeing,” he said.

Bisson said therapy for conditions such as post-traumatic stress disorder was usually best offered once individuals were settled and had stability, meaning provision may be needed months or years after their arrival.

Dr Noreen Tehrani, a chartered member of the British Psychological Society and a member of its crisis, disaster and trauma section, also stressed the importance of ensuring refugees felt safe, adding that placing them in families, rather than refugee camps, would hopefully make this easier.

But Tehrani raised concerns about a lack of specialist support. “There is the concern that lots of well-meaning but untrained counsellors and other kind people will want to help, but for refugees with a high level of trauma it is possible to do more harm when you don’t understand exactly what is needed,” she said, adding there was also a need for safeguarding and an awareness of the risks to women and children.

Tehrani said it would also be helpful for information to be provided to services including schools, GPs, youth organisations and people who were offering homes to the refugees so they knew what to expect.

Kama Petruczenko, policy and research officer at the Refugee Council, also pointed to the need for support both for refugees and for those who want to help them. “There is an urgent need for more investment in mental health support for refugees,” she said. “Two-thirds of people seeking asylum experience serious mental distress, and they are five times more likely to have mental health needs than the UK population.”

She added: “The extremely traumatised women and children who arrive from Ukraine will need significant professional support to come to terms with all they have endured. The government needs to ensure sponsors are able to access appropriate levels of support and training to support the complex needs of Ukrainian families who have lost so much.”

Petruczenko said it was hugely important that immediate help and also longer-term support were available.

“The government says additional resources will be made available, but it’s important this funding is at the right level to meet needs as soon as people start to arrive,” she said.

Dr Adrian James, president of the Royal College of Psychiatrists, also called for action. “It’s absolutely critical that we help refugees to recover from the trauma they’ve experienced, and that we identify those in need of additional specialist mental health support. The government must also urgently focus on improving conditions for refugees, including increasing access to mental health support.”

A government spokesperson said: “Ukrainians fleeing their home country will be guaranteed free access to NHS healthcare, including mental health care services and registration with a GP.

“Arrivals will be signposted to services including 24/7 mental health helplines available in every area, and information on accessing NHS services including talking therapies.”",https://www.theguardian.com/society/2022/mar/20/mental-health-support-ukrainians-refugees-uk
5,e7b3de41-d4b3-4ce8-97d8-eba7637a9db2,['Associated Press'],2022-03-21 08:10:50,"Latest on Ukraine: March 21, 2022

Live updates: Ukraine says Russia shelled chemical plant

[EDITOR'S NOTE: There is a photo gallery located at the end of this post that contains images that readers might find disturbing, including images that show injuries and death. The reader is advised and cautioned to use discretion as the content may not be suitable for all.]

By The Associated Press, undefined

KYIV, Ukraine — Ukraine's prosecutor general said a Russian shell struck a chemical plant outside the city of Sumy a little after 3 a.m. Monday, causing a leak in a 50-ton tank of ammonia that took hours to contain.

Russian military spokesman Igor Konashenkov claimed the leak was a ""planned provocation"" by Ukrainian forces to falsely accuse Russia of a chemical attack.

Konashenkov also said an overnight cruise missile strike hit a Ukrainian military training center in the Rivne region. He said 80 foreign and Ukrainian troops were killed.

Vitaliy Koval, the head of the Rivne regional military administration, confirmed a twin Russian missile strike on a training center there early Monday but offered no details about injuries or deaths.

___

KEY DEVELOPMENTS IN THE RUSSIA-UKRAINE WAR:

— Russia demands Mariupol lay down arms but Ukraine says no

— 'No city anymore': Mariupol survivors take train to safety

— Biden adds stop in Poland, crucial ally in the Ukraine crisis, to his trip this week to Europe

Go to https://apnews.com/hub/russia-ukraine for more coverage

___

OTHER DEVELOPMENTS TODAY:

NEW YORK — Kremlin spokesman Dmitry Peskov says more progress must be made in talks with Ukraine before Russian President Vladimir Putin can meet his Ukrainian counterpart Volodymyr Zelenskyy.

Peskov says that ""in order to talk about a meeting of the two presidents, first it's necessary to do the homework, it's necessary to hold talks and agree the results.""

He adds that ""so far significant movement has not been achieved"" in the talks and that ""there are not any agreements which they could commit to"" at a joint meeting.

Ukraine and Russia's delegations have held several rounds of talks both in person and more recently via video link. Zelenskyy has said he would be prepared to meet Putin directly to seek agreements on key issues.

___

BRUSSELS — EU foreign policy chief Josep Borrell is accusing Russia of committing war crimes in Ukraine, most notably in the besieged port city of Mariupol where hundreds of civilians have been killed.

Borrell says that ""what's happening in Mariupol is a massive war crime. Destroying everything, bombarding and killing everybody in an indiscriminate manner. This is something awful.""

He says Russia has lost any moral high ground and he underlined that ""war also has law."" Borrell's remarks Monday came as he arrived to chair a meeting of EU foreign ministers in Brussels.

The International Criminal Court in the Netherlands is gathering evidence about any possible war crimes in Ukraine, but Russia, like the United States, does not recognize the tribunal's jurisdiction.

Irish Foreign Minister Simon Coveney says his country is ""certainly open to other mechanisms for accountability in terms of the atrocities that are taking place in Ukraine right now.""

Coveney says social media images of the war are ""driving a fury across the European Union"" for those responsible to be held to account.

___

JERUSALEM — Israel's prime minister says that while there have been advances in cease-fire talks between Russia and Ukraine, ""very large"" gaps remain between the two sides.

Naftali Bennett, who has acted as intermediary between the two warring countries in recent weeks, said at a conference on Monday that Israel ""will continue — together with other friends in the world — to try and bridge the gap and bring an end to the war.""

Israel has good relations with both Ukraine and Russia and has acted as a broker between the two sides since Russia invaded Ukraine in late February. Bennett has held multiple phone calls with both leaders in recent weeks and flew to Moscow earlier this month to meet with Russian President Vladimir Putin.

Bennett has offered to host a summit in Jerusalem.

""There's still a long way to go, because as I stated, there are a number of controversial issues, some of them fundamental,"" the prime minister said at the Yedioth Ahronoth newspaper's conference.

___

LJUBLJANA, Slovenia — Slovenia says it plans to send the country's diplomatic representatives back to Ukraine later this week.

Prime Minister Janez Jansa has urged other European Union nations to do the same. He said on Twitter late on Sunday that ""Ukraine needs diplomatic support.""

Slovenia's diplomats left Ukraine with the start of the Russian invasion on Feb. 24 as other countries withdrew their representatives as well.

Jansa visited Kyiv last week along with the prime ministers of Poland and the Czech Republic. He has said after the visit that Ukraine was feeling abandoned and urged the EU to send a bloc's representative there.

Jansa said the return of Slovenia's diplomats will be organized on voluntary basis.

___

LONDON — Britain's defense ministry says heavy fighting is continuing north of Kyiv as Russian forces press on with a stalled effort to encircle Ukraine's capital city.

In an update Monday on social media, the ministry said Russian forces advancing on the city from the northeast have stalled, and troops advancing from the direction of Hostomel to the northwest have been pushed back by fierce Ukrainian resistance. It said the bulk of Russian forces were more than 25 kilometers (15 miles) from the city center.

U.K. officials said that ""despite the continued lack of progress, Kyiv remains Russia's primary military objective and they are likely to prioritise attempting to encircle the city over the coming weeks.""

___

JERUSALEM — Israel's prime minister says the country is managing its involvement with Ukraine and Russia ""in a sensitive, generous and responsible way while balancing various and complex considerations"" after Ukraine's president called on Israel to take sides.

Naftali Bennett spoke on the tarmac at Israel's main international airport as an aid delegation was set to depart for Ukraine to set up a field hospital for refugees near the Polish border.

A day earlier Ukrainian President Volodymyr Zelenskyy rebuked Israel in a televised address to Israeli parliament members, saying Israel should provide arms and impose sanctions on Russia.

Israel has good relations with both Ukraine and Russia and has acted as an intermediary between the two sides since Russia invaded Ukraine in late February. While Israel has condemned Russia's invasion, it has also refrained from taking action that would anger Moscow out of concern of jeopardizing its military coordination in neighboring Syria.

Bennett said that ""Israel has extended its hand in aid in the Ukraine crisis for several weeks, very much from the first moment, through different channels,"" pointing to humanitarian aid shipments and taking in Ukrainian refugees and immigrants.

___

LVIV, Ukraine — Emergency officials have contained an ammonia leak at a chemical plant that contaminated wide area in the eastern Ukrainian city of Sumy, officials said Monday.

Sumy regional governor Dmytro Zhyvytskyy didn't say what caused the leak, which spread about 2.5 kilometers (1.5 miles) in all directions from the Sumykhimprom plant.

The plant is on the eastern outskirts of the city, which has a population of about 263,000 and has been regularly shelled by Russian troops in recent weeks.

___

KYIV, Ukraine — Shelling in a Kyiv neighborhood has devastated a shopping center, leaving a flattened ruin still smoldering Monday morning in the midst of high-rise towers.

Overnight shelling near the city center late Sunday left at least eight dead according to emergency officials. The force of the explosion shattered every window in the high-rise next door and twisted their metal frames.

In the distance, the sound of artillery rang out as firefighters picked their way through the destruction in the densely populated Podil district.

___

LVIV, Ukraine — An ammonia leak at a chemical plant in the eastern Ukrainian city of Sumy has contaminated an area with a radius of more than 2.5 kilometers (about 1.5 miles), officials said early Monday.

Sumy regional governor Dmytro Zhyvytskyy didn't say what caused the leak.

The Sumykhimprom plant is on the eastern outskirts of the city, which has a population of about 263,000 and has been regularly shelled by Russian troops in recent weeks.

""For the center of Sumy, there is no threat now, since the wind does not blow on the city,"" said Zhyvytskyy.

He said the nearby village of Novoselytsya, about 1.5 kilometers (1 mile) southeast of Sumy, is under threat.

Emergency crews were working to contain the leak.

___

NEW YORK — The Russian military has offered the Ukrainian troops defending the strategic port of Mariupol to lay down arms and exit the city via humanitarian corridors, but that proposal was quickly rejected by the Ukrainian authorities.

Col. Gen. Mikhail Mizintsev said Sunday that all Ukrainian soldiers could leave the Azov Sea port Monday using safe routes for evacuating civilians that had been previously agreed with Ukraine and head to areas controlled by the Ukrainian authorities. He said that ""all those who lay down arms will be guaranteed a safe exit from Mariupol.""

Mizintsev added that Russia will wait until 5 a.m. Monday for a written Kyiv's response to the Russian proposal for the Ukrainian troops to leave Mariupol but didn't say what action Russia will take if its ""humanitarian offer"" is rejected.

Ukraine's Deputy Prime Minister Iryna Vereshchuk said in remarks carried by Ukrainska Pravda news outlet that Kyiv already had told Russia that ""there can be no talk about surrender and laying down weapons."" She rejected the Russian statement as ""manipulation.""

Mizintsev said that the deliveries of humanitarian supplies to the city will immediately follow if the Ukrainian troops agree to leave the city. He added that civilians will be free to choose whether to leave Mariupol or stay in the city.

___

KYIV, Ukraine — Ukraine President Volodymyr Zelenskyy denounced the Russian bombing of a school in Mariupol where civilians took refuge.

Speaking in a video address early Monday, Zelenskyy said about 400 civilians were taking shelter at the art school in the besieged Azov Sea port city when it was struck by a Russian bomb.

""They are under the rubble, and we don't know how many of them have survived,"" he said. ""But we know that we will certainly shoot down the pilot who dropped that bomb, like about 100 other such mass murderers whom we already have downed.""

Zelenskyy, who spoke to members of the Israeli parliament via video link on Sunday, thanked Israel for its efforts to broker talks with Russia. He praised Israeli Prime Minister Naftali Bennett for trying to help ""find a negotiation track with Russia … so that we sooner or later start talking with Russia, possibly in Jerusalem.""

""It would be the right place to find peace if possible,"" he added.

The Ukrainian president also said that he had a call Sunday with British Prime Minister Boris Johnson, a ""true friend of Ukraine,"" to discuss support for Ukraine during this week's summit of the Group of Seven and NATO.

Zelenskyy said 7,295 Ukrainians were evacuated from zones of combat on Sunday, including nearly 4,000 from Mariupol. He also hailed people in the southern city of Kherson for taking to the streets Sunday to protest the Russian occupation, showing ""Ukrainian courage, armless against the occupiers.""

[EDITOR'S NOTE: The photo gallery below contains images that readers might find disturbing, including images that show injuries and death. The reader is advised and cautioned to use discretion as the content may not be suitable for all.]

Ukraine and the World's Response to Russia's Attack - February 2022 The following images help document Russia's invasion of Urkaine, and the world's response. The reader is STRONGLY CAUTIONED that this gallery CONTAINS GRAPHIC IMAGES, some of which include IMAGES OF DEATH. As of March 5, 2022 the gallery includes images that are not suitable for all readers. The reader is cautioned not to view this gallery without discretion.",https://wibx950.com/latest-on-ukraine-march-21-2022-ukraine-says-russia-shelled-chemical-plant/
