,uid,article_author,article_date,article_text,article_url
0,2c71f564-b03a-4529-8b32-69daf9334c96,[],2022-03-20 00:00:00,"Moscow launches cruise and hypersonic missiles targeting Ukrainian military assets as it steps up its military offensive.

Russia’s defence ministry says it attacked Ukraine with cruise missiles from ships in the Black and Caspian Seas, and with hypersonic missiles from Crimean airspace.

Russian defence ministry spokesman Major General Igor Konashenkov said on Sunday that the Kinzhal (Dagger) hypersonic missile hit a Ukrainian fuel depot in Kostiantynivka near the Black Sea port of Mykolaiv.

He added: “Kalibr cruise missiles were launched from the waters of the Black Sea against the Nizhyn plant that repairs Ukrainian armoured vehicles damaged in fighting.”

The attacks marked the second day in a row that Russia used the Kinzhal, a weapon capable of striking targets 2,000km (1,250 miles) away at 10 times the speed of sound.

Konashenkov added that another attack by air-launched missiles hit a facility in Ovruch in the northern Zhytomyr region where foreign fighters and Ukrainian special forces were based.

The previous day, the Russian military said the Kinzhal had been used for the first time in combat to destroy an ammunition depot in Diliatyn in the Carpathian Mountains in western Ukraine.

‘Kamikaze drones’

Russia prides itself on its advanced weaponry, and President Vladimir Putin said in December that Russia was the global leader in hypersonic missiles, whose speed, manoeuvrability and altitude make them difficult to track and intercept.

The Kinzhal missiles are part of an array of weapons unveiled in 2018. Russia first used the hypersonic missile during its military campaign in Syria in 2016.

Putin has called the Kinzhal missile “an ideal weapon” given its speed and ability to overcome air-defence systems.

“This is a missile capable of carrying nuclear warheads and is believed to be undetectable by western air defence systems,” said Al Jazeera’s Dorsa Jabbari, speaking from Moscow. “It is being called an unstoppable ballistic missile.”

Putin announced an array of new hypersonic weapons in 2018 in one of his most bellicose speeches in years, saying they could hit almost any point in the world and evade a US-built missile shield.

The following year, he threatened to deploy hypersonic missiles on ships and submarines that could lurk outside US territorial waters if Washington moved to deploy intermediate-range nuclear weapons in Europe.

The US has actively pursued the development of hypersonic weapons – manoeuvering weapons that fly at speeds of at least Mach 5 – as a part of its conventional Prompt Global Strike programme since the early 2000s, according to a new congressional report.

These weapons could enable “responsive, long-range, strike options against distant, defended, and/or time-critical threats [such as road-mobile missiles] when other forces are unavailable, denied access, or not preferred”, said former Commander of US Strategic Command General John Hyten.",https://www.aljazeera.com/news/2022/3/20/russia-says-it-used-hypersonic-missiles-in-ukraine-for-second-day
1,2c71f564-b03a-4529-8b32-69daf9334c96,"['Nigel Gould-Davies', 'March']",2022-03-20 00:00:00,"""Kinzhal aviation missile systems with hypersonic ballistic missiles destroyed a large storage site for fuels and lubricants of the Ukrainian armed forces near the settlement of Kostyantynivka in the Mykolaiv region,"" the Defense Ministry said.

The Russian Defense Ministry also said it killed more than 100 members of Ukrainian special forces and ""foreign mercenaries"" when it targeted a training center in the town of Ovruch in northern Ukraine with sea-based missiles.

Russia said Sunday it has again fired its newest Kinzhal hypersonic missiles in Ukraine, destroying a fuel storage site in the country's south.

The ministry said the base had been used for the main supplies of fuel for Ukrainian armored vehicles in the country's south.

The Kinzhal (Dagger) hypersonic missiles were fired from airspace over Russian-controlled Crimea, the ministry said, adding that Kalibr cruise missiles launched from the Caspian Sea had also targeted the depot.

On Saturday, Russia said it had used the Kinzhal hypersonic missiles to destroy an underground missile and ammunition storage site in western Ukraine close to the border with NATO member Romania.

The Ukrainian armed forces confirmed to AFP on Saturday that the depot had been targeted but said they had ""no information of the type of missile.""

Russian analysts said the use Friday of the Kinzhal hypersonic missiles in Deliatyn, a village in the foothills of the Carpathian mountains, was the first combat use of such weapons in the world.

The Russian Defense Ministry said that it also used long-range precision weapons against other facilities in Ukraine on Saturday evening and early Sunday.

Russian forces fired the Kalibr missiles from the Black Sea to target a plant in the northern city of Nizhyn used to repair armored vehicles, the ministry said.",https://www.themoscowtimes.com/2022/03/20/russia-says-has-again-fired-hypersonic-missiles-in-ukraine-a77005
2,2c71f564-b03a-4529-8b32-69daf9334c96,[],,"MOSCOW. Russia — Russia said Sunday it has again fired its newest Kinzhal hypersonic missiles in Ukraine, destroying a fuel storage site in the country’s south.

The Russian defense ministry also said it killed more than 100 members of Ukrainian special forces and “foreign mercenaries” when it targeted a training center in the town of Ovruch in northern Ukraine with sea-based missiles.

“Kinzhal aviation missile systems with hypersonic ballistic missiles destroyed a large storage site for fuels and lubricants of the Ukrainian armed forces near the settlement of Kostyantynivka in the Mykolaiv region,” the defense ministry said.

The ministry said the base had been used for the main supplies of fuel for Ukrainian armored vehicles in the country’s south.

The strike marked the second day in a row that Russia used the Kinzhal, a weapon capable of striking targets 2,000 kilometers (1,250 miles) away at a speed 10 times the speed of sound.

Get The Times of Israel's Daily Edition by email and never miss our top stories Newsletter email address Get it By signing up, you agree to the terms

The Kinzhal (Dagger) hypersonic missiles were fired from airspace over Russian-controlled Crimea, the ministry said, adding that Kalibr cruise missiles launched from the Caspian Sea had also targeted the depot.

On Saturday, Russia said it had used the Kinzhal hypersonic missiles to destroy an underground missile and ammunition storage site in western Ukraine close to the border with NATO member Romania.

The Ukrainian armed forces confirmed to AFP on Saturday that the depot had been targeted but said they had “no information of the type of missile.”

Advertisement

Russian analysts said the use Friday of the Kinzhal hypersonic missiles in Deliatyn, a village in the foothills of the Carpathian mountains, was the first combat use of such weapons in the world.

The Russian defense ministry said that it also used long-range precision weapons against other facilities in Ukraine on Saturday evening and early Sunday.

Russian forces fired the Kalibr missiles from the Black Sea to target a plant in the northern city of Nizhyn used to repair armored vehicles, the ministry said.",https://www.timesofisrael.com/for-second-day-in-a-row-russia-claims-use-of-hypersonic-missiles-in-ukraine/
3,2c71f564-b03a-4529-8b32-69daf9334c96,"['Helen Regan', 'Steve George', 'Ben Church', 'Luke Mcgee', 'Ed Upright', 'Maureen Chowdhury', 'Joe Ruiz', 'Mike Hayes', 'Amir Vera']",2022-03-20 04:04:45+00:00,"Residents leave the city of Mariupol on March 18. The city has been a site of intense fighting in recent weeks. (Alexey Kudenko/Sputnik/AP)

The south eastern city of Mariupol has been under siege for several weeks, with residents facing a constant barrage of deadly unprovoked Russian attacks. These have included deadly strikes on a maternity ward and the bombing of a theater, the losses from which are still unknown as the rescue operation continues.

Here's what we know about the situation in the besieged city:

Taken against their will: Residents of Mariupol are being taken to Russia against their will by Russian forces, the Mariupol City Council said Saturday. Captured Mariupol residents were forcibly taken to camps where Russian forces checked their phones and documents, then redirected some of the residents to remote cities in Russia, the council said.

Mariupol Mayor Vadym Boichenko compared Russia's actions to ""horrific events of World War II, when the Nazis forcibly captured people.""

Constant bombardment: A Ukrainian army commander told CNN people in Mariupol risk their lives each time they emerge from underground bunkers, and claimed the strategic port is facing the most intense fighting anywhere in the country. Major Denis Prokopenko, from the National Guard Azov Regiment, said air and land attacks on the city were now almost relentless.

Bodies in the street: Prokopenko said people in the city were reluctant to leave their underground shelters even to get hold of essentials, meaning they were trying to drink less water and eat less food, only emerging to prepare hot meals. Basic services like gas, electricity and water, are all out in the city. Bodies are being left in the street because there is either no one left to collect them, or it is simply too dangerous to try.

Theater attack: A new satellite image shows the Mariupol theater, which was bombed several days ago, almost completely destroyed, with just the western façade still standing. Still clearly visible in the photo is the Russian word for ""children"" painted by sheltering residents in large letters on the ground in front of the entrance. Hundreds of Ukrainians, including many children, were taking shelter inside the theater when it was attacked. Communications in the besieged city have been difficult for days and rescue work has been hampered by the danger of near-continuous shelling, according to reports from inside the city.

Zelensky: Ukrainian President Volodymyr Zelensky said the sustained Russian attack on Mariupol is an ""act of terror"" that will be ""remembered for centuries."" In a video message posted to Facebook early Sunday, the Ukrainian President said Mariupol will go down in history as an example of war crimes.

Steel plant: There are conflicting reports over the status of one of Ukraine’s key industrial facilities – the Azov Steel plant in Mariupol. Late Friday, a government advisor reported the plant was in Russian hands after ongoing battles with Ukrainian troops. But in an update Saturday, the Azov battalion, which has a large presence in Mariupol, said the plant remained in their hands.

Read more here.",https://www.cnn.com/europe/live-news/ukraine-russia-putin-news-03-20-22/h_a9859626eb4e3a25f96a146339163429
4,2c71f564-b03a-4529-8b32-69daf9334c96,[],2022-03-20 11:56:11+00:00,"The moment Russian military says it carried out a hypersonic missile strike on Ukrainian military facilities has been captured in new footage.

The Russian defence ministry claimed to have used high-precision missiles to hit a weapons depot belonging to the Ukrainian army in Deliatyn, a village in south-western Ukraine only 100km from the border with Romania.

Moscow said the strike on Saturday was Russia’s first use of the Kinzhal, or Dagger, ballistic missile in their war on Ukraine. The missile was likely launched from the air from an MiG-31 warplane.

On Sunday, Russian defence ministry spokesperson said that the military had carried out a number of further strikes on Ukrainian targets.

Major General Igor Konashenkov said that a Kinzhal hypersonic missile hit a Ukrainian fuel depot in Kostiantynivka, near the Black Sea port of Mykolaiv.

The strike would mark the second day in a row that Russia had used the weapon, which is capable of travelling at 10 times the speed of sound.

Major General Igor Konashenkov announced the use of further hypersonic missiles (AFP via Getty Images)

Mr Konashenkov said that Kalibr cruise missiles had been launched by Russian warships stationed in the Caspain Sea on a fuel depot in Kostiantynivka. Further missiles were also launched from the Black Sea.

“Kalibr cruise missiles were launched from the waters of the Black Sea against the Nizhyn plant that repairs Ukrainian armoured vehicles damaged in fighting,” Mr Konashenkov said.

Ukrainian soldiers walk next to the military school hit by Russian rockets the day before, in Mykolaiv, southern Ukraine. (AFP via Getty Images)

The Russian defence ministry also said that their military had launched hypersonic missiles from Crimean airspace.

The office of Ukrainian president Zelensky added on Sunday that there could be a risk of an attack on western Ukraine being launched from inside Belarus.

Officials said that the attack could be launched on Ukraine’s Volyn region, the country’s most northwestern province, but they did not clarify whether they thought it would be launched by Russian or Belarusian troops.

The Independent has a proud history of campaigning for the rights of the most vulnerable, and we first ran our Refugees Welcome campaign during the war in Syria in 2015. Now, as we renew our campaign and launch this petition in the wake of the unfolding Ukrainian crisis, we are calling on the government to go further and faster to ensure help is delivered. To find out more about our Refugees Welcome campaign, click here. To sign the petition click here. If you would like to donate then please click here for our GoFundMe page.",https://www.independent.co.uk/news/world/europe/russia-hypersonic-putin-missiles-crimea-b2039878.html
5,2c71f564-b03a-4529-8b32-69daf9334c96,['Updated Date'],2022-03-20 15:19:23+05:30,"The Russian defence ministry also said it killed more than 100 members of Ukrainian special forces and 'foreign mercenaries' when it targeted a training centre in the town of Ovruch in northern Ukraine with sea-based missiles

Moscow, Russia: Russia said Sunday it has again fired its newest Kinzhal hypersonic missiles in Ukraine, destroying a fuel storage site in the country's south.

The Russian defence ministry also said it killed more than 100 members of Ukrainian special forces and ""foreign mercenaries"" when it targeted a training centre in the town of Ovruch in northern Ukraine with sea-based missiles.

""Kinzhal aviation missile systems with hypersonic ballistic missiles destroyed a large storage site for fuels and lubricants of the Ukrainian armed forces near the settlement of Kostyantynivka in the Mykolaiv region,"" the defence ministry said.

The ministry said the base had been used for the main supplies of fuel for Ukrainian armoured vehicles in the country's south.

The Kinzhal (Dagger) hypersonic missiles were fired from airspace over Russian-controlled Crimea, the ministry said, adding that Kalibr cruise missiles launched from the Caspian Sea had also targeted the depot.

On Saturday, Russia said it had used the Kinzhal hypersonic missiles to destroy an underground missile and ammunition storage site in western Ukraine close to the border with NATO member Romania.

The Ukrainian armed forces confirmed to AFP on Saturday that the depot had been targeted but said they had ""no information of the type of missile.""

Russian analysts said the use of the Kinzhal hypersonic missiles on Friday in Deliatyn, a village in the foothills of the Carpathian mountains, was the first combat use of such weapons in the world.

The Russian defence ministry said that it also used long-range precision weapons against other facilities in Ukraine on Saturday evening and early Sunday.

Russian forces fired the Kalibr missiles from the Black Sea to target a plant in the northern city of Nizhyn used to repair armoured vehicles, the ministry said.

Read all the Latest News, Trending News, Cricket News, Bollywood News,

India News and Entertainment News here. Follow us on Facebook, Twitter and Instagram.",https://www.firstpost.com/world/ukraine-russia-war-moscow-says-has-again-fired-kinzhal-hypersonic-missiles-in-ukraine-10473161.html
6,2c71f564-b03a-4529-8b32-69daf9334c96,[],2022-03-23 03:59:43+00:00,"Analysis by Nathan Hodge | CNN

On Monday, after intense fighting, Ukrainian forces regained control of Makariv, a town west of Kyiv that had been battered by Russian airstrikes.

It’s tempting to view this small victory for Ukrainian forces as a shift of momentum in the battle for Kyiv: In better times, this suburb would be only an hour’s drive to Khreshchatyk, the capital’s central boulevard.

Kyiv once appeared to be the primary objective of what the Kremlin must have envisioned as a swift regime-change operation. The capital has been rocked by explosions in recent days, but it is far from encircled.

On the Azov Sea, the besieged southeastern city of Mariupol — despite being surrounded and mercilessly pummeled, block by block, by Russian firepower — still eludes Russian control. Its defenders rejected an ultimatum to surrender by Monday morning, thwarting a Russian effort to finalize a land bridge linking Crimea with the separatist republics of the eastern Donbas region.

Nearly a month after Russia launched its invasion of Ukraine, the Ukrainian military has perceptibly shifted its messaging. The Russian military’s advances have been stymied, the Ukrainians say, forcing a shift in Russian tactics.

“Due to the lack of success of the ground phase of the operation, the enemy continues to actively launch missile and bomb strikes on important military and civilian infrastructure using operational and tactical aircraft, high-precision missile weapons and indiscriminate munitions,” the General Staff of the Armed Forces of Ukraine said in a statement Tuesday.

There’s plenty of evidence to suggest that the Russians are taking more of a standoff approach, launching salvos of missiles from outside of Ukrainian airspace.

In a statement released Sunday, Russia’s defense ministry said warships in the Caspian sea launched Kalibr cruise missiles and aircraft launched Kinzhal hypersonic missile systems from the airspace over Crimea. Those missiles targeted what the Russians described as a large storage base for fuels and lubricants of the Ukrainian military near the settlement of Kostyantynivka, in the southern Mykolaiv region.

Separately, the Russian military said Kalibr cruise missiles were fired from the Black Sea, targeting a workshop for the repair of Ukrainian armored vehicles. Russian precision missiles also targeted what Russia described as a Ukrainian military training center near the settlement of Ovruch, in the northern Zhytomyr region.

There is an element of PR to such costly displays of firepower: Russia is keen to export a version of the Kalibr and it has touted the Kinzhal as being able to elude missile-defense systems.

The UK defense ministry, for one, was dismissive of Russian claims about the Kinzhal’s combat debut, saying its use was “highly likely intended to detract from a lack of progress in Russia’s ground campaign. Deployment of Kinzhal is highly unlikely to materially affect the outcome of Russia’s campaign in Ukraine.”

Such assessments, however, give little solace to anyone on the receiving end of Russian firepower. Dozens were killed Friday in a missile strike on a barracks housing soldiers in Mykolaiv, and Russian long-distance strikes have struck areas far away from the front lines: At least 35 people were killed in strikes on March 13 against the Yavoriv military training ground in the Lviv region of western Ukraine, not far from the Polish border. More than 30 missiles fired from warplanes over the Black and Azov seas hit the base.

Still, Russia has thus far not captured any major Ukrainian city in the offensive: neither Kharkiv in the northeast, nor Odesa in the southwest. Even Sumy and Chernihiv in the north, both of which are just across the border from major military staging areas inside Russia, remain under Ukrainian control. And in Kherson, a medium-sized city in the south under Russian control, Russian forces have faced another protracted problem: Angry locals who gather daily in the central square to tell Russian troops go home. One of those rallies ended Monday with one man seriously injured after Russian troops used gunfire and apparent stun grenades to disperse the crowd.

Military analysts worry about another consequence of this emerging phase of the war: As Russian ground forces become bogged down and make little new progress, their leaders resort more to the indiscriminate and punitive use of firepower against Ukrainian cities.

A March 19 assessment by the Institute for the Study of War gave precisely that grim prognosis.

“If the war in Ukraine settles into a stalemate condition, Russian forces will continue to bomb and bombard Ukrainian cities, devastating them and killing civilians, even as Ukrainian forces impose losses on Russian attackers and conduct counter-attacks of their own,” the assessment read.

“The Russians could hope to break Ukrainians’ will to continue fighting under such circumstances by demonstrating Kyiv’s inability to expel Russian forces or stop their attacks even if the Russians are demonstrably unable to take Ukraine’s cities. Ukraine’s defeat of the initial Russian campaign may therefore set conditions for a devastating protraction of the conflict and a dangerous new period testing the resolve of Ukraine and the West.”

Adding to that gloomy forecast, Ukrainian officials have begun warning of a potential new front in the war, with the country’s General Staff saying Sunday the threat of an offensive from Belarus in the direction of northwestern Ukraine was “high,” without giving further specifics.

Ukraine’s northwestern Volyn region borders Belarus to the north and Poland, a NATO ally, to the west. It could — theoretically — serve as a gateway for attacking forces from the north to approach Lviv, a strategic city in western Ukraine that is a hub for both government logistics and relief efforts, as well as a transit point for many civilians looking to flee fighting in other parts of the country.

Russia has already used Belarusian territory as a launching pad for its invasion, with Russian forces staging an offensive push toward Kyiv and central Ukraine from southern Belarus.

It’s unclear if Belarus would actively join the war. But the Ukrainian General Staff is already warning that Russia is now looking to bring in reserve forces to the borders of Ukraine.

If true, that speaks volumes. It attests to the high cost the Russian military has already paid in terms of lives — even though the Kremlin has not disclosed casualty totals since March 2. And it speaks to the political will of one person — Russian President Vladimir Putin — to continue expending blood and treasure in Ukraine.",https://theatlantavoice.com/ukraine-has-denied-russia-a-victory-for-four-weeks-a-grim-new-phase-could-be-coming/
