,uid,article_author,article_date,article_text,article_url
8,2c71f564-b03a-4529-8b32-69daf9334c96,[],2022-03-20 09:46:10+00:00,"On Saturday, Russia said it had used the Kinzhal hypersonic missile

A view shows a residential building damaged by shelling, as Russia’s attack on Ukraine continues, in Chernihiv, Ukraine, in this handout picture released on March 20, 2022. | Photo Credit: Reuters/National Police of Ukraine

On Saturday, Russia said it had used the Kinzhal hypersonic missile

Russia said on Sunday it has again fired its newest Kinzhal hypersonic missiles in Ukraine, destroying a fuel storage site in the country’s south.

The Russian defence ministry also said it killed more than 100 members of Ukrainian special forces and “foreign mercenaries” when it targeted a training centre in the town of Ovruch in northern Ukraine with sea-based missiles.

“Kinzhal aviation missile systems with hypersonic ballistic missiles destroyed a large storage site for fuels and lubricants of the Ukrainian armed forces near the settlement of Kostyantynivka in the Mykolaiv region,” the defence ministry said.

The ministry said the base had been used for the main supplies of fuel for Ukrainian armoured vehicles in the country’s south.

The Kinzhal (Dagger) hypersonic missiles were fired from airspace over Russian-controlled Crimea, the ministry said, adding that Kalibr cruise missiles launched from the Caspian Sea had also targeted the depot.

On Saturday, Russia said it had used the Kinzhal hypersonic missiles to destroy an underground missile and ammunition storage site in western Ukraine close to the border with NATO member Romania.

The Ukrainian armed forces confirmed to AFP on Saturday that the depot had been targeted but said they had “no information of the type of missile.”

Russian analysts said the use Friday of the Kinzhal hypersonic missiles in Deliatyn, a village in the foothills of the Carpathian mountains, was the first combat use of such weapons in the world.

The Russian defence ministry said that it also used long-range precision weapons against other facilities in Ukraine on Saturday evening and early Sunday.

Russian forces fired the Kalibr missiles from the Black Sea to target a plant in the northern city of Nizhyn used to repair armoured vehicles, the ministry said.",https://www.thehindu.com/news/international/russia-says-has-again-fired-hypersonic-missiles-in-ukraine/article65243039.ece
9,2c71f564-b03a-4529-8b32-69daf9334c96,[],2022-03-20 16:44:03+08:00,"KYIV (AFP) - Russia said on Sunday (March 20) it has again fired its newest Kinzhal hypersonic missiles in Ukraine, destroying a fuel storage site in the country’s south.

The Russian defence ministry also said it killed more than 100 members of Ukrainian special forces and “foreign mercenaries” when it targeted a training centre in the town of Ovruch in northern Ukraine with sea-based missiles.

“Kinzhal aviation missile systems with hypersonic ballistic missiles destroyed a large storage site for fuels and lubricants of the Ukrainian armed forces near the settlement of Kostyantynivka in the Mykolaiv region,” the defence ministry said.

The ministry said the base had been used for the main supplies of fuel for Ukrainian armoured vehicles in the country’s south.

The Kinzhal (Dagger) hypersonic missiles were fired from airspace over Russian-controlled Crimea, the ministry said, adding that Kalibr cruise missiles launched from the Caspian Sea had also targeted the depot.

On Saturday, Russia said it had used the Kinzhal hypersonic missiles to destroy an underground missile and ammunition storage site in western Ukraine close to the border with Romania, a member of the North Atlantic Treaty Organisation (Nato) military alliance.

The Ukrainian armed forces confirmed to AFP on Saturday that the depot had been targeted but said they had “no information of the type of missile"".

Russian analysts said the use of the Kinzhal hypersonic missiles in Deliatyn, a village in the foothills of the Carpathian mountains, on Friday was the first combat use of such weapons in the world.

The Russian defence ministry said it also used long-range precision weapons against other facilities in Ukraine on Saturday evening and early Sunday.

Russian forces fired the Kalibr missiles from the Black Sea to target a plant in the northern city of Nizhyn used to repair armoured vehicles, the ministry said.

Meanwhile, Ukraine sees a high risk of an attack on western Ukraine’s Volyn region being launched from Belarus, President Volodymyr Zelensky’s office said on Sunday, citing the military.

The Russian invasion has mostly focused on northern, southern and eastern areas of Ukraine, though missiles also hit the Yavoriv military base last week, close to the Polish border.

It was not immediately clear whether Ukraine saw the threat of an attack on Volyn from Russian forces or the Belarusian military, which has so far not publicly committed troops to supporting Russia.",https://www.straitstimes.com/world/europe/russia-strikes-ukraine-with-cruise-missiles-from-black-sea-and-caspian-sea
