,uid,article_author,article_date,article_text,article_url
0,ccefdb7f-1013-46c8-9a4c-28da16e1be90,[],2022-03-20 00:00:00,"Placeholder while article actions load

Russia’s attempt to conquer Ukraine could be headed toward a stalemate as heavy casualties and equipment losses take a toll on unprepared Russian forces that have failed so far to achieve any of their initial objectives, Western officials and military experts say. Wp Get the full experience. Choose your plan ArrowRight The front lines have barely moved in more than a week. Russians are being killed or injured at the rate of up to 1,000 a day, according to Western intelligence estimates, and even more according to Ukrainian ones.

Russian-held areas and troop movement BELARUS RUSSIA POL. Separatist- controlled area Kyiv Lviv UKRAINE Kryvhi Rih Mariupol ROMANIA Odessa 200 MILES Russian troops are trying to advance within artillery range of central Kyiv. Russian forces in the south drove north toward Kryvyi Rih. Russian troops continued to struggle to take Mariupol. Control areas as of March 19 Sources: Institute for the Study of War, AEI's Critical Threats Project, Post reporting Russian-held areas and troop movement RUSSIA BELARUS Chernihiv POLAND Sumy Kyiv Lviv Russian troops are trying to advance within artillery range of central Kyiv. Kharkiv UKRAINE Kryvyi Rih Separatist- controlled area Kherson ROMANIA Mariupol Odessa Russian troops continued to struggle to take Mariupol. Sea of Azov Russian forces in the south drove north toward Kryvyi Rih. 100 MILES Crimea Annexed by Russia in 2014 Active nuclear power plants with power-generating capabilities Black Sea Control areas as of March 19 Sources: Institute for the Study of War, AEI's Critical Threats Project, Post reporting Russian-held areas and troop movement BELARUS RUSSIA Chernihiv POLAND Sumy Kyiv Russian troops are trying to advance within artillery range of central Kyiv. Lviv Kharkiv UKRAINE Separatist- controlled area Russian forces in the south drove north toward Kryvyi Rih. Kryvyi Rih Mykolaiv Mariupol Russian troops continued to struggle to take Mariupol. Kherson ROMANIA Odessa Sea of Azov Crimea Annexed by Russia in 2014 Black Sea Active nuclear power plants with power-generating capabilities 100 MILES Control areas as of March 19 Sources: Institute for the Study of War, AEI's Critical Threats Project, Post reporting

Videos of burned-out tanks and abandoned convoys stream constantly on Ukrainian social media accounts, alongside footage of dead Russian soldiers, surrendering Russian soldiers, hungry Russian soldiers stealing chickens from local farmers — and, increasingly, the mangled bodies of Ukrainian civilians dying in missile and artillery attacks.

Advertisement

The ferocity of the Russian assault has only intensified as the advances have slowed, with Russia substituting harsh bombardments of civilian populations for progress on the battlefield. Regular Ukrainians living in cities surrounded, or partially surrounded, by Russian troops are paying the price for a war effort that began to go wrong in the first hours.

But in the absence of substantive progress on the ground and given the scale of the losses being inflicted on its ranks, Russia’s military campaign could soon become unsustainable, with troops unable to advance because they lack sufficient manpower, supplies and munitions, analysts and officials say.

The next two weeks could be critical in determining the outcome of the entire war, they say. Unless Russia can swiftly improve its supply lines, bring reinforcements and bolster the flagging morale of the troops on the ground, its goals may become impossible to achieve.

Advertisement

“I don’t think Ukraine forces can push Russian forces out of Ukraine, but I also don’t think Russian forces can take that much more of Ukraine,” said Rob Lee, a former U.S. Marine who is now a senior fellow at the Foreign Policy Research Institute.

Ukrainian President Volodymyr Zelensky said on March 20 the siege of Mariupol will go down in history as “war crimes” by Russian forces. (Video: The Washington Post)

An assessment Saturday by the Institute for the Study of War (ISW) went further. “Ukrainian forces have defeated the initial Russian campaign of this war,” it said. The conflict, it said, has now reached “a stalemate.”

Events on the battlefield could yet tilt in a different direction: for example, if the Russians succeed in capturing the besieged and desperate city of Mariupol, freeing up their forces to bolster their offensive elsewhere.

But in a widely shared March 14 article, a retired U.S. general and a European military academic argue that the Russian force is close to reaching what military strategists call the “culminating point” of its offensive, meaning that it will have reached the limits of its capacity to wage the war it set out to prosecute.

Advertisement

“The Russian war of conquest in Ukraine is now entering a critical phase; a race to reach the culminating point of Russia’s offensive capacity and Ukraine’s defensive capacity,” wrote retired Lt. Gen. Ben Hodges and Julian Lindley-French, who chairs the Alphen Group think tank in the Netherlands. They advocate a sustained effort by the United States and its allies to provide military supplies to Ukraine in hopes that Ukrainian forces can take advantage of this “window of opportunity” to win concessions at the negotiating table.

“I believe that Russia does not have the time, manpower or ammunition to sustain what they are doing now,” Hodges, who is now with the Washington-based Center for European Policy Analysis, said in an interview. The assessment assumes, he says, that the West continues to step up military support for Ukraine, thereby enabling Ukrainian forces to sustain the tempo of their resistance.

The Russian military still has overwhelming superiority in terms of numbers and equipment compared with the smaller and more lightly armed Ukrainian military. Russia could yet turn the fight around if it is able to replenish its manpower and supplies, cautioned Lindley-French.

“It would be a big mistake to think that Russia cannot sustain this war,” he said. “They can’t now, but they could fix it” by adjusting tactics and bringing in reinforcements.

However, he added, “Unless the Russians can really improve their game and start rotating [troop] formations into the front line, this particular force is facing a problem.”

Advertisement

U.S. officials decline to make public predictions about the course of the war but say there are clear indications that the Russians are struggling to sustain the existing forces they have and are scrambling to find reinforcements and resolve their logistical difficulties.

Appeals to China for military assistance, a so far fruitless attempt to recruit Syrians and talk of bringing in reinforcements from other parts of Russia and the breakaway territory of South Ossetia in Georgia have not yet produced evidence that fresh troops are on the way, the officials say.

More than 3 million people have been forced to flee Ukraine; more than half are children. Their parents are trying to explain the war to them. (Video: Zoeann Murphy/The Washington Post)

“Just that they’re talking about resupply and re-sourcing tells you they are beginning to get concerned about longevity here,” said a senior U.S. Defense Department official, who spoke on the condition of anonymity to discuss sensitive subjects.

Advertisement

“It’s quite extraordinary, three weeks in, that they are still having these same logistical and sustainment issues, and that they are considering additional ways to overcome these shortages from outside Ukraine,” the official added.

The Russian troops that initially surged into Ukraine from at least four directions had expected to be welcomed as liberators and came unprepared for a long fight, officials and experts say. Instead, the Russians encountered fierce resistance, and now they are strung out along multiple fronts, bogged down in manpower-intensive sieges and without preplanned supply lines to sustain a protracted war, the officials and experts say.

The current map of the battlefield points to the scale of the difficulties, Lee said.

It was clear from the way Russian forces moved in the first hours of the war, he said, that their key objectives were to take Ukraine’s second-largest city of Kharkiv, link up the occupied Donbas region with the port city of Odessa along Ukraine’s southern coast, and — most crucially — capture the capital, Kyiv, with a lightning push from the north.

More than three weeks on, Russian troops still haven’t achieved any of those goals.

They have failed to fully encircle the northeastern city of Kharkiv, even though it lies just a few miles from the Russian border. Their push to take the port city of Odessa has been halted by fierce Ukrainian resistance at the gates of Mykolaiv. Their effort to link the Russian-annexed territory of Crimea has become ensnared by the grinding and increasingly bloody siege of Mariupol.

The Russians have been making gains in the east, in the oblasts of Luhansk and Donetsk, which Russia recognized as independent republics on the eve of the war and which have been partially occupied by Russian-backed forces since 2014. But those advances fall far short of the initial ambitious goal of the invasion.

Advertisement

The Russians’ hopes of encircling Kyiv, let alone capturing it, are starting to recede, Lee said. Russian forces remain stuck about 15 miles outside the city, and though U.S. officials say Russia is moving rear forces toward the front in anticipation of a renewed push on the capital, the front line hasn’t shifted.

Meanwhile, Russians are dying at a rate that is increasingly unsustainable, Lee said. Although Russia still has vast reserves of manpower, it has already committed the bulk of its combat-ready forces, and they are the ones that are almost certainly bearing the brunt of the casualties, he said.

There are no confirmed casualty figures, and Russia has not updated the figure of 498 dead that it announced a week into the war. But of the Russian army’s 168 battalion tactical groups, 120 are already fighting on the ground, making up about 100,000 soldiers out of the total 190,000 sent into Ukraine. That means Russia has already committed 75 percent of its combat-ready force, U.S. officials say.

Advertisement

Western intelligence estimates say it is likely that at least 7,000 Russians have been killed and as many as 20,000 injured, and assuming that the combat forces are bearing the brunt of the casualties, that could mean up to a third of the main combat force is now out of action, Lee said.

“That’s a huge loss, and you can’t readily replace that,” he said. Russia can bring in new conscripts or call up more reservists, but that will dilute the capabilities of the overall force, “and that is not in Russia’s interest,” he said.

Ukrainian forces have been taking casualties, too, though how many isn’t publicly known because they also have not released any numbers. The longer the war drags on, the more perilous their position will become, too, and the greater the chance that Russia will overcome its initial mistakes, said Jack Watling of the London-based Royal United Services Institute.

Advertisement

But, he noted, the Ukrainian forces appear to remain highly motivated, while there are clear signs that morale continues to diminish among the Russian troops, he said. Russian forces continue to surrender, abandon their vehicles and show few signs of initiative in the areas they do control, signs “that this is not a force that is well motivated,” he said.

As Russia’s offensive capabilities slow, the risk is high that civilian casualties will mount. A stalemate is likely to become “very violent and bloody,” the ISW assessment said, because Russian troops are more likely to rely on the bombardment of cities to apply pressure.

There are signs that Russia is running out of precision missiles, U.S. officials say, which means Russian forces will also increasingly resort to the use of “dumb bombs” indiscriminately dropped on civilian areas in an effort to cow them into submission.

Ukraine is unlikely to have the capacity to push Russia out of the territory it has taken so far, officials and analysts say. But the Russians’ current difficulties open up the possibility that the Ukrainians could at least fight them to a standstill, thereby exerting pressure on Russia to accept a negotiated solution.

The main question now has shifted from how long it would take the Russians to conquer Ukraine to “can Ukraine fight Russia to a stalemate?” said a Western official who spoke on the condition of anonymity. “They’re doing pretty well at the moment.”

“The next two weeks are going to be pretty decisive,” Watling said. The war won’t be over in two weeks, he predicted, and all the signals from Moscow suggest the Russians are more likely to double down than climb down, making the war more deadly for Ukrainians even as it moves at a slower pace.

“The odds are stacked heavily in the Russians’ favor. This is their war to lose. The reason they are not achieving their objective is largely about their own incompetence, their lack of coordination,” he said.

“What this really comes down to is whether the Russians are going to get their act together.”

William Booth contributed to this report.

GiftOutline Gift Article",https://www.washingtonpost.com/world/2022/03/20/russia-ukraine-military-offensive/
1,ccefdb7f-1013-46c8-9a4c-28da16e1be90,['Jeremy Schultz'],2022-03-21 18:29:07+00:00,"Shanghai warned that anyone who violates COVID lockdown rules will be dealt with strictly, while also rallying citizens to defend their city as its tally of new cases rebounded to more than 25,000.",https://www.reuters.com/news/picture/destroyed-russian-military-vehicles-stre-idUSRTS6EQ4P
2,ccefdb7f-1013-46c8-9a4c-28da16e1be90,"['Joshua Eferighe', 'Joe Donlon']",2022-03-22 02:15:21+00:00,"CHICAGO (NewsNation) — A volunteer member of Ukraine’s military says the numbers don’t tell the story of the war so far.

The Uhas confirmed 902 civilian deaths — although they admit the toll is likely much higher — and nearly 3.4 million people have fled Ukraine. Additionally, Ukrainian officials say at least 115 children have been killed and 148 injured.

Monday night on “The Donlon Report,” however, a volunteer member of Ukraine’s military detailed what they’re up against from up-close. From his perspective, things are going better than numbers suggest.

“I’m seeing that Russia is losing the war,” Maksym Skubenko said on the program. “I saw, a few days ago, how they were running through the forest … They’re losing hope.”

Skubenko is the chief executive of VoxUkraine — an independent analytical organization and fact-checking service in Kyiv. When Russia invaded in February, he set aside his work and joined the Territorial Defense Forces.

He had no previous military or weapons experience.

“On the first day of invasion, in, like, six or seven hours, we was already with guns and was fighting against Russian troops,” Skubenko said.

It was only after an instructor taught him how to shoot a rifle, fire anti-tank missiles, make Molotov cocktails and fight with a knife that he became comfortable and effective.

“Now, we are on the frontlines,” Skubenko said. “Now we have a base and ammunition. I’ve got training with javelins and knives.”

The former corporate figure has even shot at soldiers.

Skubenko’s account of Russia’s struggles on the battlefield aligns with other reports that Russian President Vladimir Putin’s military tactics have turned into a logistical nightmare.

The Pentagon reported, for example, that Putin’s army is struggling to feed its troops and fuel its vehicles. Morale is also reportedly low, with captured Russian soldiers claiming they were under the impression they were taking part in a military exercise, up until the moment they came under fire from Ukrainian units.

“They have no commands,” Skubenko explains. “They do not know how to communicate with each other.”

Some expert observers are even calling the war a potential stalemate, despite Russia’s vast numerical superiority over Ukraine’s armed forces.

“Russian forces remain bogged down,” former Lt. Gen. Richard Newton said Sunday on “NewsNation Prime.” The fact that Ukraine’s badly outmatched forces have been able to halt the Russian advance on several fronts “shows the resiliency” of the Ukrainian people, and especially its military.

But former Army Lt. Col. Daniel Davis, a four-time combat veteran, says we shouldn’t rush to judgment on who will win.

“Right now, it’s way too early to call that and I don’t want anybody to get any false hopes that Ukraine can win because, military speaking, I don’t think they can over a long time,” Lt. Col. Daniel Davis said on “The Donlon Report.”

According to Davis, while the Russian’s original plan to quickly scare the Ukrainians into submission hasn’t worked, they’ve resorted to an alternative plan to “slog it out” with weapons.

“Even the Pentagon came out last Friday and said they still estimate that Russia has 90 percent of the combat power that crossed into the borders. That’s one of the reasons why I say its a little too early to say this is bogged down.”

Davis says the world can only hope and watch if things continue to go bad for Putin.

“Russia has not played a bunch of major cards they have in their hands,” Davis said, before describing Russia’s hypersonic missiles, 700,000 active duty troops and 2 million reserves. “I pray to God it doesn’t get to that point because that would have catastrophic impacts inside Ukraine.”",https://www.newsnationnow.com/the-donlon-report/ukrainian-volunteer-fighter-gives-frontline-perspective/
