,uid,article_author,article_date,article_text,article_url
6,ffd3c19f-0664-4168-9784-a1864c650775,"['Claudia Rowan', 'Mason Boycott-Owen', 'George Styllis', 'Grace Millimaci', 'Nataliya Vasilyeva', 'Russia Correspondent']",2022-02-26 00:00:00,"​The US, Britain, Europe and Canada on Saturday moved to block 'certain' Russian banks from accessing the Swift international payment system as part of another round of sanctions against Moscow.

The measures, which will also include restrictions on the Russian central bank's international reserves, will be implemented in the coming days, the nations said in a joint statement.

In addition to the supplies announced by Mr Scholz, they said Germany would give 400 German-made rocket propelled grenades to Ukraine through the Netherlands and 14 armoured personnel carriers. It will also supply 10,000 tonnes of fuel via Poland and further supplies to Ukraine are being considered.

Berlin’s dramatic change of stance came hours before Russia was effectively ejected from Swift, which is used by more than 11,000 banks for cross-border payments and is crucial for global trade.

The move came on the third day of Russia's invasion, as Ukraine continued to resist Putin's forces.",https://www.telegraph.co.uk/world-news/2022/02/26/ukraine-news-russia-war-invasion-nato-putin-zelensky-latest/
