,uid,article_author,article_date,article_text,article_url
0,ffd3c19f-0664-4168-9784-a1864c650775,[],,Choose which Defense.gov products you want delivered to your inbox.,https://www.defense.gov/News/Transcripts/Transcript/Article/2947461/senior-defense-official-holds-an-off-camera-press-briefing/
1,ffd3c19f-0664-4168-9784-a1864c650775,"['Pamela Falk', ""Charlie D'Agata"", 'Associated Press', 'Michael Kaplan', 'Eleanor Watson', 'Christopher Brito', 'Alex Sund', 'Haley Ott', 'Kathryn Watson', 'Li Cohen']",,Zelensky: Russia will soon try to storm Kyiv,https://www.cbsnews.com/live-updates/russia-ukraine-invasion-donbas-troops/
2,ffd3c19f-0664-4168-9784-a1864c650775,"['- British Prime Minister Boris Johnson', ""- Ukraine'S Ambassador To Us""]",,"Ukraine News Updates: Chernobyl falls to Russian forces, Moscow says it ""successfully completed"" objectives for the day",https://economictimes.indiatimes.com/news/newsblogs/daily-news-and-latest-updates-live-february-24/liveblog/89786845.cms
3,ffd3c19f-0664-4168-9784-a1864c650775,['Elias Visontay'],2022-02-25 00:00:00,"Ukrainian soldiers who died defending an island in the Black Sea from an air and sea bombardment reportedly told an officer on board a Russian navy warship to “go fuck yourself” when asked to surrender.

There were 13 border guards stationed on Snake Island, a roughly 16-hectare (40-acre) rocky island owned by Ukraine that sits about 186 miles (300km) west of Crimea, when Russian troops bombed the island on Thursday.

All 13 soldiers died after refusing to surrender, Ukrainian officials announced.

In his address after the first day of the invasion of his country, President Volodymyr Zelenskiy announced he would posthumously award all of the soldiers the Hero of Ukraine award.

“All border guards died heroically but did not give up,” Zelenskiy said.

Audio has emerged that is purported to have captured an exchange between Ukrainian border guards on Snake Island and an approaching Russian navy vessel, in which a Russian officer told the Ukrainian forces on the island to “lay down your weapons”.

“This is a military warship. This is a Russian military warship. I suggest you lay down your weapons and surrender to avoid bloodshed and needless casualties. Otherwise, you will be bombed,” the Russian office was recorded as saying on a naval radio channel.

After a short period of silence in the recording, a Ukrainian officer reportedly responded: “Russian warship, go fuck yourself.”

The audio has been published by multiple media outlets including the Ukrainian online newspaper Ukrayinska Pravda, and was shared on social media by Anton Herashchenko, an adviser to the Ukrainian interior ministry.

Audio from Snake Island, Black Sea:



Russians: This is a Russian warship. I propose you lay down arms and surrender to avoid bloodshed & unnecessary victims. Otherwise, you’ll be bombed.



Ukrainians: Russian warship, go fuck yourself.



They were all killed https://t.co/uNqh5b9L8C — Christopher Miller (@ChristopherJM) February 24, 2022

The Russian navy is reported to have bombarded the island with deck guns before sending soldiers on board to take control, according to Maritime Executive citing local media reports.

Snake Island – known as Zmiinyi Island in Ukrainian – is situated near the Ukrainian and Romanian coasts along the Black Sea, and has previously been the subject of a territorial dispute between the two countries.

A marine research station is situated on the island, and its maritime borders take in an area understood to be strategically important for resources including petroleum.",https://www.theguardian.com/world/2022/feb/25/ukraine-soldiers-told-russians-to-go-fuck-yourself-before-black-sea-island-death
