,uid,article_author,article_date,article_text,article_url
0,6c734aa6-1e5e-49ed-9ae7-3d614412d041,[],,"Points of Interest

For quick viewing, C-SPAN provides Points of Interest markers for some events.



Click the play button and move your cursor over the video to see the . Click on the marker to see the description and watch.



You can also click the in the lower left of the video player to see a complete list of all Points of Interest from this program - click on any moment in the list and the video will play.",https://www.c-span.org/video/?519185-1/defense-department-fiscal-year-2023-budget-request
1,6c734aa6-1e5e-49ed-9ae7-3d614412d041,[],,"JavaScript is not available.

We’ve detected that JavaScript is disabled in this browser. Please enable JavaScript or switch to a supported browser to continue using twitter.com. You can see a list of supported browsers in our Help Center.

Help Center",https://mobile.twitter.com/rustilev
2,6c734aa6-1e5e-49ed-9ae7-3d614412d041,[],,,https://www.cnn.com/search?size=10&q=japan%20trade%20deal
