,uid,article_author,article_date,article_text,article_url
0,cec776f0-89f1-4240-b721-00ce888150ac,['Peter Weber'],2022-04-05,"""Ukrainian forces have retaken key terrain in the north of Ukraine, after denying Russia the ability to secure its objectives and forcing Russian forces to retreat from the areas around Chernihiv and north of Kyiv,"" Britain's Ministry of Defense said early Tuesday. ""Low-level fighting is likely to continue in some parts of the newly recaptured regions"" until ""the remainder of Russian forces withdraw,"" and those forces ""are likely to require significant re-equipping and refurbishment before being available to redeploy for operations in eastern Ukraine.""

About two-thirds of the 20 Russian 800-strong fast-response units, known as battalion tactical groups, positioned around Kyiv have already turned back north to Belarus, a senior U.S. defense official concurred Monday, and ""we continue to believe"" those troops ""are going to be refit, resupplied, perhaps maybe even reinforced with additional manpower, and then sent back into Ukraine to continue fighting elsewhere.""

""Clearly the maximalist goals originally set out by [Russian President Vladimir] Putin have not been attained,"" the U.S. defense official added. He ""made it very clear he was after regime change in Ukraine, and a key piece of achieving that regime change was taking the capital city. He has failed to do that, and they are now moving away on the ground.""

Ukraine appears to have forced Russia to retreat from Kyiv, but ""the next stage of this conflict may very well be protracted"" and even uglier, U.S. National Security Adviser Jake Sullivan said Monday. ""We should be under no illusions that Russia will adjust its tactics, which have included and will likely continue to include wanton and brazen attacks on civilian targets"" as well as missile strikes across Ukraine intended ""to cause military and economic damage and, frankly, to cause terror.""

""At this stage, the Russian force is tapped out,"" and ""without national mobilization, there are very hard limits on what is available in terms of fighting power,"" Michael Kofman, a Russian military expert with the CNA think tank, tells The Washington Post. ""Russian political leadership will have a very significant choice to make,"" he added. ""They cannot sustain a war with Ukraine as a 'special operation,"" and trying ""to prosecute a long war"" with these ""large objectives"" is ""just not sustainable,"" Kofman said. ""They'll run out of troops.""",https://theweek.com/russo-ukrainian-war/1012168/russian-troops-are-retreating-from-kyiv-will-head-east-after
1,cec776f0-89f1-4240-b721-00ce888150ac,"['Abc News', 'Matt Seyler', 'April']",,"Thousands of Russian forces near Kyiv and Chernihiv have left to regroup.

The Pentagon has been providing daily updates on the U.S. assessment of the Russian invasion of Ukraine and Ukraine's efforts to resist.

Here are highlights of what a senior U.S. defense official told reporters Wednesday on Day 42:

All Russian troops withdrawn from around Kyiv and Chernihiv

The tens of thousands of Russian troops arrayed against Kyiv and Chernihiv have withdrawn north across the borders of Belarus and Russia to consolidate before likely redeploying to eastern Ukraine, according to the senior defense official.

""We are assessing that they have completely withdrawn from Kiev and from Chernihiv,"" the official said.

But even with the Russian forces, the territory remains treacherous.

""There are some indications that they left behind mines and things like that, so the Ukrainians are being somewhat careful in some areas north of Kyiv as they begin to clear the ground and clear the territory and re-occupy it,"" the official said.

On Monday, the Pentagon estimated that roughly one-third of the Russian forces apparently originally designated to take the capital remained.

Before the withdrawal, there were about 20 Russian battalion tactical groups (BTGs) consisting of 800-1,000 troops each in the areas north and northwest of Kyiv, and another 20 BTGs near Chernihiv, according to the official.

While the U.S. hasn't yet seen these troops redeploy elsewhere in Ukraine, it's likely to happen soon, according to the official.

""Our assessment is that they won't want to spend too much time on refit and resupply because they have made a very public show of saying that they're going to prioritize their efforts on the Donbas region,"" the official said.

But the timing will depend on how much work is needed to get the Russian forces back into fighting condition.

""Some of these units have been much more depleted than others, and it's possible that the Russians could combine units to make new BTGs as a result, we just we just don't know,"" the official said.

Of the roughly 130 BTGs Russia dedicated to the invasion, about 80 are still inside Ukraine, according to the official. More than 30 are already in the Donbas region.

US sending 'urgent' shipment of anti-tank missiles for fight in Donbas

Ukrainian forces are preparing for a major fight in the east as Russia prepares as many as 40 BTGs to join 30 more battalions already in Donbas.

""They're not waiting,"" the official said. ""They are already adapting to increased Russian activity in the Donbas region and doing the best they can.""

On Tuesday, the Biden administration authorized a $100 million drawdown package to ""meet an urgent Ukrainian need for additional Javelin anti-armor systems,"" Pentagon press secretary John Kirby said in a statement.

The senior U.S. defense official said this move was specifically to help in Donbas.

""One of the reasons why you saw us describe this $100 million drawdown package last night as an urgent need for Javelins was in fact because of the activity in the Donbas and the Ukrainians wanting to make sure that they're ready for increased Russian activity there,"" the official said.

Ukrainians get drone training in US

A small number of Ukrainians currently in the U.S. for ""professional military education"" were pulled aside for a couple days of training on Switchblade drones, which the U.S. is sending overseas as part of its military aid, according to the official.

""Although it's not a very difficult system to operate, we took advantage of having them in the country to give them some rudimentary training on that,"" the official said. ""And there may be some additional rudimentary training while they're here.""

The official said fewer than 12 Ukrainians were given this U.S.-based training.

Pentagon blames Russia for nitric acid explosion

The official said the Pentagon is ""monitoring"" an apparent nitric acid explosion in the Luhansk region, which Russia blamed on Ukraine.

""We've seen the Russians claim that this was a Ukrainian attack on this. We do not believe that is true,"" the official said. ""We do believe that the Russians are responsible, but exactly what they used when they did it, why they did it, what the damage is, we just don't have that level of detail,"" the official said.

'Premeditated' Russian atrocities in Bucha

""When you see individuals with their hands tied behind their backs and evidence of being shot in the head, that certainly appears to be premeditated,"" the official said, again calling for Russian war crimes in Ukraine to be investigated.

Long-range strikes shifting east

Russia has now launched more than 1,450 missiles against Ukraine, according to the official. The Pentagon is seeing more airstrikes targeting the east than Kyiv as Russia shifts its overall focus to the Donbas region.",https://abcnews.go.com/Politics/russia-fully-withdraws-kyiv-region-ukrainians-drone-training/story?id=83914701
2,cec776f0-89f1-4240-b721-00ce888150ac,"['Eleanor Watson', 'Cbs News Reporter Covering The Pentagon.']",,"The highest ranking military officer in the U.S. said Tuesday that he expects the conflict in Ukraine to last years.

""I do think this is a very protracted conflict, and I think it's measured in years. I don't know about decade, but at least years for sure,"" Chairman of the Joint Chiefs of Staff General Mark Milley told the House Armed Services Committee Tuesday during testimony on the defense budget.

""This is a very extended conflict that Russia has initiated and I think that NATO, the United States, Ukraine and all of the allies and partners supporting Ukraine will be involved in this for quite some time,"" Milley said.

Milley and Defense Secretary Lloyd Austin appeared before the committee for the first time since Russia invaded Ukraine in February and as Russia is refocusing on eastern Ukraine.

The Pentagon has seen about two-thirds of the less than 20 Russian battalion tactical groups that were arrayed against Kyiv repostion north toward Belarus, according to a U.S. senior defense official.The assessment is Russia will refit, resupply, and potentially reinforce them with additional manpower before sending the units back into Ukraine, likely in the Donbas region.

Chairman of the Joint Chiefs of Staff Gen. Mark Milley speaks during a House Armed Services Committee hearing on the fiscal year 2023 defense budget, Tuesday, April 5, 2022, in Washington. Evan Vucci / AP

Ukraine has been fighting Russian-backed separatists in the Donbas region since 2014. A senior defense official said last week that Russia's reprioritized focus in eastern Ukraine could mean the conflict takes more time instead of less because Ukrainian forces know the territory well, and they have a lot of forces there already who are fighting hard to defend the region.

National security adviser Jake Sullivan said in a White House press briefing Monday that the next phase of the war in Ukraine ""may very well be protracted"" and if the Russians do achieve some success in the Donbas region, the forces could try to take other areas of Ukraine.

To help Ukraine, the Biden administration is shipping weapons to Ukraine as quickly as possible and is working with partners who have equipment Ukraine wants that the U.S. doesn't have.

Austin said Tuesday that the Pentagon continues to focus on assistance that the Ukrainians have used effectively like anti-aircraft and anti-armor weapons. He said the Pentagon is working to provide both Switchblade 300 and 600 drones to Ukraine quickly.

Russia's invasion of Ukraine has prompted questions about the U.S. force posture in Europe. Milley said Tuesday the posture of the U.S. is still being decided but because of the war in Ukraine, it's likely there will be an increased presence of U.S. troops in the region long term.

""My advice would be to create permanent bases but don't permanently station, so you get the effect of permanence by rotational forces cycling through permanent bases,"" Milley said.

The U.S. currently has around 100,000 stationed troops in Europe, the highest number since 2005.

As for the coming weeks, the Pentagon has seen indications Russia is looking to reapply the forces that repositioned away from Kyiv to the Donbas region but has not seen any evidence yet that those units have started to move into the Donbas, according to a senior defense official.

A recent British military intelligence update said many Russian units withdrawing from northern Ukraine are likely to require significant re-equipping and refurbishment before being available to redeploy for operations in eastern Ukraine.

Milley and Austin are scheduled to testify in front of the Senate Armed Services Committee on Thursday.",https://www.cbsnews.com/news/ukraine-conflict-years-mark-milley-house-armed-services-committee/
3,cec776f0-89f1-4240-b721-00ce888150ac,[],,"Over the weekend, Ukraine said its forces had seized back all areas around Kyiv.

Russia has repositioned about two thirds of its forces from around Kyiv, with many consolidating in Belarus where they are expected to be refit, resupplied and redeployed elsewhere in Ukraine, a senior U.S. defense official said on Monday.

Over the weekend, Ukraine said its forces had seized back all areas around Kyiv, claiming complete control of the capital region for the first time since Russia launched the invasion.

The U.S. official, speaking on the condition of anonymity, told reporters the United States estimated that prior to the pullback, there had been just under 20 battalion tactical groups focused on Kyiv. That was less than a sixth of the battalion tactical groups that the Kremlin deployed for the invasion.

""We still assess that the vast, vast majority of the more than 125 battalion tactical groups that the Russians invested in this invasion are still in Ukraine,"" the official said.The official estimated that Russian forces that had withdrawn from around Kyiv would likely be redirected towards eastern Ukraine, but that was still not confirmed.

""What we continue to believe is that they're going to be refit, resupplied, perhaps maybe even reinforced with additional manpower and then sent back into Ukraine to continue fighting elsewhere,"" the official said.

As Russian troops regrouped for battles in east Ukraine, towns surrounding Kyiv bore scars of five weeks of fighting.

The discovery of a mass grave and tied bodies shot at close range in Bucha, outside Kyiv, a town taken back from Russian troops, looked set to galvanize the United States and Europe into additional sanctions against Moscow.

The mayor in Bucha, a liberated town 37 km (23 miles) northwest of the capital, said that 300 residents had been killed by Russian forces while Chechen fighters controlled the area.

The Kremlin has denied accusations related to the murder of civilians in the town.

The U.S. military was not in a position to independently confirm Ukrainian accounts of atrocities by Russian forces against civilians in Bucha, but has not reason to dispute the accounts either, the senior U.S. defense said.

""We're seeing the same imagery that you are. We have no reason whatsoever to refute the Ukrainian claims about these atrocities -- clearly, deeply, deeply troubling,"" the official added.

The defense official did not challenge Russia's claims over the weekend that it carried out an airstrike on an oil depot in Odessa. But the reasoning for the strike was not entirely clear, the official said, as speculation persists about a possible amphibious assault on the city.

""It could be that they are simply doing that (strike) to try to pin down Ukrainian forces there, make them think that there's something big coming in Odessa and so that they stay and try to protect the city,"" the official said.

(Except for the headline, this story has not been edited by NDTV staff and is published from a syndicated feed.)",https://www.ndtv.com/world-news/russia-has-withdrawn-2-3-of-forces-near-kyiv-u-s-official-2862649
4,cec776f0-89f1-4240-b721-00ce888150ac,[],,"THE TIMES OF INDIA | Apr 05, 2022, 09:16:39 IST

world

Russia-Ukraine War News : Russia has withdrawn two-third of forces near Kyiv, says US official

Russia has repositioned about two thirds of its forces from around Kyiv, with many consolidating in Belarus where they are expected to be refit, resupplied and redeployed elsewhere in Ukraine, a senior US defense official said on Monday. Stay with TOI for latest updates:Read Less",https://timesofindia.indiatimes.com/world/europe/russia-ukraine-war-april-3-2022/liveblog/90616067.cms
5,cec776f0-89f1-4240-b721-00ce888150ac,"['Megan Specia', 'Cora Engelbrecht', 'Eric Schmitt', 'Nathan Willis', 'Anushka Patil', 'Traci Carl', 'Daniel Berehulak', 'Richard Pérez-Peña', 'Tyler Hicks', 'Farnaz Fassihi']",2022-04-06,"Families waiting to board trains in the eastern Ukrainian city of Kramatorsk on Tuesday.

Spurred by reports of Russian atrocities outside Ukraine’s capital, and alarmed at signs that Russia’s invasion force is about to escalate assaults in eastern Ukraine, many civilians in that region are fleeing while they can, officials said Wednesday.

“The cities of the Luhansk region are in ruins,” warned one eastern governor. “Thousands of residents have not yet left. Get out of the way!”

The exodus accelerated as Western nations moved to provide more weapons to Ukraine’s military and further ostracize Russia economically with new sanctions, including restrictions on its leading banks and on the assets of President Vladimir V. Putin’s children.

The new sanctions are a response to outrage and revulsion over the atrocities, including executions and torture, that appear to have been carried out by Russian forces before they retreated from areas outside Kyiv in the past few weeks. Russia has denied responsibility, saying the atrocities were fabricated or were committed by the Ukrainians themselves.

The European Union also was weighing a ban on coal from Russia, the leading provider of fossil-fuel energy to Europe, and Russia appeared to move closer to default on its foreign debt because of U.S. currency restrictions.

“Together with our allies and our partners, we’re going to keep raising the economic costs and ratchet up the pain for Putin, and further increase Russia’s economic isolation,” said President Biden, who has described Mr. Putin as a war criminal and suggested he should not remain in power.

More than 11 million Ukrainians — roughly one in four — have fled their homes since the Feb. 24 invasion, according to the United Nations, including more than four million who have fled the country. It is the biggest refugee crisis in Europe since World War II.

The Russian military announced last week that it would focus its campaign on eastern Ukraine, where Russian-backed separatists have been fighting for eight years. The redeployment came as the Russians, hampered by botched planning and fierce Ukrainian military resistance, retreated from the Kyiv area and apparently abandoned — at least for now — any effort to capture the capital in their war to subjugate the former Soviet republic.

Western military analysts have said the Russians vastly underestimated the challenges in Ukraine and that their initial invasion force of more than 150,000 has been weakened by losses, exhaustion and low morale. But that does not mean Russia’s military cannot undertake a powerful new assault in eastern Ukraine.

The shift has accelerated civilian displacement in the east. Thousands of people have been leaving, according to Ukrainian officials, and photos and videos posted online. Ukrainian officials say Russian troops have been massing in the Donetsk, Luhansk and Kharkiv regions.

Image Severodonetsk, in the eastern Donbas region, on Wednesday. Evacuate “now,” Ukrainians in the region have been told. Credit... Fadel Senna/Agence France-Presse — Getty Images

In Kramatorsk, a city in the north of the Donetsk region, photos showed crowds of people huddled at a platform in a central train station.

At least two people were killed and five injured when Russian forces launched a strike on a humanitarian aid site in the town of Vugledar in the Donetsk region, according to Pavlo Kyrylenko, the Donetsk governor.

Russian forces now control 60 percent of the town of Rubizhne, in the Luhansk region, according to the governor there, Serhiy Haidai, who said the attackers had scaled up their offensive this week.

“Evacuations are taking place under the roar of enemy guns,” Mr. Haidai wrote in a Facebook post on Wednesday, saying that approximately 30,000 people had left the region since Russia invaded. He urged remaining residents to flee before Russia scaled up attacks.

Oleg Synegubov, the state administrator for the Kharkiv military region, said Wednesday in a post on Telegram that the army would evacuate two towns in the eastern part of the country because fighting was escalating there.

The towns, Lozova and Barvinkove, are southwest of Izium, a city Russian forces seized as part of an apparent drive toward Sloviansk, which military analysts say is strategically critical to Russia’s plan to gain full control of eastern Ukraine.

Earlier this week, Oleksiy Danilov, the head of Ukraine’s National Security and Defense Council, speaking on national television, said “large groupings of Russian troops” had been massing in the region.

Image A young girl with her dog arriving in Zaporizhzhia, some 100 miles northwest of Mariupol. Credit... Bulent Kilic/Agence France-Presse — Getty Images

“They are not going to stop,” he said. “They have a great desire to create big problems for our armed forces in this direction, and we also expect that fierce battles will be fought there for our territory in the near future.”

The Pentagon’s assessment of Russian deployments appeared to corroborate what Ukrainian officials were saying. Pentagon officials said Russia had withdrawn all of its troops arrayed against Kyiv and another city in the north, Chernihiv, and sent them back to Russia or to its ally Belarus to rearm, resupply and possibly redeploy in eastern Ukraine.

The Pentagon officials said those forces included as many as 40,000 troops that, in many cases, had departed under fierce attack from the Ukrainian military units that retook the territory.

“We believe they are all out,” one senior Pentagon official said, speaking on the condition of anonymity to discuss confidential operational issues.

Russia now has about 30 battalion tactical groups — as many as 30,000 troops — in the east, the senior Pentagon official said. Earlier this week, Jake Sullivan, Mr. Biden’s national security adviser, said Russia would most likely send “tens of thousands of soldiers to the front line in Ukraine’s east” in the coming weeks.

Largely in anticipation of this next major phase of the war, the Pentagon announced late Tuesday that it was sending $100 million worth of Javelin anti-tank missiles — roughly several hundred missiles — to Ukraine, where the weapon has been used with high success in destroying Russian tanks and other armored vehicles.

NATO foreign ministers, meeting this week, have been discussing how to further help Ukraine prosecute the war without entangling the alliance in direct combat with Russian forces.

Image A column of Ukrainian armored vehicles on Tuesday moving through the town of Bucha, from which Russian forces recently retreated. Credit... Ivor Prickett for The New York Times

The war, they said, is far from over, noting that however badly Russia’s forces have performed, and their retreat from areas around Kyiv notwithstanding, they are making slow and brutal progress in the east.

“Moscow is not giving up its ambitions in Ukraine,” said Jens Stoltenberg, NATO’s secretary general.

Ukrainian officials in a number of areas, including Mykolayiv in the south and the Luhansk and Donetsk regions in the east, have been sharing schedules of planned evacuations or links to online portals for people to sign up to join buses and trains that are transporting residents to safer places.

But in some besieged cities in the south, like Mariupol, it is already nearly impossible to leave, making evacuations sporadic and risky.

Attempts by the Red Cross to enter Mariupol to supervise civilian departures have repeatedly been scrubbed, leaving fearful residents to fend for themselves. On Wednesday, 500 people who had escaped Mariupol to join a Red Cross convoy in the nearby city of Berdyansk arrived in Zaporizhzhia, about 100 miles away.

The climate of fear gripping Mariupol has spread to the region of Kherson, near the Black Sea, where people have lived under occupation by Russian forces since they encircled and entered the city and its suburbs on March 2.

“Anyone who did not leave early is now stuck here,” said Evgeniya Selivantseva, a doctor from Velyka Lepetyka, a village on the Dnipro River, in the Kherson region.

Dr. Selivantseva, 38, described a deepening humanitarian crisis in the village: Gasoline stations have run out of fuel, and food and medical supplies are running low. Food is so scarce that local leaders have started a makeshift flour mill.

“We feel helpless and totally defenseless,” she said. “People are afraid to leave their homes.”

The proposed European Union ban on Russian coal, part of the bloc’s effort to further penalize Russia over atrocities in Ukraine, reflected a choice of an imported energy source that would be the easiest to replace.

Deliberations over the ban and other sanctions were set to continue into Thursday, and European Union officials and diplomats anticipated that the measures would be approved. The process reflected the challenges of reaching agreement among all 27 member nations on the penalties, which would also include banning Russian ships from E.U. ports.

If approved, the sanctions would be the harshest enforced by the bloc since the invasion.

Though the European Union depends on Russian coal, the bloc could find substitute imports more easily than for natural gas and oil.

But banning coal from Russia could send energy prices soaring for European consumers, given the existing shortages in the bloc, according to Rystad Energy, a consulting firm. Carlos Torres Diaz, a senior vice president at Rystad, called the potential sanctions “a double-edged sword.”

Megan Specia and Cora Engelbrecht reported from Krakow, Poland, and Eric Schmitt from Washington. Reporting was contributed by Katie Rogers from Washington; Matina Stevis-Gridneff and Steven Erlanger from Brussels; Melissa Eddy from Berlin; and Farnaz Fassihi and Michael Schwirtz from New York.",https://www.nytimes.com/live/2022/04/06/world/ukraine-russia-war-news
