,uid,article_author,article_date,article_text,article_url
7,cec776f0-89f1-4240-b721-00ce888150ac,"['Charmaine Jacob Chelsea Ong Christina Wilkie Sam Meredith Amanda Macias', 'Charmaine Jacob', 'Chelsea Ong', 'Christina Wilkie', 'Sam Meredith', 'Amanda Macias']",2022-04-05,"Britain's Prime Minister Boris Johnson addresses the media during a press conference following a NATO summit on Russia's invasion of Ukraine on March 24, 2022.

British Prime Minister Boris Johnson called on Russians to ""find the truth"" and ""share it.""

""Your president stands accused of committing war crimes. But I cannot believe he's acting in your name,"" Johnson said in a video directly addressing the Russian people.

Speaking in both Russian and English, he said: ""The atrocities committed by Russian troops in Bucha, Irpin and elsewhere in Ukraine have horrified the world.""

He went on to outline the alleged atrocities of Russian troops: civilians massacred, women raped, bodies burned and ""dumped in mass graves, or just left lying in the street.""

Ukrainian officials say that more than 300 civilians were tortured and killed by Russian troops in the town of Bucha outside Kyiv, discoveries made only after Moscow pulled out of those areas.

Graphic media images also revealed corpses of civilians in the streets — some with their hands and legs tied up — while satellite images captured mass graves.

Russia has been waging information warfare alongside its military operations.

The Russian people have been ""fed a steady diet of propaganda"" by Russian-state media, according to NBC News' Ken Dilanian. The Kremlin has labeled the unprovoked and unwarranted war in Ukraine a ""special military operation.""

""The reports are so shocking, so sickening, it's no wonder your government is seeking to hide them from you,"" Johnson said.

""But don't just take my word for it,"" he added, calling on them to access independent information via VPN connection. ""And when you find the truth, share it.""

— Charmaine Jacob, Joanna Tan",https://www.cnbc.com/2022/04/05/russia-ukraine-live-updates.html
